id,title,selftext,permalink,score
1jrpde7,Wife and I got married in 2022. Our wedding venue called us this week to say we still owe $7000 dollars.,,https://www.reddit.com/r/personalfinance/comments/1jrpde7/wife_and_i_got_married_in_2022_our_wedding_venue/,44733
1n96stx,"$20k raise, but only $100 more per paycheck",,https://www.reddit.com/r/personalfinance/comments/1n96stx/20k_raise_but_only_100_more_per_paycheck/,39741
1kn4xsn,"Chase only applied $23 of my $23,000 credit card payment.. now they’re reversing it and I’m stuck. Please help.",,https://www.reddit.com/r/personalfinance/comments/1kn4xsn/chase_only_applied_23_of_my_23000_credit_card/,34667
1mgqrp1,"My former sorority is telling me I owe thousands in debt, and has destroyed my credit score. I have no idea what to do.",,https://www.reddit.com/r/personalfinance/comments/1mgqrp1/my_former_sorority_is_telling_me_i_owe_thousands/,30535
1r8wh11,"I let my parents convince me to skip my company's 401k for three years because they said ""the market is about to crash"" and I will never forgive myself for this",,https://www.reddit.com/r/personalfinance/comments/1r8wh11/i_let_my_parents_convince_me_to_skip_my_companys/,26522
1rauamc,"Be very cautious about master's degrees, including from prestigious universities. Some of my coworkers in their 30s are financially hobbled by these degrees.",,https://www.reddit.com/r/personalfinance/comments/1rauamc/be_very_cautious_about_masters_degrees_including/,23754
1pwr8td,How to distribute my deceased brother's inheritance to his children?,,https://www.reddit.com/r/personalfinance/comments/1pwr8td/how_to_distribute_my_deceased_brothers/,20981
1q2aweq,I have 6 months to live. How do I take care of my family?,,https://www.reddit.com/r/personalfinance/comments/1q2aweq/i_have_6_months_to_live_how_do_i_take_care_of_my/,18170
1jo8uo2,My friend lent me 5k in 2019. I want to now return it with decent interest,,https://www.reddit.com/r/personalfinance/comments/1jo8uo2/my_friend_lent_me_5k_in_2019_i_want_to_now_return/,16686
1kzp2zm,Did the right thing but still got scammed,,https://www.reddit.com/r/personalfinance/comments/1kzp2zm/did_the_right_thing_but_still_got_scammed/,14185
1k9l0xm,Company hired a felon of identity theft to be our HR manager then fired her,,https://www.reddit.com/r/personalfinance/comments/1k9l0xm/company_hired_a_felon_of_identity_theft_to_be_our/,12984
1obo68u,My dad took loans out for my college without telling me and then died leaving me 90k I didn’t know about,,https://www.reddit.com/r/personalfinance/comments/1obo68u/my_dad_took_loans_out_for_my_college_without/,11360
1jrcyww,I just had my first experience filing with FreeTaxUSA,,https://www.reddit.com/r/personalfinance/comments/1jrcyww/i_just_had_my_first_experience_filing_with/,9731
1phx9dz,Will paying off 72-month car loan in first month hurt me?,,https://www.reddit.com/r/personalfinance/comments/1phx9dz/will_paying_off_72month_car_loan_in_first_month/,8631
1l8x495,Kid made expensive mistake,,https://www.reddit.com/r/personalfinance/comments/1l8x495/kid_made_expensive_mistake/,8002
1o02q0w,My payroll company made an error that cost me years of 401k,,https://www.reddit.com/r/personalfinance/comments/1o02q0w/my_payroll_company_made_an_error_that_cost_me/,6933
1kbleby,Citi sent me a card that never arrived. There is a 2k charge on it. They say its my problem.,,https://www.reddit.com/r/personalfinance/comments/1kbleby/citi_sent_me_a_card_that_never_arrived_there_is_a/,5834
1m2cvmp,My mother in law just passed away and we found 2 common stock certificates she left my husband,,https://www.reddit.com/r/personalfinance/comments/1m2cvmp/my_mother_in_law_just_passed_away_and_we_found_2/,5253
1rf5wpx,Protecting myself from my soon to be ex-fiancée,,https://www.reddit.com/r/personalfinance/comments/1rf5wpx/protecting_myself_from_my_soon_to_be_exfiancée/,4830
1k6es3r,$2800 vanished from account and my account is frozen,,https://www.reddit.com/r/personalfinance/comments/1k6es3r/2800_vanished_from_account_and_my_account_is/,4005
1n2vagn,"I inherited a house with 0% interest, so why can't I change it to my name?",,https://www.reddit.com/r/personalfinance/comments/1n2vagn/i_inherited_a_house_with_0_interest_so_why_cant_i/,4271
1rp9jih,"Bank is closing my account with life savings in it, what’s the best way of getting my money to another bank safely?",,https://www.reddit.com/r/personalfinance/comments/1rp9jih/bank_is_closing_my_account_with_life_savings_in/,3507
1rsazfh,Scammer Emptied My (Chase) Checking and Savings Account,,https://www.reddit.com/r/personalfinance/comments/1rsazfh/scammer_emptied_my_chase_checking_and_savings/,2770
1phma67,Should I buy this house from my grandparents or am I setting myself up to be house-poor? Need advice.,,https://www.reddit.com/r/personalfinance/comments/1phma67/should_i_buy_this_house_from_my_grandparents_or/,3086
1ni63nl,PLEASE HELP the unimaginable just happened--parents can't be trusted with their own retirement,,https://www.reddit.com/r/personalfinance/comments/1ni63nl/please_help_the_unimaginable_just_happenedparents/,2269
1pl4z48,Accidentally had my new credit card mailed to my old address and the person living there used it,,https://www.reddit.com/r/personalfinance/comments/1pl4z48/accidentally_had_my_new_credit_card_mailed_to_my/,2378
1mp5gjz,"I died, how does my wife know what to do",,https://www.reddit.com/r/personalfinance/comments/1mp5gjz/i_died_how_does_my_wife_know_what_to_do/,1870
1ojb0vn,It’s better to donate cash to a food bank than buying and donating food. Food banks are able to make dollars stretch further because they purchase food at discounted prices.,,https://www.reddit.com/r/personalfinance/comments/1ojb0vn/its_better_to_donate_cash_to_a_food_bank_than/,1785
1mh2z9a,Gf has a credit card from when she was 6,,https://www.reddit.com/r/personalfinance/comments/1mh2z9a/gf_has_a_credit_card_from_when_she_was_6/,1750
1jwoevi,Mortgage payment went up $400,,https://www.reddit.com/r/personalfinance/comments/1jwoevi/mortgage_payment_went_up_400/,1632
1ml4thq,Someone said I hit their car in a parking lot. I didn't. How do I respond to their insurance agent?,,https://www.reddit.com/r/personalfinance/comments/1ml4thq/someone_said_i_hit_their_car_in_a_parking_lot_i/,1624
1jlni4u,Stop Using Rocket Money -- PLEASE!!,,https://www.reddit.com/r/personalfinance/comments/1jlni4u/stop_using_rocket_money_please/,1538
1px9ytx,How to live off of an inheritance?,,https://www.reddit.com/r/personalfinance/comments/1px9ytx/how_to_live_off_of_an_inheritance/,1446
1of5q30,Mom asking for paystub when I don’t live with her anymore at 17 for “insurance”,,https://www.reddit.com/r/personalfinance/comments/1of5q30/mom_asking_for_paystub_when_i_dont_live_with_her/,1623
1lga3tg,"Roommate is telling me I can’t buy,sell or trade any stocks without them telling their company?",,https://www.reddit.com/r/personalfinance/comments/1lga3tg/roommate_is_telling_me_i_cant_buysell_or_trade/,1545
1omb6bq,Someone sent $40 through Zelle and asking for it back,,https://www.reddit.com/r/personalfinance/comments/1omb6bq/someone_sent_40_through_zelle_and_asking_for_it/,1056
1q56bck,Halp. I'm an idiot. I asked my Bank about HELOC,,https://www.reddit.com/r/personalfinance/comments/1q56bck/halp_im_an_idiot_i_asked_my_bank_about_heloc/,1408
1nwloxa,Citibank denied my credit card fraud claim of $1400. Now what?,,https://www.reddit.com/r/personalfinance/comments/1nwloxa/citibank_denied_my_credit_card_fraud_claim_of/,1163
1ouexu3,My 18 year old daughter managed to stash away 3000 bucks. where should I put it?,,https://www.reddit.com/r/personalfinance/comments/1ouexu3/my_18_year_old_daughter_managed_to_stash_away/,1134
1rqu19o,Debt in a foreign country I’m never moving back to,,https://www.reddit.com/r/personalfinance/comments/1rqu19o/debt_in_a_foreign_country_im_never_moving_back_to/,1276
1ls9s6x,"Had $13,000 left on car loan, Capital One offered for us to get out of it for $7000. Confused as to why?",,https://www.reddit.com/r/personalfinance/comments/1ls9s6x/had_13000_left_on_car_loan_capital_one_offered/,1015
1kfoo5c,Was suppose to be a co-singer but refused to sign. Borrower got the car anyway,,https://www.reddit.com/r/personalfinance/comments/1kfoo5c/was_suppose_to_be_a_cosinger_but_refused_to_sign/,1170
1qnr9n1,"I cover my ex-wife's mortgage, she pays it back. Can this hurt me?",,https://www.reddit.com/r/personalfinance/comments/1qnr9n1/i_cover_my_exwifes_mortgage_she_pays_it_back_can/,562
1rdprp1,"I received a $15,000 bill for an ER visit for a kidney stone. They offering 70% off - should I take it or can I negotiate a higher discount?",,https://www.reddit.com/r/personalfinance/comments/1rdprp1/i_received_a_15000_bill_for_an_er_visit_for_a/,887
1rll8vl,My parents have basically no retirement savings and are starting to hint that I'll need to help support them. I'm 29 and just getting my own finances together.,,https://www.reddit.com/r/personalfinance/comments/1rll8vl/my_parents_have_basically_no_retirement_savings/,1003
1kgacjh,"If you are in the market for a new car, do not just trade in your old car to the same dealer.",,https://www.reddit.com/r/personalfinance/comments/1kgacjh/if_you_are_in_the_market_for_a_new_car_do_not/,933
1prdj4d,I am dying and 32k in debt. I don't want to burden my family.,,https://www.reddit.com/r/personalfinance/comments/1prdj4d/i_am_dying_and_32k_in_debt_i_dont_want_to_burden/,549
1klf4s2,"Mr Cooper added $1400 ""legal fees"" to my payment due after they bought my loan.",,https://www.reddit.com/r/personalfinance/comments/1klf4s2/mr_cooper_added_1400_legal_fees_to_my_payment_due/,244
1jz0avr,Did I screw up by not maxing out 401k all these years?,,https://www.reddit.com/r/personalfinance/comments/1jz0avr/did_i_screw_up_by_not_maxing_out_401k_all_these/,1021
1m983vj,"Got a recycled phone number, ended up fighting off five years of nonstop debt collector harassment for someone I’ve never met",,https://www.reddit.com/r/personalfinance/comments/1m983vj/got_a_recycled_phone_number_ended_up_fighting_off/,859
