id,title,selftext,permalink,score
1ralvwc,ULPT How can I ultimately troll my husband so he stops embarrassing me?,,https://www.reddit.com/r/UnethicalLifeProTips/comments/1ralvwc/ulpt_how_can_i_ultimately_troll_my_husband_so_he/,22813
1rr6ap8,ULPT to avoid a DUI,,https://www.reddit.com/r/UnethicalLifeProTips/comments/1rr6ap8/ulpt_to_avoid_a_dui/,20274
1rc5q9c,ULPT: The easiest way to get out of a subscription is to get banned,,https://www.reddit.com/r/UnethicalLifeProTips/comments/1rc5q9c/ulpt_the_easiest_way_to_get_out_of_a_subscription/,18022
1rfrdcl,ULPT to get a free shirt,,https://www.reddit.com/r/UnethicalLifeProTips/comments/1rfrdcl/ulpt_to_get_a_free_shirt/,15664
1rn3hzz,ULPT request: neighbor running a business under my address,,https://www.reddit.com/r/UnethicalLifeProTips/comments/1rn3hzz/ulpt_request_neighbor_running_a_business_under_my/,14132
1ro0vwd,ULPT I want this MF OUT!!!,,https://www.reddit.com/r/UnethicalLifeProTips/comments/1ro0vwd/ulpt_i_want_this_mf_out/,12003
1ri27o1,ULPT request: I’m desperate. How to get my neighbors dogs to shut up.,,https://www.reddit.com/r/UnethicalLifeProTips/comments/1ri27o1/ulpt_request_im_desperate_how_to_get_my_neighbors/,10612
1rpthtt,ULPT Request What to do against my daughter's bullies?,,https://www.reddit.com/r/UnethicalLifeProTips/comments/1rpthtt/ulpt_request_what_to_do_against_my_daughters/,9654
1rfsu8g,ULPT How I got one spam number to stop calling me ever again,,https://www.reddit.com/r/UnethicalLifeProTips/comments/1rfsu8g/ulpt_how_i_got_one_spam_number_to_stop_calling_me/,8192
1rggvaf,ULPT Request: How to waste Home Depot’s time?,,https://www.reddit.com/r/UnethicalLifeProTips/comments/1rggvaf/ulpt_request_how_to_waste_home_depots_time/,7335
1r375v6,ULPT: How to get a colonoscopy in your 20s/30s covered by insurance,,https://www.reddit.com/r/UnethicalLifeProTips/comments/1r375v6/ulpt_how_to_get_a_colonoscopy_in_your_20s30s/,6514
1rbhiy5,ULPT request: Need to send a message to my drug dealing neighbor,,https://www.reddit.com/r/UnethicalLifeProTips/comments/1rbhiy5/ulpt_request_need_to_send_a_message_to_my_drug/,5912
1r6n6pk,ULPT you can fuck with fifa ticket scalpers by keeping tickets on cart,,https://www.reddit.com/r/UnethicalLifeProTips/comments/1r6n6pk/ulpt_you_can_fuck_with_fifa_ticket_scalpers_by/,5098
1r4d7kh,ULPT Bf's work is pocket checking. what should he bring to humiliate them?,,https://www.reddit.com/r/UnethicalLifeProTips/comments/1r4d7kh/ulpt_bfs_work_is_pocket_checking_what_should_he/,4497
1riqest,ULPT Can I live on a fake identity forever if I start from the beginning?,,https://www.reddit.com/r/UnethicalLifeProTips/comments/1riqest/ulpt_can_i_live_on_a_fake_identity_forever_if_i/,3805
1r5rwv6,ULPT how can I get neighborhood bully to leave my kid alone,,https://www.reddit.com/r/UnethicalLifeProTips/comments/1r5rwv6/ulpt_how_can_i_get_neighborhood_bully_to_leave_my/,3438
1rfseqv,ULPT Request- Need some ideas how to make a neighbors life miserable.,,https://www.reddit.com/r/UnethicalLifeProTips/comments/1rfseqv/ulpt_request_need_some_ideas_how_to_make_a/,3639
1rdwl6k,ULPT request. You become homeless tomorrow. How do you get off the streets?,,https://www.reddit.com/r/UnethicalLifeProTips/comments/1rdwl6k/ulpt_request_you_become_homeless_tomorrow_how_do/,3068
1r3093g,ULPT Request: How to ruin a retirement party?,,https://www.reddit.com/r/UnethicalLifeProTips/comments/1r3093g/ulpt_request_how_to_ruin_a_retirement_party/,2581
1rlppgx,ULPT when my mother in law gets me mad I give her number to insurance webs,,https://www.reddit.com/r/UnethicalLifeProTips/comments/1rlppgx/ulpt_when_my_mother_in_law_gets_me_mad_i_give_her/,2464
1rfexkq,ULPT Request: How do I rebel against camera rule for Teams?,,https://www.reddit.com/r/UnethicalLifeProTips/comments/1rfexkq/ulpt_request_how_do_i_rebel_against_camera_rule/,1868
1r5btgq,ULPT Request - What are believable two-year employment gap excuses?,,https://www.reddit.com/r/UnethicalLifeProTips/comments/1r5btgq/ulpt_request_what_are_believable_twoyear/,2159
1r4jfn4,ULPT - Going to court for a crime? Have your friend go as you instead.,,https://www.reddit.com/r/UnethicalLifeProTips/comments/1r4jfn4/ulpt_going_to_court_for_a_crime_have_your_friend/,1953
1r24v6q,ULPT Request. How to make a 1 bedroom work for 3 people?,,https://www.reddit.com/r/UnethicalLifeProTips/comments/1r24v6q/ulpt_request_how_to_make_a_1_bedroom_work_for_3/,1679
1r40k21,ULPT - What work have you automated and has made your life better?,,https://www.reddit.com/r/UnethicalLifeProTips/comments/1r40k21/ulpt_what_work_have_you_automated_and_has_made/,1948
1rkt1k6,ULPT request - can I ignore my American medical debt forever?,,https://www.reddit.com/r/UnethicalLifeProTips/comments/1rkt1k6/ulpt_request_can_i_ignore_my_american_medical/,1627
1r38oqk,ULPT request: dealing with a neighbor who thinks he owns the public street?,,https://www.reddit.com/r/UnethicalLifeProTips/comments/1r38oqk/ulpt_request_dealing_with_a_neighbor_who_thinks/,1360
1rnn07y,ULPT request: How to get my Dad to stop burning firewood in the house?,,https://www.reddit.com/r/UnethicalLifeProTips/comments/1rnn07y/ulpt_request_how_to_get_my_dad_to_stop_burning/,1425
1r7g0xo,ULPT Request: Making my previous firing sound more appealing to employers,,https://www.reddit.com/r/UnethicalLifeProTips/comments/1r7g0xo/ulpt_request_making_my_previous_firing_sound_more/,1261
1rhs0eb,ULPT Request: flatmate tried to kill my cat years ago,,https://www.reddit.com/r/UnethicalLifeProTips/comments/1rhs0eb/ulpt_request_flatmate_tried_to_kill_my_cat_years/,884
1ra1joc,ULPT | I was terminated the day I returned from FMLA - how to get back?,,https://www.reddit.com/r/UnethicalLifeProTips/comments/1ra1joc/ulpt_i_was_terminated_the_day_i_returned_from/,1238
1r68uom,ULPT how to truly stay anonymous in Reddit,,https://www.reddit.com/r/UnethicalLifeProTips/comments/1r68uom/ulpt_how_to_truly_stay_anonymous_in_reddit/,873
1rmdy82,ULPT How to disable Flock cameras?,,https://www.reddit.com/r/UnethicalLifeProTips/comments/1rmdy82/ulpt_how_to_disable_flock_cameras/,968
1rog3hl,ULPT please review This man deserves to be miserable,,https://www.reddit.com/r/UnethicalLifeProTips/comments/1rog3hl/ulpt_please_review_this_man_deserves_to_be/,515
1r8m13w,ULPT Request: how to get back at person who called cops on me for walking,,https://www.reddit.com/r/UnethicalLifeProTips/comments/1r8m13w/ulpt_request_how_to_get_back_at_person_who_called/,604
1rdgn3v,"ULPT request- harassed in ER by another patient, turns out she’s a nurse",,https://www.reddit.com/r/UnethicalLifeProTips/comments/1rdgn3v/ulpt_request_harassed_in_er_by_another_patient/,508
1r7roi0,ULPT Request: How to get mom’s ex-bf squatter to vacate,,https://www.reddit.com/r/UnethicalLifeProTips/comments/1r7roi0/ulpt_request_how_to_get_moms_exbf_squatter_to/,946
1r6zb4o,ULPT request - how can I call my prank caller and find out their name?,,https://www.reddit.com/r/UnethicalLifeProTips/comments/1r6zb4o/ulpt_request_how_can_i_call_my_prank_caller_and/,990
1r8ouo6,ULPT Modifying Pay stubs to make it look like I make 3x the rent,,https://www.reddit.com/r/UnethicalLifeProTips/comments/1r8ouo6/ulpt_modifying_pay_stubs_to_make_it_look_like_i/,662
1rb2ogr,"ULPT request - scammed on Ebay, seller lives close to me",,https://www.reddit.com/r/UnethicalLifeProTips/comments/1rb2ogr/ulpt_request_scammed_on_ebay_seller_lives_close/,802
1rjybb8,ULPT Request to make a narcissists life hell?,,https://www.reddit.com/r/UnethicalLifeProTips/comments/1rjybb8/ulpt_request_to_make_a_narcissists_life_hell/,373
1r8erb0,ULPT Request. My neighbor puts his trash cans where I park. Help me stop it,,https://www.reddit.com/r/UnethicalLifeProTips/comments/1r8erb0/ulpt_request_my_neighbor_puts_his_trash_cans/,1063
1rc4cww,ULPT Request: Neighbor repeatedly dumping used oil,,https://www.reddit.com/r/UnethicalLifeProTips/comments/1rc4cww/ulpt_request_neighbor_repeatedly_dumping_used_oil/,675
1rl07s2,ULPT Request: How to email a HS transcript so it appears the school sent it,,https://www.reddit.com/r/UnethicalLifeProTips/comments/1rl07s2/ulpt_request_how_to_email_a_hs_transcript_so_it/,403
1rqoxkv,ULPT Request: I need to make a monitor at work not function,,https://www.reddit.com/r/UnethicalLifeProTips/comments/1rqoxkv/ulpt_request_i_need_to_make_a_monitor_at_work_not/,947
1rggwak,ULPT request: how to purposefully corrup a PDF file,,https://www.reddit.com/r/UnethicalLifeProTips/comments/1rggwak/ulpt_request_how_to_purposefully_corrup_a_pdf_file/,756
1ric05b,ULPT: neighbors let their pitbull’s wander around the neighborhood,,https://www.reddit.com/r/UnethicalLifeProTips/comments/1ric05b/ulpt_neighbors_let_their_pitbulls_wander_around/,390
1rl5l9e,"ULPT Visiting the US, forgot bloodthinner, help me get my rx meds fast",,https://www.reddit.com/r/UnethicalLifeProTips/comments/1rl5l9e/ulpt_visiting_the_us_forgot_bloodthinner_help_me/,764
1rmut1j,ULPT Request - wreck a cement mixer,,https://www.reddit.com/r/UnethicalLifeProTips/comments/1rmut1j/ulpt_request_wreck_a_cement_mixer/,987
1rrtj12,ULPT Request: Husband Invited to a Party and Never Takes Family,,https://www.reddit.com/r/UnethicalLifeProTips/comments/1rrtj12/ulpt_request_husband_invited_to_a_party_and_never/,638
