id,title,selftext,permalink,score
1t8pl63,"ULPT request; My fellow Redditors, we have a home wrecker in our midst.",,https://www.reddit.com/r/UnethicalLifeProTips/comments/1t8pl63/ulpt_request_my_fellow_redditors_we_have_a_home/,27415
1tbjzkj,ULPT How I Stopped Someone From Playing Their Radio/CD Player In The Office,,https://www.reddit.com/r/UnethicalLifeProTips/comments/1tbjzkj/ulpt_how_i_stopped_someone_from_playing_their/,24237
1tm0fe6,ULPT: Getting hit but can’t hit back? Flick them,,https://www.reddit.com/r/UnethicalLifeProTips/comments/1tm0fe6/ulpt_getting_hit_but_cant_hit_back_flick_them/,20851
1tmfb71,ULPT request: How to shut down neighbors “doggy day care”,,https://www.reddit.com/r/UnethicalLifeProTips/comments/1tmfb71/ulpt_request_how_to_shut_down_neighbors_doggy_day/,18679
1t7qcie,ULPT blocking my neighbors camera,,https://www.reddit.com/r/UnethicalLifeProTips/comments/1t7qcie/ulpt_blocking_my_neighbors_camera/,16744
1tcaffv,ULPT: How to stop noisy neighbours keeping you awake with their loud sex.,,https://www.reddit.com/r/UnethicalLifeProTips/comments/1tcaffv/ulpt_how_to_stop_noisy_neighbours_keeping_you/,14959
1tekgd7,ULPT request - Uber drivers forcing you to cancel ride,,https://www.reddit.com/r/UnethicalLifeProTips/comments/1tekgd7/ulpt_request_uber_drivers_forcing_you_to_cancel/,13223
1t7ehi2,ULPT Request: How can I disrupt a business that covers for predatory staff?,,https://www.reddit.com/r/UnethicalLifeProTips/comments/1t7ehi2/ulpt_request_how_can_i_disrupt_a_business_that/,11166
1t6tudt,ULPT Request: Hotel valets parking cars in my driveway,,https://www.reddit.com/r/UnethicalLifeProTips/comments/1t6tudt/ulpt_request_hotel_valets_parking_cars_in_my/,9923
1tgenmc,ULPT REQUEST Boyfriend cheated. can’t damage our apt or cars. Ideas?,,https://www.reddit.com/r/UnethicalLifeProTips/comments/1tgenmc/ulpt_request_boyfriend_cheated_cant_damage_our/,8961
1t9e5mo,ULPT request: incentivize an elderly squatter to leave my mother’s house,,https://www.reddit.com/r/UnethicalLifeProTips/comments/1t9e5mo/ulpt_request_incentivize_an_elderly_squatter_to/,7997
1tiptee,ULPT: How to be a pain in the ass for a thrit store scalper,,https://www.reddit.com/r/UnethicalLifeProTips/comments/1tiptee/ulpt_how_to_be_a_pain_in_the_ass_for_a_thrit/,6907
1tvri6e,ULPT: Tokenmaxx to make your company rethink their AI expense,,https://www.reddit.com/r/UnethicalLifeProTips/comments/1tvri6e/ulpt_tokenmaxx_to_make_your_company_rethink_their/,6370
1t5qxjg,ULPT request: how to be visually sick to leave a work thing.,,https://www.reddit.com/r/UnethicalLifeProTips/comments/1t5qxjg/ulpt_request_how_to_be_visually_sick_to_leave_a/,5601
1ts260p,ULPT request: How can I make sure my new neighbors will be cool.,,https://www.reddit.com/r/UnethicalLifeProTips/comments/1ts260p/ulpt_request_how_can_i_make_sure_my_new_neighbors/,5297
1tu18ta,ULPT: How to sneak in my girlfriend in my flat?,,https://www.reddit.com/r/UnethicalLifeProTips/comments/1tu18ta/ulpt_how_to_sneak_in_my_girlfriend_in_my_flat/,4339
1t6t224,ULPT Cyber truck unplugs every other car in the apartment.,,https://www.reddit.com/r/UnethicalLifeProTips/comments/1t6t224/ulpt_cyber_truck_unplugs_every_other_car_in_the/,3710
1tpj4ww,ULPT Wedding Gift,,https://www.reddit.com/r/UnethicalLifeProTips/comments/1tpj4ww/ulpt_wedding_gift/,3427
1tukdj5,ULPT Get a ceiling vibrator for noisy neighbors,,https://www.reddit.com/r/UnethicalLifeProTips/comments/1tukdj5/ulpt_get_a_ceiling_vibrator_for_noisy_neighbors/,2920
1tucko6,"ULPT instead of “hide ad” or “not interested in this ad”, etc-report the ad",,https://www.reddit.com/r/UnethicalLifeProTips/comments/1tucko6/ulpt_instead_of_hide_ad_or_not_interested_in_this/,3041
1t8azbm,ULPT Request: sabotage a company that’s quietly firing me after med issues,,https://www.reddit.com/r/UnethicalLifeProTips/comments/1t8azbm/ulpt_request_sabotage_a_company_thats_quietly/,2682
1tafu8c,ULPT Request: how to break golf clubs with no evidence?,,https://www.reddit.com/r/UnethicalLifeProTips/comments/1tafu8c/ulpt_request_how_to_break_golf_clubs_with_no/,2749
1te1qd7,"ULPT Request - I’m ready to stop asking for the money, now I want revenge",,https://www.reddit.com/r/UnethicalLifeProTips/comments/1te1qd7/ulpt_request_im_ready_to_stop_asking_for_the/,2285
1trlkh3,ULPT: Never buy a new Apple Pencil; get a broken one and replace it for $30,,https://www.reddit.com/r/UnethicalLifeProTips/comments/1trlkh3/ulpt_never_buy_a_new_apple_pencil_get_a_broken/,1759
1t9tfqz,ULPT Coworker keeps asking why me and my husband use our canes,,https://www.reddit.com/r/UnethicalLifeProTips/comments/1t9tfqz/ulpt_coworker_keeps_asking_why_me_and_my_husband/,1937
1tmgdul,ULPT: How can I get an Airbnb shut down?,,https://www.reddit.com/r/UnethicalLifeProTips/comments/1tmgdul/ulpt_how_can_i_get_an_airbnb_shut_down/,1688
1tl6fhg,ULPT request: Kids banging on my door,,https://www.reddit.com/r/UnethicalLifeProTips/comments/1tl6fhg/ulpt_request_kids_banging_on_my_door/,1234
1tov71l,ULPT Request: Anything against these Ebike gang kids,,https://www.reddit.com/r/UnethicalLifeProTips/comments/1tov71l/ulpt_request_anything_against_these_ebike_gang/,1263
1thphsx,ULPT: Lie about having kids to your coworkers and manager,,https://www.reddit.com/r/UnethicalLifeProTips/comments/1thphsx/ulpt_lie_about_having_kids_to_your_coworkers_and/,1536
1thacrh,ULPT Request. Christian Hate Street Preachers,,https://www.reddit.com/r/UnethicalLifeProTips/comments/1thacrh/ulpt_request_christian_hate_street_preachers/,1314
1tsz5yi,ULPT: Get them to drain the damn pool,,https://www.reddit.com/r/UnethicalLifeProTips/comments/1tsz5yi/ulpt_get_them_to_drain_the_damn_pool/,1178
1tiigh4,ULPT request: How to keep landlord and his gf/ kid downstairs?,,https://www.reddit.com/r/UnethicalLifeProTips/comments/1tiigh4/ulpt_request_how_to_keep_landlord_and_his_gf_kid/,1345
1t4kly3,ULPT Request: Find a Meal Train site for a neighbor that faked cancer,,https://www.reddit.com/r/UnethicalLifeProTips/comments/1t4kly3/ulpt_request_find_a_meal_train_site_for_a/,841
1t5n9u8,ULPT Sending documents via email,,https://www.reddit.com/r/UnethicalLifeProTips/comments/1t5n9u8/ulpt_sending_documents_via_email/,497
1tsdbw4,ULPT request: Excuse to get out of work every Saturday,,https://www.reddit.com/r/UnethicalLifeProTips/comments/1tsdbw4/ulpt_request_excuse_to_get_out_of_work_every/,1017
1tnz5d4,ULPT how to escape the country while on the run without any fake credential,,https://www.reddit.com/r/UnethicalLifeProTips/comments/1tnz5d4/ulpt_how_to_escape_the_country_while_on_the_run/,979
1t4idvo,ULPT request: how to get coworker to shut up,,https://www.reddit.com/r/UnethicalLifeProTips/comments/1t4idvo/ulpt_request_how_to_get_coworker_to_shut_up/,450
1tdyz7r,ULPT Request - Dog peeing on my hydrangea,,https://www.reddit.com/r/UnethicalLifeProTips/comments/1tdyz7r/ulpt_request_dog_peeing_on_my_hydrangea/,387
1teqbgr,ULPT: Old bastard reversed into my car and then blamed me.,,https://www.reddit.com/r/UnethicalLifeProTips/comments/1teqbgr/ulpt_old_bastard_reversed_into_my_car_and_then/,525
1ts81a0,ULPT Suggestions: Photographer Took Deposit and Ghosted Us,,https://www.reddit.com/r/UnethicalLifeProTips/comments/1ts81a0/ulpt_suggestions_photographer_took_deposit_and/,1161
1t8aikd,ULPT request: Need to make my car intentionally break down on the motorway,,https://www.reddit.com/r/UnethicalLifeProTips/comments/1t8aikd/ulpt_request_need_to_make_my_car_intentionally/,880
1tuwlw2,ULPT Make a Bar Owner Miserable,,https://www.reddit.com/r/UnethicalLifeProTips/comments/1tuwlw2/ulpt_make_a_bar_owner_miserable/,655
1tuaobh,ULPT How to make them feel ashamed? 🆘,,https://www.reddit.com/r/UnethicalLifeProTips/comments/1tuaobh/ulpt_how_to_make_them_feel_ashamed/,452
1to9nxn,ULPT request: roommate put ring camera in house,,https://www.reddit.com/r/UnethicalLifeProTips/comments/1to9nxn/ulpt_request_roommate_put_ring_camera_in_house/,834
1tv9eb4,ULPT How to get a coworker to quit.,,https://www.reddit.com/r/UnethicalLifeProTips/comments/1tv9eb4/ulpt_how_to_get_a_coworker_to_quit/,574
1tooeay,ULPT Request- Threatened by slander over a 1 star Google review,,https://www.reddit.com/r/UnethicalLifeProTips/comments/1tooeay/ulpt_request_threatened_by_slander_over_a_1_star/,727
1tqww3w,ULPT Request- Co-worker drank almost all my coffee creamer.,,https://www.reddit.com/r/UnethicalLifeProTips/comments/1tqww3w/ulpt_request_coworker_drank_almost_all_my_coffee/,948
1tqp4qq,ULPT: How to respond to low-ballers?,,https://www.reddit.com/r/UnethicalLifeProTips/comments/1tqp4qq/ulpt_how_to_respond_to_lowballers/,283
1td2gj6,ULPT: How to Deter door to door salesman?,,https://www.reddit.com/r/UnethicalLifeProTips/comments/1td2gj6/ulpt_how_to_deter_door_to_door_salesman/,249
1t6fcc1,ULPT Request: How to get road-raging menace fired?,,https://www.reddit.com/r/UnethicalLifeProTips/comments/1t6fcc1/ulpt_request_how_to_get_roadraging_menace_fired/,424
