id,title,selftext,permalink,score
1ufjh0q,ULPT -- Tell doctors you want to have a baby soon,,https://www.reddit.com/r/UnethicalLifeProTips/comments/1ufjh0q/ulpt_tell_doctors_you_want_to_have_a_baby_soon/,17453
1tyghyr,ULPT: If your partner is fat and refuses to workout; cook and walk,,https://www.reddit.com/r/UnethicalLifeProTips/comments/1tyghyr/ulpt_if_your_partner_is_fat_and_refuses_to/,15731
1ucd9fe,ULPT Take a free hotel shuttle from the airport then call uber from hotel.,,https://www.reddit.com/r/UnethicalLifeProTips/comments/1ucd9fe/ulpt_take_a_free_hotel_shuttle_from_the_airport/,14015
1ua5n2t,ULPT: If you're meeting someone to sell/buy on facebook marketplace...,,https://www.reddit.com/r/UnethicalLifeProTips/comments/1ua5n2t/ulpt_if_youre_meeting_someone_to_sellbuy_on/,12382
1txkhz3,"ULPT: For remote workers, tip to help you clock out early without detection",,https://www.reddit.com/r/UnethicalLifeProTips/comments/1txkhz3/ulpt_for_remote_workers_tip_to_help_you_clock_out/,11070
1uih7vm,ULPT: skip elevator lines,,https://www.reddit.com/r/UnethicalLifeProTips/comments/1uih7vm/ulpt_skip_elevator_lines/,9580
1ufiy01,"ULPT- When a piss disc or tuna can water just won't do, use these.",,https://www.reddit.com/r/UnethicalLifeProTips/comments/1ufiy01/ulpt_when_a_piss_disc_or_tuna_can_water_just_wont/,8595
1u1i2bc,ULPT: You can tell those Payday Loan apps (Earnin etc) to kick rocks,,https://www.reddit.com/r/UnethicalLifeProTips/comments/1u1i2bc/ulpt_you_can_tell_those_payday_loan_apps_earnin/,7812
1ujyn6y,ULPT: Put a “Proud _____ Grandparent” bumper sticker on your car,,https://www.reddit.com/r/UnethicalLifeProTips/comments/1ujyn6y/ulpt_put_a_proud_grandparent_bumper_sticker_on/,6655
1uk6htg,ULPT Squatters not leaving after purchasing home,,https://www.reddit.com/r/UnethicalLifeProTips/comments/1uk6htg/ulpt_squatters_not_leaving_after_purchasing_home/,6209
1u5t09p,ULPT: the smoke detectors in hotel bathrooms cannot detect vaping,,https://www.reddit.com/r/UnethicalLifeProTips/comments/1u5t09p/ulpt_the_smoke_detectors_in_hotel_bathrooms/,5515
1ujh690,ULPT: Get found if you're lost,,https://www.reddit.com/r/UnethicalLifeProTips/comments/1ujh690/ulpt_get_found_if_youre_lost/,4354
1ucuq1v,ULPT: How to make someone uncomfortable enough to leave lake house.,,https://www.reddit.com/r/UnethicalLifeProTips/comments/1ucuq1v/ulpt_how_to_make_someone_uncomfortable_enough_to/,4022
1u4zbu0,ULPT I want to mess with my VRBO Host,,https://www.reddit.com/r/UnethicalLifeProTips/comments/1u4zbu0/ulpt_i_want_to_mess_with_my_vrbo_host/,4024
1ug9qy1,ULPT Request : Client won't pay final 600€ but flexes 10K€ cash in his BMW.,,https://www.reddit.com/r/UnethicalLifeProTips/comments/1ug9qy1/ulpt_request_client_wont_pay_final_600_but_flexes/,2952
1u7zefp,"ULPT: If customer service call starts with AI bot, swear to get a human",,https://www.reddit.com/r/UnethicalLifeProTips/comments/1u7zefp/ulpt_if_customer_service_call_starts_with_ai_bot/,2648
1ugk1dy,ULPT Request - Glitter in the dryer,,https://www.reddit.com/r/UnethicalLifeProTips/comments/1ugk1dy/ulpt_request_glitter_in_the_dryer/,2381
1u5fht1,"ULPT Request: My workplace bully is a protected ""genius""",,https://www.reddit.com/r/UnethicalLifeProTips/comments/1u5fht1/ulpt_request_my_workplace_bully_is_a_protected/,2810
1ukyumw,ULPT fail a drug test (the drug is estrogen),,https://www.reddit.com/r/UnethicalLifeProTips/comments/1ukyumw/ulpt_fail_a_drug_test_the_drug_is_estrogen/,2550
1uba57g,ULPT scare your kids into brushing their teeth,,https://www.reddit.com/r/UnethicalLifeProTips/comments/1uba57g/ulpt_scare_your_kids_into_brushing_their_teeth/,2368
1tyovpj,ULPT: If someone parks dumb leave them a note...,,https://www.reddit.com/r/UnethicalLifeProTips/comments/1tyovpj/ulpt_if_someone_parks_dumb_leave_them_a_note/,1894
1uefj33,ULPT - always keep maps open when driving to easily report cops,,https://www.reddit.com/r/UnethicalLifeProTips/comments/1uefj33/ulpt_always_keep_maps_open_when_driving_to_easily/,1616
1uhrdci,ULPT: You can ask Google for information on any reddit user,,https://www.reddit.com/r/UnethicalLifeProTips/comments/1uhrdci/ulpt_you_can_ask_google_for_information_on_any/,1890
1ulchnn,ULPT Request - need a way to subtly destroy cameras at my workplace,,https://www.reddit.com/r/UnethicalLifeProTips/comments/1ulchnn/ulpt_request_need_a_way_to_subtly_destroy_cameras/,1188
1u9ddtz,ULPT Request: how to subtly pump fart spray to make some people move,,https://www.reddit.com/r/UnethicalLifeProTips/comments/1u9ddtz/ulpt_request_how_to_subtly_pump_fart_spray_to/,1456
1u8963x,ULPT request Lower response times,,https://www.reddit.com/r/UnethicalLifeProTips/comments/1u8963x/ulpt_request_lower_response_times/,1290
1uczakx,ULPT free taxi in london? say your going to great ormond street hospital,,https://www.reddit.com/r/UnethicalLifeProTips/comments/1uczakx/ulpt_free_taxi_in_london_say_your_going_to_great/,1583
1u79dbd,"ULPT Next accident you are in, blame the high beams of the other drivers",,https://www.reddit.com/r/UnethicalLifeProTips/comments/1u79dbd/ulpt_next_accident_you_are_in_blame_the_high/,912
1ubt6eu,ULPT: Just found out my roommate is homophobic. How to mess with him?,,https://www.reddit.com/r/UnethicalLifeProTips/comments/1ubt6eu/ulpt_just_found_out_my_roommate_is_homophobic_how/,1342
1ul9foz,ULPT Request - Need a clever way to catch my friend cheating in crosswords,,https://www.reddit.com/r/UnethicalLifeProTips/comments/1ul9foz/ulpt_request_need_a_clever_way_to_catch_my_friend/,979
1udqj8z,ULPT License Plate Cameras Are About To Start Tracking A Lot More ...,,https://www.reddit.com/r/UnethicalLifeProTips/comments/1udqj8z/ulpt_license_plate_cameras_are_about_to_start/,846
1u0u0l3,ULPT How to make life hard for Boss while being the perfect employee?,,https://www.reddit.com/r/UnethicalLifeProTips/comments/1u0u0l3/ulpt_how_to_make_life_hard_for_boss_while_being/,820
1ui95wb,"ULPT: Been fired, need to transfer data off laptop",,https://www.reddit.com/r/UnethicalLifeProTips/comments/1ui95wb/ulpt_been_fired_need_to_transfer_data_off_laptop/,952
1u6c912,ULPT how to insult a narcissist,,https://www.reddit.com/r/UnethicalLifeProTips/comments/1u6c912/ulpt_how_to_insult_a_narcissist/,641
1u6k752,ULPT Request: How to trim down a beer gut but not stop drinking.,,https://www.reddit.com/r/UnethicalLifeProTips/comments/1u6k752/ulpt_request_how_to_trim_down_a_beer_gut_but_not/,524
1tz7d3l,ULPT request: Road rage revenge despite an anti piss disc security camera,,https://www.reddit.com/r/UnethicalLifeProTips/comments/1tz7d3l/ulpt_request_road_rage_revenge_despite_an_anti/,911
1u1c93z,ULPT Request: How do I get denied for a mortgage?,,https://www.reddit.com/r/UnethicalLifeProTips/comments/1u1c93z/ulpt_request_how_do_i_get_denied_for_a_mortgage/,562
1ujnr8g,ULPT Verify the ROI of a degree or cert just by adding it to your resume.,,https://www.reddit.com/r/UnethicalLifeProTips/comments/1ujnr8g/ulpt_verify_the_roi_of_a_degree_or_cert_just_by/,756
1uhyb2h,"ULPT Request: Man sexually harassed me, now will be teaching college kids",,https://www.reddit.com/r/UnethicalLifeProTips/comments/1uhyb2h/ulpt_request_man_sexually_harassed_me_now_will_be/,1092
1u8ccvj,ULPT Request: Will 12 pre-rolls get through TSA security?,,https://www.reddit.com/r/UnethicalLifeProTips/comments/1u8ccvj/ulpt_request_will_12_prerolls_get_through_tsa/,310
1ujdxjp,ULPT request how do I get my best friend and his girlfriend to break up.,,https://www.reddit.com/r/UnethicalLifeProTips/comments/1ujdxjp/ulpt_request_how_do_i_get_my_best_friend_and_his/,827
1u2ckwl,ULPT - Take a picture of your computer when it's updating or has an error.,,https://www.reddit.com/r/UnethicalLifeProTips/comments/1u2ckwl/ulpt_take_a_picture_of_your_computer_when_its/,986
1u2qcbr,ULPT Request - Any way to lose my voice or get it hoarse overnight?,,https://www.reddit.com/r/UnethicalLifeProTips/comments/1u2qcbr/ulpt_request_any_way_to_lose_my_voice_or_get_it/,1042
1ujcz99,ULPT Dont like being forced to order using QR codes?,,https://www.reddit.com/r/UnethicalLifeProTips/comments/1ujcz99/ulpt_dont_like_being_forced_to_order_using_qr/,575
1tyx0xa,"ULPT Request: Brother In Law bullying me, can I help his online presence?",,https://www.reddit.com/r/UnethicalLifeProTips/comments/1tyx0xa/ulpt_request_brother_in_law_bullying_me_can_i/,878
1uhh3dw,ULPT. Best ways to waste Pokemon scalpers time?,,https://www.reddit.com/r/UnethicalLifeProTips/comments/1uhh3dw/ulpt_best_ways_to_waste_pokemon_scalpers_time/,1044
1ubyvnv,ULPT what illness can you fake instead of your real illness?,,https://www.reddit.com/r/UnethicalLifeProTips/comments/1ubyvnv/ulpt_what_illness_can_you_fake_instead_of_your/,870
1ujkx7l,"ULPT Request: If you go to prison for fraud, how can you keep the money?",,https://www.reddit.com/r/UnethicalLifeProTips/comments/1ujkx7l/ulpt_request_if_you_go_to_prison_for_fraud_how/,234
1uk80sv,ULPT request: found my stolen bike on facebook marketplace,,https://www.reddit.com/r/UnethicalLifeProTips/comments/1uk80sv/ulpt_request_found_my_stolen_bike_on_facebook/,1019
1u3xqz6,ULPT. I've been hounded in work for four years and want to get revenge,,https://www.reddit.com/r/UnethicalLifeProTips/comments/1u3xqz6/ulpt_ive_been_hounded_in_work_for_four_years_and/,742
