id,title,selftext,permalink,score
1rr6ap8,ULPT to avoid a DUI,,https://www.reddit.com/r/UnethicalLifeProTips/comments/1rr6ap8/ulpt_to_avoid_a_dui/,25132
1rfrdcl,ULPT to get a free shirt,,https://www.reddit.com/r/UnethicalLifeProTips/comments/1rfrdcl/ulpt_to_get_a_free_shirt/,21758
1rn3hzz,ULPT request: neighbor running a business under my address,,https://www.reddit.com/r/UnethicalLifeProTips/comments/1rn3hzz/ulpt_request_neighbor_running_a_business_under_my/,19536
1s1r8mb,"ULPT request: How do I prove to unemployment that I was home, when I wasnt?",,https://www.reddit.com/r/UnethicalLifeProTips/comments/1s1r8mb/ulpt_request_how_do_i_prove_to_unemployment_that/,17135
1rrz5cx,ULPT Request: I need to fake my eyes test to avoid draft to russian army,,https://www.reddit.com/r/UnethicalLifeProTips/comments/1rrz5cx/ulpt_request_i_need_to_fake_my_eyes_test_to_avoid/,14985
1rumf7e,ULPT request - revenge on a homewrecker?,,https://www.reddit.com/r/UnethicalLifeProTips/comments/1rumf7e/ulpt_request_revenge_on_a_homewrecker/,13801
1ro0vwd,ULPT I want this MF OUT!!!,,https://www.reddit.com/r/UnethicalLifeProTips/comments/1ro0vwd/ulpt_i_want_this_mf_out/,12181
1rpthtt,ULPT Request What to do against my daughter's bullies?,,https://www.reddit.com/r/UnethicalLifeProTips/comments/1rpthtt/ulpt_request_what_to_do_against_my_daughters/,10477
1rfsu8g,ULPT How I got one spam number to stop calling me ever again,,https://www.reddit.com/r/UnethicalLifeProTips/comments/1rfsu8g/ulpt_how_i_got_one_spam_number_to_stop_calling_me/,9690
1rggvaf,ULPT Request: How to waste Home Depot’s time?,,https://www.reddit.com/r/UnethicalLifeProTips/comments/1rggvaf/ulpt_request_how_to_waste_home_depots_time/,8397
1rxgntp,ULPT: Respond to AI text scammers to burn their money,,https://www.reddit.com/r/UnethicalLifeProTips/comments/1rxgntp/ulpt_respond_to_ai_text_scammers_to_burn_their/,7692
1riqest,ULPT Can I live on a fake identity forever if I start from the beginning?,,https://www.reddit.com/r/UnethicalLifeProTips/comments/1riqest/ulpt_can_i_live_on_a_fake_identity_forever_if_i/,6134
1s36yq4,ULPT Request: how to permanently shut down someone who belittles you?,,https://www.reddit.com/r/UnethicalLifeProTips/comments/1s36yq4/ulpt_request_how_to_permanently_shut_down_someone/,5988
1rfseqv,ULPT Request- Need some ideas how to make a neighbors life miserable.,,https://www.reddit.com/r/UnethicalLifeProTips/comments/1rfseqv/ulpt_request_need_some_ideas_how_to_make_a/,4891
1ru0dhg,ULPT Request: How to make my neighbor constantly late,,https://www.reddit.com/r/UnethicalLifeProTips/comments/1ru0dhg/ulpt_request_how_to_make_my_neighbor_constantly/,4674
1rlppgx,ULPT when my mother in law gets me mad I give her number to insurance webs,,https://www.reddit.com/r/UnethicalLifeProTips/comments/1rlppgx/ulpt_when_my_mother_in_law_gets_me_mad_i_give_her/,4076
1rfexkq,ULPT Request: How do I rebel against camera rule for Teams?,,https://www.reddit.com/r/UnethicalLifeProTips/comments/1rfexkq/ulpt_request_how_do_i_rebel_against_camera_rule/,3683
1s1h9a7,ULPT: Free parking,,https://www.reddit.com/r/UnethicalLifeProTips/comments/1s1h9a7/ulpt_free_parking/,3737
1rkt1k6,ULPT request - can I ignore my American medical debt forever?,,https://www.reddit.com/r/UnethicalLifeProTips/comments/1rkt1k6/ulpt_request_can_i_ignore_my_american_medical/,2689
1rnn07y,ULPT request: How to get my Dad to stop burning firewood in the house?,,https://www.reddit.com/r/UnethicalLifeProTips/comments/1rnn07y/ulpt_request_how_to_get_my_dad_to_stop_burning/,2507
1rt80cv,ULPT How to cost work more money,,https://www.reddit.com/r/UnethicalLifeProTips/comments/1rt80cv/ulpt_how_to_cost_work_more_money/,2305
1rhs0eb,ULPT Request: flatmate tried to kill my cat years ago,,https://www.reddit.com/r/UnethicalLifeProTips/comments/1rhs0eb/ulpt_request_flatmate_tried_to_kill_my_cat_years/,2100
1rrtj12,ULPT Request: Husband Invited to a Party and Never Takes Family,,https://www.reddit.com/r/UnethicalLifeProTips/comments/1rrtj12/ulpt_request_husband_invited_to_a_party_and_never/,1958
1rmdy82,ULPT How to disable Flock cameras?,,https://www.reddit.com/r/UnethicalLifeProTips/comments/1rmdy82/ulpt_how_to_disable_flock_cameras/,1756
1s3sd1d,ULPT - old work laptop being requested,,https://www.reddit.com/r/UnethicalLifeProTips/comments/1s3sd1d/ulpt_old_work_laptop_being_requested/,1293
1s097uj,ULPT Request: how can I ruin an Airbnb?,,https://www.reddit.com/r/UnethicalLifeProTips/comments/1s097uj/ulpt_request_how_can_i_ruin_an_airbnb/,1790
1rzh2yh,"ULPT-Car flipper using my parking stall, ideas to irritate seller.",,https://www.reddit.com/r/UnethicalLifeProTips/comments/1rzh2yh/ulptcar_flipper_using_my_parking_stall_ideas_to/,1559
1rog3hl,ULPT please review This man deserves to be miserable,,https://www.reddit.com/r/UnethicalLifeProTips/comments/1rog3hl/ulpt_please_review_this_man_deserves_to_be/,1168
1s0vkmw,ULPT - Assaulted by a man,,https://www.reddit.com/r/UnethicalLifeProTips/comments/1s0vkmw/ulpt_assaulted_by_a_man/,1313
1rxvci9,ULPT: REQUEST How to protect bike from thieves?,,https://www.reddit.com/r/UnethicalLifeProTips/comments/1rxvci9/ulpt_request_how_to_protect_bike_from_thieves/,1198
1rvt5v7,ULPT How do I get back at my neighbor for not paying his rent for 8 months?,,https://www.reddit.com/r/UnethicalLifeProTips/comments/1rvt5v7/ulpt_how_do_i_get_back_at_my_neighbor_for_not/,1331
1s3at7z,ULPT - how do i make a .docx file be really annoying to copy text from?,,https://www.reddit.com/r/UnethicalLifeProTips/comments/1s3at7z/ulpt_how_do_i_make_a_docx_file_be_really_annoying/,1298
1rvty2x,ULPT Request - How to keep and disguise a bird feeder from my HOA?,,https://www.reddit.com/r/UnethicalLifeProTips/comments/1rvty2x/ulpt_request_how_to_keep_and_disguise_a_bird/,1167
1rjybb8,ULPT Request to make a narcissists life hell?,,https://www.reddit.com/r/UnethicalLifeProTips/comments/1rjybb8/ulpt_request_to_make_a_narcissists_life_hell/,896
1rqoxkv,ULPT Request: I need to make a monitor at work not function,,https://www.reddit.com/r/UnethicalLifeProTips/comments/1rqoxkv/ulpt_request_i_need_to_make_a_monitor_at_work_not/,463
1rs90iq,ULPT for getting reward card sign ups in retail/customer service,,https://www.reddit.com/r/UnethicalLifeProTips/comments/1rs90iq/ulpt_for_getting_reward_card_sign_ups_in/,747
1s12n5r,ULPT request : Landlord wants to sell fobs for new system at 25$ each,,https://www.reddit.com/r/UnethicalLifeProTips/comments/1s12n5r/ulpt_request_landlord_wants_to_sell_fobs_for_new/,925
1rxfdom,ULPT Request. How to order contacts online without a current prescription.,,https://www.reddit.com/r/UnethicalLifeProTips/comments/1rxfdom/ulpt_request_how_to_order_contacts_online_without/,339
1rl07s2,ULPT Request: How to email a HS transcript so it appears the school sent it,,https://www.reddit.com/r/UnethicalLifeProTips/comments/1rl07s2/ulpt_request_how_to_email_a_hs_transcript_so_it/,598
1s3s2px,"ULPT-Request Pet safe ""dye"" that won't dry in a day.",,https://www.reddit.com/r/UnethicalLifeProTips/comments/1s3s2px/ulptrequest_pet_safe_dye_that_wont_dry_in_a_day/,270
1rggwak,ULPT request: how to purposefully corrup a PDF file,,https://www.reddit.com/r/UnethicalLifeProTips/comments/1rggwak/ulpt_request_how_to_purposefully_corrup_a_pdf_file/,518
1ric05b,ULPT: neighbors let their pitbull’s wander around the neighborhood,,https://www.reddit.com/r/UnethicalLifeProTips/comments/1ric05b/ulpt_neighbors_let_their_pitbulls_wander_around/,356
1rl5l9e,"ULPT Visiting the US, forgot bloodthinner, help me get my rx meds fast",,https://www.reddit.com/r/UnethicalLifeProTips/comments/1rl5l9e/ulpt_visiting_the_us_forgot_bloodthinner_help_me/,1048
1rmut1j,ULPT Request - wreck a cement mixer,,https://www.reddit.com/r/UnethicalLifeProTips/comments/1rmut1j/ulpt_request_wreck_a_cement_mixer/,636
1rotr6q,ULPT: Get an out of state number.,,https://www.reddit.com/r/UnethicalLifeProTips/comments/1rotr6q/ulpt_get_an_out_of_state_number/,604
1rxf3d8,ULPT request : How to make the upstairs AirBnB life a hell?,,https://www.reddit.com/r/UnethicalLifeProTips/comments/1rxf3d8/ulpt_request_how_to_make_the_upstairs_airbnb_life/,831
1rl6xrb,ULPT REQUEST - my neighbour parks his car in my visitor spot,,https://www.reddit.com/r/UnethicalLifeProTips/comments/1rl6xrb/ulpt_request_my_neighbour_parks_his_car_in_my/,485
1rpsbep,ULPT request: avoiding hotel no show charge,,https://www.reddit.com/r/UnethicalLifeProTips/comments/1rpsbep/ulpt_request_avoiding_hotel_no_show_charge/,306
1rz6zt8,ULPT: HOA keeps giving my buddy BS parking tix. Any ideas to make it stop?,,https://www.reddit.com/r/UnethicalLifeProTips/comments/1rz6zt8/ulpt_hoa_keeps_giving_my_buddy_bs_parking_tix_any/,271
1s2e10z,ULPT - How to stop my neighbors from throwing cigarette butts?,,https://www.reddit.com/r/UnethicalLifeProTips/comments/1s2e10z/ulpt_how_to_stop_my_neighbors_from_throwing/,315
