id,title,selftext,permalink,score
1sn98da,ULPT: Need to get out of a hotel room? Do this.,,https://www.reddit.com/r/UnethicalLifeProTips/comments/1sn98da/ulpt_need_to_get_out_of_a_hotel_room_do_this/,30466
1spizxf,ULPT How to get the lowest possible price from a car dealership.,,https://www.reddit.com/r/UnethicalLifeProTips/comments/1spizxf/ulpt_how_to_get_the_lowest_possible_price_from_a/,26797
1srtkei,ULPT Request: How to fail a sleep apnea test,,https://www.reddit.com/r/UnethicalLifeProTips/comments/1srtkei/ulpt_request_how_to_fail_a_sleep_apnea_test/,24118
1sd01zh,ULPT: Dispose of small heavy items for free at the airport.,,https://www.reddit.com/r/UnethicalLifeProTips/comments/1sd01zh/ulpt_dispose_of_small_heavy_items_for_free_at_the/,20989
1so7oyr,ULPT: landlord is going to tour apartments - how to hide giant fish tank,,https://www.reddit.com/r/UnethicalLifeProTips/comments/1so7oyr/ulpt_landlord_is_going_to_tour_apartments_how_to/,18313
1s9dmdx,ULPT: Mention ADA accommodations to bypass AI agents.,,https://www.reddit.com/r/UnethicalLifeProTips/comments/1s9dmdx/ulpt_mention_ada_accommodations_to_bypass_ai/,16636
1sqwgiq,ULPT You Can Get Information Out of Someone Easily By Making a False Claim,,https://www.reddit.com/r/UnethicalLifeProTips/comments/1sqwgiq/ulpt_you_can_get_information_out_of_someone/,14219
1si1evl,ULPT How to subtly disrespect an evil persons funeral (I have to go),,https://www.reddit.com/r/UnethicalLifeProTips/comments/1si1evl/ulpt_how_to_subtly_disrespect_an_evil_persons/,13035
1stjs5z,ULPT: Drivers will yield to dog poo bags,,https://www.reddit.com/r/UnethicalLifeProTips/comments/1stjs5z/ulpt_drivers_will_yield_to_dog_poo_bags/,11447
1s9uvig,ULPT Request: How to break a camera lens from long range,,https://www.reddit.com/r/UnethicalLifeProTips/comments/1s9uvig/ulpt_request_how_to_break_a_camera_lens_from_long/,10265
1sn56wz,"ULPT: If you want people to trust you faster, let them correct you once.",,https://www.reddit.com/r/UnethicalLifeProTips/comments/1sn56wz/ulpt_if_you_want_people_to_trust_you_faster_let/,9211
1sc7cgb,ULPT Request: fight against Bluetooth speakers on a public beach,,https://www.reddit.com/r/UnethicalLifeProTips/comments/1sc7cgb/ulpt_request_fight_against_bluetooth_speakers_on/,7544
1s7nufp,ULPT request: revenge on a scumbag who made me miss my mother's funeral,,https://www.reddit.com/r/UnethicalLifeProTips/comments/1s7nufp/ulpt_request_revenge_on_a_scumbag_who_made_me/,6646
1sgzkzp,ULPT: Record Your Calls,,https://www.reddit.com/r/UnethicalLifeProTips/comments/1sgzkzp/ulpt_record_your_calls/,5941
1snqess,ULPT: Replace dented panels on your relatively new car for CHEAP!,,https://www.reddit.com/r/UnethicalLifeProTips/comments/1snqess/ulpt_replace_dented_panels_on_your_relatively_new/,5761
1sq8oyv,ULPT Request: How to get someone out of the shower.,,https://www.reddit.com/r/UnethicalLifeProTips/comments/1sq8oyv/ulpt_request_how_to_get_someone_out_of_the_shower/,4638
1sg00ht,ULPT Request: how can I make sure no one goes to a university event?,,https://www.reddit.com/r/UnethicalLifeProTips/comments/1sg00ht/ulpt_request_how_can_i_make_sure_no_one_goes_to_a/,4172
1s85o3y,ULPT Request I need a way to move 13 2000lb pallets of kitkats,,https://www.reddit.com/r/UnethicalLifeProTips/comments/1s85o3y/ulpt_request_i_need_a_way_to_move_13_2000lb/,4388
1sagapv,ULPT Request: How to catch a cheater on Bumble,,https://www.reddit.com/r/UnethicalLifeProTips/comments/1sagapv/ulpt_request_how_to_catch_a_cheater_on_bumble/,3887
1sbcxlp,ULPT: You don't ever need to pay medical bills in California,,https://www.reddit.com/r/UnethicalLifeProTips/comments/1sbcxlp/ulpt_you_dont_ever_need_to_pay_medical_bills_in/,2941
1spquw5,ULPT Request: I need to be a member of a church in good standing in 3 weeks,,https://www.reddit.com/r/UnethicalLifeProTips/comments/1spquw5/ulpt_request_i_need_to_be_a_member_of_a_church_in/,2437
1sr8dr7,ULPT request: Psychiatrist made me go to rehab,,https://www.reddit.com/r/UnethicalLifeProTips/comments/1sr8dr7/ulpt_request_psychiatrist_made_me_go_to_rehab/,2168
1sjdq7k,ULPT Request: ways to hypothetically scare off buyers of my dream house,,https://www.reddit.com/r/UnethicalLifeProTips/comments/1sjdq7k/ulpt_request_ways_to_hypothetically_scare_off/,2414
1sp2yp2,ULPT: never give your 100% at a new job as it sets high expectations,,https://www.reddit.com/r/UnethicalLifeProTips/comments/1sp2yp2/ulpt_never_give_your_100_at_a_new_job_as_it_sets/,2188
1s6vvtd,ULPT: I lied about having a DUI on my background check.,,https://www.reddit.com/r/UnethicalLifeProTips/comments/1s6vvtd/ulpt_i_lied_about_having_a_dui_on_my_background/,2115
1ss5a0r,ULPT Request: Stop cars speeding by my house,,https://www.reddit.com/r/UnethicalLifeProTips/comments/1ss5a0r/ulpt_request_stop_cars_speeding_by_my_house/,1979
1s4huhq,"ULPT - Travel for work, book friends and relatives homes as airbnbs",,https://www.reddit.com/r/UnethicalLifeProTips/comments/1s4huhq/ulpt_travel_for_work_book_friends_and_relatives/,1693
1sq2uzi,ULPT Request: How to get back at home inspector who screwed us?,,https://www.reddit.com/r/UnethicalLifeProTips/comments/1sq2uzi/ulpt_request_how_to_get_back_at_home_inspector/,1232
1smqp70,ULPT request: office 365 tips for revenge for being fired with cancer,,https://www.reddit.com/r/UnethicalLifeProTips/comments/1smqp70/ulpt_request_office_365_tips_for_revenge_for/,1336
1sp4547,ULPT Request: What can you put on your resume that's impossible to verify,,https://www.reddit.com/r/UnethicalLifeProTips/comments/1sp4547/ulpt_request_what_can_you_put_on_your_resume/,1447
1s6nk6b,ULPT: Macbook Student Discounts,,https://www.reddit.com/r/UnethicalLifeProTips/comments/1s6nk6b/ulpt_macbook_student_discounts/,1090
1su2ew6,ULPT; Sneaking alcohol on Carnival cruise,,https://www.reddit.com/r/UnethicalLifeProTips/comments/1su2ew6/ulpt_sneaking_alcohol_on_carnival_cruise/,958
1ss27jp,ULPT: Finding my mom's SSN for life insurance,,https://www.reddit.com/r/UnethicalLifeProTips/comments/1ss27jp/ulpt_finding_my_moms_ssn_for_life_insurance/,672
1sjh7oq,ULPT How to get revenge on asshat terrorizing our community?,,https://www.reddit.com/r/UnethicalLifeProTips/comments/1sjh7oq/ulpt_how_to_get_revenge_on_asshat_terrorizing_our/,1068
1sluguj,ULPT Request: How to get rid of a giant truck abandoned outside my house,,https://www.reddit.com/r/UnethicalLifeProTips/comments/1sluguj/ulpt_request_how_to_get_rid_of_a_giant_truck/,703
1sc8s39,ULPT request. Found social security card with my name but different number.,,https://www.reddit.com/r/UnethicalLifeProTips/comments/1sc8s39/ulpt_request_found_social_security_card_with_my/,1007
1sf9enu,ULPT Request: Make HR director feel unappreciated without contacting them!,,https://www.reddit.com/r/UnethicalLifeProTips/comments/1sf9enu/ulpt_request_make_hr_director_feel_unappreciated/,967
1sld2ve,ULPT how to ruin neighbour's shoes,,https://www.reddit.com/r/UnethicalLifeProTips/comments/1sld2ve/ulpt_how_to_ruin_neighbours_shoes/,888
1smepj5,ULPT Request: way to turn water back on without paying?,,https://www.reddit.com/r/UnethicalLifeProTips/comments/1smepj5/ulpt_request_way_to_turn_water_back_on_without/,1194
1s8jho4,ULPT request - moved to a new house. child predator working 20ft from house,,https://www.reddit.com/r/UnethicalLifeProTips/comments/1s8jho4/ulpt_request_moved_to_a_new_house_child_predator/,1023
1sdtbk5,ULPT how to get someone pulled over?,,https://www.reddit.com/r/UnethicalLifeProTips/comments/1sdtbk5/ulpt_how_to_get_someone_pulled_over/,487
1s5b7zm,ULPT REQUEST. I need help escaping post separation abuse.,,https://www.reddit.com/r/UnethicalLifeProTips/comments/1s5b7zm/ulpt_request_i_need_help_escaping_post_separation/,465
1scn716,ULPT Request: How to mess with a neighbour who thinks she owns the road,,https://www.reddit.com/r/UnethicalLifeProTips/comments/1scn716/ulpt_request_how_to_mess_with_a_neighbour_who/,323
1sbylb7,ULPT Request: How to deal with kids who barge in front of you at a museum,,https://www.reddit.com/r/UnethicalLifeProTips/comments/1sbylb7/ulpt_request_how_to_deal_with_kids_who_barge_in/,325
1sg3o4g,"ULPT My grandpa is being terrorized by his new neighbor, what can I do?",,https://www.reddit.com/r/UnethicalLifeProTips/comments/1sg3o4g/ulpt_my_grandpa_is_being_terrorized_by_his_new/,522
1sg07ki,ULPT Request: My disabled Dad is getting bullied,,https://www.reddit.com/r/UnethicalLifeProTips/comments/1sg07ki/ulpt_request_my_disabled_dad_is_getting_bullied/,481
1sl9jj5,ULPT Reauest : How to push through during hard financial times?,,https://www.reddit.com/r/UnethicalLifeProTips/comments/1sl9jj5/ulpt_reauest_how_to_push_through_during_hard/,1008
1slstwp,ULPT: Looking for petty long term revenge ideas to a very abusive parent,,https://www.reddit.com/r/UnethicalLifeProTips/comments/1slstwp/ulpt_looking_for_petty_long_term_revenge_ideas_to/,964
1st4tq0,ULPT Request: How to get revenge on my cheating bum boyfriend,,https://www.reddit.com/r/UnethicalLifeProTips/comments/1st4tq0/ulpt_request_how_to_get_revenge_on_my_cheating/,192
1sf9fne,"ULPT - SIL, daughter just had baby and",,https://www.reddit.com/r/UnethicalLifeProTips/comments/1sf9fne/ulpt_sil_daughter_just_had_baby_and/,899
