id,title,selftext,permalink,score
1rr6ap8,ULPT to avoid a DUI,,https://www.reddit.com/r/UnethicalLifeProTips/comments/1rr6ap8/ulpt_to_avoid_a_dui/,21876
1s8ftw4,ULPT: You can add fake job to your employment history,,https://www.reddit.com/r/UnethicalLifeProTips/comments/1s8ftw4/ulpt_you_can_add_fake_job_to_your_employment/,18979
1sd01zh,ULPT: Dispose of small heavy items for free at the airport.,,https://www.reddit.com/r/UnethicalLifeProTips/comments/1sd01zh/ulpt_dispose_of_small_heavy_items_for_free_at_the/,16889
1s9dmdx,ULPT: Mention ADA accommodations to bypass AI agents.,,https://www.reddit.com/r/UnethicalLifeProTips/comments/1s9dmdx/ulpt_mention_ada_accommodations_to_bypass_ai/,14765
1rrz5cx,ULPT Request: I need to fake my eyes test to avoid draft to russian army,,https://www.reddit.com/r/UnethicalLifeProTips/comments/1rrz5cx/ulpt_request_i_need_to_fake_my_eyes_test_to_avoid/,13587
1rumf7e,ULPT request - revenge on a homewrecker?,,https://www.reddit.com/r/UnethicalLifeProTips/comments/1rumf7e/ulpt_request_revenge_on_a_homewrecker/,11953
1s9uvig,ULPT Request: How to break a camera lens from long range,,https://www.reddit.com/r/UnethicalLifeProTips/comments/1s9uvig/ulpt_request_how_to_break_a_camera_lens_from_long/,10027
1rpthtt,ULPT Request What to do against my daughter's bullies?,,https://www.reddit.com/r/UnethicalLifeProTips/comments/1rpthtt/ulpt_request_what_to_do_against_my_daughters/,9137
1s7nufp,ULPT request: revenge on a scumbag who made me miss my mother's funeral,,https://www.reddit.com/r/UnethicalLifeProTips/comments/1s7nufp/ulpt_request_revenge_on_a_scumbag_who_made_me/,8407
1sc7cgb,ULPT Request: fight against Bluetooth speakers on a public beach,,https://www.reddit.com/r/UnethicalLifeProTips/comments/1sc7cgb/ulpt_request_fight_against_bluetooth_speakers_on/,7318
1sagapv,ULPT Request: How to catch a cheater on Bumble,,https://www.reddit.com/r/UnethicalLifeProTips/comments/1sagapv/ulpt_request_how_to_catch_a_cheater_on_bumble/,6042
1s85o3y,ULPT Request I need a way to move 13 2000lb pallets of kitkats,,https://www.reddit.com/r/UnethicalLifeProTips/comments/1s85o3y/ulpt_request_i_need_a_way_to_move_13_2000lb/,5443
1sbcxlp,ULPT: You don't ever need to pay medical bills in California,,https://www.reddit.com/r/UnethicalLifeProTips/comments/1sbcxlp/ulpt_you_dont_ever_need_to_pay_medical_bills_in/,4979
1rxgntp,ULPT: Respond to AI text scammers to burn their money,,https://www.reddit.com/r/UnethicalLifeProTips/comments/1rxgntp/ulpt_respond_to_ai_text_scammers_to_burn_their/,4755
1ru0dhg,ULPT Request: How to make my neighbor constantly late,,https://www.reddit.com/r/UnethicalLifeProTips/comments/1ru0dhg/ulpt_request_how_to_make_my_neighbor_constantly/,3872
1s6vvtd,ULPT: I lied about having a DUI on my background check.,,https://www.reddit.com/r/UnethicalLifeProTips/comments/1s6vvtd/ulpt_i_lied_about_having_a_dui_on_my_background/,3387
1s1h9a7,ULPT: Free parking,,https://www.reddit.com/r/UnethicalLifeProTips/comments/1s1h9a7/ulpt_free_parking/,3211
1s4huhq,"ULPT - Travel for work, book friends and relatives homes as airbnbs",,https://www.reddit.com/r/UnethicalLifeProTips/comments/1s4huhq/ulpt_travel_for_work_book_friends_and_relatives/,2839
1s3sd1d,ULPT - old work laptop being requested,,https://www.reddit.com/r/UnethicalLifeProTips/comments/1s3sd1d/ulpt_old_work_laptop_being_requested/,2364
1s6nk6b,ULPT: Macbook Student Discounts,,https://www.reddit.com/r/UnethicalLifeProTips/comments/1s6nk6b/ulpt_macbook_student_discounts/,2058
1rt80cv,ULPT How to cost work more money,,https://www.reddit.com/r/UnethicalLifeProTips/comments/1rt80cv/ulpt_how_to_cost_work_more_money/,1792
1rrtj12,ULPT Request: Husband Invited to a Party and Never Takes Family,,https://www.reddit.com/r/UnethicalLifeProTips/comments/1rrtj12/ulpt_request_husband_invited_to_a_party_and_never/,1983
1s3at7z,ULPT - how do i make a .docx file be really annoying to copy text from?,,https://www.reddit.com/r/UnethicalLifeProTips/comments/1s3at7z/ulpt_how_do_i_make_a_docx_file_be_really_annoying/,1876
1s097uj,ULPT Request: how can I ruin an Airbnb?,,https://www.reddit.com/r/UnethicalLifeProTips/comments/1s097uj/ulpt_request_how_can_i_ruin_an_airbnb/,2004
1rzh2yh,"ULPT-Car flipper using my parking stall, ideas to irritate seller.",,https://www.reddit.com/r/UnethicalLifeProTips/comments/1rzh2yh/ulptcar_flipper_using_my_parking_stall_ideas_to/,1800
1rog3hl,ULPT please review This man deserves to be miserable,,https://www.reddit.com/r/UnethicalLifeProTips/comments/1rog3hl/ulpt_please_review_this_man_deserves_to_be/,1263
1s0vkmw,ULPT - Assaulted by a man,,https://www.reddit.com/r/UnethicalLifeProTips/comments/1s0vkmw/ulpt_assaulted_by_a_man/,985
1s8jho4,ULPT request - moved to a new house. child predator working 20ft from house,,https://www.reddit.com/r/UnethicalLifeProTips/comments/1s8jho4/ulpt_request_moved_to_a_new_house_child_predator/,1456
1rxvci9,ULPT: REQUEST How to protect bike from thieves?,,https://www.reddit.com/r/UnethicalLifeProTips/comments/1rxvci9/ulpt_request_how_to_protect_bike_from_thieves/,1552
1rvt5v7,ULPT How do I get back at my neighbor for not paying his rent for 8 months?,,https://www.reddit.com/r/UnethicalLifeProTips/comments/1rvt5v7/ulpt_how_do_i_get_back_at_my_neighbor_for_not/,979
1sc8s39,ULPT request. Found social security card with my name but different number.,,https://www.reddit.com/r/UnethicalLifeProTips/comments/1sc8s39/ulpt_request_found_social_security_card_with_my/,827
1s5b7zm,ULPT REQUEST. I need help escaping post separation abuse.,,https://www.reddit.com/r/UnethicalLifeProTips/comments/1s5b7zm/ulpt_request_i_need_help_escaping_post_separation/,1261
1rvty2x,ULPT Request - How to keep and disguise a bird feeder from my HOA?,,https://www.reddit.com/r/UnethicalLifeProTips/comments/1rvty2x/ulpt_request_how_to_keep_and_disguise_a_bird/,1248
1s3s2px,"ULPT-Request Pet safe ""dye"" that won't dry in a day.",,https://www.reddit.com/r/UnethicalLifeProTips/comments/1s3s2px/ulptrequest_pet_safe_dye_that_wont_dry_in_a_day/,938
1rqoxkv,ULPT Request: I need to make a monitor at work not function,,https://www.reddit.com/r/UnethicalLifeProTips/comments/1rqoxkv/ulpt_request_i_need_to_make_a_monitor_at_work_not/,565
1sbylb7,ULPT Request: How to deal with kids who barge in front of you at a museum,,https://www.reddit.com/r/UnethicalLifeProTips/comments/1sbylb7/ulpt_request_how_to_deal_with_kids_who_barge_in/,1147
1rs90iq,ULPT for getting reward card sign ups in retail/customer service,,https://www.reddit.com/r/UnethicalLifeProTips/comments/1rs90iq/ulpt_for_getting_reward_card_sign_ups_in/,670
1scn716,ULPT Request: How to mess with a neighbour who thinks she owns the road,,https://www.reddit.com/r/UnethicalLifeProTips/comments/1scn716/ulpt_request_how_to_mess_with_a_neighbour_who/,299
1s12n5r,ULPT request : Landlord wants to sell fobs for new system at 25$ each,,https://www.reddit.com/r/UnethicalLifeProTips/comments/1s12n5r/ulpt_request_landlord_wants_to_sell_fobs_for_new/,723
1rxfdom,ULPT Request. How to order contacts online without a current prescription.,,https://www.reddit.com/r/UnethicalLifeProTips/comments/1rxfdom/ulpt_request_how_to_order_contacts_online_without/,280
1s6ny9a,ULPT Get multiple uses from one email address by adding periods.,,https://www.reddit.com/r/UnethicalLifeProTips/comments/1s6ny9a/ulpt_get_multiple_uses_from_one_email_address_by/,693
1rotr6q,ULPT: Get an out of state number.,,https://www.reddit.com/r/UnethicalLifeProTips/comments/1rotr6q/ulpt_get_an_out_of_state_number/,314
1rxf3d8,ULPT request : How to make the upstairs AirBnB life a hell?,,https://www.reddit.com/r/UnethicalLifeProTips/comments/1rxf3d8/ulpt_request_how_to_make_the_upstairs_airbnb_life/,1018
1sdtbk5,ULPT how to get someone pulled over?,,https://www.reddit.com/r/UnethicalLifeProTips/comments/1sdtbk5/ulpt_how_to_get_someone_pulled_over/,979
1rpsbep,ULPT request: avoiding hotel no show charge,,https://www.reddit.com/r/UnethicalLifeProTips/comments/1rpsbep/ulpt_request_avoiding_hotel_no_show_charge/,572
1sa04hz,ULPT Request: How do hotels know if you’re a guest or not?,,https://www.reddit.com/r/UnethicalLifeProTips/comments/1sa04hz/ulpt_request_how_do_hotels_know_if_youre_a_guest/,474
1s2e10z,ULPT - How to stop my neighbors from throwing cigarette butts?,,https://www.reddit.com/r/UnethicalLifeProTips/comments/1s2e10z/ulpt_how_to_stop_my_neighbors_from_throwing/,194
1rz6zt8,ULPT: HOA keeps giving my buddy BS parking tix. Any ideas to make it stop?,,https://www.reddit.com/r/UnethicalLifeProTips/comments/1rz6zt8/ulpt_hoa_keeps_giving_my_buddy_bs_parking_tix_any/,649
1rzszp7,ULPT request - I have a drone…how can I use it?,,https://www.reddit.com/r/UnethicalLifeProTips/comments/1rzszp7/ulpt_request_i_have_a_dronehow_can_i_use_it/,240
1rw7slh,ULPT - How to get cheap lounge access at airports?,,https://www.reddit.com/r/UnethicalLifeProTips/comments/1rw7slh/ulpt_how_to_get_cheap_lounge_access_at_airports/,1003
