id,title,selftext,permalink,score
1srzctp,Atomic Habits has been on my nightstand for six months. I'm starting to think reading the book was the entire transaction.,,https://www.reddit.com/r/productivity/comments/1srzctp/atomic_habits_has_been_on_my_nightstand_for_six/,20928
1spl6n4,Motivation is less important than energy levels,,https://www.reddit.com/r/productivity/comments/1spl6n4/motivation_is_less_important_than_energy_levels/,18630
1siemvv,I'm mentally slow and I don't know why,,https://www.reddit.com/r/productivity/comments/1siemvv/im_mentally_slow_and_i_dont_know_why/,16202
1simw4i,NO ADVERTISING IS ALLOWED OF ANY KIND (including solicitation)! Advertising = Instant ban,,https://www.reddit.com/r/productivity/comments/1simw4i/no_advertising_is_allowed_of_any_kind_including/,14296
1sy735v,the only productivity advice that matters right now.,,https://www.reddit.com/r/productivity/comments/1sy735v/the_only_productivity_advice_that_matters_right/,12254
1sinb6j,How do i break this loop of doing nothing?,,https://www.reddit.com/r/productivity/comments/1sinb6j/how_do_i_break_this_loop_of_doing_nothing/,11393
1sux39u,Tomorrow I will spend my day as Thomas Jefferson.,,https://www.reddit.com/r/productivity/comments/1sux39u/tomorrow_i_will_spend_my_day_as_thomas_jefferson/,10037
1t4asn1,I work 18 hours a day and get nothing done. Help.,,https://www.reddit.com/r/productivity/comments/1t4asn1/i_work_18_hours_a_day_and_get_nothing_done_help/,8374
1sl89m2,What's a small habit that you feel like impacted your life the most?,,https://www.reddit.com/r/productivity/comments/1sl89m2/whats_a_small_habit_that_you_feel_like_impacted/,8225
1t2i6ec,I stopped watching political news,,https://www.reddit.com/r/productivity/comments/1t2i6ec/i_stopped_watching_political_news/,6726
1sr4u2v,stop organizing your notes. seriously. it's killing your productivity.,,https://www.reddit.com/r/productivity/comments/1sr4u2v/stop_organizing_your_notes_seriously_its_killing/,6516
1slt4lw,"Why does society often value visible discipline (like waking up early, strict routines, hustle habits) more than actual outcome-driven discipline like delivering results consistently?",,https://www.reddit.com/r/productivity/comments/1slt4lw/why_does_society_often_value_visible_discipline/,5509
1t5sodh,What do you guys do in the first hour after waking up?,,https://www.reddit.com/r/productivity/comments/1t5sodh/what_do_you_guys_do_in_the_first_hour_after/,5110
1smz9zu,"We need to stop acting like ""hustle culture"" is a good trait. busy 24/7 isn't a flex, it’s a failure of time mngmt",,https://www.reddit.com/r/productivity/comments/1smz9zu/we_need_to_stop_acting_like_hustle_culture_is_a/,4664
1sk6g7w,Do you ever delay replying to emails just because it feels mentally exhausting?,,https://www.reddit.com/r/productivity/comments/1sk6g7w/do_you_ever_delay_replying_to_emails_just_because/,3501
1t1jza9,Things to do instead of doom scrolling?,,https://www.reddit.com/r/productivity/comments/1t1jza9/things_to_do_instead_of_doom_scrolling/,3080
1snpc5a,How did you become a morning person?,,https://www.reddit.com/r/productivity/comments/1snpc5a/how_did_you_become_a_morning_person/,3277
1sy5j07,does anyone feel like they can never cut rotting out of their life?,,https://www.reddit.com/r/productivity/comments/1sy5j07/does_anyone_feel_like_they_can_never_cut_rotting/,2652
1stn14w,Which of your habits have contributed most to your productivity?,,https://www.reddit.com/r/productivity/comments/1stn14w/which_of_your_habits_have_contributed_most_to/,2525
1skprtg,Stop endless scrolling before it even begins.,,https://www.reddit.com/r/productivity/comments/1skprtg/stop_endless_scrolling_before_it_even_begins/,2258
1stxdiu,"The Eisenhower Matrix: If a task isn’t important, why delegate it at all?",,https://www.reddit.com/r/productivity/comments/1stxdiu/the_eisenhower_matrix_if_a_task_isnt_important/,2362
1sjk91r,Pro tip: this is the only study hack you need.,,https://www.reddit.com/r/productivity/comments/1sjk91r/pro_tip_this_is_the_only_study_hack_you_need/,2207
1soch78,28M and I've achieved nothing: I want to fix my life but I just stay sad and do nothing every day,,https://www.reddit.com/r/productivity/comments/1soch78/28m_and_ive_achieved_nothing_i_want_to_fix_my/,2038
1t3q3fx,How do you actually stop endless scrolling?,,https://www.reddit.com/r/productivity/comments/1t3q3fx/how_do_you_actually_stop_endless_scrolling/,1855
1sfxsty,How to be productive when you have depression,,https://www.reddit.com/r/productivity/comments/1sfxsty/how_to_be_productive_when_you_have_depression/,1102
1sgjbx7,How did you leave scrolling for hours?,,https://www.reddit.com/r/productivity/comments/1sgjbx7/how_did_you_leave_scrolling_for_hours/,1003
1svyaom,"What are some things - maybe tiny changes you made, which actually improved your life a lot better?",,https://www.reddit.com/r/productivity/comments/1svyaom/what_are_some_things_maybe_tiny_changes_you_made/,1591
1t1rw5v,"I changed 3 small things about how I save files, and it made finding them way easier",,https://www.reddit.com/r/productivity/comments/1t1rw5v/i_changed_3_small_things_about_how_i_save_files/,1512
1t0afzu,I stopped doing one thing and saved 5 hours,,https://www.reddit.com/r/productivity/comments/1t0afzu/i_stopped_doing_one_thing_and_saved_5_hours/,1497
1si8g8a,i think making time for hobbies is necessary once you hit a certain level of productivity.,,https://www.reddit.com/r/productivity/comments/1si8g8a/i_think_making_time_for_hobbies_is_necessary_once/,877
1swqk63,Update on one day as Thomas Jefferson,,https://www.reddit.com/r/productivity/comments/1swqk63/update_on_one_day_as_thomas_jefferson/,912
1t2me54,I think this might be the reason why people can't focus anymore,,https://www.reddit.com/r/productivity/comments/1t2me54/i_think_this_might_be_the_reason_why_people_cant/,1279
1t2fich,What’s the lowest-effort productivity “hack” that actually made you more consistent?,,https://www.reddit.com/r/productivity/comments/1t2fich/whats_the_lowesteffort_productivity_hack_that/,607
1t68ta3,Please help me stop dressing like steve jobs/elizabeth holmes! I want to be efficient without seeming like a weirdo.,,https://www.reddit.com/r/productivity/comments/1t68ta3/please_help_me_stop_dressing_like_steve/,930
1szim9r,"Those who successfully built a side hustle, how did you do it working a 9 to 5?",,https://www.reddit.com/r/productivity/comments/1szim9r/those_who_successfully_built_a_side_hustle_how/,931
1suf9ic,I don’t fully agree with 'you have to wake up early to be successful.',,https://www.reddit.com/r/productivity/comments/1suf9ic/i_dont_fully_agree_with_you_have_to_wake_up_early/,1027
1t56q38,I spend all day being “productive” but still avoid the work that actually matters,,https://www.reddit.com/r/productivity/comments/1t56q38/i_spend_all_day_being_productive_but_still_avoid/,963
1sqjylz,I stay up late to get work done almost everyday because regardless of what time I go to bed. I will always wake up late.,,https://www.reddit.com/r/productivity/comments/1sqjylz/i_stay_up_late_to_get_work_done_almost_everyday/,700
1ss0gjm,I tracked how long it took me to type vs say things for 30 days and it kind of pissed me off,,https://www.reddit.com/r/productivity/comments/1ss0gjm/i_tracked_how_long_it_took_me_to_type_vs_say/,755
1sspjym,I have a golden ticket but I don't have the motivation to use it,,https://www.reddit.com/r/productivity/comments/1sspjym/i_have_a_golden_ticket_but_i_dont_have_the/,391
1t49oxc,"I’m a genius at planning, but a fucking failure at consistency. Help.",,https://www.reddit.com/r/productivity/comments/1t49oxc/im_a_genius_at_planning_but_a_fucking_failure_at/,582
1spkz7s,A small trick that helps me start the day right,,https://www.reddit.com/r/productivity/comments/1spkz7s/a_small_trick_that_helps_me_start_the_day_right/,450
1srbfvd,"Exhausted all the time, except at night!",,https://www.reddit.com/r/productivity/comments/1srbfvd/exhausted_all_the_time_except_at_night/,669
1sgqn01,PLEASE HELP I’m ignoring all of my alarms in the morning.,,https://www.reddit.com/r/productivity/comments/1sgqn01/please_help_im_ignoring_all_of_my_alarms_in_the/,963
1snrdcm,Quie Instagram- Got my brain back,,https://www.reddit.com/r/productivity/comments/1snrdcm/quie_instagram_got_my_brain_back/,255
1t1581t,What do your most productive days look like and what helps you personally to keep them that way?,,https://www.reddit.com/r/productivity/comments/1t1581t/what_do_your_most_productive_days_look_like_and/,257
1st744m,As a workaholic what exactly am I supposed to do while not at work?,,https://www.reddit.com/r/productivity/comments/1st744m/as_a_workaholic_what_exactly_am_i_supposed_to_do/,917
1sv9ef7,Why is it so hard to do basic things consistently?,,https://www.reddit.com/r/productivity/comments/1sv9ef7/why_is_it_so_hard_to_do_basic_things_consistently/,255
1sy22ca,How do you motivate yourself to make money?,,https://www.reddit.com/r/productivity/comments/1sy22ca/how_do_you_motivate_yourself_to_make_money/,279
1sgwdg9,A Simple Trick To Kill Procrastination,,https://www.reddit.com/r/productivity/comments/1sgwdg9/a_simple_trick_to_kill_procrastination/,519
