id,title,selftext,permalink,score
1tyjt2g,How are people so energetic after work and after the work week?,,https://www.reddit.com/r/productivity/comments/1tyjt2g/how_are_people_so_energetic_after_work_and_after/,23666
1u08yc8,what’s the wellness habit that actually changed your life more than expected?,,https://www.reddit.com/r/productivity/comments/1u08yc8/whats_the_wellness_habit_that_actually_changed/,21448
1tlxeha,How are elite athletes so disciplined?,,https://www.reddit.com/r/productivity/comments/1tlxeha/how_are_elite_athletes_so_disciplined/,18934
1ttor4o,What to replace with social media?,,https://www.reddit.com/r/productivity/comments/1ttor4o/what_to_replace_with_social_media/,16399
1tu56g3,I realized why everyone I know hates Todoist,,https://www.reddit.com/r/productivity/comments/1tu56g3/i_realized_why_everyone_i_know_hates_todoist/,14407
1tl15rl,why am i never-endingly exhausted??,,https://www.reddit.com/r/productivity/comments/1tl15rl/why_am_i_neverendingly_exhausted/,12531
1tpp9xp,How do you read 20+ books a year without getting tired or bored?,,https://www.reddit.com/r/productivity/comments/1tpp9xp/how_do_you_read_20_books_a_year_without_getting/,11689
1ts8ky9,"what helped shift your perspective from ""I'll do it last minute"" to ""I'll do it ASAP to not let it hang over me""",,https://www.reddit.com/r/productivity/comments/1ts8ky9/what_helped_shift_your_perspective_from_ill_do_it/,9853
1tuyyll,"After some sessions with a psychologist, I found out that the reason why I procrastinate and am afraid to be assertive is because I have a low tolerance of stress. So what can I do now?",,https://www.reddit.com/r/productivity/comments/1tuyyll/after_some_sessions_with_a_psychologist_i_found/,8836
1tegjak,Getting diagnosed made me more productive,,https://www.reddit.com/r/productivity/comments/1tegjak/getting_diagnosed_made_me_more_productive/,7588
1twceb4,Constantly sleepy and out of energy,,https://www.reddit.com/r/productivity/comments/1twceb4/constantly_sleepy_and_out_of_energy/,7003
1tres24,I think social media destroyed my attention span and motivation,,https://www.reddit.com/r/productivity/comments/1tres24/i_think_social_media_destroyed_my_attention_span/,6542
1thvep8,"People who workout before work, what's your routine?",,https://www.reddit.com/r/productivity/comments/1thvep8/people_who_workout_before_work_whats_your_routine/,5789
1u1ephl,starting to fix my life using simple habits. and the first one I tried got all of me.,,https://www.reddit.com/r/productivity/comments/1u1ephl/starting_to_fix_my_life_using_simple_habits_and/,4858
1ty8jk2,I’m just over 40 and getting so slow at work..,,https://www.reddit.com/r/productivity/comments/1ty8jk2/im_just_over_40_and_getting_so_slow_at_work/,4280
1tgcegn,What's a dummy or tiny micro-habit you use that weirdly works every single time?,,https://www.reddit.com/r/productivity/comments/1tgcegn/whats_a_dummy_or_tiny_microhabit_you_use_that/,4359
1tauzmh,Can I reverse the cognitive decline caused by constantly being on screens?,,https://www.reddit.com/r/productivity/comments/1tauzmh/can_i_reverse_the_cognitive_decline_caused_by/,3829
1teowil,Do you see the weekends as an opportunity to grow or relax?,,https://www.reddit.com/r/productivity/comments/1teowil/do_you_see_the_weekends_as_an_opportunity_to_grow/,3090
1tp8kn7,Looking for tips on how to get up in the morning,,https://www.reddit.com/r/productivity/comments/1tp8kn7/looking_for_tips_on_how_to_get_up_in_the_morning/,3235
1tfutzl,HOW do you stop wasting time? Hours can go by without realizing and I don't even know what I wasted them on?,,https://www.reddit.com/r/productivity/comments/1tfutzl/how_do_you_stop_wasting_time_hours_can_go_by/,2902
1ty1hkd,I can't bring myself to focus anymore,,https://www.reddit.com/r/productivity/comments/1ty1hkd/i_cant_bring_myself_to_focus_anymore/,2321
1tswlza,"Please, I really need to lock in",,https://www.reddit.com/r/productivity/comments/1tswlza/please_i_really_need_to_lock_in/,2268
1tn2cwr,Feel like my brain is fried from doom scrolling,,https://www.reddit.com/r/productivity/comments/1tn2cwr/feel_like_my_brain_is_fried_from_doom_scrolling/,1547
1th3af6,30 days no external media (days 7-10),,https://www.reddit.com/r/productivity/comments/1th3af6/30_days_no_external_media_days_710/,2123
1ti5a9s,Has anyone tried staring at the wall for 10 min?,,https://www.reddit.com/r/productivity/comments/1ti5a9s/has_anyone_tried_staring_at_the_wall_for_10_min/,1676
1tbuocp,what can i do instead of doom scrolling at work,,https://www.reddit.com/r/productivity/comments/1tbuocp/what_can_i_do_instead_of_doom_scrolling_at_work/,1696
1to4x4d,I've been lazing around for 7 years now and wanna know how I can start working again.,,https://www.reddit.com/r/productivity/comments/1to4x4d/ive_been_lazing_around_for_7_years_now_and_wanna/,977
1tiv76j,How do some people stay so updated about everything going on in the world?,,https://www.reddit.com/r/productivity/comments/1tiv76j/how_do_some_people_stay_so_updated_about/,1107
1u02nxp,how am i supposed to read books?,,https://www.reddit.com/r/productivity/comments/1u02nxp/how_am_i_supposed_to_read_books/,1640
1tvib2n,How are we helping 24/7 lethargy,,https://www.reddit.com/r/productivity/comments/1tvib2n/how_are_we_helping_247_lethargy/,1108
1tcwgfh,Whats the thing that currently gives you the most dopamine ?,,https://www.reddit.com/r/productivity/comments/1tcwgfh/whats_the_thing_that_currently_gives_you_the_most/,1486
1tipmt3,"Suffering through severe procrastination....My time is running out and I still procrastinate, I don't understand why I'm doing what I'm doing, someone please help.",,https://www.reddit.com/r/productivity/comments/1tipmt3/suffering_through_severe_procrastinationmy_time/,1401
1tmuvfh,How do you reset quickly after losing 2–3 hours to procrastination?,,https://www.reddit.com/r/productivity/comments/1tmuvfh/how_do_you_reset_quickly_after_losing_23_hours_to/,1217
1twghxh,how do you stop confusing “planning” with actually being productive?,,https://www.reddit.com/r/productivity/comments/1twghxh/how_do_you_stop_confusing_planning_with_actually/,985
1taazuz,voice input is the most underrated productivity shift of the last ten years and the reason nobody uses it is completely stupid,,https://www.reddit.com/r/productivity/comments/1taazuz/voice_input_is_the_most_underrated_productivity/,1283
1u17yqa,How do you stay consistent when you're interested in too many things?,,https://www.reddit.com/r/productivity/comments/1u17yqa/how_do_you_stay_consistent_when_youre_interested/,499
1tz6ffw,I always forget what I just read!,,https://www.reddit.com/r/productivity/comments/1tz6ffw/i_always_forget_what_i_just_read/,875
1tqio0h,How do people stay productive when working from home?,,https://www.reddit.com/r/productivity/comments/1tqio0h/how_do_people_stay_productive_when_working_from/,342
1tmzgl4,"Do people avoid journaling because they dislike reflection, or because the format feels too heavy?",,https://www.reddit.com/r/productivity/comments/1tmzgl4/do_people_avoid_journaling_because_they_dislike/,586
1tdd280,Is it actually possible to do ALL the self-help habits simultaneously?,,https://www.reddit.com/r/productivity/comments/1tdd280/is_it_actually_possible_to_do_all_the_selfhelp/,782
1tl378v,"How to clean out 5,000+ unread emails",,https://www.reddit.com/r/productivity/comments/1tl378v/how_to_clean_out_5000_unread_emails/,1076
1trjco0,All the times where there was a Lego set 10 feet from me and I literally couldn't make myself start it. Turns out there's a name for that.,,https://www.reddit.com/r/productivity/comments/1trjco0/all_the_times_where_there_was_a_lego_set_10_feet/,1028
1tbjlp8,I am so tired and I dont know why,,https://www.reddit.com/r/productivity/comments/1tbjlp8/i_am_so_tired_and_i_dont_know_why/,411
1txgjxx,"For a long time, I thought consistency required more discipline.",,https://www.reddit.com/r/productivity/comments/1txgjxx/for_a_long_time_i_thought_consistency_required/,632
1tvq9nn,I thought I remembered Atomic Habits. I tested myself. I was wrong.,,https://www.reddit.com/r/productivity/comments/1tvq9nn/i_thought_i_remembered_atomic_habits_i_tested/,532
1tftvqv,How to replace reels addiction?,,https://www.reddit.com/r/productivity/comments/1tftvqv/how_to_replace_reels_addiction/,360
1tfbvty,"Should I just abandon my digital ""Second Brain"" for pen and paper?",,https://www.reddit.com/r/productivity/comments/1tfbvty/should_i_just_abandon_my_digital_second_brain_for/,654
1teeggu,I hate constantly scrolling and can’t stop,,https://www.reddit.com/r/productivity/comments/1teeggu/i_hate_constantly_scrolling_and_cant_stop/,681
1txtwsf,how do i improve my attention span,,https://www.reddit.com/r/productivity/comments/1txtwsf/how_do_i_improve_my_attention_span/,662
1tckuw8,I can’t care about anything and it blows.,,https://www.reddit.com/r/productivity/comments/1tckuw8/i_cant_care_about_anything_and_it_blows/,834
