id,title,selftext,permalink,score
1td8kg3,How to stop putting your entire day on hold because of something you have to do later in the afternoon?,,https://www.reddit.com/r/productivity/comments/1td8kg3/how_to_stop_putting_your_entire_day_on_hold/,33263
1tlxeha,How are elite athletes so disciplined?,,https://www.reddit.com/r/productivity/comments/1tlxeha/how_are_elite_athletes_so_disciplined/,29309
1ttor4o,What to replace with social media?,,https://www.reddit.com/r/productivity/comments/1ttor4o/what_to_replace_with_social_media/,25814
1trvj2z,What do you do when you have nothing to do.,,https://www.reddit.com/r/productivity/comments/1trvj2z/what_do_you_do_when_you_have_nothing_to_do/,23462
1tl15rl,why am i never-endingly exhausted??,,https://www.reddit.com/r/productivity/comments/1tl15rl/why_am_i_neverendingly_exhausted/,20626
1tpp9xp,How do you read 20+ books a year without getting tired or bored?,,https://www.reddit.com/r/productivity/comments/1tpp9xp/how_do_you_read_20_books_a_year_without_getting/,18403
1t5sodh,What do you guys do in the first hour after waking up?,,https://www.reddit.com/r/productivity/comments/1t5sodh/what_do_you_guys_do_in_the_first_hour_after/,16050
1ts8ky9,"what helped shift your perspective from ""I'll do it last minute"" to ""I'll do it ASAP to not let it hang over me""",,https://www.reddit.com/r/productivity/comments/1ts8ky9/what_helped_shift_your_perspective_from_ill_do_it/,14069
1t9g9y4,Do you guys exercise before or after work?,,https://www.reddit.com/r/productivity/comments/1t9g9y4/do_you_guys_exercise_before_or_after_work/,12288
1t4asn1,I work 18 hours a day and get nothing done. Help.,,https://www.reddit.com/r/productivity/comments/1t4asn1/i_work_18_hours_a_day_and_get_nothing_done_help/,11388
1tegjak,Getting diagnosed made me more productive,,https://www.reddit.com/r/productivity/comments/1tegjak/getting_diagnosed_made_me_more_productive/,9911
1t9o0mi,Naming files in yymmdd order. Am I mad?,,https://www.reddit.com/r/productivity/comments/1t9o0mi/naming_files_in_yymmdd_order_am_i_mad/,8698
1tsw6v5,"Get off screen, Go for that walk.",,https://www.reddit.com/r/productivity/comments/1tsw6v5/get_off_screen_go_for_that_walk/,7759
1t7rjyd,The best way to lock in is to lock out.,,https://www.reddit.com/r/productivity/comments/1t7rjyd/the_best_way_to_lock_in_is_to_lock_out/,6530
1tres24,I think social media destroyed my attention span and motivation,,https://www.reddit.com/r/productivity/comments/1tres24/i_think_social_media_destroyed_my_attention_span/,5737
1tma0ks,What skill would you genuinely improve if learning it only took 5 minutes a day?,,https://www.reddit.com/r/productivity/comments/1tma0ks/what_skill_would_you_genuinely_improve_if/,5411
1thvep8,"People who workout before work, what's your routine?",,https://www.reddit.com/r/productivity/comments/1thvep8/people_who_workout_before_work_whats_your_routine/,4585
1tgcegn,What's a dummy or tiny micro-habit you use that weirdly works every single time?,,https://www.reddit.com/r/productivity/comments/1tgcegn/whats_a_dummy_or_tiny_microhabit_you_use_that/,4125
1tauzmh,Can I reverse the cognitive decline caused by constantly being on screens?,,https://www.reddit.com/r/productivity/comments/1tauzmh/can_i_reverse_the_cognitive_decline_caused_by/,4044
1tp8kn7,Looking for tips on how to get up in the morning,,https://www.reddit.com/r/productivity/comments/1tp8kn7/looking_for_tips_on_how_to_get_up_in_the_morning/,3876
1teowil,Do you see the weekends as an opportunity to grow or relax?,,https://www.reddit.com/r/productivity/comments/1teowil/do_you_see_the_weekends_as_an_opportunity_to_grow/,3259
1tkma7g,Productivity is basically decided by how I slept the night before,,https://www.reddit.com/r/productivity/comments/1tkma7g/productivity_is_basically_decided_by_how_i_slept/,3181
1tfutzl,HOW do you stop wasting time? Hours can go by without realizing and I don't even know what I wasted them on?,,https://www.reddit.com/r/productivity/comments/1tfutzl/how_do_you_stop_wasting_time_hours_can_go_by/,2436
1t3q3fx,How do you actually stop endless scrolling?,,https://www.reddit.com/r/productivity/comments/1t3q3fx/how_do_you_actually_stop_endless_scrolling/,1892
1tn2cwr,Feel like my brain is fried from doom scrolling,,https://www.reddit.com/r/productivity/comments/1tn2cwr/feel_like_my_brain_is_fried_from_doom_scrolling/,2114
1tswlza,"Please, I really need to lock in",,https://www.reddit.com/r/productivity/comments/1tswlza/please_i_really_need_to_lock_in/,1727
1tsdl41,"We need to talk about the “recipe blog effect” on everything, this is affecting a lot of things in the internet",,https://www.reddit.com/r/productivity/comments/1tsdl41/we_need_to_talk_about_the_recipe_blog_effect_on/,2090
1th3af6,30 days no external media (days 7-10),,https://www.reddit.com/r/productivity/comments/1th3af6/30_days_no_external_media_days_710/,1893
1tbuocp,what can i do instead of doom scrolling at work,,https://www.reddit.com/r/productivity/comments/1tbuocp/what_can_i_do_instead_of_doom_scrolling_at_work/,1442
1to4x4d,I've been lazing around for 7 years now and wanna know how I can start working again.,,https://www.reddit.com/r/productivity/comments/1to4x4d/ive_been_lazing_around_for_7_years_now_and_wanna/,1324
1tiv76j,How do some people stay so updated about everything going on in the world?,,https://www.reddit.com/r/productivity/comments/1tiv76j/how_do_some_people_stay_so_updated_about/,1155
1ti5a9s,Has anyone tried staring at the wall for 10 min?,,https://www.reddit.com/r/productivity/comments/1ti5a9s/has_anyone_tried_staring_at_the_wall_for_10_min/,1266
1tcwgfh,Whats the thing that currently gives you the most dopamine ?,,https://www.reddit.com/r/productivity/comments/1tcwgfh/whats_the_thing_that_currently_gives_you_the_most/,955
1t9ah1g,How do you stay productive after work?,,https://www.reddit.com/r/productivity/comments/1t9ah1g/how_do_you_stay_productive_after_work/,1145
1t2me54,I think this might be the reason why people can't focus anymore,,https://www.reddit.com/r/productivity/comments/1t2me54/i_think_this_might_be_the_reason_why_people_cant/,1009
1tipmt3,"Suffering through severe procrastination....My time is running out and I still procrastinate, I don't understand why I'm doing what I'm doing, someone please help.",,https://www.reddit.com/r/productivity/comments/1tipmt3/suffering_through_severe_procrastinationmy_time/,907
1tmuvfh,How do you reset quickly after losing 2–3 hours to procrastination?,,https://www.reddit.com/r/productivity/comments/1tmuvfh/how_do_you_reset_quickly_after_losing_23_hours_to/,1081
1t68ta3,Please help me stop dressing like steve jobs/elizabeth holmes! I want to be efficient without seeming like a weirdo.,,https://www.reddit.com/r/productivity/comments/1t68ta3/please_help_me_stop_dressing_like_steve/,621
1t56q38,I spend all day being “productive” but still avoid the work that actually matters,,https://www.reddit.com/r/productivity/comments/1t56q38/i_spend_all_day_being_productive_but_still_avoid/,384
1tqio0h,How do people stay productive when working from home?,,https://www.reddit.com/r/productivity/comments/1tqio0h/how_do_people_stay_productive_when_working_from/,829
1tmzgl4,"Do people avoid journaling because they dislike reflection, or because the format feels too heavy?",,https://www.reddit.com/r/productivity/comments/1tmzgl4/do_people_avoid_journaling_because_they_dislike/,345
1taazuz,voice input is the most underrated productivity shift of the last ten years and the reason nobody uses it is completely stupid,,https://www.reddit.com/r/productivity/comments/1taazuz/voice_input_is_the_most_underrated_productivity/,771
1t8439d,"the ""i'll start in 5 minutes"" loop is actually destroying my income",,https://www.reddit.com/r/productivity/comments/1t8439d/the_ill_start_in_5_minutes_loop_is_actually/,299
1t49oxc,"I’m a genius at planning, but a fucking failure at consistency. Help.",,https://www.reddit.com/r/productivity/comments/1t49oxc/im_a_genius_at_planning_but_a_fucking_failure_at/,290
1tdd280,Is it actually possible to do ALL the self-help habits simultaneously?,,https://www.reddit.com/r/productivity/comments/1tdd280/is_it_actually_possible_to_do_all_the_selfhelp/,606
1tl378v,"How to clean out 5,000+ unread emails",,https://www.reddit.com/r/productivity/comments/1tl378v/how_to_clean_out_5000_unread_emails/,894
1t8qagc,How do you cope when your life starts feeling too big for you?,,https://www.reddit.com/r/productivity/comments/1t8qagc/how_do_you_cope_when_your_life_starts_feeling_too/,523
1tbjlp8,I am so tired and I dont know why,,https://www.reddit.com/r/productivity/comments/1tbjlp8/i_am_so_tired_and_i_dont_know_why/,1006
1t5jatf,what are the easiest practical skills no one taugh you?,,https://www.reddit.com/r/productivity/comments/1t5jatf/what_are_the_easiest_practical_skills_no_one/,905
1tftvqv,How to replace reels addiction?,,https://www.reddit.com/r/productivity/comments/1tftvqv/how_to_replace_reels_addiction/,544
