id,title,selftext,permalink,score
1td8kg3,How to stop putting your entire day on hold because of something you have to do later in the afternoon?,,https://www.reddit.com/r/productivity/comments/1td8kg3/how_to_stop_putting_your_entire_day_on_hold/,21826
1tb55b4,What’s one habit that genuinely improved your life the most?,,https://www.reddit.com/r/productivity/comments/1tb55b4/whats_one_habit_that_genuinely_improved_your_life/,19946
1tj2384,I'm not depressed but all I have energy to do is lie in bed while listening to music.,,https://www.reddit.com/r/productivity/comments/1tj2384/im_not_depressed_but_all_i_have_energy_to_do_is/,17799
1tl15rl,why am i never-endingly exhausted??,,https://www.reddit.com/r/productivity/comments/1tl15rl/why_am_i_neverendingly_exhausted/,15181
1t5sodh,What do you guys do in the first hour after waking up?,,https://www.reddit.com/r/productivity/comments/1t5sodh/what_do_you_guys_do_in_the_first_hour_after/,13673
1sy735v,the only productivity advice that matters right now.,,https://www.reddit.com/r/productivity/comments/1sy735v/the_only_productivity_advice_that_matters_right/,12016
1sux39u,Tomorrow I will spend my day as Thomas Jefferson.,,https://www.reddit.com/r/productivity/comments/1sux39u/tomorrow_i_will_spend_my_day_as_thomas_jefferson/,10419
1t9g9y4,Do you guys exercise before or after work?,,https://www.reddit.com/r/productivity/comments/1t9g9y4/do_you_guys_exercise_before_or_after_work/,9022
1t4asn1,I work 18 hours a day and get nothing done. Help.,,https://www.reddit.com/r/productivity/comments/1t4asn1/i_work_18_hours_a_day_and_get_nothing_done_help/,8769
1tegjak,Getting diagnosed made me more productive,,https://www.reddit.com/r/productivity/comments/1tegjak/getting_diagnosed_made_me_more_productive/,7363
1t9o0mi,Naming files in yymmdd order. Am I mad?,,https://www.reddit.com/r/productivity/comments/1t9o0mi/naming_files_in_yymmdd_order_am_i_mad/,6604
1t7rjyd,The best way to lock in is to lock out.,,https://www.reddit.com/r/productivity/comments/1t7rjyd/the_best_way_to_lock_in_is_to_lock_out/,5848
1t2i6ec,I stopped watching political news,,https://www.reddit.com/r/productivity/comments/1t2i6ec/i_stopped_watching_political_news/,5502
1thvep8,"People who workout before work, what's your routine?",,https://www.reddit.com/r/productivity/comments/1thvep8/people_who_workout_before_work_whats_your_routine/,4781
1tgcegn,What's a dummy or tiny micro-habit you use that weirdly works every single time?,,https://www.reddit.com/r/productivity/comments/1tgcegn/whats_a_dummy_or_tiny_microhabit_you_use_that/,4121
1tauzmh,Can I reverse the cognitive decline caused by constantly being on screens?,,https://www.reddit.com/r/productivity/comments/1tauzmh/can_i_reverse_the_cognitive_decline_caused_by/,3939
1t1jza9,Things to do instead of doom scrolling?,,https://www.reddit.com/r/productivity/comments/1t1jza9/things_to_do_instead_of_doom_scrolling/,3217
1teowil,Do you see the weekends as an opportunity to grow or relax?,,https://www.reddit.com/r/productivity/comments/1teowil/do_you_see_the_weekends_as_an_opportunity_to_grow/,2628
1tfutzl,HOW do you stop wasting time? Hours can go by without realizing and I don't even know what I wasted them on?,,https://www.reddit.com/r/productivity/comments/1tfutzl/how_do_you_stop_wasting_time_hours_can_go_by/,2359
1tkma7g,Productivity is basically decided by how I slept the night before,,https://www.reddit.com/r/productivity/comments/1tkma7g/productivity_is_basically_decided_by_how_i_slept/,2135
1sy5j07,does anyone feel like they can never cut rotting out of their life?,,https://www.reddit.com/r/productivity/comments/1sy5j07/does_anyone_feel_like_they_can_never_cut_rotting/,2118
1t3q3fx,How do you actually stop endless scrolling?,,https://www.reddit.com/r/productivity/comments/1t3q3fx/how_do_you_actually_stop_endless_scrolling/,2060
1th3af6,30 days no external media (days 7-10),,https://www.reddit.com/r/productivity/comments/1th3af6/30_days_no_external_media_days_710/,1495
1tbuocp,what can i do instead of doom scrolling at work,,https://www.reddit.com/r/productivity/comments/1tbuocp/what_can_i_do_instead_of_doom_scrolling_at_work/,1627
1svyaom,"What are some things - maybe tiny changes you made, which actually improved your life a lot better?",,https://www.reddit.com/r/productivity/comments/1svyaom/what_are_some_things_maybe_tiny_changes_you_made/,2005
1ti5a9s,Has anyone tried staring at the wall for 10 min?,,https://www.reddit.com/r/productivity/comments/1ti5a9s/has_anyone_tried_staring_at_the_wall_for_10_min/,1785
1t1rw5v,"I changed 3 small things about how I save files, and it made finding them way easier",,https://www.reddit.com/r/productivity/comments/1t1rw5v/i_changed_3_small_things_about_how_i_save_files/,1179
1tiv76j,How do some people stay so updated about everything going on in the world?,,https://www.reddit.com/r/productivity/comments/1tiv76j/how_do_some_people_stay_so_updated_about/,1005
1tcwgfh,Whats the thing that currently gives you the most dopamine ?,,https://www.reddit.com/r/productivity/comments/1tcwgfh/whats_the_thing_that_currently_gives_you_the_most/,824
1t0afzu,I stopped doing one thing and saved 5 hours,,https://www.reddit.com/r/productivity/comments/1t0afzu/i_stopped_doing_one_thing_and_saved_5_hours/,1022
1t9ah1g,How do you stay productive after work?,,https://www.reddit.com/r/productivity/comments/1t9ah1g/how_do_you_stay_productive_after_work/,713
1t2me54,I think this might be the reason why people can't focus anymore,,https://www.reddit.com/r/productivity/comments/1t2me54/i_think_this_might_be_the_reason_why_people_cant/,1307
1t2fich,What’s the lowest-effort productivity “hack” that actually made you more consistent?,,https://www.reddit.com/r/productivity/comments/1t2fich/whats_the_lowesteffort_productivity_hack_that/,668
1swqk63,Update on one day as Thomas Jefferson,,https://www.reddit.com/r/productivity/comments/1swqk63/update_on_one_day_as_thomas_jefferson/,588
1tipmt3,"Suffering through severe procrastination....My time is running out and I still procrastinate, I don't understand why I'm doing what I'm doing, someone please help.",,https://www.reddit.com/r/productivity/comments/1tipmt3/suffering_through_severe_procrastinationmy_time/,992
1t68ta3,Please help me stop dressing like steve jobs/elizabeth holmes! I want to be efficient without seeming like a weirdo.,,https://www.reddit.com/r/productivity/comments/1t68ta3/please_help_me_stop_dressing_like_steve/,768
1t56q38,I spend all day being “productive” but still avoid the work that actually matters,,https://www.reddit.com/r/productivity/comments/1t56q38/i_spend_all_day_being_productive_but_still_avoid/,323
1taazuz,voice input is the most underrated productivity shift of the last ten years and the reason nobody uses it is completely stupid,,https://www.reddit.com/r/productivity/comments/1taazuz/voice_input_is_the_most_underrated_productivity/,407
1szim9r,"Those who successfully built a side hustle, how did you do it working a 9 to 5?",,https://www.reddit.com/r/productivity/comments/1szim9r/those_who_successfully_built_a_side_hustle_how/,541
1suf9ic,I don’t fully agree with 'you have to wake up early to be successful.',,https://www.reddit.com/r/productivity/comments/1suf9ic/i_dont_fully_agree_with_you_have_to_wake_up_early/,572
1t8439d,"the ""i'll start in 5 minutes"" loop is actually destroying my income",,https://www.reddit.com/r/productivity/comments/1t8439d/the_ill_start_in_5_minutes_loop_is_actually/,952
1t49oxc,"I’m a genius at planning, but a fucking failure at consistency. Help.",,https://www.reddit.com/r/productivity/comments/1t49oxc/im_a_genius_at_planning_but_a_fucking_failure_at/,582
1tlc9fp,What’s your biggest ‘I’ll do it later’ task right now… and how long have you been avoiding it?,,https://www.reddit.com/r/productivity/comments/1tlc9fp/whats_your_biggest_ill_do_it_later_task_right_now/,1078
1tdd280,Is it actually possible to do ALL the self-help habits simultaneously?,,https://www.reddit.com/r/productivity/comments/1tdd280/is_it_actually_possible_to_do_all_the_selfhelp/,372
1t8qagc,How do you cope when your life starts feeling too big for you?,,https://www.reddit.com/r/productivity/comments/1t8qagc/how_do_you_cope_when_your_life_starts_feeling_too/,1063
1t1581t,What do your most productive days look like and what helps you personally to keep them that way?,,https://www.reddit.com/r/productivity/comments/1t1581t/what_do_your_most_productive_days_look_like_and/,596
1tbjlp8,I am so tired and I dont know why,,https://www.reddit.com/r/productivity/comments/1tbjlp8/i_am_so_tired_and_i_dont_know_why/,576
1t5jatf,what are the easiest practical skills no one taugh you?,,https://www.reddit.com/r/productivity/comments/1t5jatf/what_are_the_easiest_practical_skills_no_one/,1016
1sy22ca,How do you motivate yourself to make money?,,https://www.reddit.com/r/productivity/comments/1sy22ca/how_do_you_motivate_yourself_to_make_money/,221
1tfbvty,"Should I just abandon my digital ""Second Brain"" for pen and paper?",,https://www.reddit.com/r/productivity/comments/1tfbvty/should_i_just_abandon_my_digital_second_brain_for/,285
