id,title,selftext,permalink,score
1r9meg9,How i finally stopped bed rotting for 4 hours every night (willpower is a scam),,https://www.reddit.com/r/productivity/comments/1r9meg9/how_i_finally_stopped_bed_rotting_for_4_hours/,33565
1rhwxiw,"I tracked every hour I worked for a week, and honestly it was kind of embarrassing.",,https://www.reddit.com/r/productivity/comments/1rhwxiw/i_tracked_every_hour_i_worked_for_a_week_and/,29511
1rg07m5,i can’t stop wasting days and idk what’s wrong with me,,https://www.reddit.com/r/productivity/comments/1rg07m5/i_cant_stop_wasting_days_and_idk_whats_wrong_with/,26552
1rl1kql,im fixing my f*cked brain and attention span (join me),,https://www.reddit.com/r/productivity/comments/1rl1kql/im_fixing_my_fcked_brain_and_attention_span_join/,22692
1rfc0ub,I thought I was lazy but actually I feel unrested even after sleeping 8 hours,,https://www.reddit.com/r/productivity/comments/1rfc0ub/i_thought_i_was_lazy_but_actually_i_feel_unrested/,20442
1rkalu1,Left social media forever. Been a month,,https://www.reddit.com/r/productivity/comments/1rkalu1/left_social_media_forever_been_a_month/,17715
1rcel42,I really want to understand how much you all work everyday,,https://www.reddit.com/r/productivity/comments/1rcel42/i_really_want_to_understand_how_much_you_all_work/,15583
1rtk406,"People who prefer staying home, what do you do all day?",,https://www.reddit.com/r/productivity/comments/1rtk406/people_who_prefer_staying_home_what_do_you_do_all/,13848
1raelyb,I tried Dopamine detox for few weeks here is my results,,https://www.reddit.com/r/productivity/comments/1raelyb/i_tried_dopamine_detox_for_few_weeks_here_is_my/,12759
1rb5xkx,I stopped tracking 10 habits and started defining a “minimum viable day.” It’s working better than I expected.,,https://www.reddit.com/r/productivity/comments/1rb5xkx/i_stopped_tracking_10_habits_and_started_defining/,10634
1rpv8mt,Your 5 AM routine is a performance not a strategy,,https://www.reddit.com/r/productivity/comments/1rpv8mt/your_5_am_routine_is_a_performance_not_a_strategy/,9640
1rw1we1,"I do a 1 minute breathing thing before deep work and honestly it's the only ""productivity hack"" thats actually stuck",,https://www.reddit.com/r/productivity/comments/1rw1we1/i_do_a_1_minute_breathing_thing_before_deep_work/,8437
1rdgz2b,"I tested the fastest way to deal with procrastination and productivity, it took me less than 30 minutes.",,https://www.reddit.com/r/productivity/comments/1rdgz2b/i_tested_the_fastest_way_to_deal_with/,7510
1rdrdai,I assigned Jesus as my productivity manager,,https://www.reddit.com/r/productivity/comments/1rdrdai/i_assigned_jesus_as_my_productivity_manager/,7251
1r9co09,"""I don't have time"" is the biggest lie you tell yourself every day",,https://www.reddit.com/r/productivity/comments/1r9co09/i_dont_have_time_is_the_biggest_lie_you_tell/,6069
1r8lzfw,"finally figured out why I keep starting my day ""productively"" but getting nothing done",,https://www.reddit.com/r/productivity/comments/1r8lzfw/finally_figured_out_why_i_keep_starting_my_day/,5353
1rrhe55,I just go back to bed whenever I wake up,,https://www.reddit.com/r/productivity/comments/1rrhe55/i_just_go_back_to_bed_whenever_i_wake_up/,5205
1rh740g,What're some productive things that I can do on my phone instead of scrolling?,,https://www.reddit.com/r/productivity/comments/1rh740g/whatre_some_productive_things_that_i_can_do_on_my/,4572
1rqn8lk,I have so many things I can do but always end up doing nothing,,https://www.reddit.com/r/productivity/comments/1rqn8lk/i_have_so_many_things_i_can_do_but_always_end_up/,3783
1rmgo06,I kept blaming myself for being unproductive but it was actually just my apartment,,https://www.reddit.com/r/productivity/comments/1rmgo06/i_kept_blaming_myself_for_being_unproductive_but/,3472
1rc9jfa,My memory is utterly fucked!!!,,https://www.reddit.com/r/productivity/comments/1rc9jfa/my_memory_is_utterly_fucked/,3514
1rv8ftj,Your productivity is directly dependent on your relationship.,,https://www.reddit.com/r/productivity/comments/1rv8ftj/your_productivity_is_directly_dependent_on_your/,2518
1r9yloa,I solved an 11-day problem on a walk where I wasn't trying to solve anything,,https://www.reddit.com/r/productivity/comments/1r9yloa/i_solved_an_11day_problem_on_a_walk_where_i_wasnt/,2784
1rgi00k,Does anyone else's brain replay embarrassing moments for hours after they happen?,,https://www.reddit.com/r/productivity/comments/1rgi00k/does_anyone_elses_brain_replay_embarrassing/,1974
1rf6iqj,How can you escape the hell that is brain fog!!!,,https://www.reddit.com/r/productivity/comments/1rf6iqj/how_can_you_escape_the_hell_that_is_brain_fog/,1726
1rty69o,How do you deal with wanting to do a lot but doing very little?,,https://www.reddit.com/r/productivity/comments/1rty69o/how_do_you_deal_with_wanting_to_do_a_lot_but/,2074
1rm2zuy,Pro tip: this is the only productivity hack you need.,,https://www.reddit.com/r/productivity/comments/1rm2zuy/pro_tip_this_is_the_only_productivity_hack_you/,2082
1rcdusz,Studying 6 hours a day changed how I think about productivity,,https://www.reddit.com/r/productivity/comments/1rcdusz/studying_6_hours_a_day_changed_how_i_think_about/,1217
1rak8ea,What’s one daily habit that unexpectedly improved your productivity?,,https://www.reddit.com/r/productivity/comments/1rak8ea/whats_one_daily_habit_that_unexpectedly_improved/,1117
1rbksu9,Addiction and stuck in life. Help needed.,,https://www.reddit.com/r/productivity/comments/1rbksu9/addiction_and_stuck_in_life_help_needed/,1129
1ry88nk,Nothing has improved my productivity more than minimizing short form content,,https://www.reddit.com/r/productivity/comments/1ry88nk/nothing_has_improved_my_productivity_more_than/,1670
1ro3403,this absurd idea of seeing sunlight in the morning is actually working to get me up and awake,,https://www.reddit.com/r/productivity/comments/1ro3403/this_absurd_idea_of_seeing_sunlight_in_the/,1015
1rs9ecr,What household tasks have you managed to fully automate or outsource?,,https://www.reddit.com/r/productivity/comments/1rs9ecr/what_household_tasks_have_you_managed_to_fully/,860
1rp04k6,How do you make weekdays feel… manageable?,,https://www.reddit.com/r/productivity/comments/1rp04k6/how_do_you_make_weekdays_feel_manageable/,1356
1rx4ifn,"I want to read, but I get tired at night",,https://www.reddit.com/r/productivity/comments/1rx4ifn/i_want_to_read_but_i_get_tired_at_night/,1370
1rjf44l,Unable to motivate myself to pursue my passions after work,,https://www.reddit.com/r/productivity/comments/1rjf44l/unable_to_motivate_myself_to_pursue_my_passions/,1366
1rrcsac,One small reason the mind feels exhausted even when the day wasn’t difficult,,https://www.reddit.com/r/productivity/comments/1rrcsac/one_small_reason_the_mind_feels_exhausted_even/,1247
1rpup4t,"Anyone noticed that sometimes it's easier to do things in the morning, before you ate or even drank water?",,https://www.reddit.com/r/productivity/comments/1rpup4t/anyone_noticed_that_sometimes_its_easier_to_do/,539
1ro34xm,I moved to another continent to chase my ambitions… but now I spend my days scrolling and doing nothing. What’s wrong with me?,,https://www.reddit.com/r/productivity/comments/1ro34xm/i_moved_to_another_continent_to_chase_my/,475
1re5sr2,Office toxicity is affecting my overall work productivity,,https://www.reddit.com/r/productivity/comments/1re5sr2/office_toxicity_is_affecting_my_overall_work/,704
1rcupqu,How Do I Manage My Limited Time After Work?,,https://www.reddit.com/r/productivity/comments/1rcupqu/how_do_i_manage_my_limited_time_after_work/,772
1rcqmee,"I watched my ""8am–12pm deep work block"" die in real time this morning and I need to understand why I keep doing this to myself",,https://www.reddit.com/r/productivity/comments/1rcqmee/i_watched_my_8am12pm_deep_work_block_die_in_real/,1109
1rp6ybo,"tired constantly, can’t get anything done 22f",,https://www.reddit.com/r/productivity/comments/1rp6ybo/tired_constantly_cant_get_anything_done_22f/,463
1ra8p9a,"I cant rewire my brain, cant stop doom scrolling. How do i change myself ?",,https://www.reddit.com/r/productivity/comments/1ra8p9a/i_cant_rewire_my_brain_cant_stop_doom_scrolling/,841
1rfmkzl,Multitasking is ruining your focus more than you think,,https://www.reddit.com/r/productivity/comments/1rfmkzl/multitasking_is_ruining_your_focus_more_than_you/,363
1rjq9zp,How do you deal with a todo list that just never gets shorter?,,https://www.reddit.com/r/productivity/comments/1rjq9zp/how_do_you_deal_with_a_todo_list_that_just_never/,538
1rrsmpu,does anyone else find they're more productive when they have less time?,,https://www.reddit.com/r/productivity/comments/1rrsmpu/does_anyone_else_find_theyre_more_productive_when/,756
1rg9fi6,"I thought I had ruined my career, but here’s what helped",,https://www.reddit.com/r/productivity/comments/1rg9fi6/i_thought_i_had_ruined_my_career_but_heres_what/,487
1rq9k4c,meetings are 10x more productive when one person is responsible for actually listening,,https://www.reddit.com/r/productivity/comments/1rq9k4c/meetings_are_10x_more_productive_when_one_person/,674
1rotsk6,Does anyone else feel guilty reading fiction?,,https://www.reddit.com/r/productivity/comments/1rotsk6/does_anyone_else_feel_guilty_reading_fiction/,452
