id,title,selftext,permalink,score
1s1r1kn,"Why do I feel super motivated to fix my life at night, but completely lose it the next day?",,https://www.reddit.com/r/productivity/comments/1s1r1kn/why_do_i_feel_super_motivated_to_fix_my_life_at/,19686
1s9o2th,Are people who wake up at 5am actually more productive or have they just convinced themselves suffering early is the same as being disciplined?,,https://www.reddit.com/r/productivity/comments/1s9o2th/are_people_who_wake_up_at_5am_actually_more/,17532
1s8vfgc,Do Absolutely Nothing! This eliminates procrastination.,,https://www.reddit.com/r/productivity/comments/1s8vfgc/do_absolutely_nothing_this_eliminates/,15726
1rz3gkb,Replacing My Phone with a Tennis Ball Actually Improved My Focus,,https://www.reddit.com/r/productivity/comments/1rz3gkb/replacing_my_phone_with_a_tennis_ball_actually/,13362
1s6vckm,Unexplainable daily fatigue impairing my life,,https://www.reddit.com/r/productivity/comments/1s6vckm/unexplainable_daily_fatigue_impairing_my_life/,12374
1rtk406,"People who prefer staying home, what do you do all day?",,https://www.reddit.com/r/productivity/comments/1rtk406/people_who_prefer_staying_home_what_do_you_do_all/,10653
1s4djo0,What’s something that actually forces your brain to wake up instantly in the morning?,,https://www.reddit.com/r/productivity/comments/1s4djo0/whats_something_that_actually_forces_your_brain/,9475
1rpv8mt,Your 5 AM routine is a performance not a strategy,,https://www.reddit.com/r/productivity/comments/1rpv8mt/your_5_am_routine_is_a_performance_not_a_strategy/,8323
1rw1we1,"I do a 1 minute breathing thing before deep work and honestly it's the only ""productivity hack"" thats actually stuck",,https://www.reddit.com/r/productivity/comments/1rw1we1/i_do_a_1_minute_breathing_thing_before_deep_work/,7291
1s5y37e,"The most productive people you know, are not doing more. They are protecting specific hours like their life depends on it",,https://www.reddit.com/r/productivity/comments/1s5y37e/the_most_productive_people_you_know_are_not_doing/,6480
1s3xlwy,Something I noticed about the days I actually get things done,,https://www.reddit.com/r/productivity/comments/1s3xlwy/something_i_noticed_about_the_days_i_actually_get/,6293
1rrhe55,I just go back to bed whenever I wake up,,https://www.reddit.com/r/productivity/comments/1rrhe55/i_just_go_back_to_bed_whenever_i_wake_up/,5441
1rqn8lk,I have so many things I can do but always end up doing nothing,,https://www.reddit.com/r/productivity/comments/1rqn8lk/i_have_so_many_things_i_can_do_but_always_end_up/,4875
1rv8ftj,Your productivity is directly dependent on your relationship.,,https://www.reddit.com/r/productivity/comments/1rv8ftj/your_productivity_is_directly_dependent_on_your/,4250
1rmgo06,I kept blaming myself for being unproductive but it was actually just my apartment,,https://www.reddit.com/r/productivity/comments/1rmgo06/i_kept_blaming_myself_for_being_unproductive_but/,3587
1ry88nk,Nothing has improved my productivity more than minimizing short form content,,https://www.reddit.com/r/productivity/comments/1ry88nk/nothing_has_improved_my_productivity_more_than/,3778
1rzprmi,i feel mentally paralysed as if I cannot do anything,,https://www.reddit.com/r/productivity/comments/1rzprmi/i_feel_mentally_paralysed_as_if_i_cannot_do/,3445
1s1okom,"I lost my spark, I wanna get my life back",,https://www.reddit.com/r/productivity/comments/1s1okom/i_lost_my_spark_i_wanna_get_my_life_back/,2851
1s4td7z,Almost 8 hours of free time per shift at my overnight hospital job. How would you spend it?,,https://www.reddit.com/r/productivity/comments/1s4td7z/almost_8_hours_of_free_time_per_shift_at_my/,2399
1rty69o,How do you deal with wanting to do a lot but doing very little?,,https://www.reddit.com/r/productivity/comments/1rty69o/how_do_you_deal_with_wanting_to_do_a_lot_but/,2488
1rm2zuy,Pro tip: this is the only productivity hack you need.,,https://www.reddit.com/r/productivity/comments/1rm2zuy/pro_tip_this_is_the_only_productivity_hack_you/,1790
1s0i527,the only hack to keep my life together,,https://www.reddit.com/r/productivity/comments/1s0i527/the_only_hack_to_keep_my_life_together/,1869
1s5bdi4,Why am I always EXTREAMLY tired?,,https://www.reddit.com/r/productivity/comments/1s5bdi4/why_am_i_always_extreamly_tired/,1425
1sb7ghv,Productive ways to use 90 mins/day commute time.,,https://www.reddit.com/r/productivity/comments/1sb7ghv/productive_ways_to_use_90_minsday_commute_time/,1945
1ro3403,this absurd idea of seeing sunlight in the morning is actually working to get me up and awake,,https://www.reddit.com/r/productivity/comments/1ro3403/this_absurd_idea_of_seeing_sunlight_in_the/,1626
1s88du3,Does anyone else find at night it's a different vibe?,,https://www.reddit.com/r/productivity/comments/1s88du3/does_anyone_else_find_at_night_its_a_different/,1541
1rx4ifn,"I want to read, but I get tired at night",,https://www.reddit.com/r/productivity/comments/1rx4ifn/i_want_to_read_but_i_get_tired_at_night/,1051
1rs9ecr,What household tasks have you managed to fully automate or outsource?,,https://www.reddit.com/r/productivity/comments/1rs9ecr/what_household_tasks_have_you_managed_to_fully/,1165
1rp04k6,How do you make weekdays feel… manageable?,,https://www.reddit.com/r/productivity/comments/1rp04k6/how_do_you_make_weekdays_feel_manageable/,820
1rv9wld,"Best feeling is getting into the flow state, no?",,https://www.reddit.com/r/productivity/comments/1rv9wld/best_feeling_is_getting_into_the_flow_state_no/,1015
1rrcsac,One small reason the mind feels exhausted even when the day wasn’t difficult,,https://www.reddit.com/r/productivity/comments/1rrcsac/one_small_reason_the_mind_feels_exhausted_even/,1245
1s192aq,I keep waiting for the ‘right moment’ to do things and it never comes. How do you break this,,https://www.reddit.com/r/productivity/comments/1s192aq/i_keep_waiting_for_the_right_moment_to_do_things/,1007
1rpup4t,"Anyone noticed that sometimes it's easier to do things in the morning, before you ate or even drank water?",,https://www.reddit.com/r/productivity/comments/1rpup4t/anyone_noticed_that_sometimes_its_easier_to_do/,1035
1s03xl3,Can yall tell me the most unhinged way i could get rid of my phone addiction?,,https://www.reddit.com/r/productivity/comments/1s03xl3/can_yall_tell_me_the_most_unhinged_way_i_could/,708
1ro34xm,I moved to another continent to chase my ambitions… but now I spend my days scrolling and doing nothing. What’s wrong with me?,,https://www.reddit.com/r/productivity/comments/1ro34xm/i_moved_to_another_continent_to_chase_my/,993
1s0y9mh,My brain can’t be idle without stirring up negativity from literally nothing. How do I stop it?,,https://www.reddit.com/r/productivity/comments/1s0y9mh/my_brain_cant_be_idle_without_stirring_up/,1088
1s8l3xe,What helps you stay productive for 4–6 hours without losing focus?,,https://www.reddit.com/r/productivity/comments/1s8l3xe/what_helps_you_stay_productive_for_46_hours/,1034
1s37haj,Why do i feel productive when im alone and unproductive when someone is with me,,https://www.reddit.com/r/productivity/comments/1s37haj/why_do_i_feel_productive_when_im_alone_and/,670
1s2n3sg,I can't stop scrolling and it's ruining my studies and mental health 🥀,,https://www.reddit.com/r/productivity/comments/1s2n3sg/i_cant_stop_scrolling_and_its_ruining_my_studies/,365
1rp6ybo,"tired constantly, can’t get anything done 22f",,https://www.reddit.com/r/productivity/comments/1rp6ybo/tired_constantly_cant_get_anything_done_22f/,238
1s20l50,i’m ruining my life but i can’t/won’t do anything about it,,https://www.reddit.com/r/productivity/comments/1s20l50/im_ruining_my_life_but_i_cantwont_do_anything/,697
1rz1y3b,Genuinely how are people so fast,,https://www.reddit.com/r/productivity/comments/1rz1y3b/genuinely_how_are_people_so_fast/,205
1s72qz9,what do you do when you feel that you deserve some scrolling after a long day?,,https://www.reddit.com/r/productivity/comments/1s72qz9/what_do_you_do_when_you_feel_that_you_deserve/,201
1say8hs,Dropping the Ball ON Nonstop work email,,https://www.reddit.com/r/productivity/comments/1say8hs/dropping_the_ball_on_nonstop_work_email/,288
1rzb787,How do you make yourself work when you don’t want to?,,https://www.reddit.com/r/productivity/comments/1rzb787/how_do_you_make_yourself_work_when_you_dont_want/,323
1ryu07o,Whats your #1 hack thats kept you motivated and productive?,,https://www.reddit.com/r/productivity/comments/1ryu07o/whats_your_1_hack_thats_kept_you_motivated_and/,658
1rrsmpu,does anyone else find they're more productive when they have less time?,,https://www.reddit.com/r/productivity/comments/1rrsmpu/does_anyone_else_find_theyre_more_productive_when/,238
1rq9k4c,meetings are 10x more productive when one person is responsible for actually listening,,https://www.reddit.com/r/productivity/comments/1rq9k4c/meetings_are_10x_more_productive_when_one_person/,649
1s7mg7m,24M – I feel like my brain changed completely after 19… should I see a psychiatrist?,,https://www.reddit.com/r/productivity/comments/1s7mg7m/24m_i_feel_like_my_brain_changed_completely_after/,556
1s2cucs,How are you guys actually staying productive while working from home?,,https://www.reddit.com/r/productivity/comments/1s2cucs/how_are_you_guys_actually_staying_productive/,428
