id,title,selftext,permalink,score
1rkwvmf,The mask slipped during Karoline Leavitt’s press conference on Iran,,https://www.reddit.com/r/TrueReddit/comments/1rkwvmf/the_mask_slipped_during_karoline_leavitts_press/,52632
1r9i98m,Third American death linked to ICE uncovered by Newsweek,,https://www.reddit.com/r/TrueReddit/comments/1r9i98m/third_american_death_linked_to_ice_uncovered_by/,46249
1r216wh,Conservatives Are Terrified That People Like Me Are Buying Guns Now. Maybe They Should Be.,,https://www.reddit.com/r/TrueReddit/comments/1r216wh/conservatives_are_terrified_that_people_like_me/,41001
1r913vw,Mom of 7-year-old hospitalized with brain swelling from measles: ‘I still wouldn’t have given my son the vaccine’,,https://www.reddit.com/r/TrueReddit/comments/1r913vw/mom_of_7yearold_hospitalized_with_brain_swelling/,36552
1r25z0e,Pam Bondi has fully drunk the Kool-Aid. Her latest hearing about the Epstein files proves it,,https://www.reddit.com/r/TrueReddit/comments/1r25z0e/pam_bondi_has_fully_drunk_the_koolaid_her_latest/,31627
1riwexd,Pete Hegseth’s speech about the war in Iran was both deeply unserious and terrifying at the same time,,https://www.reddit.com/r/TrueReddit/comments/1riwexd/pete_hegseths_speech_about_the_war_in_iran_was/,28540
1r15206,ICE Is Expanding Across the US at Breakneck Speed. Here’s Where It’s Going Next,,https://www.reddit.com/r/TrueReddit/comments/1r15206/ice_is_expanding_across_the_us_at_breakneck_speed/,25087
1ra7xcm,Trump learns a bitter truth: Plenty of conservatives don’t like his tariffs,,https://www.reddit.com/r/TrueReddit/comments/1ra7xcm/trump_learns_a_bitter_truth_plenty_of/,22245
1rk23fn,DHS is a ‘disaster’ under Kristi Noem. Even Republicans can’t convince her to care,,https://www.reddit.com/r/TrueReddit/comments/1rk23fn/dhs_is_a_disaster_under_kristi_noem_even/,19670
1redxm4,"Musk cutting Starlink to Russia’s drones has delivered ‘enormous’ boost to Ukraine, says frontline general",,https://www.reddit.com/r/TrueReddit/comments/1redxm4/musk_cutting_starlink_to_russias_drones_has/,17000
1qzehfb,Democracy Dies in Broad Daylight,,https://www.reddit.com/r/TrueReddit/comments/1qzehfb/democracy_dies_in_broad_daylight/,15127
1rm0645,Christian Nationalists Have an Apocalypse Fetish,,https://www.reddit.com/r/TrueReddit/comments/1rm0645/christian_nationalists_have_an_apocalypse_fetish/,13101
1rjw4ha,The Pentagon says it’s ‘lethalitymaxxing’. Why has ‘incel’ slang crossed into the mainstream?,,https://www.reddit.com/r/TrueReddit/comments/1rjw4ha/the_pentagon_says_its_lethalitymaxxing_why_has/,11970
1r2bjt6,‘A good way of dealing with overpopulation’: Epstein files reveal how the rich fuel climate denialism,,https://www.reddit.com/r/TrueReddit/comments/1r2bjt6/a_good_way_of_dealing_with_overpopulation_epstein/,10406
1rcuz5w,"Trump’s polling keeps getting worse and worse, can a State of the Union address fix it?",,https://www.reddit.com/r/TrueReddit/comments/1rcuz5w/trumps_polling_keeps_getting_worse_and_worse_can/,9276
1r2y20q,"ICE is pushing Minneapolis underground | The triumphalist narrative of Minnesotans fighting back has taken hold nationally. But on the ground, the occupation is everywhere.",,https://www.reddit.com/r/TrueReddit/comments/1r2y20q/ice_is_pushing_minneapolis_underground_the/,8233
1rkmrcy,"Trump, Rubio and Hegseth can’t seem to get their stories straight on rationale for Iran war as Mideast explodes",,https://www.reddit.com/r/TrueReddit/comments/1rkmrcy/trump_rubio_and_hegseth_cant_seem_to_get_their/,7046
1rcdf95,"The billionaires' eugenics project: how Epstein infiltrated Harvard, muzzled the humanities and preached master-race science",,https://www.reddit.com/r/TrueReddit/comments/1rcdf95/the_billionaires_eugenics_project_how_epstein/,6628
1r979dm,The Epstein files arrest of former ‘Prince’ Andrew makes Trump’s Justice Department look pathetic,,https://www.reddit.com/r/TrueReddit/comments/1r979dm/the_epstein_files_arrest_of_former_prince_andrew/,5431
1rlhoc4,Trump wants to distract Americans from scandals at home with a diversionary war | Christopher S Chivvis,,https://www.reddit.com/r/TrueReddit/comments/1rlhoc4/trump_wants_to_distract_americans_from_scandals/,5142
1rfc32y,The Pentagon Feuding With an AI Company Is a Very Bad Sign,,https://www.reddit.com/r/TrueReddit/comments/1rfc32y/the_pentagon_feuding_with_an_ai_company_is_a_very/,4471
1r754rr,Life on Russia’s kill list: ‘I don’t touch door handles with my bare hands’,,https://www.reddit.com/r/TrueReddit/comments/1r754rr/life_on_russias_kill_list_i_dont_touch_door/,3812
1rmw6gj,Trump Officials Attended a Summit of Election Deniers Who Want the President to Take Over the Midterms,,https://www.reddit.com/r/TrueReddit/comments/1rmw6gj/trump_officials_attended_a_summit_of_election/,3462
1rheqjm,Fascist Failure: The State of Trump,,https://www.reddit.com/r/TrueReddit/comments/1rheqjm/fascist_failure_the_state_of_trump/,3710
1rbqobx,Gallup Stops Asking Presidential Approval Question After 88 Years,,https://www.reddit.com/r/TrueReddit/comments/1rbqobx/gallup_stops_asking_presidential_approval/,2865
1r3sdi0,ICE moves out to the suburbs | The less densely populated areas outside the Twin Cities make it harder for protesters and observers to organize.,,https://www.reddit.com/r/TrueReddit/comments/1r3sdi0/ice_moves_out_to_the_suburbs_the_less_densely/,2928
1rfelxv,I have studied Mexico’s cartels for decades. Here’s what will happen next,,https://www.reddit.com/r/TrueReddit/comments/1rfelxv/i_have_studied_mexicos_cartels_for_decades_heres/,2751
1rdp770,FDA takes down page warning of crank autism cures as RFK Jr. nominates people have promoted them,,https://www.reddit.com/r/TrueReddit/comments/1rdp770/fda_takes_down_page_warning_of_crank_autism_cures/,2507
1rfl0c0,"The billionaires' eugenics project: how Epstein infiltrated Harvard, muzzled the humanities and preached master-race science",,https://www.reddit.com/r/TrueReddit/comments/1rfl0c0/the_billionaires_eugenics_project_how_epstein/,2119
1r855cp,Leaked Email Suggests Ring Plans to Expand ‘Search Party’ Surveillance Beyond Dogs,,https://www.reddit.com/r/TrueReddit/comments/1r855cp/leaked_email_suggests_ring_plans_to_expand_search/,1466
1r0igqy,This whistle fights fascists | How thousands of 3D-printed whistles are derailing ICE.,,https://www.reddit.com/r/TrueReddit/comments/1r0igqy/this_whistle_fights_fascists_how_thousands_of/,1799
1r0xoh0,Trump’s Grip on Billions of Taxpayer Dollars Loosened by Courts,,https://www.reddit.com/r/TrueReddit/comments/1r0xoh0/trumps_grip_on_billions_of_taxpayer_dollars/,1957
1ra7wej,They Bet Against Trump's Tariffs. Now They Stand to Make Millions,,https://www.reddit.com/r/TrueReddit/comments/1ra7wej/they_bet_against_trumps_tariffs_now_they_stand_to/,1206
1r8dsto,"Zuckerberg takes stand in social media trial as jury hears that he’s trained on how to avoid being ‘fake, robotic and corporate’",,https://www.reddit.com/r/TrueReddit/comments/1r8dsto/zuckerberg_takes_stand_in_social_media_trial_as/,1450
1rnomkp,Paul Bremer ran Iraq for Bush. His emails show what really happened,,https://www.reddit.com/r/TrueReddit/comments/1rnomkp/paul_bremer_ran_iraq_for_bush_his_emails_show/,1486
1ro8dcr,Supreme Court Abuse of the Shadow Docket Under Trump,,https://www.reddit.com/r/TrueReddit/comments/1ro8dcr/supreme_court_abuse_of_the_shadow_docket_under/,1375
1r0ju8z,New SAVE Act Bills Would Still Block Millions of Americans From Voting,,https://www.reddit.com/r/TrueReddit/comments/1r0ju8z/new_save_act_bills_would_still_block_millions_of/,827
1rlt54x,Proton Mail Helped FBI Unmask Anonymous ‘Stop Cop City’ Protester,,https://www.reddit.com/r/TrueReddit/comments/1rlt54x/proton_mail_helped_fbi_unmask_anonymous_stop_cop/,891
1r3jzy2,This Is How A Child Dies of Measles,,https://www.reddit.com/r/TrueReddit/comments/1r3jzy2/this_is_how_a_child_dies_of_measles/,652
1rf03lt,The State of the Union Revealed a Sad Reality,,https://www.reddit.com/r/TrueReddit/comments/1rf03lt/the_state_of_the_union_revealed_a_sad_reality/,796
1rmsjej,They Helped Bring Down Epstein. The System Consumed Them Anyway.,,https://www.reddit.com/r/TrueReddit/comments/1rmsjej/they_helped_bring_down_epstein_the_system/,1035
1ra3clw,Metadata Exposes Authors of ICE’s ‘Mega’ Detention Center Plans,,https://www.reddit.com/r/TrueReddit/comments/1ra3clw/metadata_exposes_authors_of_ices_mega_detention/,943
1rhcqyt,Trump’s Attack on Iran Is Reckless,,https://www.reddit.com/r/TrueReddit/comments/1rhcqyt/trumps_attack_on_iran_is_reckless/,550
1r4923h,My Life Is a Lie: How a Broken Benchmark Quietly Broke America,,https://www.reddit.com/r/TrueReddit/comments/1r4923h/my_life_is_a_lie_how_a_broken_benchmark_quietly/,937
1rdtrsr,Are We Living in the Age of Jeffrey Epstein?,,https://www.reddit.com/r/TrueReddit/comments/1rdtrsr/are_we_living_in_the_age_of_jeffrey_epstein/,345
1r3trhc,The Fulton County raid is part of Trump's total war on voting,,https://www.reddit.com/r/TrueReddit/comments/1r3trhc/the_fulton_county_raid_is_part_of_trumps_total/,465
1r4ndvc,Marco Rubio Is Rebooting the Neocons for the MAGA Era,,https://www.reddit.com/r/TrueReddit/comments/1r4ndvc/marco_rubio_is_rebooting_the_neocons_for_the_maga/,980
1r99f2p,TRUMP’S TEMPERAMENT AND PERSONALITY CULT IS A NATIONAL SECURITY THREAT; Yet NYT stories aggrandize Trump and expand the appearance of his power ignoring the real threat. What is going on ?,,https://www.reddit.com/r/TrueReddit/comments/1r99f2p/trumps_temperament_and_personality_cult_is_a/,325
1rif9x3,The ‘Crazy’ Plot to Release the Epstein Files,,https://www.reddit.com/r/TrueReddit/comments/1rif9x3/the_crazy_plot_to_release_the_epstein_files/,940
1rdljax,College Campuses Are in Upheaval Over Faculty Ties to Epstein,,https://www.reddit.com/r/TrueReddit/comments/1rdljax/college_campuses_are_in_upheaval_over_faculty/,630
