id,title,selftext,permalink,score
1rwo6rv,Everyone but Trump Understands What He’s Done,,https://www.reddit.com/r/TrueReddit/comments/1rwo6rv/everyone_but_trump_understands_what_hes_done/,59436
1s2n6u9,Republican Says Trump Blocked TSA Agents Getting Paid,,https://www.reddit.com/r/TrueReddit/comments/1s2n6u9/republican_says_trump_blocked_tsa_agents_getting/,52450
1rxj6jd,Trump now calls war reporting ‘treason’. His attacks on the press are escalating fast,,https://www.reddit.com/r/TrueReddit/comments/1rxj6jd/trump_now_calls_war_reporting_treason_his_attacks/,46340
1s4abfq,Pentagon Wants It to Be Illegal for Reporters to Ask “Unauthorized” Questions,,https://www.reddit.com/r/TrueReddit/comments/1s4abfq/pentagon_wants_it_to_be_illegal_for_reporters_to/,40581
1saiath,"What in god’s name is Pete Hegseth doing in Iran? Religious framing is ‘completely, totally unprecedented,’ experts say",,https://www.reddit.com/r/TrueReddit/comments/1saiath/what_in_gods_name_is_pete_hegseth_doing_in_iran/,35491
1rwlb04,Watch Mike Johnson Struggle to Name Even One Example of Voter Fraud,,https://www.reddit.com/r/TrueReddit/comments/1rwlb04/watch_mike_johnson_struggle_to_name_even_one/,31380
1scgotm,"In private, Trump has plans for unspeakable violence. I know because he told me",,https://www.reddit.com/r/TrueReddit/comments/1scgotm/in_private_trump_has_plans_for_unspeakable/,27970
1ry7531,"RIP Metaverse, an $80 Billion Dumpster Fire Nobody Wanted",,https://www.reddit.com/r/TrueReddit/comments/1ry7531/rip_metaverse_an_80_billion_dumpster_fire_nobody/,24315
1rry72r,I Watched 6 Hours of DOGE Bro Testimony. Here's What They Had to Say For Themselves,,https://www.reddit.com/r/TrueReddit/comments/1rry72r/i_watched_6_hours_of_doge_bro_testimony_heres/,21474
1s7tkcu,Experts Warn Global Mass Starvation is Coming By Summer,,https://www.reddit.com/r/TrueReddit/comments/1s7tkcu/experts_warn_global_mass_starvation_is_coming_by/,18666
1rsvk5g,Trump Seems to Be Selling Fans Access to National Security Briefings,,https://www.reddit.com/r/TrueReddit/comments/1rsvk5g/trump_seems_to_be_selling_fans_access_to_national/,16525
1s55hi2,The US would need a million troops to control Iran – not the few thousand currently on their way,,https://www.reddit.com/r/TrueReddit/comments/1s55hi2/the_us_would_need_a_million_troops_to_control/,14724
1rvlbl2,"""No, we didn’t"": DOGE staffers admit Elon Musk’s cost-cutting agency failed to reduce the federal deficit",,https://www.reddit.com/r/TrueReddit/comments/1rvlbl2/no_we_didnt_doge_staffers_admit_elon_musks/,13515
1rz4ezu,"Trump is dismantling democracy at 'unprecedented' speed, global report finds",,https://www.reddit.com/r/TrueReddit/comments/1rz4ezu/trump_is_dismantling_democracy_at_unprecedented/,12033
1rvk7hm,‘Dead by June’: Trump drops jaws by revealing Republican’s ‘terminal diagnosis’ in course of Kennedy Center press conference,,https://www.reddit.com/r/TrueReddit/comments/1rvk7hm/dead_by_june_trump_drops_jaws_by_revealing/,10500
1rs1bps,Palantir CEO Makes Shocking Confession on Disrupting Democratic Power | The New Republic,,https://www.reddit.com/r/TrueReddit/comments/1rs1bps/palantir_ceo_makes_shocking_confession_on/,9202
1scgw6s,Hegseth Says U.S. Troops Are Fighting for Jesus. The Pope Disagrees.,,https://www.reddit.com/r/TrueReddit/comments/1scgw6s/hegseth_says_us_troops_are_fighting_for_jesus_the/,7735
1ru6ssv,Whitehouse Speech on Trump-Epstein-Russia Triangle Goes Viral - Senator Sheldon Whitehouse,,https://www.reddit.com/r/TrueReddit/comments/1ru6ssv/whitehouse_speech_on_trumpepsteinrussia_triangle/,7572
1s885n8,America Is Now a Rogue Superpower,,https://www.reddit.com/r/TrueReddit/comments/1s885n8/america_is_now_a_rogue_superpower/,6778
1s7hdpo,The Manosphere Turns on Trump - The Atlantic,,https://www.reddit.com/r/TrueReddit/comments/1s7hdpo/the_manosphere_turns_on_trump_the_atlantic/,6067
1rrsnp6,"Trump Allegedly Told GOP Leader “No One Gives a [Bleep] About Housing""",,https://www.reddit.com/r/TrueReddit/comments/1rrsnp6/trump_allegedly_told_gop_leader_no_one_gives_a/,4959
1rtqg4c,Trump’s war on trans people has left Americans seeking asylum — from America,,https://www.reddit.com/r/TrueReddit/comments/1rtqg4c/trumps_war_on_trans_people_has_left_americans/,4850
1s0fb5r,Cruz proposes splitting ICE from Homeland Security funding bill to end airport chaos,,https://www.reddit.com/r/TrueReddit/comments/1s0fb5r/cruz_proposes_splitting_ice_from_homeland/,4510
1rqa37b,The U.S. Built a Blueprint to Avoid Civilian War Casualties. Trump Officials Scrapped It.,,https://www.reddit.com/r/TrueReddit/comments/1rqa37b/the_us_built_a_blueprint_to_avoid_civilian_war/,3238
1s8z1xc,"Trump’s Justice Department Dropped 23,000 Criminal Investigations in Shift to Immigration",,https://www.reddit.com/r/TrueReddit/comments/1s8z1xc/trumps_justice_department_dropped_23000_criminal/,3543
1s19cfi,The War Against Iran is a Fuck-up – Because the US is Failing as a System,,https://www.reddit.com/r/TrueReddit/comments/1s19cfi/the_war_against_iran_is_a_fuckup_because_the_us/,3221
1rtj9yg,"Raging at Media, Pete Hegseth Just Said the Quiet Part Out Loud | The New Republic",,https://www.reddit.com/r/TrueReddit/comments/1rtj9yg/raging_at_media_pete_hegseth_just_said_the_quiet/,2604
1ro8dcr,Supreme Court Abuse of the Shadow Docket Under Trump,,https://www.reddit.com/r/TrueReddit/comments/1ro8dcr/supreme_court_abuse_of_the_shadow_docket_under/,2660
1s7pe76,A Nursing Home Owner Got a Trump Pardon. The Families of His Patients Got Nothing.,,https://www.reddit.com/r/TrueReddit/comments/1s7pe76/a_nursing_home_owner_got_a_trump_pardon_the/,2595
1rup6j6,"Newspapers Did Not Kill Themselves: New docs say Jeffrey Epstein collaborated with the Russian mob to loot the New York Daily News, then tried to help Mort Zuckerman discard it when reporting became inconvenient.",,https://www.reddit.com/r/TrueReddit/comments/1rup6j6/newspapers_did_not_kill_themselves_new_docs_say/,1792
1scj3s5,Sickle cell disease has just been cured for the first time in New York,,https://www.reddit.com/r/TrueReddit/comments/1scj3s5/sickle_cell_disease_has_just_been_cured_for_the/,1565
1s8r27y,Trump's FCC Chief Says His Censorship Protects the Little Guy. It Really Serves One Powerful Man.,,https://www.reddit.com/r/TrueReddit/comments/1s8r27y/trumps_fcc_chief_says_his_censorship_protects_the/,1996
1s9vd4q,The DOJ thinks news is contraband,,https://www.reddit.com/r/TrueReddit/comments/1s9vd4q/the_doj_thinks_news_is_contraband/,1657
1rtdrxh,"Trump faces fresh backlash after two disturbing videos tied to his DHS pick resurface, raising new questions about judgment",,https://www.reddit.com/r/TrueReddit/comments/1rtdrxh/trump_faces_fresh_backlash_after_two_disturbing/,1011
1s3cocj,Disney's Sora Disaster Shows AI Will Not Revolutionize Hollywood,,https://www.reddit.com/r/TrueReddit/comments/1s3cocj/disneys_sora_disaster_shows_ai_will_not/,1597
1s45xvx,Why ICE Is Allowed to Impersonate Law Enforcement,,https://www.reddit.com/r/TrueReddit/comments/1s45xvx/why_ice_is_allowed_to_impersonate_law_enforcement/,1268
1rwgn94,"Trump Wants to Put You in a Massive, Secret Government Database",,https://www.reddit.com/r/TrueReddit/comments/1rwgn94/trump_wants_to_put_you_in_a_massive_secret/,914
1rnomkp,Paul Bremer ran Iraq for Bush. His emails show what really happened,,https://www.reddit.com/r/TrueReddit/comments/1rnomkp/paul_bremer_ran_iraq_for_bush_his_emails_show/,1504
1s1sgm0,US Supreme Court conservatives lean toward Republican bid to limit mail-in voting,,https://www.reddit.com/r/TrueReddit/comments/1s1sgm0/us_supreme_court_conservatives_lean_toward/,849
1rsa299,"Epstein files: DOJ refuses to address fully redacted, 300+ page document",,https://www.reddit.com/r/TrueReddit/comments/1rsa299/epstein_files_doj_refuses_to_address_fully/,987
1s1l50k,The Rise of the Ray-Ban Meta Creep,,https://www.reddit.com/r/TrueReddit/comments/1s1l50k/the_rise_of_the_rayban_meta_creep/,769
1sbi8kf,Donald Trump and Pete Hegseth’s Warped Vision of the Iran War,,https://www.reddit.com/r/TrueReddit/comments/1sbi8kf/donald_trump_and_pete_hegseths_warped_vision_of/,1119
1s8wl1e,The Law That Almost Killed Playboy Is Back With a Vengeance,,https://www.reddit.com/r/TrueReddit/comments/1s8wl1e/the_law_that_almost_killed_playboy_is_back_with_a/,496
1s2s9xv,What is ICE actually doing at the airport? | ICE is supposed to be helping TSA at American airports. I didn’t see that at JFK.,,https://www.reddit.com/r/TrueReddit/comments/1s2s9xv/what_is_ice_actually_doing_at_the_airport_ice_is/,1190
1rq208n,Immigration agents wearing Meta’s AI glasses is a huge red flag. How are they getting away with it?,,https://www.reddit.com/r/TrueReddit/comments/1rq208n/immigration_agents_wearing_metas_ai_glasses_is_a/,490
1rvmge9,Peter Thiel warns of the Antichrist threat during Rome lectures | Fortune,,https://www.reddit.com/r/TrueReddit/comments/1rvmge9/peter_thiel_warns_of_the_antichrist_threat_during/,534
1s2bi7y,The Treasury just declared the U.S. insolvent. The media missed it,,https://www.reddit.com/r/TrueReddit/comments/1s2bi7y/the_treasury_just_declared_the_us_insolvent_the/,768
1ruflkh,Trump Administration Turns to Migrant Workers to Help Farm Labor Shortage - The New York Times,,https://www.reddit.com/r/TrueReddit/comments/1ruflkh/trump_administration_turns_to_migrant_workers_to/,265
1rsp1mg,"‘I’m Schroedinger’s gender right now:’ Trans Kansans share confusion, panic and grief over new ID laws",,https://www.reddit.com/r/TrueReddit/comments/1rsp1mg/im_schroedingers_gender_right_now_trans_kansans/,564
1rpv1qf,MMA fighter's wife fighting ICE to save him from deportation into Russia draft,,https://www.reddit.com/r/TrueReddit/comments/1rpv1qf/mma_fighters_wife_fighting_ice_to_save_him_from/,769
