id,title,selftext,permalink,score
1sn0el3,"Mexico is officially launching universal healthcare this week, giving all 120 million citizens access to all public health institutions",,https://www.reddit.com/r/TrueReddit/comments/1sn0el3/mexico_is_officially_launching_universal/,57943
1scgotm,"In private, Trump has plans for unspeakable violence. I know because he told me",,https://www.reddit.com/r/TrueReddit/comments/1scgotm/in_private_trump_has_plans_for_unspeakable/,50979
1shutfz,JD Vance Is The Most Malignant Force In Politics,,https://www.reddit.com/r/TrueReddit/comments/1shutfz/jd_vance_is_the_most_malignant_force_in_politics/,44579
1sp1gtf,The FBI Director Is MIA: Kash Patel has alarmed colleagues with episodes of excessive drinking and unexplained absences.,,https://www.reddit.com/r/TrueReddit/comments/1sp1gtf/the_fbi_director_is_mia_kash_patel_has_alarmed/,40045
1sjrjbx,Melania Trump Has an Amanda Ungaro Problem—A Big One,,https://www.reddit.com/r/TrueReddit/comments/1sjrjbx/melania_trump_has_an_amanda_ungaro_problema_big/,35164
1scgw6s,Hegseth Says U.S. Troops Are Fighting for Jesus. The Pope Disagrees.,,https://www.reddit.com/r/TrueReddit/comments/1scgw6s/hegseth_says_us_troops_are_fighting_for_jesus_the/,31099
1se2ijb,"Bernie Sanders calls out Bezos, Musk, Bloomberg, and Buffett in billionaire tax push: ""The richest people in America have never ever had it so good""",,https://www.reddit.com/r/TrueReddit/comments/1se2ijb/bernie_sanders_calls_out_bezos_musk_bloomberg_and/,27101
1sq97tu,The Social Contract Is Broken in America,,https://www.reddit.com/r/TrueReddit/comments/1sq97tu/the_social_contract_is_broken_in_america/,24043
1sjqi99,The Real Reason For Jeffrey Epstein's Remote Zorro Ranch Emerges When You Examine the Ranch Next Door,,https://www.reddit.com/r/TrueReddit/comments/1sjqi99/the_real_reason_for_jeffrey_epsteins_remote_zorro/,21630
1sg89xp,Trump Made a Deal That Gives Him Nothing He Wanted,,https://www.reddit.com/r/TrueReddit/comments/1sg89xp/trump_made_a_deal_that_gives_him_nothing_he_wanted/,18963
1ssn505,"The ‘unregistered Americans’: because of their parents, they do not exist",,https://www.reddit.com/r/TrueReddit/comments/1ssn505/the_unregistered_americans_because_of_their/,16601
1sdwat7,Trump's niece warns 'it won't end with Bondi' as she shares reasons he fired her,,https://www.reddit.com/r/TrueReddit/comments/1sdwat7/trumps_niece_warns_it_wont_end_with_bondi_as_she/,14632
1sthr0b,Ukraine’s Olympic swimmers ask: Why is Russia being welcomed back?,,https://www.reddit.com/r/TrueReddit/comments/1sthr0b/ukraines_olympic_swimmers_ask_why_is_russia_being/,12754
1sihz4k,US Dominance in the Middle East Is ‘Basically Over’,,https://www.reddit.com/r/TrueReddit/comments/1sihz4k/us_dominance_in_the_middle_east_is_basically_over/,11049
1sljy8m,A virologist who grew cancer-killing viruses in her own lab and injected them into her tumour has been cancer-free for four years,,https://www.reddit.com/r/TrueReddit/comments/1sljy8m/a_virologist_who_grew_cancerkilling_viruses_in/,10256
1shp68s,Schools across America are quietly admitting that screens in classrooms made students worse off and are reversing years of tech-first policies,,https://www.reddit.com/r/TrueReddit/comments/1shp68s/schools_across_america_are_quietly_admitting_that/,8858
1t00hox,"Two Generations Ago, It Wasn’t So Weird to Be Naked in Front of Other People. Now Everyone Hates It. I Went to the Only Place to Find Out Why.",,https://www.reddit.com/r/TrueReddit/comments/1t00hox/two_generations_ago_it_wasnt_so_weird_to_be_naked/,8292
1syzy0b,"U.S. Mint Buys Drug Cartel Gold and Sells It as ‘American’ As prices for the precious metal soar, the industry’s guardrails have broken down.",,https://www.reddit.com/r/TrueReddit/comments/1syzy0b/us_mint_buys_drug_cartel_gold_and_sells_it_as/,7203
1smmnvr,"He spent years investigating Opus Dei, a Catholic group accused of a vast conspiracy of abuse. Then Pope Leo asked to meet",,https://www.reddit.com/r/TrueReddit/comments/1smmnvr/he_spent_years_investigating_opus_dei_a_catholic/,6422
1seyhs9,Trump seems dead serious saying ‘a whole civilization will die’ – Lord save us,,https://www.reddit.com/r/TrueReddit/comments/1seyhs9/trump_seems_dead_serious_saying_a_whole/,6004
1scj3s5,Sickle cell disease has just been cured for the first time in New York,,https://www.reddit.com/r/TrueReddit/comments/1scj3s5/sickle_cell_disease_has_just_been_cured_for_the/,4905
1sh8ojv,Trump administration orders dismantling of the U.S. Forest Service,,https://www.reddit.com/r/TrueReddit/comments/1sh8ojv/trump_administration_orders_dismantling_of_the_us/,4329
1ssu0zx,What I Learned About Billionaires at Jeff Bezos’s Private Retreat,,https://www.reddit.com/r/TrueReddit/comments/1ssu0zx/what_i_learned_about_billionaires_at_jeff_bezoss/,4183
1sfac06,Human trials begin for drug that could let adults regrow teeth for the first time,,https://www.reddit.com/r/TrueReddit/comments/1sfac06/human_trials_begin_for_drug_that_could_let_adults/,3502
1t0vccr,The ‘manosphere’ has already infiltrated the workplace. We’re only just noticing,,https://www.reddit.com/r/TrueReddit/comments/1t0vccr/the_manosphere_has_already_infiltrated_the/,2931
1sz8afu,‘A husband expects a yes’: how wife schools are shaping submissive Christian women,,https://www.reddit.com/r/TrueReddit/comments/1sz8afu/a_husband_expects_a_yes_how_wife_schools_are/,3138
1sbi8kf,Donald Trump and Pete Hegseth’s Warped Vision of the Iran War,,https://www.reddit.com/r/TrueReddit/comments/1sbi8kf/donald_trump_and_pete_hegseths_warped_vision_of/,2699
1siomi8,"Universe expected to decay in 10⁷⁸ years, much sooner than previously thought",,https://www.reddit.com/r/TrueReddit/comments/1siomi8/universe_expected_to_decay_in_10⁷⁸_years_much/,2433
1t0f32f,Voters Can Be Disenfranchised Now,,https://www.reddit.com/r/TrueReddit/comments/1t0f32f/voters_can_be_disenfranchised_now/,1870
1skx1yf,"Trump, Orban, Putin and Vance—The Seven Mountains and the Blueprint Nobody’s Reading",,https://www.reddit.com/r/TrueReddit/comments/1skx1yf/trump_orban_putin_and_vancethe_seven_mountains/,2115
1sgppz7,FBI Extracts Suspect’s Deleted Signal Messages Saved in iPhone Notification Database,,https://www.reddit.com/r/TrueReddit/comments/1sgppz7/fbi_extracts_suspects_deleted_signal_messages/,1848
1squds3,It Was on Your Table Every Morning Growing Up. It’s Dying Before Our Eyes. No One Wants to Face It.,,https://www.reddit.com/r/TrueReddit/comments/1squds3/it_was_on_your_table_every_morning_growing_up_its/,1328
1sxfan5,Trump wants to rebrand ICE to NICE. It’s destined to backfire,,https://www.reddit.com/r/TrueReddit/comments/1sxfan5/trump_wants_to_rebrand_ice_to_nice_its_destined/,1082
1sl8h92,"Google, Microsoft, Meta All Tracking You Even When You Opt Out, According to an Independent Audit",,https://www.reddit.com/r/TrueReddit/comments/1sl8h92/google_microsoft_meta_all_tracking_you_even_when/,1104
1shn6fs,The U.S. Forest Service is closing down research stations ahead of a catastrophic wildfire season,,https://www.reddit.com/r/TrueReddit/comments/1shn6fs/the_us_forest_service_is_closing_down_research/,847
1svr6ml,‘Counter to the message of Jesus’: progressive Christians stake a claim to their religion amid Trump-pope feud,,https://www.reddit.com/r/TrueReddit/comments/1svr6ml/counter_to_the_message_of_jesus_progressive/,1609
1sh1lz3,4-day workweek advocates gain momentum as new study reveals 5th day is basically useless,,https://www.reddit.com/r/TrueReddit/comments/1sh1lz3/4day_workweek_advocates_gain_momentum_as_new/,1280
1sp8oce,The Worst Justice in Modern Supreme Court History,,https://www.reddit.com/r/TrueReddit/comments/1sp8oce/the_worst_justice_in_modern_supreme_court_history/,686
1sf2hw9,What Donald Trump Told Playboy About Nuclear War in 1990,,https://www.reddit.com/r/TrueReddit/comments/1sf2hw9/what_donald_trump_told_playboy_about_nuclear_war/,865
1spyvyh,I Missed the Part About the Divine Right of Presidents,,https://www.reddit.com/r/TrueReddit/comments/1spyvyh/i_missed_the_part_about_the_divine_right_of/,1061
1sd6y41,Corporate America Spent $147.4M Lobbying on Tax Policy,,https://www.reddit.com/r/TrueReddit/comments/1sd6y41/corporate_america_spent_1474m_lobbying_on_tax/,786
1sg4yj0,Anthropic Says Its Latest AI Model Is Too Powerful to Be Released,,https://www.reddit.com/r/TrueReddit/comments/1sg4yj0/anthropic_says_its_latest_ai_model_is_too/,1240
1sday8r,Hallucinated citations are polluting the scientific literature. What can be done?,,https://www.reddit.com/r/TrueReddit/comments/1sday8r/hallucinated_citations_are_polluting_the/,979
1se3n4j,Her Murder Had Been Cold for Decades. Five Gen Zers Attempted to Solve It. It Took Them Somewhere the Detectives Never Imagined.,,https://www.reddit.com/r/TrueReddit/comments/1se3n4j/her_murder_had_been_cold_for_decades_five_gen/,1072
1se9g11,Scientists are developing a daily pill that extends your dog's lifespan by years,,https://www.reddit.com/r/TrueReddit/comments/1se9g11/scientists_are_developing_a_daily_pill_that/,392
1sc9v1v,NVIDIAs Lobbying Spending Surged While 10 Congress Members Bought Its Stock,,https://www.reddit.com/r/TrueReddit/comments/1sc9v1v/nvidias_lobbying_spending_surged_while_10/,617
1skc81s,That ‘quantum heartbeat detector’ allegedly used to find the lost US pilot? Experts are skeptical,,https://www.reddit.com/r/TrueReddit/comments/1skc81s/that_quantum_heartbeat_detector_allegedly_used_to/,871
1sslqra,"After spending over $1 trillion, the roads are still crumbling, unsafe, and congested. Does Congress care?",,https://www.reddit.com/r/TrueReddit/comments/1sslqra/after_spending_over_1_trillion_the_roads_are/,630
1swfua8,Bonobos enjoy pretend tea parties and chimps think rationally: why apes are more like us than we ever thought,,https://www.reddit.com/r/TrueReddit/comments/1swfua8/bonobos_enjoy_pretend_tea_parties_and_chimps/,943
1sg7nku,Man unexpectedly cured of HIV after stem cell transplant,,https://www.reddit.com/r/TrueReddit/comments/1sg7nku/man_unexpectedly_cured_of_hiv_after_stem_cell/,1089
