id,title,selftext,permalink,score
1rwo6rv,Everyone but Trump Understands What He’s Done,,https://www.reddit.com/r/TrueReddit/comments/1rwo6rv/everyone_but_trump_understands_what_hes_done/,59910
1s2n6u9,Republican Says Trump Blocked TSA Agents Getting Paid,,https://www.reddit.com/r/TrueReddit/comments/1s2n6u9/republican_says_trump_blocked_tsa_agents_getting/,52814
1scgotm,"In private, Trump has plans for unspeakable violence. I know because he told me",,https://www.reddit.com/r/TrueReddit/comments/1scgotm/in_private_trump_has_plans_for_unspeakable/,46482
1shutfz,JD Vance Is The Most Malignant Force In Politics,,https://www.reddit.com/r/TrueReddit/comments/1shutfz/jd_vance_is_the_most_malignant_force_in_politics/,40898
1rxj6jd,Trump now calls war reporting ‘treason’. His attacks on the press are escalating fast,,https://www.reddit.com/r/TrueReddit/comments/1rxj6jd/trump_now_calls_war_reporting_treason_his_attacks/,35716
1s4abfq,Pentagon Wants It to Be Illegal for Reporters to Ask “Unauthorized” Questions,,https://www.reddit.com/r/TrueReddit/comments/1s4abfq/pentagon_wants_it_to_be_illegal_for_reporters_to/,31887
1saiath,"What in god’s name is Pete Hegseth doing in Iran? Religious framing is ‘completely, totally unprecedented,’ experts say",,https://www.reddit.com/r/TrueReddit/comments/1saiath/what_in_gods_name_is_pete_hegseth_doing_in_iran/,28182
1rwlb04,Watch Mike Johnson Struggle to Name Even One Example of Voter Fraud,,https://www.reddit.com/r/TrueReddit/comments/1rwlb04/watch_mike_johnson_struggle_to_name_even_one/,24972
1scgw6s,Hegseth Says U.S. Troops Are Fighting for Jesus. The Pope Disagrees.,,https://www.reddit.com/r/TrueReddit/comments/1scgw6s/hegseth_says_us_troops_are_fighting_for_jesus_the/,21494
1ry7531,"RIP Metaverse, an $80 Billion Dumpster Fire Nobody Wanted",,https://www.reddit.com/r/TrueReddit/comments/1ry7531/rip_metaverse_an_80_billion_dumpster_fire_nobody/,19334
1se2ijb,"Bernie Sanders calls out Bezos, Musk, Bloomberg, and Buffett in billionaire tax push: ""The richest people in America have never ever had it so good""",,https://www.reddit.com/r/TrueReddit/comments/1se2ijb/bernie_sanders_calls_out_bezos_musk_bloomberg_and/,16952
1s7tkcu,Experts Warn Global Mass Starvation is Coming By Summer,,https://www.reddit.com/r/TrueReddit/comments/1s7tkcu/experts_warn_global_mass_starvation_is_coming_by/,15125
1s55hi2,The US would need a million troops to control Iran – not the few thousand currently on their way,,https://www.reddit.com/r/TrueReddit/comments/1s55hi2/the_us_would_need_a_million_troops_to_control/,13132
1rvlbl2,"""No, we didn’t"": DOGE staffers admit Elon Musk’s cost-cutting agency failed to reduce the federal deficit",,https://www.reddit.com/r/TrueReddit/comments/1rvlbl2/no_we_didnt_doge_staffers_admit_elon_musks/,11668
1sjrjbx,Melania Trump Has an Amanda Ungaro Problem—A Big One,,https://www.reddit.com/r/TrueReddit/comments/1sjrjbx/melania_trump_has_an_amanda_ungaro_problema_big/,10764
1rz4ezu,"Trump is dismantling democracy at 'unprecedented' speed, global report finds",,https://www.reddit.com/r/TrueReddit/comments/1rz4ezu/trump_is_dismantling_democracy_at_unprecedented/,9158
1rvk7hm,‘Dead by June’: Trump drops jaws by revealing Republican’s ‘terminal diagnosis’ in course of Kennedy Center press conference,,https://www.reddit.com/r/TrueReddit/comments/1rvk7hm/dead_by_june_trump_drops_jaws_by_revealing/,8064
1s885n8,America Is Now a Rogue Superpower,,https://www.reddit.com/r/TrueReddit/comments/1s885n8/america_is_now_a_rogue_superpower/,7323
1sg89xp,Trump Made a Deal That Gives Him Nothing He Wanted,,https://www.reddit.com/r/TrueReddit/comments/1sg89xp/trump_made_a_deal_that_gives_him_nothing_he_wanted/,6877
1s7hdpo,The Manosphere Turns on Trump - The Atlantic,,https://www.reddit.com/r/TrueReddit/comments/1s7hdpo/the_manosphere_turns_on_trump_the_atlantic/,6043
1sdwat7,Trump's niece warns 'it won't end with Bondi' as she shares reasons he fired her,,https://www.reddit.com/r/TrueReddit/comments/1sdwat7/trumps_niece_warns_it_wont_end_with_bondi_as_she/,5049
1sihz4k,US Dominance in the Middle East Is ‘Basically Over’,,https://www.reddit.com/r/TrueReddit/comments/1sihz4k/us_dominance_in_the_middle_east_is_basically_over/,4349
1s0fb5r,Cruz proposes splitting ICE from Homeland Security funding bill to end airport chaos,,https://www.reddit.com/r/TrueReddit/comments/1s0fb5r/cruz_proposes_splitting_ice_from_homeland/,4533
1sjqi99,The Real Reason For Jeffrey Epstein's Remote Zorro Ranch Emerges When You Examine the Ranch Next Door,,https://www.reddit.com/r/TrueReddit/comments/1sjqi99/the_real_reason_for_jeffrey_epsteins_remote_zorro/,4107
1shp68s,Schools across America are quietly admitting that screens in classrooms made students worse off and are reversing years of tech-first policies,,https://www.reddit.com/r/TrueReddit/comments/1shp68s/schools_across_america_are_quietly_admitting_that/,2972
1s8z1xc,"Trump’s Justice Department Dropped 23,000 Criminal Investigations in Shift to Immigration",,https://www.reddit.com/r/TrueReddit/comments/1s8z1xc/trumps_justice_department_dropped_23000_criminal/,2962
1s19cfi,The War Against Iran is a Fuck-up – Because the US is Failing as a System,,https://www.reddit.com/r/TrueReddit/comments/1s19cfi/the_war_against_iran_is_a_fuckup_because_the_us/,2738
1seyhs9,Trump seems dead serious saying ‘a whole civilization will die’ – Lord save us,,https://www.reddit.com/r/TrueReddit/comments/1seyhs9/trump_seems_dead_serious_saying_a_whole/,2471
1scj3s5,Sickle cell disease has just been cured for the first time in New York,,https://www.reddit.com/r/TrueReddit/comments/1scj3s5/sickle_cell_disease_has_just_been_cured_for_the/,2547
1s7pe76,A Nursing Home Owner Got a Trump Pardon. The Families of His Patients Got Nothing.,,https://www.reddit.com/r/TrueReddit/comments/1s7pe76/a_nursing_home_owner_got_a_trump_pardon_the/,1642
1rup6j6,"Newspapers Did Not Kill Themselves: New docs say Jeffrey Epstein collaborated with the Russian mob to loot the New York Daily News, then tried to help Mort Zuckerman discard it when reporting became inconvenient.",,https://www.reddit.com/r/TrueReddit/comments/1rup6j6/newspapers_did_not_kill_themselves_new_docs_say/,2113
1sh8ojv,Trump administration orders dismantling of the U.S. Forest Service,,https://www.reddit.com/r/TrueReddit/comments/1sh8ojv/trump_administration_orders_dismantling_of_the_us/,1711
1s8r27y,Trump's FCC Chief Says His Censorship Protects the Little Guy. It Really Serves One Powerful Man.,,https://www.reddit.com/r/TrueReddit/comments/1s8r27y/trumps_fcc_chief_says_his_censorship_protects_the/,1580
1sfac06,Human trials begin for drug that could let adults regrow teeth for the first time,,https://www.reddit.com/r/TrueReddit/comments/1sfac06/human_trials_begin_for_drug_that_could_let_adults/,1039
1s9vd4q,The DOJ thinks news is contraband,,https://www.reddit.com/r/TrueReddit/comments/1s9vd4q/the_doj_thinks_news_is_contraband/,1671
1s3cocj,Disney's Sora Disaster Shows AI Will Not Revolutionize Hollywood,,https://www.reddit.com/r/TrueReddit/comments/1s3cocj/disneys_sora_disaster_shows_ai_will_not/,1513
1s45xvx,Why ICE Is Allowed to Impersonate Law Enforcement,,https://www.reddit.com/r/TrueReddit/comments/1s45xvx/why_ice_is_allowed_to_impersonate_law_enforcement/,950
1rwgn94,"Trump Wants to Put You in a Massive, Secret Government Database",,https://www.reddit.com/r/TrueReddit/comments/1rwgn94/trump_wants_to_put_you_in_a_massive_secret/,1291
1s1sgm0,US Supreme Court conservatives lean toward Republican bid to limit mail-in voting,,https://www.reddit.com/r/TrueReddit/comments/1s1sgm0/us_supreme_court_conservatives_lean_toward/,835
1sbi8kf,Donald Trump and Pete Hegseth’s Warped Vision of the Iran War,,https://www.reddit.com/r/TrueReddit/comments/1sbi8kf/donald_trump_and_pete_hegseths_warped_vision_of/,609
1s1l50k,The Rise of the Ray-Ban Meta Creep,,https://www.reddit.com/r/TrueReddit/comments/1s1l50k/the_rise_of_the_rayban_meta_creep/,735
1s8wl1e,The Law That Almost Killed Playboy Is Back With a Vengeance,,https://www.reddit.com/r/TrueReddit/comments/1s8wl1e/the_law_that_almost_killed_playboy_is_back_with_a/,706
1sgppz7,FBI Extracts Suspect’s Deleted Signal Messages Saved in iPhone Notification Database,,https://www.reddit.com/r/TrueReddit/comments/1sgppz7/fbi_extracts_suspects_deleted_signal_messages/,1037
1siomi8,"Universe expected to decay in 10⁷⁸ years, much sooner than previously thought",,https://www.reddit.com/r/TrueReddit/comments/1siomi8/universe_expected_to_decay_in_10⁷⁸_years_much/,1097
1s2s9xv,What is ICE actually doing at the airport? | ICE is supposed to be helping TSA at American airports. I didn’t see that at JFK.,,https://www.reddit.com/r/TrueReddit/comments/1s2s9xv/what_is_ice_actually_doing_at_the_airport_ice_is/,552
1rvmge9,Peter Thiel warns of the Antichrist threat during Rome lectures | Fortune,,https://www.reddit.com/r/TrueReddit/comments/1rvmge9/peter_thiel_warns_of_the_antichrist_threat_during/,772
1s2bi7y,The Treasury just declared the U.S. insolvent. The media missed it,,https://www.reddit.com/r/TrueReddit/comments/1s2bi7y/the_treasury_just_declared_the_us_insolvent_the/,452
1ruflkh,Trump Administration Turns to Migrant Workers to Help Farm Labor Shortage - The New York Times,,https://www.reddit.com/r/TrueReddit/comments/1ruflkh/trump_administration_turns_to_migrant_workers_to/,710
1shn6fs,The U.S. Forest Service is closing down research stations ahead of a catastrophic wildfire season,,https://www.reddit.com/r/TrueReddit/comments/1shn6fs/the_us_forest_service_is_closing_down_research/,311
1s0zjxw,Tom Homan: ICE officers will not assist with airport security scanning amid TSA staffing shortage,,https://www.reddit.com/r/TrueReddit/comments/1s0zjxw/tom_homan_ice_officers_will_not_assist_with/,928
