id,title,selftext,permalink,score
1n2csrw,What did Native Americans use to wipe their butts? (This sounds ridiculous but I have a good reason to ask),,https://www.reddit.com/r/AskHistorians/comments/1n2csrw/what_did_native_americans_use_to_wipe_their_butts/,99156
1na2ols,Can someone please recommend what to start reading so I can finally learn the truth about the USA?,,https://www.reddit.com/r/AskHistorians/comments/1na2ols/can_someone_please_recommend_what_to_start/,87628
1s9e0w5,AITA FOR LEADING 300 SPARTANS TO THEIR DEATHS?,,https://www.reddit.com/r/AskHistorians/comments/1s9e0w5/aita_for_leading_300_spartans_to_their_deaths/,76823
1o0x3wa,"The Bible seems to indicate that there are multiple gods but only the god of the Bible should be worshiped. How did we move from ""this is the only God we worship"" to ""this is the only God that exists?""",,https://www.reddit.com/r/AskHistorians/comments/1o0x3wa/the_bible_seems_to_indicate_that_there_are/,68121
1q7qac6,When did the average German realize that Hitler wasn't good?,,https://www.reddit.com/r/AskHistorians/comments/1q7qac6/when_did_the_average_german_realize_that_hitler/,59599
1mo8mfi,What happened to supporters of Hitler after he fell from power?,,https://www.reddit.com/r/AskHistorians/comments/1mo8mfi/what_happened_to_supporters_of_hitler_after_he/,53029
1ns2fpg,Modern day evangelicals from the US now claim that empathy is actually a sin. What historical process led american calvinism to reject a fundamental christian virtue?,,https://www.reddit.com/r/AskHistorians/comments/1ns2fpg/modern_day_evangelicals_from_the_us_now_claim/,46595
1msbirr,"On the day before he left office, President Jimmy Carter issued a full pardon to Peter Yarrow, who was convicted in 1970 of taking ""immoral and improper liberties"" with a 14 year old girl. To date he is the only President to pardon someone for sexual offenses against a child. Why did he do this?",,https://www.reddit.com/r/AskHistorians/comments/1msbirr/on_the_day_before_he_left_office_president_jimmy/,40635
1nj1qbl,What happened to the “leave in for 2 minutes” instructions on conditioner bottles?,,https://www.reddit.com/r/AskHistorians/comments/1nj1qbl/what_happened_to_the_leave_in_for_2_minutes/,36506
1qbjtkr,"Is the phrase ""One of ours, all of yours"" an old Nazi slogan advocating for collective punishment?",,https://www.reddit.com/r/AskHistorians/comments/1qbjtkr/is_the_phrase_one_of_ours_all_of_yours_an_old/,32084
1n32oii,How did ancient Inuit people get the privacy to have intercourse?,,https://www.reddit.com/r/AskHistorians/comments/1n32oii/how_did_ancient_inuit_people_get_the_privacy_to/,28414
1tam8xp,"Reddit was founded in 2005, meaning it is history according to this sub's 20 year rule. Has there been any sort of academic discussion on the value of Reddit posts as a historical source given the years' worth of threads commented on by thousands of users discussing contemporary events?",,https://www.reddit.com/r/AskHistorians/comments/1tam8xp/reddit_was_founded_in_2005_meaning_it_is_history/,25218
1mtr6s8,Why aren’t Jesus siblings a bigger deal in modern Christianity?,,https://www.reddit.com/r/AskHistorians/comments/1mtr6s8/why_arent_jesus_siblings_a_bigger_deal_in_modern/,21985
1procan,"Do you think it's likely that Adolf Hitler personally saw the 1941 Warner Bros movie Wabbit Twouble, from which the Big Chungus meme comes from?",,https://www.reddit.com/r/AskHistorians/comments/1procan/do_you_think_its_likely_that_adolf_hitler/,19689
1q1131k,Our 20 Year Rule: You can now ask questions about 2006!,,https://www.reddit.com/r/AskHistorians/comments/1q1131k/our_20_year_rule_you_can_now_ask_questions_about/,17434
1qwnad2,Where WWII soldiers regularly carrying toilet paper? Or was everyone running around fighting with poopy butts?,,https://www.reddit.com/r/AskHistorians/comments/1qwnad2/where_wwii_soldiers_regularly_carrying_toilet/,14814
1rxiehf,I grew up Christian nationalist. Where should I start learning better history?,,https://www.reddit.com/r/AskHistorians/comments/1rxiehf/i_grew_up_christian_nationalist_where_should_i/,13495
1mp8d0w,What happened to homeless people in fascist states like Germany and Italy?,,https://www.reddit.com/r/AskHistorians/comments/1mp8d0w/what_happened_to_homeless_people_in_fascist/,12233
1mzxjez,"Is it true that creeping fascism is never stopped without violence? Seeking a fact check on the essay, ""I researched every attempt to stop fascism in history. The success rate is 0%.""",,https://www.reddit.com/r/AskHistorians/comments/1mzxjez/is_it_true_that_creeping_fascism_is_never_stopped/,10546
1tf6to8,Question for German-speaking historians: Was Mein Kampf actually written well? Or is it basically a giant ramble like many people describe it as?,,https://www.reddit.com/r/AskHistorians/comments/1tf6to8/question_for_germanspeaking_historians_was_mein/,9377
1n6snhh,"It's September 12th, 2001. While I was able to survive yesterday's attacks on the world trade center unscaved, my office is currently sitting underneath a pile of rubble. Do I still have a job? When and where will I go back to work? How will I get by in the time between now and when I start working?",,https://www.reddit.com/r/AskHistorians/comments/1n6snhh/its_september_12th_2001_while_i_was_able_to/,7940
1qeufck,"How long did ""business as usual"" carry on in Germany during the third reich?",,https://www.reddit.com/r/AskHistorians/comments/1qeufck/how_long_did_business_as_usual_carry_on_in/,6997
1mmj4zr,Nazi Germany rejected Einsteinian physics because of anti-Semitism. The Soviet Union rejected Darwinian evolution because of Marxism. Did the United States ever reject major scientific discoveries because of ideology?,,https://www.reddit.com/r/AskHistorians/comments/1mmj4zr/nazi_germany_rejected_einsteinian_physics_because/,6694
1sa4cdw,The President of Iran just wrote an open letter to the American people in which he made multiple large claims about Iranian history. To what degree are these claims accurate or inaccurate?,,https://www.reddit.com/r/AskHistorians/comments/1sa4cdw/the_president_of_iran_just_wrote_an_open_letter/,5958
1n36z14,Why is the family who possessed the murder weapon used to kill Emmett Till allowed to remain anonymous?,,https://www.reddit.com/r/AskHistorians/comments/1n36z14/why_is_the_family_who_possessed_the_murder_weapon/,4804
1nan9fb,"If sexual assault is almost an expected reality in the event of a sacking, did women in historical civilisations have a mentality or culture to deal with that?",,https://www.reddit.com/r/AskHistorians/comments/1nan9fb/if_sexual_assault_is_almost_an_expected_reality/,4893
1rchu0g,Why are Western families happy to have daughters even though male primogeniture exists?,,https://www.reddit.com/r/AskHistorians/comments/1rchu0g/why_are_western_families_happy_to_have_daughters/,4361
1o1uxua,"The US Attorney General said today that they would pursue for destruction ""Antifa"", which she called a left-wing terrorist organization, but which many believe does not to exist. Are there historic examples where a government sought to wipe out a group which did not exist, and what happened?",,https://www.reddit.com/r/AskHistorians/comments/1o1uxua/the_us_attorney_general_said_today_that_they/,3694
1qzjtd2,"Say I am a 20-year-old man in a rich farming household in Central France in 456. Do I get any sense that the (Western) Roman Empire is in the process of ""falling""? How different is my day-to-day life compared to my great-great-grandfather in the 350s, and to my great-great-grandson in the 550s?",,https://www.reddit.com/r/AskHistorians/comments/1qzjtd2/say_i_am_a_20yearold_man_in_a_rich_farming/,3138
1q4n3je,"Did medieval executioners have psychological problems because of their job, or did they have their job because of their psychological problems?",,https://www.reddit.com/r/AskHistorians/comments/1q4n3je/did_medieval_executioners_have_psychological/,2819
1tq675h,"How did ancient armies actually move 100,000–200,000 soldiers across long distances without modern logistics? Like, where did they sleep, how did they get enough food and water every day, and how did they stop the whole army from just collapsing into chaos?",,https://www.reddit.com/r/AskHistorians/comments/1tq675h/how_did_ancient_armies_actually_move_100000200000/,2992
1r4tlja,"Dr. Ignaz Semmelweis famously died in an insane asylum for his insistence that other doctors wash their hands to reduce surgery mortality. What accounts do we have from colleagues who rejected ridiculed Semmelweis in life, only to find out many years after his death that he was right?",,https://www.reddit.com/r/AskHistorians/comments/1r4tlja/dr_ignaz_semmelweis_famously_died_in_an_insane/,2051
1m9erfo,Did the Red Army really rape 2 million German women?,,https://www.reddit.com/r/AskHistorians/comments/1m9erfo/did_the_red_army_really_rape_2_million_german/,2324
1mz6b77,"Was female pleasure during sex ever important before modern times, or is this focus on women also getting their share a complete modern phenomenon?",,https://www.reddit.com/r/AskHistorians/comments/1mz6b77/was_female_pleasure_during_sex_ever_important/,1683
1q41emw,"Why was Churchill so early, adamant and consistent in his denouncing of Hitler and the Nazis?",,https://www.reddit.com/r/AskHistorians/comments/1q41emw/why_was_churchill_so_early_adamant_and_consistent/,1414
1rysdnr,"Why are most Jews, well, Jewish?",,https://www.reddit.com/r/AskHistorians/comments/1rysdnr/why_are_most_jews_well_jewish/,1770
1n91pjg,"I'm Dr. Elizabeth Reis and the US Naval Academy banned my book, Bodies in Doubt: An American History of Intersex, from their library last spring. Ask Me Anything!",,https://www.reddit.com/r/AskHistorians/comments/1n91pjg/im_dr_elizabeth_reis_and_the_us_naval_academy/,1249
1t1b708,"English longbowmen during the Hundred Year's War earned 6 pence a day. A single arrow cost 0.3125 pence, so you'd start losing money on the 20th arrow. That doesn't seem like a lot when battles could last multiple hours. Are there accounts or archers refusing to put themselves in the red?",,https://www.reddit.com/r/AskHistorians/comments/1t1b708/english_longbowmen_during_the_hundred_years_war/,1776
1nhltxc,"When the Joad family crosses into Arizona in *Grapes of Wrath*, a police officer asks them where they're going, gives them some kind of sticker to indicate they're just passing through, and implies they better not dawdle; were practices like this realistic in the Great Depression?",,https://www.reddit.com/r/AskHistorians/comments/1nhltxc/when_the_joad_family_crosses_into_arizona_in/,1343
1q5j3eg,"Gerald of Wales (1188) noted that Irish midwives didn't ""raise the nose"" or ""lengthen the legs"" of babies and just let them grow naturally. What are the practices he's talking about? How were other medieval Europeans trying to shape infants' bodies?",,https://www.reddit.com/r/AskHistorians/comments/1q5j3eg/gerald_of_wales_1188_noted_that_irish_midwives/,1233
1trkaok,"The No Child Left Behind Act is often seen as a failure that didn't improve education. However data has shown that education ""peaked"" in the mid-2010s with students who spent the majority of their school careers under NCLB. What exactly was NCLB, why is it so controversial, and did it actually fail?",,https://www.reddit.com/r/AskHistorians/comments/1trkaok/the_no_child_left_behind_act_is_often_seen_as_a/,1177
1pciprl,Was there really a time when they were basically taking every kid’s tonsils out? What was up with that?,,https://www.reddit.com/r/AskHistorians/comments/1pciprl/was_there_really_a_time_when_they_were_basically/,818
1mgek13,Why is the Arab conquest and settlement of North Africa normally referred to as “Arabization” rather than the more common term of “Colonialism”? Is there something that makes this process different than other colonialist conquests?,,https://www.reddit.com/r/AskHistorians/comments/1mgek13/why_is_the_arab_conquest_and_settlement_of_north/,971
1s9oztt,I (35/m/HRH) just lowered tea taxes on my colonies (166/gender neutral) and now they're throwing the tea in the harbor. AITAH?,,https://www.reddit.com/r/AskHistorians/comments/1s9oztt/i_35mhrh_just_lowered_tea_taxes_on_my_colonies/,509
1se0vrh,What historical evidence do we have of Jesus’ crucifixion and its aftermath?,,https://www.reddit.com/r/AskHistorians/comments/1se0vrh/what_historical_evidence_do_we_have_of_jesus/,1020
1nsyulj,What was James Bond’s drink order supposed say about him?,,https://www.reddit.com/r/AskHistorians/comments/1nsyulj/what_was_james_bonds_drink_order_supposed_say/,1202
1pq8xce,"I recently learned about the ""pansy craze"" of the 20s-30s, when America became obsessed with gay culture. Why in the 20s-30s? And how was gay culture back then different from now?",,https://www.reddit.com/r/AskHistorians/comments/1pq8xce/i_recently_learned_about_the_pansy_craze_of_the/,388
1qmqxxt,How did normal people resist the Nazis?,,https://www.reddit.com/r/AskHistorians/comments/1qmqxxt/how_did_normal_people_resist_the_nazis/,1209
1qa87p1,What are the best resources to teach teens about fascism and how it begins?,,https://www.reddit.com/r/AskHistorians/comments/1qa87p1/what_are_the_best_resources_to_teach_teens_about/,642
1pn0ssp,"[META]For the love of Clio, Óðinn, Thṓth, 孔子, and the Saints Bede and Jerome, please do not delete your posts after they have been answered!",,https://www.reddit.com/r/AskHistorians/comments/1pn0ssp/metafor_the_love_of_clio_óðinn_thṓth_孔子_and_the/,707
