article_id,title,url,description,pub_date,author,source_post,scraped_at
ebe43b5e24d3,"The weekend is here! Pour yourself a mug of  coffee, grab a seat outside, and get ready for our longer-form weekend reads:",https://www.portorico.com/store/product75.html,,2026-05-10T11:00:00.494333,Danish Blend,https://ritholtz.com/2026/05/10-weekend-reads-90/,2026-05-10T11:00:00.494343
be0e3625de8d,I Want to Live Like Costco People,https://tastecooking.com/i-want-to-live-like-costco-people/,"Embracing the Costco lifestyle means accepting the fact that I am, in many ways, becoming my father. This is an old idea, both Freudian and Kierkegaardian—the belief that we are all destined to embody learned characteristics and habits passed down from parent to child. On the strange aspirational pull of bulk warehouse shopping. A rare cultural piece that’s actually fun. Some of us are crying in H Mart; some of us are mourning in Costco. (  )",2026-05-10T11:00:00.494408,Taste,https://ritholtz.com/2026/05/10-weekend-reads-90/,2026-05-10T11:00:00.494410
0d0cbcb2a020,David Attenborough and the Voice That Revealed a Planet,https://www.theringer.com/2026/05/04/tv/david-attenborough-voice-nature-earth-100-years,"As Attenborough turns 100, a tribute to the most recognizable voice in nature documentary — and a worldview that hardened from wonder into warning over six decades. (  ) see also At 100, David Attenborough Is Nature’s Most Trusted Voice : A second centennial salute to Attenborough, this one featuring Prince Harry. Two takes on the same milestone — pick your poison. ( Time )",2026-05-10T11:00:00.494473,The Ringer,https://ritholtz.com/2026/05/10-weekend-reads-90/,2026-05-10T11:00:00.494475
e8ff1cb4d9ed,SpaceX is Breaking Capitalism (& Indexing),http://www.etf.com/sections/equity/spacex-breaking-capitalism-indexing,"Once upon a time, companies went public to raise money. You’d go on a road show to pitch your story and drum up interest, you’d float a big pile of stock, and then you’re off to the races to go build your company. Turns out, that’s not really the case anymore. On the index-construction problem when the most valuable companies are private and untouchable. The market-cap weighted world has a SpaceX-shaped blind spot. (  )",2026-05-10T11:00:00.494534,ETF.com,https://ritholtz.com/2026/05/10-weekend-reads-90/,2026-05-10T11:00:00.494536
07f8d087d61a,Raising Cane’s Grew From an Idea a College Professor Hated,https://www.bloomberg.com/news/features/2026-05-07/raising-cane-s-founder-todd-graves-built-chicken-finger-chain-after-failed-pitch?accessToken=eyJhbGciOiJIUzI1NiIsInR5cCI6IkpXVCJ9.eyJzb3VyY2UiOiJTdWJzY3JpYmVyR2lmdGVkQXJ0aWNsZSIsImlhdCI6MTc3ODE3NjcxMiwiZXhwIjoxNzc4NzgxNTEyLCJhcnRpY2xlSWQiOiJURU5YNktLSVVQVFAwMCIsImJjb25uZWN0SWQiOiIxQzU5RkM5NjZDRTU0N0QwOTc1RkRBNTFBRTY1N0ZENyJ9.JSVfgZ_6G1wZRCdPKPXn9tAQJguoCovBrv2TaPy6xJY&utm_source=nextdraft&utm_medium=website,"No one believed in Todd Graves’ vision for a restaurant at first. Today, Raising Cane’s is the third-largest chicken chain in the US by sales and growing fast. Founder Todd Graves built a multibillion-dollar chicken-finger empire from a business-school F. The professor is presumably re-grading. (  free )",2026-05-10T11:00:00.494606,Businessweek,https://ritholtz.com/2026/05/10-weekend-reads-90/,2026-05-10T11:00:00.494608
8d63c92bbd6e,Artemis II Is Competency Porn and We Are Starving For It,https://lizplank.substack.com/p/artemis-ii-is-competency-porn-and?utm_medium=email&utm_source=substack,"(girls will be like i needed this and it’s just four nerds in space). If you have spent the last week inexplicably emotional about a space mission, you are not alone and you are not being dramatic. Something real is happening to you. Something your nervous system recognized before your brain caught up to it, and it is worth understanding why, because the reason is actually about a lot more than space.On the cathartic appeal of an institution that still works. The rocket program is the rare feder",2026-05-10T11:00:00.494683,Airplane Mode,https://ritholtz.com/2026/05/10-weekend-reads-90/,2026-05-10T11:00:00.494685
d79353d930b4,Six lessons from history’s greatest financial crises,https://www.ft.com/content/0bd796c9-bc0e-43ab-bedd-d0294c2efd17 https://giftarticle.ft.com/giftarticle/actions/redeem/55b9aa76-790e-4c4b-ad07-0e4c13d09a4a,Robin Wigglesworth distills six recurring patterns. None of them are surprising; all of them keep getting forgotten. (  ),2026-05-10T11:00:00.494751,Financial Times,https://ritholtz.com/2026/05/10-weekend-reads-90/,2026-05-10T11:00:00.494753
8e7540242c6e,Toyota built a $10 billion private utopia—what’s going on in there?,https://arstechnica.com/cars/2026/05/inside-toyotas-10b-private-utopia-big-ideas-few-people-cameras-everywhere/,"A reported tour of Woven City, the corporate test-bed at the foot of Mount Fuji. The ‘utopia’ framing is doing a lot of work, but the engineering is real. Woven City is a privacy nightmare but could be helpful to an OEM desperate to be more. (  ) see also Our Cringe Century : On cringe as the dominant cultural register of the 2020s. A cleverer essay than the headline suggests. Since the start of the millennium Britain has found new and exquisite ways to humiliate herself. Here, in order, are the",2026-05-10T11:00:00.494813,Ars Technica,https://ritholtz.com/2026/05/10-weekend-reads-90/,2026-05-10T11:00:00.494815
4458a732f0a6,"There Is No ‘ Hard Problem Of Consciousness ’ A bracing essay arguing the famous puzzle is a category error. Whether you buy it or not, it’s the best version of the case. Consciousness is not separate",https://www.noemamag.com/there-is-no-hard-problem-of-consciousness,,2026-05-10T11:00:00.494936,NOEMA,https://ritholtz.com/2026/05/10-weekend-reads-90/,2026-05-10T11:00:00.494938
d9628b303bd3,How college students are learning to socialize without cellphones,https://www.washingtonpost.com/education/2026/05/06/college-socializing-screen-free-zones/,Phone-free dorms and screen-free social hours are spreading on campus. The kids may end up correcting this faster than the policymakers. (  ),2026-05-10T11:00:00.494994,Washington Post,https://ritholtz.com/2026/05/10-weekend-reads-90/,2026-05-10T11:00:00.494996
7876e74e35b2,Who’s NBA’s most overrated player? Underrated? Best coach? Anonymous player poll results,https://www.nytimes.com/athletic/7253518/2026/05/06/anonymous-nba-player-poll-2026-overrated-underrated/,"How do NBA players feel about which of their peers is most underrated and most overrated? And what do they think when it comes to the league’s head coaches? We asked them those questions, and more, for ’s 2026 Anonymous NBA Player Poll. ( The Athletic )",2026-05-10T11:00:00.495051,The Athletic,https://ritholtz.com/2026/05/10-weekend-reads-90/,2026-05-10T11:00:00.495053
ab418f6dea6f,Video of the day :,https://www.youtube.com/watch?v=Ja3_9BQXFf4&t=1832s,,2026-05-10T11:00:00.495109,Billie Eilish | Good Hang with Amy Poehler,https://ritholtz.com/2026/05/10-weekend-reads-90/,2026-05-10T11:00:00.495111
