article_id,title,url,description,pub_date,author,source_post,scraped_at
4934f299ec72,"What Do You Believe About Investing? Asking questions about what an investor believes, or what their investment philosophy is, can increasingly feel like a mundane tick box exercise quickly covered by",https://behaviouralinvestment.com/2026/04/14/what-are-your-investment-beliefs-2/,,2026-04-22T11:02:16.208432,Behavioural Investment,https://ritholtz.com/2026/04/10-wednesday-am-reads-368/,2026-04-22T11:02:16.208443
d75573775656,The Trade,https://theomission26.substack.com/p/assessment-015-the-trade?isFreemail=true&post_id=194843409&publication_id=8278024&r=21r0e&triedRedirect=true&utm_campaign=email-post-title&utm_medium=email&utm_source=post-email-title,The war produced a market mechanism. Someone knew how it worked before the public did . Every announcement moved markets and every extension of a deadline crashed oil. Then escalation would push it back up and the cycle would repeat. This happened seven times in fifty-two days. (  ),2026-04-22T11:02:16.208517,The Omission,https://ritholtz.com/2026/04/10-wednesday-am-reads-368/,2026-04-22T11:02:16.208519
26084db6b275,"Has the Stock Market Really Been More Volatile Than Usual This Year? For most investors, stock market volatility is something to endure, not act upon. (  )",https://www.morningstar.com/stocks/has-stock-market-really-been-more-volatile-than-usual-this-year,,2026-04-22T11:02:16.208609,Morningstar,https://ritholtz.com/2026/04/10-wednesday-am-reads-368/,2026-04-22T11:02:16.208612
e9a76ce15de3,"Tim Cook Was Very, Very Good at Making Money",https://www.nytimes.com/2026/04/21/business/how-apple-became-a-4-trillion-company-under-tim-cook.html,"How Cook turned Jobs’s creation into a $4 trillion machine. Whatever you think of him as a product visionary, the operator’s ledger is unassailable. (  )",2026-04-22T11:02:16.208675,New York Times,https://ritholtz.com/2026/04/10-wednesday-am-reads-368/,2026-04-22T11:02:16.208677
a82b62bd9bc7,Breaking cover: the future of the business book,https://www.ft.com/content/4651ae29-51b2-416c-89bd-3427617b131a?syn-25a6b1a6=1,"Authors are experimenting with new technology and formats to better communicate ideas. Business books are being replaced by podcasts, Substacks, and LinkedIn posts. The 300-page hardback is becoming a vanity artifact, not a vehicle for actual ideas.  (  )",2026-04-22T11:02:16.208741,Financial Times,https://ritholtz.com/2026/04/10-wednesday-am-reads-368/,2026-04-22T11:02:16.208743
75cf88f0df81,San Diego Now Has So Much Water That It’s Selling It,https://www.wsj.com/us-news/climate-environment/san-diego-now-has-so-much-water-that-its-selling-it-527186fb?reflink=desktopwebshare_permalink&st=mVEk4M,"Once a drought poster child, the California city now generates enough water to rescue parched states like Arizona—and brew beer from recycled sewage  (  )",2026-04-22T11:02:16.208802,Wall Street Journal,https://ritholtz.com/2026/04/10-wednesday-am-reads-368/,2026-04-22T11:02:16.208804
61c08f46e333,You Should Be More Freaked Out by Shingles,https://www.wired.com/story/shingles-is-a-bigger-deal-than-you-think/,"The viral infection leaves millions with chronic pain, increased stroke risk, and lifelong nerve damage—yet vaccination rates remain dangerously low. (  )",2026-04-22T11:02:16.208860,Wired,https://ritholtz.com/2026/04/10-wednesday-am-reads-368/,2026-04-22T11:02:16.208862
877aeaa0bcd6,Scientists identify five ages of the human brain over a lifetime,https://www.cam.ac.uk/stories/five-ages-human-brain,"Four major turning points around ages nine, 32, 66 and 83 create five broad eras of neural wiring over the average human lifespan. (  )",2026-04-22T11:02:16.208917,University of Cambridge,https://ritholtz.com/2026/04/10-wednesday-am-reads-368/,2026-04-22T11:02:16.208918
148d8ffe59d0,Ukraine Has Finally Given Up on Trump,https://www.theatlantic.com/ideas/2026/04/ukraine-trump-us-oil-russia/686854/,Kyiv has started hitting Russian oil-export facilities — a sign it’s no longer waiting on Washington. (  ),2026-04-22T11:02:16.208974,The Atlantic,https://ritholtz.com/2026/04/10-wednesday-am-reads-368/,2026-04-22T11:02:16.208975
6f0944c1c10e,The man who saw the future: the legacy of cultural theorist Mark Fisher,https://www.theguardian.com/film/2026/apr/17/we-are-making-a-film-about-mark-fisher-capitalist-realism,"Capitalist Realism: Is There No Alternative? was published in 2009 to critical silence—now a film revisits Mark Fisher’s prescient legacy. Touching on everything from late-stage capitalism to Adele, the work of the late writer is proving increasingly influential. Now a documentary on him is looking to live up to his ideals. Touching on everything from late-stage capitalism to Adele, the work of the late writer is proving increasingly influential. Now a documentary on him is looking to live up to",2026-04-22T11:02:16.209039,The Guardian,https://ritholtz.com/2026/04/10-wednesday-am-reads-368/,2026-04-22T11:02:16.209041
3971614df778,"Be sure to check out our Masters in Business this week with  , co‑founder, chair & head of research/chief scientist at Capital Fund Management (CFM). The $20 billion firm specializes in managed future",https://en.wikipedia.org/wiki/Jean-Philippe_Bouchaud,,2026-04-22T11:02:16.209107,Philippe Bouchaud,https://ritholtz.com/2026/04/10-wednesday-am-reads-368/,2026-04-22T11:02:16.209109
6a94dcfa429d,"Be sure to check out our Masters in Business this week with Philippe Bouchaud , co‑founder, chair & head of research/chief scientist at  (CFM). The $20 billion firm specializes in managed futures. He ",https://www.cfm.com/,,2026-04-22T11:02:16.209167,Capital Fund Management,https://ritholtz.com/2026/04/10-wednesday-am-reads-368/,2026-04-22T11:02:16.209169
