article_id,title,url,description,pub_date,author,source_post,scraped_at
aeade1467137,Congrats. You’re About to Unwittingly Make Elon Musk a Trillionaire . SpaceX is IPOing next week. And there’s a good chance you’re gonna own a portion of it—whether you like it or not. (  ),https://www.thebulwark.com/p/congrats-youre-about-to-unwittingly-make-elon-musk-trillionaire-spacex-ipo-index-funds,,2026-06-05T12:35:59.053634,The Bulwark,https://ritholtz.com/2026/06/10-friday-am-reads-501/,2026-06-05T12:35:59.053647
10b7f9897cb6,Oil industry warns Trump administration of price spikes within weeks,https://www.politico.com/news/2026/06/04/oil-price-spike-white-house-hormuz-00949435,"on the API and major-producer warnings going into the White House — Hormuz risk, tanker insurance, refining maintenance, all aligned the wrong way. The Semafor piece’s nervous companion. Industry executives said the loss of oil through the Strait of Hormuz is draining petroleum inventories to dangerously low levels. ( Politico ) but see Why isn’t oil more expensive? With peace talks between Iran and the US in limbo, one of the main questions looming over global energy markets is why the price of",2026-06-05T12:35:59.053725,Politico,https://ritholtz.com/2026/06/10-friday-am-reads-501/,2026-06-05T12:35:59.053727
dc772637987e,The United States Capital Structure .The U.S. federal government is arguably the largest issuer of safe debt in the world,https://thetwocents.substack.com/p/the-united-states-treasurys-cap-table,"roughly $28 trillion of marketable Treasury debt. These Treasurys are backed only by the full faith and credit of the United States Treasury. There is no specific source of revenue that is earmarked to pay back these Treasurys, unlike, say, municipal bonds that are backed by toll revenue. How safe are these promises, really? (  )",2026-06-05T12:35:59.053829,The Two Cents,https://ritholtz.com/2026/06/10-friday-am-reads-501/,2026-06-05T12:35:59.053830
5428718743e6,After 60/40,https://www.apollo.com/wealth/insights-news/insights/2026/05/after-60-40-the-hidden-cost-of-uninvested-capital,"The Hidden Cost of Uninvested Capital Through the J-Curve . When building a strategic private markets allocation, the waiting period can carry a meaningful cost. The question is not only how to access private markets, but how to manage uncalled capital during the ramp-up period.  making the case for private-markets allocation by costing out the cash drag during the J-curve. Sponsored research, but the framework is worth the read regardless. ( Apollo )",2026-06-05T12:35:59.053879,Apollo,https://ritholtz.com/2026/06/10-friday-am-reads-501/,2026-06-05T12:35:59.053880
f6bb7e7c9549,I Fed the People Building the Metaverse,https://yeastconfections.substack.com/p/i-fed-the-people-building-the-metaverse,"A former Reality Labs caterer’s essay on what cooking inside Meta’s metaverse division actually looked like. The food sociology of a tech-cycle bust, told with affection. (  )",2026-06-05T12:35:59.053927,Yeast Confections,https://ritholtz.com/2026/06/10-friday-am-reads-501/,2026-06-05T12:35:59.053928
4190ae4395a5,How much more software do we really need?,https://www.noahpinion.blog/p/how-much-more-software-do-we-really,"Probably a lot, but not necessarily the kinds people have made money on so far. Noah Smith with the question every VC deck quietly avoids — the marginal utility of net-new SaaS in a market already drowning in seat licenses. A useful counterweight to AI-app exuberance. (  ) see also What We Learned About the AI Threat From Q1 Software Earnings : In most cases, the death of software companies has been exaggerated, according to Morningstar analysts. ( Morningstar )",2026-06-05T12:35:59.053979,Noahpinion,https://ritholtz.com/2026/06/10-friday-am-reads-501/,2026-06-05T12:35:59.053980
7221fb12bfab,"1,000 True Fans . To be a successful creator you don’t need millions. You don’t need millions of dollars or millions of customers, millions of clients or millions of fans. To make a living as a crafts",https://kk.org/thetechnium/1000-true-fans/,,2026-06-05T12:35:59.054076,The Technium,https://ritholtz.com/2026/06/10-friday-am-reads-501/,2026-06-05T12:35:59.054077
65ed568935aa,Sticker Shock at the Pump Fuels a Surge in Hybrid Sales,https://www.wsj.com/business/autos/sticker-shock-at-the-pump-fuels-a-surge-in-hybrid-sales-198f8e39?mod=hp_lista_pos1,"Sales of hybrid cars carried the day in May as buyers seek better fuel economy. WSJ on the consumer pivot the auto industry kept saying would not happen — buyers walking past pure EVs to hybrids the second gasoline tipped. Toyota, of all companies, was right. (  )",2026-06-05T12:35:59.054122,Wall Street Journal,https://ritholtz.com/2026/06/10-friday-am-reads-501/,2026-06-05T12:35:59.054124
c2f07e6a7249,"This Is the Formula That Defeated Orban. It Would Defeat Trump, Too . outlandish xenophobic and antisemitic propaganda had served Orban well for years. It didn’t work against Peter Magyar — probably b",https://www.nytimes.com/2026/05/29/opinion/hungary-win-election-viktor-orban.html,"Old-fashioned in-person politics can be a powerful antidote to media fearmongering. NYT opinion on the Hungarian opposition playbook that finally landed — coalition discipline, local infrastructure, and abandoning the moral-high-ground talking points. Specific, transferable, worth the read. (  )",2026-06-05T12:35:59.054180,New York Times,https://ritholtz.com/2026/06/10-friday-am-reads-501/,2026-06-05T12:35:59.054181
fbea95c8da01,Emily Blunt Was Drunk in a Club When a Phone Call Changed Her Life,https://www.wsj.com/arts-culture/film/emily-blunt-disclosure-day-devil-wears-prada-9e670e43?mod=wknd_pos1,"WSJ profile of Emily Blunt pegged to the new Devil Wears Prada follow-up. The opening anecdote earns the headline; the rest is better than the celebrity-profile genre usually allows. The English actress is having a blockbuster year, between reprising her breakout role and starring in Spielberg’s ‘Disclosure Day’ (  )",2026-06-05T12:35:59.054228,Wall Street Journal,https://ritholtz.com/2026/06/10-friday-am-reads-501/,2026-06-05T12:35:59.054229
4c3781a9c465,Video of the day :,https://www.youtube.com/watch?v=RjkoCg0Yd4w,,2026-06-05T12:35:59.054272,How Shakespeare Manipulates An Audience,https://ritholtz.com/2026/06/10-friday-am-reads-501/,2026-06-05T12:35:59.054273
0ddff5b28788,"Be sure to check out our Masters in Business  this weekend with Chris Davis, Chairman and Portfolio Manager of Davis Funds . The firm oversees $20 billion in client assets, with Davis (and colleagues)",https://itunes.apple.com/us/podcast/masters-in-business/id730188152?mt=2,,2026-06-05T12:35:59.054328,interview,https://ritholtz.com/2026/06/10-friday-am-reads-501/,2026-06-05T12:35:59.054329
