article_id,title,url,description,pub_date,author,source_post,scraped_at
759c1971487d,"50 years. 50 facts. Indexing since 1976 . As the golden anniversary of index fund investing approaches, the strategy is widely available across and within asset classes. Its appeal is evident",https://corporate.vanguard.com/content/corporatesite/us/en/corp/articles/50-years-50-facts-indexing-since-1976.html,"Indexing is an easy-to-understand, cost-effective strategy that can offer diversification, tax efficiency, and consistent performance relative to the results of the market. (  )",2026-04-21T11:04:04.314853,Vanguard,https://ritholtz.com/2026/04/10-tuesday-am-reads-469/,2026-04-21T11:04:04.314865
6525e2c4c8d9,The U.S. Is Manufacturing a Ton of Grid Batteries,https://reasonstobecheerful.world/us-grid-battery-storage/,"Demand for energy storage is surging on the U.S. grid — and the country now has more than enough battery-making factories to meet it. Domestic energy-storage capacity is scaling fast as grid demand climbs: (  ) see also AI Is Using So Much Energy That Computing Firepower Is Running Out: The AI bubble has a physics problem: there aren’t enough megawatts on the grid. Compute-constrained means capex-constrained, which means the models won’t scale the way investors are pricing.  ( Wall Street Journa",2026-04-21T11:04:04.314939,Reasons To Be Cheerful,https://ritholtz.com/2026/04/10-tuesday-am-reads-469/,2026-04-21T11:04:04.314942
b69a12046b14,"Deals Hurt Returns . Thaler explains that auctions—especially when there are large numbers of bidders—can cause some participants to become emotional, to the point that they become undisciplined and e",https://humbledollar.com/2026/04/how-deals-hurt-returns/,,2026-04-21T11:04:04.315069,HumbleDollar,https://ritholtz.com/2026/04/10-tuesday-am-reads-469/,2026-04-21T11:04:04.315072
212d0f772c8e,"Americans Have Always Hated Taxes. The 250-Year Battle Over Your Wallet . From the Whiskey Rebellion of the 1790s to Henry David Thoreau’s refusal to pay taxes to the 1,400 elected officials who signe",https://www.barrons.com/articles/americans-hate-taxes-d6525cad,,2026-04-21T11:04:04.315144,Barrons,https://ritholtz.com/2026/04/10-tuesday-am-reads-469/,2026-04-21T11:04:04.315147
ae5bdf60a1cc,Some of the Most Popular Graduate Degrees Don’t Pay Off Financially,https://www.washingtonpost.com/education/2026/03/31/graduate-degree-earnings-study/,"New data shows the ROI on many master’s programs is worse than advertised.The report found advanced degrees in social work and psychology may have a zero to negative return, while medicine, law and pharmacy degrees show the highest return. (  )",2026-04-21T11:04:04.315248,Washington Post,https://ritholtz.com/2026/04/10-tuesday-am-reads-469/,2026-04-21T11:04:04.315251
aa414cbab794,Why the Strait of Hormuz is a geological wonder,https://www.nationalgeographic.com/science/article/strait-of-hormuz-geology,"The continental collisions that created this narrow Mideast waterway also made it the most strategically important 21 miles on Earth. Geology is destiny, and Iran controls the choke point.  (  )",2026-04-21T11:04:04.315311,National Geographic,https://ritholtz.com/2026/04/10-tuesday-am-reads-469/,2026-04-21T11:04:04.315313
fa3fc465ac43,‘An Operational Success and a Huge Strategic Failure’ Perhaps the most apt description of Trump’s policy toward Iran is an “incoherent maze” — a phrase Pete Hegseth applied in 2016 to Barack Obama’s f,https://www.nytimes.com/2026/04/04/opinion/trump-iran-war-power.html,Garrett Graff dismantles the mythology Hegseth has built around himself as the Iran War’s cheerleader-in-chief. The alternate history he’s selling is dangerous. ( Doomsday Scenario ),2026-04-21T11:04:04.315381,NYTimes,https://ritholtz.com/2026/04/10-tuesday-am-reads-469/,2026-04-21T11:04:04.315383
1088f8861166,‘An Operational Success and a Huge Strategic Failure’ Perhaps the most apt description of Trump’s policy toward Iran is an “incoherent maze” — a phrase Pete Hegseth applied in 2016 to Barack Obama’s f,https://www.doomsdayscenario.co/p/the-mythology-of-pete-hegseth,Garrett Graff dismantles the mythology Hegseth has built around himself as the Iran War’s cheerleader-in-chief. The alternate history he’s selling is dangerous. (  ),2026-04-21T11:04:04.315455,Doomsday Scenario,https://ritholtz.com/2026/04/10-tuesday-am-reads-469/,2026-04-21T11:04:04.315457
4108d6927ed2,NBA Playoffs: Ranking the Superstar Matchups We Want to See in the First Round,https://www.si.com/nba/nba-playoffs-ranking-the-superstar-matchups-we-want-to-see-in-the-first-round,"The giants who rule atop the game must go to war with one another, over and over again, until only one is left standing. There’s no room for error or quarter on the way to the pinnacle of the sport. The quality of each team still matters quite a bit but it’s the superstar matchups that will determine who will be featured on the biggest stage come the Finals…(  )",2026-04-21T11:04:04.315516,Sports Illustrated,https://ritholtz.com/2026/04/10-tuesday-am-reads-469/,2026-04-21T11:04:04.315518
3971614df778,"Be sure to check out our Masters in Business this week with  , co‑founder, chair & head of research/chief scientist at Capital Fund Management (CFM). The $20 billion firm specializes in managed future",https://en.wikipedia.org/wiki/Jean-Philippe_Bouchaud,,2026-04-21T11:04:04.315581,Philippe Bouchaud,https://ritholtz.com/2026/04/10-tuesday-am-reads-469/,2026-04-21T11:04:04.315583
6a94dcfa429d,"Be sure to check out our Masters in Business this week with Philippe Bouchaud , co‑founder, chair & head of research/chief scientist at  (CFM). The $20 billion firm specializes in managed futures. He ",https://www.cfm.com/,,2026-04-21T11:04:04.315640,Capital Fund Management,https://ritholtz.com/2026/04/10-tuesday-am-reads-469/,2026-04-21T11:04:04.315642
c1cf2597b5e3,"The gap between Wall Street (S&P 500) and Main Street (Consumer Sentiment) has never been this wide before. Wakl St ATH, Main St ATL Source:",https://x.com/charliebilello/status/2046037937817563147,,2026-04-21T11:04:04.315699,@charliebilello,https://ritholtz.com/2026/04/10-tuesday-am-reads-469/,2026-04-21T11:04:04.315701
