article_id,title,url,description,pub_date,author,source_post,scraped_at
866d8bb570c0,The Cascade,https://theomission26.substack.com/p/assessment-011-the-cascade,"The war’s secondary effects have crossed a threshold. They are no longer consequences. They are independent crises with their own momentum, and most of them will not stop when the bombing stops. (  ) see also Why isn’t the stock market freaking out more over the Iran war? Here’s why: History tells us that geopolitical events like the launch of military actions tend to rattle the securities markets in the short term, investors eventually shift to the long view, assuming that these conflicts will ",2026-04-06T10:53:30.601784,The Omission,https://ritholtz.com/2026/04/10-monday-am-reads-469/,2026-04-06T10:53:30.601796
890fdd3cb646,The State of the (Bonkers) ETF Market,http://www.etf.com/sections/etf-analytics/q1-26-state-bonkers-etf-market,"The ETF industry just had its wildest quarter ever—new launches, record flows, and a geopolitical backdrop that scrambled every playbook. Bonkers is the right word. (  )",2026-04-06T10:53:30.601912,ETF.com,https://ritholtz.com/2026/04/10-monday-am-reads-469/,2026-04-06T10:53:30.601914
4d9ad1b0c7f6,In Batteries We Trust,https://paulkrugman.substack.com/p/in-batteries-we-trust,"Krugman argues that oil futures are still too cheap given where energy markets are headed. The battery revolution is real, but the transition is messier than anyone wants to admit. (  )",2026-04-06T10:53:30.601965,Paul Krugman,https://ritholtz.com/2026/04/10-monday-am-reads-469/,2026-04-06T10:53:30.601967
0a035e055e8e,"Dispatch from the permanent underclass, April 3rd, 2029 . Jack Raines takes a hard look at the Americans who’ve been left behind by every recovery. The permanent underclass isn’t a bug in the system—i",https://www.youngmoney.co/p/dispatch-from-the-permanent-underclass,,2026-04-06T10:53:30.602030,Young Money,https://ritholtz.com/2026/04/10-monday-am-reads-469/,2026-04-06T10:53:30.602032
cdbab3ddbf6c,How the Midwest Became the Place to Move,https://www.theatlantic.com/family/2026/03/midwest-migration-sun-belt/686468/,"Flyover country is becoming move-to country. As the Sun Belt cools off and housing costs surge on the coasts, the Midwest is having its moment. It’s (mostly) about affordability. (  ) see also Private equity house views 2026 . Uncertainty surrounding inflation, economic growth, and interest rates remains high. ( Stepstone )",2026-04-06T10:53:30.602086,The Atlantic,https://ritholtz.com/2026/04/10-monday-am-reads-469/,2026-04-06T10:53:30.602088
28d52dca6e7a,America Now Has an EV Rust Belt. High Gas Prices Won’t Rescue It . GM supplier Magna is stuck with a plant built to churn out parts for battery-powered pickups; the $575 million EV parts factory in Mi,https://www.wsj.com/business/autos/ev-factories-layoffs-autoworkers-f93de8d3,,2026-04-06T10:53:30.602202,Wall Street Journal,https://ritholtz.com/2026/04/10-monday-am-reads-469/,2026-04-06T10:53:30.602203
cb392ee5bf07,"I broke up with my Kindle. My new e-reader treats me better . After Amazon’s Kindle removed my ability to download and back up my own e-books, I went in search of an alternative. (  free )",https://wapo.st/4toHORK,,2026-04-06T10:53:30.602255,Washington Post,https://ritholtz.com/2026/04/10-monday-am-reads-469/,2026-04-06T10:53:30.602257
520a8d0e2772,How A.I. Helped One Man (and His Brother) Build a $1.8 Billion Company,https://www.nytimes.com/2026/04/02/technology/ai-billion-dollar-company-medvi.html?unlocked_article_code=1.X1A.p1Lu.LUSmFcD3eYa5,Who needs more than two employees when artificial intelligence can do so many corporate tasks? It’s super efficient — and a little bit lonely. (  ),2026-04-06T10:53:30.602306,New York Times,https://ritholtz.com/2026/04/10-monday-am-reads-469/,2026-04-06T10:53:30.602308
192d52b80b60,Iran War Showcases Strength of South Korean Defense Sector,https://www.nytimes.com/2026/04/02/business/korea-missile-defense-iran.html,"Missile interceptors made by the South Korean firm LIG Nex1 are said to be performing well, at a small fraction of the cost of U.S. interceptors. The Iran war is turning Seoul into the world’s defense industry darling. (  )",2026-04-06T10:53:30.602358,New York Times,https://ritholtz.com/2026/04/10-monday-am-reads-469/,2026-04-06T10:53:30.602360
8f5a4e415cf5,"Be sure to check out our Masters in Business next week with  , founder and managing partner of Principal Venture Partners , an AI-focused investment firm established in 2024, and since 2025 a member o",https://www.songyeeyoon.org/,,2026-04-06T10:53:30.602416,Songyee Yoon,https://ritholtz.com/2026/04/10-monday-am-reads-469/,2026-04-06T10:53:30.602417
9451e95a07c8,"Be sure to check out our Masters in Business next week with Songyee Yoon , founder and managing partner of  , an AI-focused investment firm established in 2024, and since 2025 a member of the board of",https://www.principalvc.com/,,2026-04-06T10:53:30.602464,Principal Venture Partners,https://ritholtz.com/2026/04/10-monday-am-reads-469/,2026-04-06T10:53:30.602466
1d19740c1212,Untitled,https://mailchi.mp/005fb77d75b9/ritholtzreads,,2026-04-06T10:53:30.602513,Sign up for our reads-only mailing list here,https://ritholtz.com/2026/04/10-monday-am-reads-469/,2026-04-06T10:53:30.602515
