article_id,title,url,description,pub_date,author,source_post,scraped_at
58f529f0de5e,The Spanish Exception,https://www.theatlantic.com/ideas/2026/06/spain-economy-immigration-backlash/687371/,"on why Spain keeps outgrowing Europe despite — and partly because of — the political reaction to immigration. The contrarian European data point. ( The Atlantic ) but see Germany Has Lost What It Did Best : NYT opinion on Germany’s industrial model snapping under the combined weight of energy, China, and tariffs. The Merz government is finding out which post-war assumptions still hold. ( New York Times )",2026-06-02T13:57:08.393803,The Atlantic,https://ritholtz.com/2026/06/10-tuesday-am-reads-475/,2026-06-02T13:57:08.393817
38ab01cbb803,"If It Walks Like a Bubble and Quacks Like a Bubble, Then It’s Probably a Bubble . Indisputably, there are signs—some of which hark back to the dot-com era—that it is. For instance, take a gander at th",https://www.barrons.com/articles/stock-market-bubble-spacex-ipo-anthropic-openai-5458adad,$1.75 trillion divided by $18.674 billion equals 93.71 times. (  ),2026-06-02T13:57:08.393928,Barron’s,https://ritholtz.com/2026/06/10-tuesday-am-reads-475/,2026-06-02T13:57:08.393930
8081cc42d243,"Berkshire Beyond Buffett . In the 60 years he led Berkshire, he returned 6,000,000%, beating the S&P 500 by a factor of 130. Those wanting an education in business could do worse than listening to rec",https://theweekendreader.substack.com/p/berkshire-beyond-buffett,,2026-06-02T13:57:08.393986,The Weekend Reader,https://ritholtz.com/2026/06/10-tuesday-am-reads-475/,2026-06-02T13:57:08.393988
715a6841614e,Amazon Thinks the Future of Data Centers Depends on a Technical Problem It Just Solved,https://www.wired.com/story/amazon-thinks-the-future-of-data-centers-depends-on-a-technical-problem-it-just-solved/,The tech giant says a breakthrough in data center networking has dramatically accelerated the flow of information through its massive cloud infrastructure. (  ),2026-06-02T13:57:08.394050,Wired,https://ritholtz.com/2026/06/10-tuesday-am-reads-475/,2026-06-02T13:57:08.394052
fc5e84bb91a6,The SpaceX IPO: How Index Funds Will Adapt,https://www.morningstar.com/funds/spacex-ipo-how-index-funds-will-adapt,Upcoming mega-IPOs will force tough choices for index providers. (  ),2026-06-02T13:57:08.394097,Morningstar,https://ritholtz.com/2026/06/10-tuesday-am-reads-475/,2026-06-02T13:57:08.394098
b6b5a11fd5ec,I Profile Celebrities for a Living. Nothing Prepared Me for Tilly Norwood.,https://www.nytimes.com/2026/05/31/magazine/ai-actress-tilly-norwood.html,"NYT Magazine on profiling the AI “actress” Tilly Norwood — what the interview actually consists of, who the handlers are, and what publicity for a synthetic person looks like in practice. Strange and well done. (  )",2026-06-02T13:57:08.394141,New York Times,https://ritholtz.com/2026/06/10-tuesday-am-reads-475/,2026-06-02T13:57:08.394143
e5768cfab7c1,"The Wild, Strange Case Todd Blanche Can’t Seem to Escape",https://www.vanityfair.com/news/story/todd-blanche-wild-case,"on the case that keeps following the President’s lawyer-turned-deputy-AG. The kind of slow-burn legal exposure that doesn’t show up in cable coverage until it does. A fake Mossad agent. Twin grifters. The nation’s top lawman. A head-spinning legal drama has the attorney general fighting off accusations of forgery, malpractice, and more. ( Vanity Fair )",2026-06-02T13:57:08.394186,Vanity Fair,https://ritholtz.com/2026/06/10-tuesday-am-reads-475/,2026-06-02T13:57:08.394188
000f4d838811,How a mysterious particle could explain the universe’s missing antimatter,https://knowablemagazine.org/content/article/physical-world/2025/neutrinos-could-explain-universes-missing-antimatter,"Knowable on the neutrino results that might finally close the matter-antimatter asymmetry gap. Patient, well-sourced physics writing; pair with coffee. (  )",2026-06-02T13:57:08.394232,Knowable Magazine,https://ritholtz.com/2026/06/10-tuesday-am-reads-475/,2026-06-02T13:57:08.394233
7192e01ce93b,The Tall Man Who Changed Basketball: You Cannot Miss Victor Wembanyama,https://www.wsj.com/sports/basketball/victor-wembanyama-spurs-nba-finals-86b90021?mod=hp_featst_pos3,"WSJ on Wembanyama’s Finals run and what he is doing to a sport that has not had a true mold-breaker in a decade. Even if you only check in for the Finals, worth it. A mystery not long ago, San Antonio’s star from France has conquered the NBA and vanquished its defending champion. Does New York have an answer? (  )",2026-06-02T13:57:08.394275,Wall Street Journal,https://ritholtz.com/2026/06/10-tuesday-am-reads-475/,2026-06-02T13:57:08.394277
bb473e9f400e,Video of the day :,https://youtu.be/-X6YzlY_8tM?si=UhFaEEErxP9CthuV,,2026-06-02T13:57:08.394321,The SpaceX IPO… It’s Worse Than You Think,https://ritholtz.com/2026/06/10-tuesday-am-reads-475/,2026-06-02T13:57:08.394322
511f594a8ff0,"Be sure to check out our special Masters in Business this week, Remembering Jonathan Clements with Bill Bernstein and Jason Zweig. The two recall Clements’ impact on the investor community; they discu",https://www.amazon.com/exec/obidos/ASIN/1804093750/thebigpictu09-20,,2026-06-02T13:57:08.394374,Money and Me,https://ritholtz.com/2026/06/10-tuesday-am-reads-475/,2026-06-02T13:57:08.394375
47eb022c75e0,Industries from footwear to computers require huge expansion to satisfy domestic demand Source:,https://www.mckinsey.com/~/media/mckinsey/mckinsey%20global%20institute/our%20research/ramping%20up%20manufacturing%20in%20america/ramping-up-manufacturing-in-america.pdf,,2026-06-02T13:57:08.394425,McKinsey,https://ritholtz.com/2026/06/10-tuesday-am-reads-475/,2026-06-02T13:57:08.394426
