article_id,title,url,description,pub_date,author,source_post,scraped_at
c7057f83dfa2,America’s New Tax Mantra,https://www.wsj.com/politics/policy/irs-staffing-tax-enforcement-1a18e33f?mod=hp_lead_pos7,"‘The IRS Isn’t Going to Catch Me’ Gut IRS staffing, watch tax compliance collapse. The battered Internal Revenue Service shed thousands of enforcement employees—and more taxpayers appear eager to cheat. This isn’t a surprise — it’s a choice, and the honest taxpayers pay for the cheaters. (  ) see also Our Tax System Should Make You Furious . A lot of us were doing our taxes in the final days leading up to it — not naming any names. But let’s start here: If you’re a normal person, what kind of ta",2026-04-20T11:18:45.297510,Wall Street Journal,https://ritholtz.com/2026/04/10-monday-am-reads-471/,2026-04-20T11:18:45.297523
9dce64ae6cf2,"‘There is only one QQQ,’ prays Invesco . From the outside, it’s hard to shake the feeling that Nasdaq’s willingness to permit direct competitors to QQQ in the US is linked to the ETF’s new structure. ",https://giftarticle.ft.com/giftarticle/actions/redeem/66ad71cd-12d5-4664-bd10-3e5935c2b313,,2026-04-20T11:18:45.297633,Financial Times,https://ritholtz.com/2026/04/10-monday-am-reads-471/,2026-04-20T11:18:45.297634
f062c7d65722,A New Kind of Hybrid Car Is About to Hit America’s Streets,https://www.theatlantic.com/technology/2026/04/extended-range-electric-vehicle-pickup-trucks/686811/,Extended-range EVs are the automotive industry’s answer to range anxiety. It’s a pragmatic middle ground that might actually get America off gasoline faster than pure EVs ever could. (  ),2026-04-20T11:18:45.297689,The Atlantic,https://ritholtz.com/2026/04/10-monday-am-reads-471/,2026-04-20T11:18:45.297691
6db2e2de006d,The ‘Annoyance Economy’ Is More Than Just Annoying,https://www.nytimes.com/2026/04/12/business/annoyance-economy-costs.html,"The death by a thousand fees, subscriptions, and dark patterns is adding up to a real drag on household budgets. The annoyance is the business model. A new estimate puts the cost of dealing with robocalls, hidden fees and customer service chatbots that can’t solve most problems at $165 billion. (  )",2026-04-20T11:18:45.297740,New York Times,https://ritholtz.com/2026/04/10-monday-am-reads-471/,2026-04-20T11:18:45.297741
dbb717049b09,How Iran has been studying lessons from the war in Ukraine,https://www.ft.com/content/08629b39-9d82-4046-a1b9-3023009ffa81,"Military journals provide tantalising glimpses into what Tehran’s military thinks and its priorities, including drones . Tehran’s military journals reveal how closely it’s been watching drone and missile warfare. (  ) see also How did the US run out of missiles in Iran? We spend $800-billion-a-year on defense—but the US stockpiles barely lasted through a six-week-war, and the stockpile still came up short. ( Doomsday Scenario )",2026-04-20T11:18:45.297795,FT Alphaville,https://ritholtz.com/2026/04/10-monday-am-reads-471/,2026-04-20T11:18:45.297796
95e19c6b2494,Did Millennials or Boomers Have It Harder? We Went Searching for the Answer,https://www.wsj.com/personal-finance/millennials-vs-boomers-charts-e6f1971b?mod=hp_lista_pos1,"What the data says about median income, home prices, student debt and more. (  )",2026-04-20T11:18:45.297901,Wall Street Journal,https://ritholtz.com/2026/04/10-monday-am-reads-471/,2026-04-20T11:18:45.297903
529eec3aaafc,The Effect of Deactivating Facebook and Instagram on Users’ Emotional State,https://web.stanford.edu/~gentzkow/research/emotional_state.pdf,"paid 35,000 people to quit Facebook and Instagram for 6 weeks. Depression dropped. Anxiety dropped. Happiness went up. Women under 25 on Instagram saw the biggest gains. Just 6 weeks! Now imagine a full year. Working paper on the effect of deactivating Facebook and Instagram on users’ emotional state. ( NBER ; PDF at Stanford ) see also This detox may erase 10 years of social media brain damage, researchers say : Studies show that taking even short breaks could reverse measures of cognitive decl",2026-04-20T11:18:45.297956,Stanford,https://ritholtz.com/2026/04/10-monday-am-reads-471/,2026-04-20T11:18:45.297957
02f3e491a344,The Dumbest Hack of the Year Exposed a Very Real Problem,https://www.wired.com/story/crosswalk-city-hack-cybersecurity-lessons/,"A hijacked crosswalk announcement becomes an uncomfortable lesson in municipal cybersecurity. Last April, a hacker hijacked crosswalk announcements to mimic Mark Zuckerberg and Elon Musk. Records obtained by WIRED reveal how unprepared local authorities were.  (  )",2026-04-20T11:18:45.298048,Wired,https://ritholtz.com/2026/04/10-monday-am-reads-471/,2026-04-20T11:18:45.298050
97cbf5963b03,Masters 2026: The scariest moment in Rory McIlroy’s win and 4 other revelations,https://www.golfdigest.com/story/masters2026-rory-mcilroy-wins-quotes-scariest-moment-final-round-parents,"Rory McIlroy press conferences are among the best in the sporting world because he’s an introspective athlete who listens, truly thinks about his answers before giving them, and when he wins, the joy and satisfaction are palpable. So it was yet another fascinating meeting the media on Sunday when the 36-year-old Ulsterman earned himself a second straight opportunity to chat about his victory in the Masters. (  )",2026-04-20T11:18:45.298102,Golf Digest,https://ritholtz.com/2026/04/10-monday-am-reads-471/,2026-04-20T11:18:45.298103
3971614df778,"Be sure to check out our Masters in Business this week with  , co‑founder, chair & head of research/chief scientist at Capital Fund Management (CFM). The $20 billion firm specializes in managed future",https://en.wikipedia.org/wiki/Jean-Philippe_Bouchaud,,2026-04-20T11:18:45.298154,Philippe Bouchaud,https://ritholtz.com/2026/04/10-monday-am-reads-471/,2026-04-20T11:18:45.298156
6a94dcfa429d,"Be sure to check out our Masters in Business this week with Philippe Bouchaud , co‑founder, chair & head of research/chief scientist at  (CFM). The $20 billion firm specializes in managed futures. He ",https://www.cfm.com/,,2026-04-20T11:18:45.298204,Capital Fund Management,https://ritholtz.com/2026/04/10-monday-am-reads-471/,2026-04-20T11:18:45.298205
d68ee4d52b03,What does it cost the IRS to collect taxes? Source:,https://usafacts.org/articles/what-does-it-cost-the-irs-to-collect-taxes/,,2026-04-20T11:18:45.298250,USA Facts,https://ritholtz.com/2026/04/10-monday-am-reads-471/,2026-04-20T11:18:45.298251
