article_id,title,url,description,pub_date,author,source_post,scraped_at
ebe43b5e24d3,"The weekend is here! Pour yourself a mug of  coffee, grab a seat outside, and get ready for our longer-form weekend reads:",https://www.portorico.com/store/product75.html,,2026-04-05T10:29:48.865423,Danish Blend,https://ritholtz.com/2026/04/10-weekend-reads-85/,2026-04-05T10:29:48.865434
1555a8fe59f5,Maybe you should have bought an electric car,https://www.noahpinion.blog/p/maybe-you-should-have-bought-an-electric,We run the numbers on EVs versus gas cars in an era of skyrocketing oil prices. The Iran war has turned the EV skeptics’ math upside down. The Iran War is illustrating the cost of anti-EV nonsense. (  ),2026-04-05T10:29:48.865505,Noahpinion,https://ritholtz.com/2026/04/10-weekend-reads-85/,2026-04-05T10:29:48.865507
fe5427827873,How Apple became Apple: The definitive oral history of the company’s earliest days,https://www.fastcompany.com/91514404/apple-founding-50th-anniversary-apple-1-apple-ii-jobs-wozniak,"As Apple turns 50, the founders and early employees tell the story in their own words. The true story of how Steve Jobs, Steve Wozniak, and other bright young tech hobbyists of the 1970s joined forces to ignite a revolution. The mythology gets a reality check—and the reality is more interesting. (  ) see also From the Pages of PC Magazine: How We Covered Apple’s Greatest Hits and Misses : As Apple turns 50, we look back at the boldest (and most questionable) hardware to ever pass through the PC ",2026-04-05T10:29:48.865580,Fast Company,https://ritholtz.com/2026/04/10-weekend-reads-85/,2026-04-05T10:29:48.865583
b20676d9cd7b,Vanguard Investors Cleaned Up,https://www.morningstar.com/funds/vanguard-investors-cleaned-up,"’s data shows Vanguard fund holders outperformed nearly everyone else, again. Low costs and discipline beat cleverness every time. ( Morningstar )",2026-04-05T10:29:48.865709,Morningstar,https://ritholtz.com/2026/04/10-weekend-reads-85/,2026-04-05T10:29:48.865712
95f1bcd3fca2,Private capital,https://www.ft.com/content/214371b3-aad0-405d-88f3-28b371f4c776?syn-25a6b1a6=1,"what are the risks? The FT takes a hard look at private capital’s growing footprint and the systemic risks hiding behind the illiquidity premium. Blackstone’s scale makes this everyone’s problem. As investors seek to retrieve their money, the $22tn industry rejects comparisons with 2008. Regulators aren’t so sure. (  )",2026-04-05T10:29:48.865769,Financial Times,https://ritholtz.com/2026/04/10-weekend-reads-85/,2026-04-05T10:29:48.865771
6fa17684ac98,How American Camouflage Conquered the World,https://www.wired.com/camouflage-multicam-military-navy-seals-ice/,The story of how MultiCam went from a military contract to a global fashion statement. America’s soft power now comes in woodland pattern. The world-famous MultiCam pattern was designed for the military by two Brooklyn hipsters. Now everyone—from babies to ICE agents—is suited up for battle. (  ),2026-04-05T10:29:48.865826,Wired,https://ritholtz.com/2026/04/10-weekend-reads-85/,2026-04-05T10:29:48.865829
b0dae3e40976,Is the Smartphone Theory of Everything Wrong?,https://www.derekthompson.org/p/is-the-smartphone-theory-of-everything?publication_id=2880588&utm_campaign=email-post-title&r=21r0e&utm_medium=email,"challenges the popular idea that smartphones explain every social ill among young people. The data is more nuanced than the narrative. A Comprehensive Investigation. Many people believe that the nexus of smartphones, Internet, and social media is to blame for every modern catastrophe. Here’s 5,000 words on who’s right and who’s wrong. ( Derek Thompson )",2026-04-05T10:29:48.865885,Derek Thompson,https://ritholtz.com/2026/04/10-weekend-reads-85/,2026-04-05T10:29:48.865887
5c0ef0799b60,"When are bones no longer a person? A strange tale of King Cnut’s femur, ancient DNA, religious belief on bodies and souls, and a debate over what constitutes a person after death. A haunting philosoph",https://www.forkingpaths.co/p/when-are-bones-no-longer-a-person?publication_id=1184530&utm_campaign=email-post-title&r=3ayn6p&utm_medium=email,,2026-04-05T10:29:48.865947,The Garden of Forking Paths,https://ritholtz.com/2026/04/10-weekend-reads-85/,2026-04-05T10:29:48.865949
525af399183c,Iran’s Wealth Is Parked on London’s Billionaires’ Row : Years of Western sanctions haven’t prevented money flows out of Tehran,https://www.wsj.com/world/irans-wealth-is-parked-on-londons-billionaires-row-cb2022e4?mod=hp_lead_pos8,‘They probably learned from the Russian oligarchs’ (  ),2026-04-05T10:29:48.866011,Wall Street Journal,https://ritholtz.com/2026/04/10-weekend-reads-85/,2026-04-05T10:29:48.866013
19d6b93fb77e,"Everything With Trump’s Name, Likeness and Signature",https://www.nytimes.com/interactive/2026/03/28/us/politics/trump-signature-name-image.html,"As anyone who has ever seen his buildings knows, Donald Trump has always liked to see his name displayed prominently. It’s become a hallmark of his presidency, to the point that the Treasury Department announced on Thursday that President Trump’s signature will appear on U.S. dollars later this year, a first for a sitting U.S. president. (  )",2026-04-05T10:29:48.866071,New York Times,https://ritholtz.com/2026/04/10-weekend-reads-85/,2026-04-05T10:29:48.866074
7a1232d524a1,The Curious Case Of Sidd Finch,http://www.si.com/mlb/2014/10/15/curious-case-sidd-finch,"The greatest April Fools’ prank in sports journalism history—George Plimpton’s story of a Mets pitcher who could throw 168 mph. A perfect read for the day.He’s a pitcher, part yogi and part recluse. Impressively liberated from our opulent life-style, Sidd’s deciding about yoga—and his future in baseball. (  )",2026-04-05T10:29:48.866131,Sports Illustrated,https://ritholtz.com/2026/04/10-weekend-reads-85/,2026-04-05T10:29:48.866133
781ba0d4d147,"Be sure to check out our Masters in Business next week with  , founder and managing partner of Principal Venture Partners , an AI-focused investment firm established in 2024, and since 2025 a member o",https://www.songyeeyoon.org/,,2026-04-05T10:29:48.866190,Songyee Yoon,https://ritholtz.com/2026/04/10-weekend-reads-85/,2026-04-05T10:29:48.866192
