article_id,title,url,description,pub_date,author,source_post,scraped_at
4312337937e4,"Miami got NYC’s billionaires. Will it get their businesses? The fact is, high earners who were formerly geographically tethered to their companies can now work remotely. They are optimising their domi",https://www.ft.com/content/668b3c95-ad9e-484b-b57c-cbc8e3988127,,2026-05-15T11:53:08.222122,Financial Times,https://ritholtz.com/2026/05/10-friday-am-reads-498/,2026-05-15T11:53:08.222131
c0f6edd9129e,Repeat after me,https://klementoninvesting.substack.com/p/repeat-after-me-higher-minimum-wages,"Higher minimum wages are good for business .  Higher minimum wages seem to be beneficial for small businesses. Changes in employee retention rates after minimum wages increased. On average, existing employees were slightly more likely to stay longer at their employer if they got a higher wage. And that reduces costs for businesses in the medium term because every employee who leaves creates costs for hiring and training a new employee. The data has been clear for years; the politics catches up s",2026-05-15T11:53:08.222203,Klement On Investing,https://ritholtz.com/2026/05/10-friday-am-reads-498/,2026-05-15T11:53:08.222205
8a9d81466ebc,"How does Jane Street’s trading haul stack up against the hedge fund elite? We use some proprietary data, an iPhone calculator and a ton of assumptions to find out. The FT compares Jane Street’s revenu",https://www.ft.com/content/4ff0d771-8a40-4990-a624-23f080a9a6d6,,2026-05-15T11:53:08.222332,Financial Times,https://ritholtz.com/2026/05/10-friday-am-reads-498/,2026-05-15T11:53:08.222334
a458cabe03b0,FICO And Mortgages: Rent History Now Matters More Than Your Plastic,https://housingnotes.com/p/fico-and-mortgages-rent-history-now?publication_id=6762471&utm_campaign=email-post-title&r=21r0e&utm_medium=email,"Fannie Mae and Freddie Mac are starting to accept a newer credit score model that includes rental history. Jonathan Miller on the underwriting shift that finally credits renters for paying rent. Long overdue, modestly meaningful, and politically harder than it looks. (  )",2026-05-15T11:53:08.222417,Housing Notes,https://ritholtz.com/2026/05/10-friday-am-reads-498/,2026-05-15T11:53:08.222420
aa59595e4e26,The World Has Officially Reached Peak Bagel,https://www.wsj.com/arts-culture/food-cooking/the-world-has-officially-reached-peak-bagel-903c4c2e,"From Chicago to Berlin, bakers are reimagining the bagel—and honoring its roots. Here’s where to try the very best. Saturation in the boutique-bagel economy. Either we’ve hit the bagel cycle top or H&H is about to IPO. (  )",2026-05-15T11:53:08.222479,Wall Street Journal,https://ritholtz.com/2026/05/10-friday-am-reads-498/,2026-05-15T11:53:08.222480
74e346516cda,Jung’s Five Pillars of a Good Life,https://www.theatlantic.com/ideas/archive/2024/04/carl-jung-pillars-life-happiness/678009/,The great Swiss psychoanalyst left us a surprisingly practical guide to being happier. (  ),2026-05-15T11:53:08.222537,The Atlantic,https://ritholtz.com/2026/05/10-friday-am-reads-498/,2026-05-15T11:53:08.222538
a3d52f144f7f,America the Undammed,https://www.nytimes.com/2026/05/07/climate/america-the-undammed.html,Cara Buckley on the biggest dam removal project in U.S. history. Restoring rivers and salmon runs while quietly retiring infrastructure that was due for replacement anyway. More miles of the country’s rivers were reconnected last year thanks to dam removals than at any other time in history. (  ),2026-05-15T11:53:08.222593,New York Times,https://ritholtz.com/2026/05/10-friday-am-reads-498/,2026-05-15T11:53:08.222595
f903d4261e6f,Grievance Poisoning in the First Degree,https://www.hamiltonnolan.com/p/grievance-poisoning-in-the-first,"Nolan on the political economy of resentment — who cultivates it, who profits, and who pays. Is “I am so great” an actual philosophy? (  )",2026-05-15T11:53:08.222648,How Things Work,https://ritholtz.com/2026/05/10-friday-am-reads-498/,2026-05-15T11:53:08.222649
9b1baaff458b,Trump actually started to decouple America from China,https://www.noahpinion.blog/p/trump-actually-started-to-decouple,"The “economic divorce” between the two countries is proceeding slowly, but it is proceeding. Noah Smith on the tariff numbers that actually moved the bilateral trade balance. Whatever you think of the policy, the data is now legible. (  ) see also The Hippocratic Summit : On the choreography of the Trump-Xi meeting. Diplomatic theater as the only product the principals know how to make. ( The Atlantic ) see also Taiwan’s chips power the global economy. China holds the leverage : Big Tech’s relia",2026-05-15T11:53:08.222716,Noahpinion,https://ritholtz.com/2026/05/10-friday-am-reads-498/,2026-05-15T11:53:08.222718
082765551e58,Broadway Has a Problem: Audiences Won’t Stop Laughing,https://www.wsj.com/arts-culture/theater/broadway-has-a-problem-audiences-wont-stop-laughing-0b73a3cd,Theatergoers are howling like they’re at a comedy show—even during serious moments; ‘a shrill horrible laugh.’ (  ),2026-05-15T11:53:08.222887,Wall Street Journal,https://ritholtz.com/2026/05/10-friday-am-reads-498/,2026-05-15T11:53:08.222889
aa25215a7406,"Be sure to check out our Masters in Business this weekend with Sheila Bair , former Chairperson of FDIC from 2006-11. She helped steer the agency through worst financial crisis since the Great Depress",https://www.amazon.com/exec/obidos/ASIN/0807533513/thebigpictu09-20,,2026-05-15T11:53:08.222957,How Not to Lose a Million Dollars,https://ritholtz.com/2026/05/10-friday-am-reads-498/,2026-05-15T11:53:08.222959
e40c702867ea,Video of the day :,https://youtu.be/kEYUw2kiRfc?si=PlHTCA8dBMJBnb1m,,2026-05-15T11:53:08.223015,The HBO documentary on “Yacht Rock.” Is Bullsh*t,https://ritholtz.com/2026/05/10-friday-am-reads-498/,2026-05-15T11:53:08.223017
