article_id,title,url,description,pub_date,author,source_post,scraped_at
0f21cdd29e63,"The Worst Year to Retire Wasn’t 1929. The Creator of the 4% Retirement Rule Says It Was 1968 . William Bengen, who conceived the 4% rule for safe portfolio withdrawals, to calculate the worst time to ",https://www.barrons.com/articles/worst-year-to-retire-f1291615?mod=past_editions,,2026-04-29T11:28:35.693204,Barron’s,https://ritholtz.com/2026/04/10-wednesday-am-reads-369/,2026-04-29T11:28:35.693215
fc3e9cb1d7d4,"The government is meddling with earnings reporting — but Tesla, Amazon and other market superstars prove there’s no problem",https://www.marketwatch.com/story/the-sec-fears-were-trapped-in-short-term-thinking-tesla-and-amazon-prove-investors-play-the-long-game-4181fa55?st=My7n8g,Investors aren’t trapped in short-term thinking — but the SEC still wants semiannual earnings reporting. (  ),2026-04-29T11:28:35.693301,Marketwatch,https://ritholtz.com/2026/04/10-wednesday-am-reads-369/,2026-04-29T11:28:35.693304
05cf0ea0aed7,Robotaxis are the new millennial lifestyle subsidy,https://sherwood.news/tech/robotaxis-are-the-new-millennial-lifestyle-subsidy/,"Waymo and friends are torching investor cash so urban professionals can have nice things. The Uber playbook, redux — and someone always pays in the end. (  )",2026-04-29T11:28:35.693390,Sherwood,https://ritholtz.com/2026/04/10-wednesday-am-reads-369/,2026-04-29T11:28:35.693393
7c2c977f6e61,The Jevons Employment Effect From AI,https://www.apollo.com/wealth/the-daily-spark/the-jevons-employment-effect-from-ai,"’s Daily Spark applies the Jevons paradox to AI and labor — when technology makes work cheaper, you often get more of it, not less. A counterweight to the replacement narrative. That includes startups launched by recent college graduates, who can now compete with established firms on certain tasks. ( Apollo )",2026-04-29T11:28:35.693453,Apollo,https://ritholtz.com/2026/04/10-wednesday-am-reads-369/,2026-04-29T11:28:35.693455
c955a8af55a2,"Much ado about the 1974 ‘petrodollar’ deal . According to ominous scenarios disseminated in financial circles, social media and news organisations, the war may undo an arrangement initiated in a 1974 ",https://www.ft.com/content/a65efb54-306b-49ad-9920-40d59b195623,,2026-04-29T11:28:35.693527,Financial Times,https://ritholtz.com/2026/04/10-wednesday-am-reads-369/,2026-04-29T11:28:35.693529
134a3c99b123,The unflattering secrets revealed so far in Elon Musk’s latest legal feud,https://www.washingtonpost.com/technology/2026/04/23/musk-altman-lawsuit-trial-openai/?utm_campaign=wp_must_reads&utm_medium=email&utm_source=newsletter,The Musk-Altman court fight is generating exactly the sort of unflattering discovery that lawsuits between billionaires usually do. The receipts so far are unflattering for Musk in particular. (  ),2026-04-29T11:28:35.693590,Washington Post,https://ritholtz.com/2026/04/10-wednesday-am-reads-369/,2026-04-29T11:28:35.693592
b44d4c84afb0,It doesn’t matter how much you sit — walking more could lower your risk of death and disease,https://www.sciencedaily.com/releases/2026/04/260417085409.htm,New research suggests step count dominates sit-time as a mortality predictor. Moving more matters more than sitting less — get up and walk. (  ),2026-04-29T11:28:35.693649,Science Daily,https://ritholtz.com/2026/04/10-wednesday-am-reads-369/,2026-04-29T11:28:35.693651
cfa34388098c,"Ukraine’s killer robots show how war is changing . Droid TW 12.7 was  developed by Devdroid, a private tech company in Ukraine involved in the manufacture of military robotics. This robot is armed wit",https://theconversation.com/ukraines-killer-robots-show-how-war-is-changing-280936,,2026-04-29T11:28:35.693715,The Conversation,https://ritholtz.com/2026/04/10-wednesday-am-reads-369/,2026-04-29T11:28:35.693717
54ba90fe490c,"The Weird, Twisting Tale of How China Spied on Alysa Liu and Her Dad",https://www.wired.com/story/the-weird-twisting-tale-of-how-china-spied-on-alysa-liu-and-her-dad/,"Espionage, Olympic figure skating, and a dissident father — a story that reads like a thriller but happens to be entirely true. Years before the figure skater became an Olympic superstar, a Chinese operative tried to stalk her father and monitored other US residents deemed dissidents against China. And that’s just the beginning. (  )",2026-04-29T11:28:35.693773,Wired,https://ritholtz.com/2026/04/10-wednesday-am-reads-369/,2026-04-29T11:28:35.693775
9cd79f5db096,"For ‘The Devil Wears Prada 2’ Actor B.J. Novak, There Was Never a Plan B",https://www.wsj.com/real-estate/bj-novak-devil-wears-prada-2-726d1aba,"The ‘Office’ star on his pursuit of comedy, following in Conan O’Brien’s footsteps at Harvard and his friendship with Mindy Kaling. (  )",2026-04-29T11:28:35.693830,Wall Street Journal,https://ritholtz.com/2026/04/10-wednesday-am-reads-369/,2026-04-29T11:28:35.693832
aab57bc966f4,"Be sure to check out our Masters in Business  this weekend with David Gardner, cofounder of The Motley Fool in 1993 (with his brother Tom Gardner). Originally launched as a print investment newsletter",https://itunes.apple.com/us/podcast/masters-in-business/id730188152?mt=2,How to Pick the Best Stocks of the Future and Build Lasting Wealth .”,2026-04-29T11:28:35.693898,interview,https://ritholtz.com/2026/04/10-wednesday-am-reads-369/,2026-04-29T11:28:35.693900
20ac0c531d34,"Be sure to check out our Masters in Business interview this weekend with David Gardner, cofounder of The Motley Fool in 1993 (with his brother Tom Gardner). Originally launched as a print investment n",https://www.rulebreakerinvesting.com/,,2026-04-29T11:28:35.693961,Rule Breaker Investing: How to Pick the Best Stocks of the Future and Build Lasting Wealth,https://ritholtz.com/2026/04/10-wednesday-am-reads-369/,2026-04-29T11:28:35.693962
