article_id,title,url,description,pub_date,author,source_post,scraped_at
2772b296b4db,The stock market looks wild under the surface,https://www.axios.com/2026/03/16/ai-iran-war-stocks,"The S&P 500 appears relatively calm on the surface this year, but dig a little deeper and you’ll find some wild swings. Dispersion hiding beneath calm headline indices — sector rotations, factor volatility, and the growing divergence between what the S&P shows and what individual stocks are doing. Investors have retreated from the Big Tech names that carried the market in recent years, putting downward pressure on stocks. By the numbers: The S&P 500 has fallen just 3% for the year, but that mask",2026-03-18T10:46:55.480028,Axios,https://ritholtz.com/2026/03/10-wednesday-am-reads-365/,2026-03-18T10:46:55.480040
06272b01c1ee,The Biggest Active Stock Funds Picked the Right Stocks. They Still Lagged,https://www.morningstar.com/funds/biggest-active-stock-funds-picked-right-stocks-they-still-lagged,A hypothetical portfolio of the largest active US stock funds’ collective holdings would have beaten the funds themselves. (  ),2026-03-18T10:46:55.480118,Morningstar,https://ritholtz.com/2026/03/10-wednesday-am-reads-365/,2026-03-18T10:46:55.480121
831be71e142e,Who ate all the Chinese stock market returns? Long-term nominal GDP is the stuff earnings are made of. And emerging-market economies grow faster than developed ones. Put these two facts together and t,https://www.ft.com/content/b43184b1-5b14-4be7-9801-975089aec690,,2026-03-18T10:46:55.480193,Financial Times,https://ritholtz.com/2026/03/10-wednesday-am-reads-365/,2026-03-18T10:46:55.480195
33399bafb4d5,Inside a $42 Billion Private-Credit Black Box: More Black Boxes,https://www.wsj.com/finance/investing/inside-a-42-billion-private-credit-black-box-more-black-boxes-e2523e8e?reflink=article_copyURL_share&st=rc5W6T,Cliffwater fund’s opacity helps explain why it is facing redemptions. A deep look at how private credit vehicles are layering complexity on top of complexity — and what that opacity means for investors who can’t see what they own. (  ),2026-03-18T10:46:55.480253,Wall Street Journal,https://ritholtz.com/2026/03/10-wednesday-am-reads-365/,2026-03-18T10:46:55.480255
5ef4567a2d12,When the Best Retirement Is No Retirement at All,https://www.bloomberg.com/news/features/2026-03-17/why-more-people-over-60-are-choosing-not-to-retire,"The 60-plus crowd is hard at work, and it’s not (just) about the money.The emerging research and personal accounts behind why staying engaged in meaningful work — on your own terms — often produces better outcomes than full retirement. (  )",2026-03-18T10:46:55.480318,Businessweek,https://ritholtz.com/2026/03/10-wednesday-am-reads-365/,2026-03-18T10:46:55.480320
914dfb0e6b3e,Congress Weighs Axing FINRA. But Is SEC Ready to Pick Up the Slack?,https://www.thedailyupside.com/advisor/industry-news/congress-weighs-axing-finra-but-is-sec-ready-to-pick-up-the-slack/,The case for eliminating the broker-dealer self-regulator — and the serious capacity questions about whether the SEC could absorb the workload. (  ),2026-03-18T10:46:55.480377,The Daily Upside,https://ritholtz.com/2026/03/10-wednesday-am-reads-365/,2026-03-18T10:46:55.480379
72929134efe5,America’s Diminished Place In The World,https://www.techdirt.com/2026/03/16/americas-diminished-place-in-the-world-and-the-consequences-of-not-impeaching/,"Techdirt’s Mike Masnick on how failure to check executive overreach earlier created the conditions for the current collapse of American standing abroad. (  ) see also • The US Seems to Be Deliberately Weakening its Global Position : A careful argument that the pattern of damage to alliances, institutions, and credibility isn’t incompetence — it looks intentional. ( Phillip’s Newsletter )",2026-03-18T10:46:55.480438,TechDirt,https://ritholtz.com/2026/03/10-wednesday-am-reads-365/,2026-03-18T10:46:55.480440
8b135886b5bb,Florida Is Trying to Ignore Measles Until It Can’t,https://www.theatlantic.com/health/2026/03/florida-measles-response-silence/686359/,"Florida ranks third in measles cases and the state’s response has been conspicuous silence—a public health strategy best described as “pretend it isn’t happening.” Oh, and the state is in the midst of an outbreak. (  )",2026-03-18T10:46:55.480549,The Atlantic,https://ritholtz.com/2026/03/10-wednesday-am-reads-365/,2026-03-18T10:46:55.480551
22584e279419,Is MAGA in its cringe era? Trump 2.0 was supposed to be younger and cooler than what came before. The vibes have shifted. Signs that the cultural coalition holding Trumpism together may be fracturing ,https://www.washingtonpost.com/style/power/2026/03/17/maga-cringe-vibe-shift/,,2026-03-18T10:46:55.480610,Washington Post,https://ritholtz.com/2026/03/10-wednesday-am-reads-365/,2026-03-18T10:46:55.480612
e524716f9787,Ticketmaster’s Grip on Live Concerts Is Finally Starting to Break,https://slate.com/business/2026/03/ticketmaster-live-nation-justice-department-antitrust.html,Live Nation’s settlement with the Justice Department is a big step toward accountability—and cheaper ticket prices. (  ),2026-03-18T10:46:55.480670,Slate,https://ritholtz.com/2026/03/10-wednesday-am-reads-365/,2026-03-18T10:46:55.480672
23601f90a878,"Be sure to check out our Masters in Business  this weekend with Matt Cherwin, co-founder and Chief Investment Officer of Marek Capital . The alternative asset management firm launched in 2024. Previou",https://itunes.apple.com/us/podcast/masters-in-business/id730188152?mt=2,,2026-03-18T10:46:55.480730,interview,https://ritholtz.com/2026/03/10-wednesday-am-reads-365/,2026-03-18T10:46:55.480732
978db24b494b,"Be sure to check out our Masters in Business interview this weekend with Matt Cherwin, co-founder and Chief Investment Officer of  . The alternative asset management firm launched in 2024. Previously,",https://marekcapital.com/,,2026-03-18T10:46:55.480784,Marek Capital,https://ritholtz.com/2026/03/10-wednesday-am-reads-365/,2026-03-18T10:46:55.480786
