article_id,title,url,description,pub_date,author,source_post,scraped_at
ebe43b5e24d3,"The weekend is here! Pour yourself a mug of  coffee, grab a seat outside, and get ready for our longer-form weekend reads:",https://www.portorico.com/store/product75.html,,2026-07-19T05:52:49.501740,Danish Blend,https://ritholtz.com/2026/07/10-weekend-reads-100/,2026-07-19T05:52:49.501751
d87fb89374a4,"The American E.V. Has Been Crushed. Will It Take the U.S. Auto Industry With It? The largest U.S. automakers have backed away from electric vehicles, even as global sales are booming. The decision may",https://www.nytimes.com/2026/07/15/magazine/electric-cars-american-evs.html,,2026-07-19T05:52:49.501837,New York Times,https://ritholtz.com/2026/07/10-weekend-reads-100/,2026-07-19T05:52:49.501840
474018d4b818,AI is changing what we can do. Who we become is still our choice,https://humanistreview.ai/issue-1/appiah-ai-moral-character/,"To understand AI’s effect on moral character, ethicist Kwame Anthony Appiah goes back to John Stuart Mill, and the idea that people are shaped by their choices. (  ) see also AI isn’t destroying entry-level jobs. It’s changing them : Here are the ways leading companies are already responding to the AI revolution in professional services. ( Financial Times )",2026-07-19T05:52:49.501909,Humanist Review,https://ritholtz.com/2026/07/10-weekend-reads-100/,2026-07-19T05:52:49.501911
5825ec398f8f,From Hong Kong to Xiānggǎng,https://stephenroach.substack.com/p/from-hong-kong-to-xianggang,The Hong Kong of old is over. Go to Xiānggǎng and see for yourself. Stephen Roach on Hong Kong’s transformation into Xiānggǎng — the slow-motion absorption of a once-global city. (  ),2026-07-19T05:52:49.502025,Conflict Stephen Roach,https://ritholtz.com/2026/07/10-weekend-reads-100/,2026-07-19T05:52:49.502027
0305cadccaae,Shooting Starlink: The “no limits” partnership between Russia and China is taking aim at Elon Musk,https://theins.press/en/inv/294635,"Secret documents from a series of clandestine Russian-Chinese military forums reveal a joint plan to defeat Elon Musk’s Starlink and a weapons development partnership far deeper than either country will admit. From air- and missile-defense systems to AI-enhanced drone capabilities, cooperation between Moscow and Beijing is allowing Russian forces to keep pace with Ukrainian innovations while China gains the opportunity to test its wares under combat conditions. Although the threat of increased W",2026-07-19T05:52:49.502086,The Insider,https://ritholtz.com/2026/07/10-weekend-reads-100/,2026-07-19T05:52:49.502089
043871593786,What Even Is Ultraprocessed Food? It’s less a useful label and more of a vibe . One of the biggest boogeymen around these days is ultraprocessed food. You can see dozens if not hundreds of news articl,https://slate.com/technology/2026/07/ultraprocessed-food-fda-label-vibes.html,,2026-07-19T05:52:49.502153,Slate,https://ritholtz.com/2026/07/10-weekend-reads-100/,2026-07-19T05:52:49.502154
fc495b850256,The Lost Joy of Music Piracy,https://www.pigeonsandplanes.com/read/music-piracy-what-cd-oink-nine-inch-nails-streaming,"What.CD, Oink, and the banalities of streaming . As an avid pirate suddenly finding himself in the midst of the music business, Sheridan saw the issue from a different angle than most of the suits he was surrounded by. “I got brought in and we were being flown to New York, the label was taking us out to these expensive dinners and paying for everything—top notch hotels, everyone had private cars and drivers. There was so much money going around, and it wasn’t the artists who were rolling in cash",2026-07-19T05:52:49.502214,Pigeons & Planes,https://ritholtz.com/2026/07/10-weekend-reads-100/,2026-07-19T05:52:49.502216
bc8f8d89f41b,What will be left for us to work on? A thoughtful essay on the shrinking frontier of human-only work as AI capabilities expand. The question isn’t whether machines will take jobs — it’s whether the jo,https://www.normaltech.ai/p/what-will-be-left-for-us-to-work,,2026-07-19T05:52:49.502279,AI As Normal Technology,https://ritholtz.com/2026/07/10-weekend-reads-100/,2026-07-19T05:52:49.502281
7146f8752c6c,Winners of the International Aerial Photographer of the Year,https://www.theatlantic.com/photography/2026/07/winners-international-aerial-photographer-year/687899/,"Stunning images from above — the kind of photography that makes you reconsider what the world actually looks like when you’re not standing on it. A collection of winners and selected images from the competition’s “Top 101” grouping, chosen from more than 1,500 entries by professional and amateur aerial photographers around the world (  )",2026-07-19T05:52:49.502340,The Atlantic,https://ritholtz.com/2026/07/10-weekend-reads-100/,2026-07-19T05:52:49.502342
af803f2d0679,The 25 most influential works of American culture,https://www.washingtonpost.com/style/interactive/2026/07/15/25-most-influential-works-american-culture/?itid=gfta&pwapi_token=eyJ0eXAiOiJKV1QiLCJhbGciOiJIUzI1NiJ9.eyJyZWFzb24iOiJnaWZ0IiwibmJmIjoxNzg0MDg4MDAwLCJpc3MiOiJzdWJzY3JpcHRpb25zIiwiZXhwIjoxNzg1NDcwMzk5LCJpYXQiOjE3ODQwODgwMDAsImp0aSI6IjI5YTliYjNiLWI3N2QtNGQ0ZS1hNDBlLWRmZjNmN2I5ZDFmMyIsInVybCI6Imh0dHBzOi8vd3d3Lndhc2hpbmd0b25wb3N0LmNvbS9zdHlsZS9pbnRlcmFjdGl2ZS8yMDI2LzA3LzE1LzI1LW1vc3QtaW5mbHVlbnRpYWwtd29ya3MtYW1lcmljYW4tY3VsdHVyZS8ifQ.VEzFnkd-aIXQUDclp9MeBKC3n-crbJIlbfMuQnUxs4U&utm_medium=website&utm_source=nextdraft,"A decade-by-decade look at the books, music, art and ideas that shaped society. The ’s interactive ranking — across music, literature, film, TV, and art. The list will start arguments, which is the point. ( Washington Post )",2026-07-19T05:52:49.502399,Washington Post,https://ritholtz.com/2026/07/10-weekend-reads-100/,2026-07-19T05:52:49.502401
42ac6df860e7,"The bitter history of England vs Argentina, a World Cup semi-final steeped in bad blood",https://www.nytimes.com/athletic/7445802/2026/07/15/england-argentina-world-cup-highlights-history/,"Maradona’s Hand of God, Beckham’s red card, the Falklands — every England-Argentina match carries the weight of decades of grudge.  previews the latest chapter. ( The Athletic )",2026-07-19T05:52:49.502454,The Athletic,https://ritholtz.com/2026/07/10-weekend-reads-100/,2026-07-19T05:52:49.502456
d3ba676077d4,Video of the day :,https://youtu.be/vEb1boevBt4?si=jBkfj9of5y2S61SI,,2026-07-19T05:52:49.502508,Does Anyone Know the Real Mick Jagger? He’s Not So Sure,https://ritholtz.com/2026/07/10-weekend-reads-100/,2026-07-19T05:52:49.502510
