article_id,title,url,description,pub_date,author,source_post,scraped_at
1bb6db096edd,Real-Estate Agents Are Quitting the Slow Housing Market,https://www.wsj.com/real-estate/real-estate-agents-are-quitting-the-slow-housing-market-d95fc524,"Four years into a struggling market, even agents who survived the initial shakeout are hitting their breaking point. Fewer sales, longer timelines, second jobs. (  )",2026-06-03T14:26:13.372665,Wall Street Journal,https://ritholtz.com/2026/06/10-wednesday-am-reads-374/,2026-06-03T14:26:13.372677
5fd1e592ab3f,"No, Market Highs Are Not a Bad Sign",https://ritholtz.com/2014/03/market-highs-are-not-bad/,"The old Ritholtz classic, still relevant—the data on what happens after all-time highs is the opposite of what most people assume. (  ) see also New All-Time Highs : Since 1950, roughly 7% of all trading days have been new all-time highs. The highest percentage of trading days hitting new highs in a decade is the 1990s at 12.3%. This decade is far from over but we’ve experienced new highs in the S&P 500 in 13% of trading days. ( Wealth of Common Sense )",2026-06-03T14:26:13.372748,The Big Picture,https://ritholtz.com/2026/06/10-wednesday-am-reads-374/,2026-06-03T14:26:13.372750
a0773a4986f2,The Great Wealth Transfer Includes $570 Billion in Classic Cars,https://www.bloomberg.com/news/features/2026-05-30/classic-car-wealth-transfer-boomers-570-billion/,Boomers are about to hand off a staggering collection of vintage automobiles. The question is whether anyone under 60 wants them—and what happens to prices when supply floods the market. (  ),2026-06-03T14:26:13.372866,Bloomberg,https://ritholtz.com/2026/06/10-wednesday-am-reads-374/,2026-06-03T14:26:13.372868
1c914ac08e39,Best ETFs 2026: The  Award for Investing Excellence Winners,https://www.morningstar.com/funds/best-etfs-2026-morningstar-award-winners,"Morningstar’s annual ETF honors—the funds that earned top marks for performance, cost efficiency, and risk-adjusted returns. ( Morningstar )",2026-06-03T14:26:13.372926,Morningstar,https://ritholtz.com/2026/06/10-wednesday-am-reads-374/,2026-06-03T14:26:13.372928
4b6b6b9aa880,Grocery Shoppers Are In For a Summer of Pain,https://www.bloomberg.com/news/articles/2026-05-29/expect-even-higher-grocery-prices-thanks-to-iran-war-costs,"The Iran war is driving up food costs, and the tariff aftershocks aren’t helping. Expect higher prices at the register through the fall. (  )",2026-06-03T14:26:13.372983,Bloomberg,https://ritholtz.com/2026/06/10-wednesday-am-reads-374/,2026-06-03T14:26:13.372985
b8fcf1fbeb18,America’s Favorite Comedian Wants to Be the Next Walt Disney—and He’s Not Joking,https://www.wsj.com/arts-culture/film/nate-bargatze-the-breadwinner-nateland-d811ec04,"Nate Bargatze, the country’s top selling stand-up comic, has a grand ambition: a $350 million theme park in Nashville, Tenn. (  )",2026-06-03T14:26:13.373050,Wall Street Journal,https://ritholtz.com/2026/06/10-wednesday-am-reads-374/,2026-06-03T14:26:13.373053
93240114b176,If You Take the Weasel Job Then You Must Be the Weasel,https://www.hamiltonnolan.com/p/if-you-take-the-weasel-job-then-you,"on the moral clarity of job titles—if you accept a role that requires you to do terrible things, you don’t get to pretend you’re not the one doing them. ( Hamilton Nolan )",2026-06-03T14:26:13.373154,Hamilton Nolan,https://ritholtz.com/2026/06/10-wednesday-am-reads-374/,2026-06-03T14:26:13.373157
584d0743d0ea,"I Want It, But I Don’t Like It",https://www.panoptica.com/i-want-it-but-i-dont-like-it/,"A sharp essay on the gap between desire and enjoyment—why we keep pursuing things that don’t actually make us happy, and what that says about modern consumer psychology. (  )",2026-06-03T14:26:13.373229,Panoptica,https://ritholtz.com/2026/06/10-wednesday-am-reads-374/,2026-06-03T14:26:13.373232
476f8b4405f0,Jimmy Kimmel ‘Felt Defeated’ by Stephen Colbert’s Cancellation and Says Late-Night TV Is Not ‘Dying of Natural Causes’,https://variety.com/2026/tv/news/jimmy-kimmel-late-night-poisoned-colbert-cancellation-1236763841/,"‘We’re Being Poisoned’ The “Jimmy Kimmel Live!” host opened up in a new interview with Vulture about the future of the genre following the cancellation of Stephen Colbert‘s “Late Show” on CBS and his own run-ins with Trump, including his suspension following comments made about the death of Charlie Kirk.  (  )",2026-06-03T14:26:13.373294,Variety,https://ritholtz.com/2026/06/10-wednesday-am-reads-374/,2026-06-03T14:26:13.373296
7f63dc4d7e41,Knicks-Spurs NBA Finals mega-preview,https://www.nytimes.com/athletic/7318196/2026/05/30/knicks-spurs-nba-finals-2026-preview-predictions/,"Game 1 tips off June 3 in San Antonio. ’s comprehensive breakdown—predictions, odds, matchups, and everything else you need before the series starts. ( The Athletic )",2026-06-03T14:26:13.373355,The Athletic,https://ritholtz.com/2026/06/10-wednesday-am-reads-374/,2026-06-03T14:26:13.373357
d26ac3009f82,Video of the day :,https://youtu.be/6LkMI6uvqZY?si=oG9DF4ERMhOzP-wE,,2026-06-03T14:26:13.373417,How a Secretive Trading Empire Is Taking Over Wall Street,https://ritholtz.com/2026/06/10-wednesday-am-reads-374/,2026-06-03T14:26:13.373419
511f594a8ff0,"Be sure to check out our special Masters in Business this week, Remembering Jonathan Clements with Bill Bernstein and Jason Zweig. The two recall Clements’ impact on the investor community; they discu",https://www.amazon.com/exec/obidos/ASIN/1804093750/thebigpictu09-20,,2026-06-03T14:26:13.373481,Money and Me,https://ritholtz.com/2026/06/10-wednesday-am-reads-374/,2026-06-03T14:26:13.373483
