article_id,title,url,description,pub_date,author,source_post,scraped_at
4a1e0618be63,Sell in May and Go Away? Not This Year. The S&P 500 Just Had Its Best Month Since 2020. Don’t let sell in May’ spook you. Stocks have been on a tear. The Dow Jones Industrial Average DJIA -0.31% has r,https://www.barrons.com/articles/s-p-500-best-month-since-2020-bef67ba3,,2026-05-04T11:47:13.270588,Barron’s,https://ritholtz.com/2026/05/10-monday-am-reads-473/,2026-05-04T11:47:13.270599
61c929048e1e,"More Americans Are Millionaires, But They Don’t Feel Rich",https://www.washingtonpost.com/business/2026/04/13/more-american-millionaires-than-ever/,"About 1 in 6 households nationwide has a net worth above $1 million, and, because the occasional billionaire tilts the scale, the average American family has passed that seven-figure benchmark. The disconnect between wealth on paper and felt affluence keeps widening. Says a lot about asset-price inflation, lifestyle creep, and sentiment. (  ) see also The Mathematical Reason Most People Never “Make It” : The uncomfortable truth about effort, outcome, and the math that connects them all. ( The Wr",2026-05-04T11:47:13.270679,Washington Post,https://ritholtz.com/2026/05/10-monday-am-reads-473/,2026-05-04T11:47:13.270681
c74a8e297a97,"So, About That AI Bubble",https://www.theatlantic.com/economy/2026/05/ai-bubble-revenue-anthropic/687022/,"The capex math behind the AI buildout is starting to wobble even at the leaders. Thanks to the rise of Claude Code and other AI agents, revenues are finally catching up to the hype. (  )",2026-05-04T11:47:13.270803,The Atlantic,https://ritholtz.com/2026/05/10-monday-am-reads-473/,2026-05-04T11:47:13.270806
8435a36d950e,You Have No Idea How Much You Still Use BlackBerry,https://www.wsj.com/tech/blackberry-qnx-software-cars-bf2a2280?mod=panda_wsj_author_alert,"Once left for dead, the company is making money again with hidden software in 275 million cars. You use it every day without knowing it. (  )",2026-05-04T11:47:13.270870,Wall Street Journal,https://ritholtz.com/2026/05/10-monday-am-reads-473/,2026-05-04T11:47:13.270872
08cf3a84c34d,Surging HOA Fees Are Pushing Homeowners to the Brink,https://www.wsj.com/economy/housing/housing-affordability-hoa-fees-d02902af,The hidden second mortgage no one underwrites for: HOA fees climbing faster than wages and faster than insurance premiums. Affordability has many tentacles. Monthly costs of homeowners associations have jumped 26% since 2019; owners can also be hit with special fees for large repairs (  ),2026-05-04T11:47:13.270931,Wall Street Journal,https://ritholtz.com/2026/05/10-monday-am-reads-473/,2026-05-04T11:47:13.270933
b5fdca3c4141,The particles in the early Universe painted a different picture,https://startswithabang.substack.com/p/the-particles-in-the-early-universe?isFreemail=true&post_id=195902396&publication_id=3253406&r=9qf5o&triedRedirect=true&utm_campaign=email-post-title&utm_medium=email&utm_source=post-email-title,"Cosmology done patiently. Ethan Siegel walks through what the cosmic baby pictures actually reveal about matter, antimatter, and why we ended up here at all. Today, we have the Standard Model of particles with four fundamental forces governing them. But things weren’t always the way they are now. (  )",2026-05-04T11:47:13.270998,Starts With A Bang,https://ritholtz.com/2026/05/10-monday-am-reads-473/,2026-05-04T11:47:13.271000
741230cd7085,Stephen Colbert Gets Ready to Hang It Up,https://www.nytimes.com/2026/04/28/business/media/stephen-colbert-late-night-show.html,"The Late Show host walks toward the exit. Late-night TV’s slow-motion collapse continues, one host at a time. (  ) see also How a Deep State Bureaucrat Became Trump’s ‘Fake News’ Enforcer : Brendan Carr is pointing his MAGA flamethrower at Jimmy Kimmel, Stephen Colbert and the American news media ( Businessweek )",2026-05-04T11:47:13.271061,New York Times,https://ritholtz.com/2026/05/10-monday-am-reads-473/,2026-05-04T11:47:13.271063
de2016261899,"Inside the Enhanced Games, Where Athletes Compete on Steroids. And Growth Hormones. And Adderall",https://www.vanityfair.com/news/story/inside-the-enhanced-games,"goes inside the doping-by-design Olympics. The future of sports may be more pharmacology than physiology — and the spectators don’t seem to mind. Most drugs are banned in the world of elite sports, but not here. In this competition—backed by Peter Thiel, Donald Trump Jr., and Saudi royalty—the athletes are guinea pigs. And if those backers have their way, you’re next. ( Vanity Fair )",2026-05-04T11:47:13.271176,Vanity Fair,https://ritholtz.com/2026/05/10-monday-am-reads-473/,2026-05-04T11:47:13.271179
edef6e937a0d,"Be sure to check out our Masters in Business this weekend with  , CEO and Chairman of iCapital , The firm is a fintech platform built to be the OS for alternative investments and complex products for ",https://icapital.com/about-us/lawrence-calcano/,,2026-05-04T11:47:13.271273,Lawrence Calcano,https://ritholtz.com/2026/05/10-monday-am-reads-473/,2026-05-04T11:47:13.271275
95cbdc1150d0,"Be sure to check out our Masters in Business this weekend with Lawrence Calcano , CEO and Chairman of  , The firm is a fintech platform built to be the OS for alternative investments and complex produ",https://icapital.com/,,2026-05-04T11:47:13.271342,iCapital,https://ritholtz.com/2026/05/10-monday-am-reads-473/,2026-05-04T11:47:13.271344
11c23e94788f,More than half of all Polymarket “long shot” bets on military action pay off Source:,https://arstechnica.com/tech-policy/2026/04/more-than-half-of-all-long-shot-bets-on-polymarket-pay-off/,,2026-05-04T11:47:13.271406,Ars Technica,https://ritholtz.com/2026/05/10-monday-am-reads-473/,2026-05-04T11:47:13.271408
1d19740c1212,Untitled,https://mailchi.mp/005fb77d75b9/ritholtzreads,,2026-05-04T11:47:13.271460,Sign up for our reads-only mailing list here,https://ritholtz.com/2026/05/10-monday-am-reads-473/,2026-05-04T11:47:13.271461
