article_id,title,url,description,pub_date,author,source_post,scraped_at
45925bb590aa,Wall Street Traders Are Having Their Best Year Ever,https://www.wsj.com/finance/banking/wall-street-traders-are-having-their-best-year-ever-a80f02ff?mod=hp_lead_pos3,"JPMorgan, Goldman and other big banks are raking in trading revenue this year as “the market is clearly extremely risk-on.” (  )",2026-07-18T05:25:55.583048,Wall Street Journal,https://ritholtz.com/2026/07/10-friday-am-reads-507/,2026-07-18T05:25:55.583062
9b2116d1a1c1,"Robotaxi Riders Are Falling Asleep, Sparking Frantic 911 Calls",https://www.bloomberg.com/news/features/2026-07-14/robotaxi-riders-spill-food-fall-asleep-give-birth-in-cars?accessToken=eyJhbGciOiJIUzI1NiIsInR5cCI6IkpXVCJ9.eyJzb3VyY2UiOiJTdWJzY3JpYmVyR2lmdGVkQXJ0aWNsZSIsImlhdCI6MTc4NDAzNjgxMSwiZXhwIjoxNzg0NjQxNjExLCJhcnRpY2xlSWQiOiJUSTVSUUtLSVVQU0YwMCIsImJjb25uZWN0SWQiOiJGNDJDMzlEM0JBNjY0NkQ0ODdDNTI0NzM1QjQ2OTExMyJ9.OKmV3a7fwmMednkHuzzfWBMiDn9G5qtcjIxswxirgNY&utm_source=nextdraft&utm_medium=website,"Passengers are also spilling food, getting sick and, in at least two instances, giving birth in self-driving vehicles. (  free ) see also Popular Cars to Avoid and What to Buy Instead : Skip high-selling models with low scores or reliability ratings and consider these winners instead. Consumer Reports’ annual name-and-shame list — the best-selling models that score poorly on reliability, safety, or owner satisfaction, plus what to buy instead. ( Consumer Reports )",2026-07-18T05:25:55.583126,Bloomberg,https://ritholtz.com/2026/07/10-friday-am-reads-507/,2026-07-18T05:25:55.583127
d0cfb79cd241,From spicy claypot chicken to ‘digitally enabled technology infrastructure player’,https://www.ft.com/content/fa50d922-87e1-4e00-8f11-d37bfec56468,"Back in 2017, a tiny US-listed drinks company called Long Island Iced Tea suddenly announced that it would henceforth be known as Long Blockchain Company and promptly jumped as much as 500 per cent.  It ended pretty much as you’d expect. Even the Nasdaq was shamed into taking action, delisting the company from its exchange. The SEC then got involved, and today the company is no more. Did doubt for even a minute t hat this would end in any other way?! (  )",2026-07-18T05:25:55.583236,Financial Times,https://ritholtz.com/2026/07/10-friday-am-reads-507/,2026-07-18T05:25:55.583238
b4e84ef0598b,Generative AI Is an Engineering Disaster,https://www.theatlantic.com/technology/2026/07/generative-ai-engineering-disaster/687901/,A shockingly inefficient trillion-dollar project. (  ),2026-07-18T05:25:55.583285,The Atlantic,https://ritholtz.com/2026/07/10-friday-am-reads-507/,2026-07-18T05:25:55.583287
5d16aba3e939,The Misinformation Gap: The Psychologist Who Defined the Dunning-Kruger Effect Says You’re Probably Using It Wrong,https://www.zmescience.com/other/interviews/the-psychologist-who-defined-the-dunning-kruger-effect-says-youre-probably-using-it-wrong/,"Dunning, co-discoverer of the Dunning-Kruger effect, investigates the misinformation gap built into our brains: We don’t know what we don’t know. (  ) see also Too Many Books? Mendel Uminer faced a crisis when his landlord objected to the 10,000 volumes in his New York studio apartment. ( New York Times )",2026-07-18T05:25:55.583340,ZME Science,https://ritholtz.com/2026/07/10-friday-am-reads-507/,2026-07-18T05:25:55.583341
d406a79fe6af,The solarisation of Pakistan’s energy economy,https://ember-energy.org/latest-insights/the-solarisation-of-pakistans-energy-economy,"Distributed solar is driving up electricity demand, bringing huge social and economic benefits. (  )",2026-07-18T05:25:55.583441,Ember,https://ritholtz.com/2026/07/10-friday-am-reads-507/,2026-07-18T05:25:55.583442
2ce9480d4d32,What are the cool kids doing in NYC this summer? Ditching their phones. Pervasive techno-pessimism has sparked a burgeoning analog movement and offline “Summer of Ludd” festival. (  ),https://www.washingtonpost.com/style/trends/2026/06/22/activists-launch-irl-push-tech-free-summer/,,2026-07-18T05:25:55.583489,Washington Post,https://ritholtz.com/2026/07/10-friday-am-reads-507/,2026-07-18T05:25:55.583490
ab4a95b5e733,"Why Is Digital Freedom Making Us Exhausted and Sad? From “The Burnout Society” to “The Tonality of Thought,” tech philosopher Byung-Chul Han’s ultra-short books reveal why online liberation has felt m",https://www.thenewatlantis.com/publications/byung-chul-han-what-happened-to-freedom,"Once you learn what the “uni-context” is, you won’t stop seeing it everywhere. ( Derek Thompson )",2026-07-18T05:25:55.583543,The New Atlantis,https://ritholtz.com/2026/07/10-friday-am-reads-507/,2026-07-18T05:25:55.583544
6790f1994e1c,"Why Is Digital Freedom Making Us Exhausted and Sad? From “The Burnout Society” to “The Tonality of Thought,” tech philosopher Byung-Chul Han’s ultra-short books reveal why online liberation has felt m",https://www.derekthompson.org/p/a-philosophers-one-word-theory-to,"Once you learn what the “uni-context” is, you won’t stop seeing it everywhere. (  )",2026-07-18T05:25:55.583608,Derek Thompson,https://ritholtz.com/2026/07/10-friday-am-reads-507/,2026-07-18T05:25:55.583610
d9ae0bec100b,Video of the day :,https://youtu.be/3CQ4UqAUy3Q?si=1KdeGUcpUk0FQ5vg,,2026-07-18T05:25:55.583655,Why Twitter became such a disaster,https://ritholtz.com/2026/07/10-friday-am-reads-507/,2026-07-18T05:25:55.583656
c14fc255e289,"Be sure to check out our Masters in Business this weekend with  , founder and CEO of Altruist , a modern custodian built as a clean sheet from the ground up, fully integrated with artificial intellige",https://www.jasonwenk.com/about,,2026-07-18T05:25:55.583705,Jason Wenk,https://ritholtz.com/2026/07/10-friday-am-reads-507/,2026-07-18T05:25:55.583706
4bd6efc317b2,"Be sure to check out our Masters in Business this weekend with Jason Wenk , founder and CEO of  , a modern custodian built as a clean sheet from the ground up, fully integrated with artificial intelli",https://altruist.com/try/talk-to-us/?utm_term=altruist&utm_campaign=Google_Altruist_Search_Brand_BOF_Keyword_USA_Brand_Contact&utm_content=808456056889&utm_medium=paid_search&utm_source=google&hsa_acc=7789974896&hsa_cam=23458830612&hsa_grp=192574811518&hsa_ad=808456056889&hsa_src=g&hsa_tgt=kwd-301161003818&hsa_kw=altruist&hsa_mt=e&hsa_net=adwords&hsa_ver=3&gad_source=1&gad_campaignid=23458830612&gbraid=0AAAAAC4hkZFhTweekFFAq2CIaRCXaP4Or&gclid=CjwKCAjw08fSBhA7EiwAfbQTsBOul8qWF59t5_GwKtt3F30fqQJ6pHkQjpHnRvoFtaza7M215LWDfRoCqSAQAvD_BwE,,2026-07-18T05:25:55.583754,Altruist,https://ritholtz.com/2026/07/10-friday-am-reads-507/,2026-07-18T05:25:55.583755
