article_id,title,url,description,pub_date,author,source_post,scraped_at
f6fcfb1cf39c,Bond Traders No Longer Price In Any Chance of Fed Cut in 2026,https://www.bloomberg.com/news/articles/2026-03-19/bond-traders-no-longer-price-in-any-chance-of-fed-cut-in-2026,"Bond traders are no longer pricing in any chance that the Federal Reserve will cut interest rates this year after the Bank of England stoked concern that global central banks may need to act soon against inflation. Yields in Europe and the US climbed across maturities, with those on two-year US Treasuries — which are especially sensitive to expectations for Fed policy — higher by 11 basis points to 3.89%. (  ) see also Demand destruction has begun : The ominous headline comes from JPMorgan’s tea",2026-03-21T10:22:58.673142,Bloomberg,https://ritholtz.com/2026/03/10-friday-am-reads-491/,2026-03-21T10:22:58.673152
811aa97d7384,Trump Wants Powell Out. Powell Is Digging In . Fed chair Jerome Powell says he will stay on the board until DOJ probe ends—and maybe longer. (  ),https://www.wsj.com/economy/central-banking/trump-wants-powell-out-powell-is-digging-in-43829d43?mod=hp_lead_pos4,,2026-03-21T10:22:58.673284,Wall Street Journal,https://ritholtz.com/2026/03/10-friday-am-reads-491/,2026-03-21T10:22:58.673287
182055640cb1,Concierge Nation,https://www.ft.com/content/cd4e94ec-ed2b-4148-941e-829a7bfab298,"Welcome to White-Glove America: The growing bifurcation of the American experience—pay enough and you can skip every line, access every service, while everyone else waits. Two-tier citizenship with a smile. (  )",2026-03-21T10:22:58.673351,Financial Times,https://ritholtz.com/2026/03/10-friday-am-reads-491/,2026-03-21T10:22:58.673354
596763359a54,Cuba Is Going Dark,https://www.nytimes.com/interactive/2026/03/19/world/americas/cuba-blackout-electricity.html,"Cuba is facing what may be its worst electricity crisis since Fidel Castro’s revolutionaries swept to power 67 years ago. Following weeks of frequent blackouts, the national grid suffered a “complete disconnection” on Monday, according to the energy ministry. Blackouts are getting worse, and on some days the entire island is plunged into near total darkness. (  )",2026-03-21T10:22:58.673414,New York Times,https://ritholtz.com/2026/03/10-friday-am-reads-491/,2026-03-21T10:22:58.673416
7559d813c764,Meet the Lobbyist Next Door,https://www.wired.com/story/meet-the-lobbyist-next-door/,"What do a Real Housewife, an Olympic athlete, and a doula have in common? They’re all being paid by an ad-tech startup as influencers—peddling not products but ideologies. Grassroots lobbying has gone professional, and your neighbor might be a paid advocate without you knowing it. The line between activism and astroturfing keeps blurring. (  )",2026-03-21T10:22:58.673483,Wired,https://ritholtz.com/2026/03/10-friday-am-reads-491/,2026-03-21T10:22:58.673488
9891d25bd036,Anti-Semitism Is Becoming Mainstream,https://www.theatlantic.com/ideas/2026/03/michigan-synagogue-attack/686366/,The Michigan synagogue attack is a grim data point in a trend that should alarm everyone—anti-Jewish violence is escalating and moving from the fringes to the mainstream.  (  ),2026-03-21T10:22:58.673546,The Atlantic,https://ritholtz.com/2026/03/10-friday-am-reads-491/,2026-03-21T10:22:58.673548
c425ab71ff5c,"Trump is bombing the global economy: An inflationary downturn looms . Donald Trump just TACO’d again, did he? Mere days after insisting he would accept nothing less than “unconditional surrender” from",https://unherd.com/2026/03/trump-is-bombing-the-global-economy/,A blistering assessment of how Gulf War Three is going—spoiler: not well—and the gap between triumphalist rhetoric and ground reality. Gulf War Three is not going well for the United States. ( Drezner’s World ),2026-03-21T10:22:58.673622,UnHerd,https://ritholtz.com/2026/03/10-friday-am-reads-491/,2026-03-21T10:22:58.673624
2db2bf3b59f3,"Trump is bombing the global economy: An inflationary downturn looms . Donald Trump just TACO’d again, did he? Mere days after insisting he would accept nothing less than “unconditional surrender” from",https://danieldrezner.substack.com/p/im-sick-and-tired-of-all-the-winning,A blistering assessment of how Gulf War Three is going—spoiler: not well—and the gap between triumphalist rhetoric and ground reality. Gulf War Three is not going well for the United States. (  ),2026-03-21T10:22:58.673688,Drezner’s World,https://ritholtz.com/2026/03/10-friday-am-reads-491/,2026-03-21T10:22:58.673689
861b5afda1f7,"How Did Flea Make a Jazz Album? Practice, Practice, Practice . The Red Hot Chili Peppers bassist returned to the trumpet, for a new record featuring Nick Cave, Thom Yorke and a core cast of contempora",https://www.nytimes.com/2026/03/19/arts/music/flea-honora-jazz-album.html,,2026-03-21T10:22:58.673767,New York Times,https://ritholtz.com/2026/03/10-friday-am-reads-491/,2026-03-21T10:22:58.673770
f8f1fe3d99b5,"Be sure to check out our Masters in Business  this weekend with Bill Miller IV, Chief Investment Officer and Portfolio Manager at Miller Value Fund . Previously, he was at Legg Mason Capital Managemen",https://itunes.apple.com/us/podcast/masters-in-business/id730188152?mt=2,,2026-03-21T10:22:58.673829,interview,https://ritholtz.com/2026/03/10-friday-am-reads-491/,2026-03-21T10:22:58.673831
febbc59d09c0,"Be sure to check out our Masters in Business interview this weekend with Bill Miller IV, Chief Investment Officer and Portfolio Manager at  . Previously, he was at Legg Mason Capital Management coveri",https://millervaluefunds.com/,,2026-03-21T10:22:58.673884,Miller Value Fund,https://ritholtz.com/2026/03/10-friday-am-reads-491/,2026-03-21T10:22:58.673886
d632d4cb1248,The rising prices of oil and gasoline after the start of Iran war Source:,https://www.reddit.com/r/dataisbeautiful/comments/1rrsyvz/oc_the_rising_prices_of_oil_and_gasoline_after/,,2026-03-21T10:22:58.673943,Reddit,https://ritholtz.com/2026/03/10-friday-am-reads-491/,2026-03-21T10:22:58.673945
