article_id,title,url,description,pub_date,author,source_post,scraped_at
6137453bb19d,The impact of the AI capex boom on S&P 500 return on equity,https://www.gspublishing.com/content/research/en/reports/2026/06/12/50f004d3-b246-4366-9d7d-0bc7e845644b.pdf,"Record profitability has been one of the factors supporting high S&P 500 valuations. S&P 500 ROE has surged by 150 bp during the past four quarters, driven by a boost from the mega-cap technology stocks to index profit margins. The AI capex boom has lifted semiconductor profitability but will be an increasing headwind to mega-cap tech ROE going forward. AI also creates a key long-term upside case for ROE, both for the mega-cap tech stocks and for the broad equity market. Goldman’s strategy team ",2026-06-23T06:53:31.881492,Goldman Sachs,https://ritholtz.com/2026/06/10-monday-am-reads-481/,2026-06-23T06:53:31.881503
62a76bcf3ce3,"Donald Trump, Champion of Renewable Energy :  California — which would be the world’s 4th largest economy if it were a country — gets more than half of its electricity from renewables. It is rapidly b",https://paulkrugman.substack.com/p/donald-trump-champion-of-renewable,,2026-06-23T06:53:31.881576,Paul Krugman,https://ritholtz.com/2026/06/10-monday-am-reads-481/,2026-06-23T06:53:31.881579
cbf370de3b28,Real-Estate Agents Are Quitting the Slow Housing Market,https://www.wsj.com/real-estate/real-estate-agents-are-quitting-the-slow-housing-market-d95fc524?mod=hp_lead_pos1,"WSJ on the agent exodus — NAR membership dropping, the bottom-quartile producers gone first. The post-NAR-settlement shakeout that everyone predicted, finally arriving. In fourth year of struggling market, even real-estate professionals who made it this far are reaching breaking point (  )",2026-06-23T06:53:31.881638,Wall Street Journal,https://ritholtz.com/2026/06/10-monday-am-reads-481/,2026-06-23T06:53:31.881640
98cc2021e961,Half of America’s Cities Are Depopulating. We Could Be Headed for a Ghost Town Era. *Tumbleweed* . No city in the Northeast or Midwest is safe from a trend toward depopulation. And just because states,https://www.popularmechanics.com/science/a70793664/half-of-us-cities-are-depopulating-ghost-town-era/,,2026-06-23T06:53:31.881708,Popular Mechanics,https://ritholtz.com/2026/06/10-monday-am-reads-481/,2026-06-23T06:53:31.881710
f9db5a155025,"These Are the Country’s Top CEOs. They’ve Maximized the Moment, Whether in Pizza, Sports, or Tech . From Delta’s Bastian to Exxon Mobil’s Woods, these 25 leaders have positioned their companies for lo",https://www.barrons.com/articles/top-ceos-2026-ai-huang-dimon-fraser-culp-cook-pichai-a2378dbb,,2026-06-23T06:53:31.881773,Barron’s,https://ritholtz.com/2026/06/10-monday-am-reads-481/,2026-06-23T06:53:31.881775
ede3549dced1,The Mars Delusion,https://www.noemamag.com/the-mars-delusion,"Noema makes the unsentimental case against the Mars-colonization fantasy on physical, biological, and economic grounds. The dream survives mostly because it’s marketed by people who don’t have to live the math. Establishing a human colony on Mars is fraught with risk. Why are so many people obsessed with achieving it? (  )",2026-06-23T06:53:31.881836,NOEMA,https://ritholtz.com/2026/06/10-monday-am-reads-481/,2026-06-23T06:53:31.881838
a98bba15a3b9,Trump’s Iran “Deal” Is a Giant Bag of Dog Sh*t :  It’s not a deal. It’s a memo of understanding in advance of a surrender of the American-led world order.  on the gap between the Iran-deal press relea,https://www.thebulwark.com/p/trumps-iran-deal-is-a-giant-bag-of,,2026-06-23T06:53:31.881905,The Bulwark,https://ritholtz.com/2026/06/10-monday-am-reads-481/,2026-06-23T06:53:31.881907
d221e81ea0df,Trump’s Iran “Deal” Is a Giant Bag of Dog Sh*t :  It’s not a deal. It’s a memo of understanding in advance of a surrender of the American-led world order. The Bulwark on the gap between the Iran-deal ,https://www.politico.com/news/magazine/2026/06/20/south-korea-weapons-dealer-trump-00959559,,2026-06-23T06:53:31.881970,Politico,https://ritholtz.com/2026/06/10-monday-am-reads-481/,2026-06-23T06:53:31.881972
6e13d1170616,The Classic Movie That Was Nearly Destroyed by a Single Line of Code,https://www.wsj.com/business/media/toy-story-5-saved-pixar-78e29161?mod=panda_wsj_author_alert,A beloved film was accidentally deleted—and miraculously saved. The real story behind the ‘Toy Story’ franchise is even better than the movies. WSJ on the legendary near-deletion of Toy Story 2 and how the lessons quietly saved Toy Story 5. A backup story made interesting. The real story behind the ‘Toy Story’ franchise is even better than the movies. (  ),2026-06-23T06:53:31.882051,Wall Street Journal,https://ritholtz.com/2026/06/10-monday-am-reads-481/,2026-06-23T06:53:31.882054
1cde1541e45b,Jalen Brunson Is the ‘King of New York’ The undersized superstar delivers a historic title for the Knicks. The undersized superstar delivers a historic title for the Knicks. His most important contrib,https://www.wsj.com/sports/basketball/jalen-brunson-new-york-knicks-nba-finals-ac6b287d?mod=series_olygay,,2026-06-23T06:53:31.882122,Wall Street Journal,https://ritholtz.com/2026/06/10-monday-am-reads-481/,2026-06-23T06:53:31.882124
599177641dbf,Video of the day :,https://www.wsj.com/video/series/in-depth-features/toy-story-5-director-on-pixars-secret-to-making-adults-cry/7587AB1E-89F8-439C-9F4B-0FA20C3E3823,,2026-06-23T06:53:31.882178,‘Toy Story 5’ Director on Pixar’s Secret to Making Adults Cry.,https://ritholtz.com/2026/06/10-monday-am-reads-481/,2026-06-23T06:53:31.882179
0befcdc78788,"Be sure to check out our Master’s in Business with  , CEO and portfolio manager of The Baupost Group . Founded in 1982 with $27 million in seed capital, over the past four decades, Baupost has grown t",https://www.baupost.com/Team/Seth-A-Klarman,,2026-06-23T06:53:31.882245,Seth Klarman,https://ritholtz.com/2026/06/10-monday-am-reads-481/,2026-06-23T06:53:31.882247
