id,title,selftext,permalink,score
1rj7m2g,"LPT: At a gathering, if you see someone standing alone, give them a tiny job for 30 seconds so they have a reason to exist there.",,https://www.reddit.com/r/LifeProTips/comments/1rj7m2g/lpt_at_a_gathering_if_you_see_someone_standing/,30037
1r9pxxx,lpt: let your dog choose where to go on a walk and youll see where they will likely go if they escape,,https://www.reddit.com/r/LifeProTips/comments/1r9pxxx/lpt_let_your_dog_choose_where_to_go_on_a_walk_and/,26387
1rbvgjs,"LPT: If your schedule allows it, take your lunch break as late as possible. It makes the workday feel shorter.",,https://www.reddit.com/r/LifeProTips/comments/1rbvgjs/lpt_if_your_schedule_allows_it_take_your_lunch/,23096
1rh6hkq,"LPT: When major world events happen, always check account ages",,https://www.reddit.com/r/LifeProTips/comments/1rh6hkq/lpt_when_major_world_events_happen_always_check/,20835
1rfuo36,"LPT: When you introduce two people, give them one shared hook so they can talk without awkwardness.",,https://www.reddit.com/r/LifeProTips/comments/1rfuo36/lpt_when_you_introduce_two_people_give_them_one/,18581
1r32yoi,"LPT: if you can’t get someone to guess something, just give them absurd options",,https://www.reddit.com/r/LifeProTips/comments/1r32yoi/lpt_if_you_cant_get_someone_to_guess_something/,15954
1r0bqkf,LPT: Do not add your work colleagues as your facebook friends,,https://www.reddit.com/r/LifeProTips/comments/1r0bqkf/lpt_do_not_add_your_work_colleagues_as_your/,14403
1r07lue,LPT: cut and trim your nails today if you’re planning on putting them in someone else’s body for Valentine’s Day.,,https://www.reddit.com/r/LifeProTips/comments/1r07lue/lpt_cut_and_trim_your_nails_today_if_youre/,12812
1r2dh3s,"LPT: If you struggle falling asleep, try the cognitive shuffle technique",,https://www.reddit.com/r/LifeProTips/comments/1r2dh3s/lpt_if_you_struggle_falling_asleep_try_the/,11459
1qycacf,LPT When you just can't turn off or wake up at 3am and can't fall asleep. Try this... Keep your eyes open in bed,,https://www.reddit.com/r/LifeProTips/comments/1qycacf/lpt_when_you_just_cant_turn_off_or_wake_up_at_3am/,9543
1r5jf1x,LPT: Be extra careful of how you treat people during transitions in their life. The memories they form during these times tend to be longer-lived and more meaningful.,,https://www.reddit.com/r/LifeProTips/comments/1r5jf1x/lpt_be_extra_careful_of_how_you_treat_people/,8944
1r8jnl3,LPT: Start thinking about your life in weeks instead of years. It makes you way more intentional with your time.,,https://www.reddit.com/r/LifeProTips/comments/1r8jnl3/lpt_start_thinking_about_your_life_in_weeks/,8063
1r082o2,"LPT: When your boss keeps adding projects to your “to do” list, but never takes anything off…This simple question can quietly protect your workload level.",,https://www.reddit.com/r/LifeProTips/comments/1r082o2/lpt_when_your_boss_keeps_adding_projects_to_your/,7246
1qyfwe5,LPT: Start your weekend with one tiny “anchor” habit to make it feel longer,,https://www.reddit.com/r/LifeProTips/comments/1qyfwe5/lpt_start_your_weekend_with_one_tiny_anchor_habit/,5879
1rclehq,LPT Give your kids chores they love,,https://www.reddit.com/r/LifeProTips/comments/1rclehq/lpt_give_your_kids_chores_they_love/,5777
1rf8y41,"LPT: When someone treats you badly for no clear reason, assume it reflects their internal state, not your worth.",,https://www.reddit.com/r/LifeProTips/comments/1rf8y41/lpt_when_someone_treats_you_badly_for_no_clear/,4853
1rdpx35,LPT: Stop getting pinged all day by setting the next update time in your reply,,https://www.reddit.com/r/LifeProTips/comments/1rdpx35/lpt_stop_getting_pinged_all_day_by_setting_the/,4254
1r7wkad,LPT: Find ridiculous reasons to get good at things,,https://www.reddit.com/r/LifeProTips/comments/1r7wkad/lpt_find_ridiculous_reasons_to_get_good_at_things/,3963
1resl34,"LPT: If you're arguing with someone and they start making good points, that means you're learning, not losing.",,https://www.reddit.com/r/LifeProTips/comments/1resl34/lpt_if_youre_arguing_with_someone_and_they_start/,3555
1r6y7it,LPT: There's never been a better time to sell your less than impressive early 2000's class ring.,,https://www.reddit.com/r/LifeProTips/comments/1r6y7it/lpt_theres_never_been_a_better_time_to_sell_your/,2965
1r6pnol,"LPT: When fear is stopping you, do a 14 day experiment instead of a life decision.",,https://www.reddit.com/r/LifeProTips/comments/1r6pnol/lpt_when_fear_is_stopping_you_do_a_14_day/,2663
1qwpjru,"LPT: Once a month, copy 10 job postings for the role you want and tally the repeated skills. Then spend the month building proof for the top 2.",,https://www.reddit.com/r/LifeProTips/comments/1qwpjru/lpt_once_a_month_copy_10_job_postings_for_the/,2221
1r6dak2,LPT: The best way to connect with your kid is through their hobbies,,https://www.reddit.com/r/LifeProTips/comments/1r6dak2/lpt_the_best_way_to_connect_with_your_kid_is/,2222
1rdk16t,"LPT: If you struggle to fall asleep, try narrating your day in third person inside your head like you're writing a novel. It shuts your brain up faster than anything else.",,https://www.reddit.com/r/LifeProTips/comments/1rdk16t/lpt_if_you_struggle_to_fall_asleep_try_narrating/,2535
1qyr1hq,"LPT: When a conversation turns into a public interrogation, move it to a private channel fast.",,https://www.reddit.com/r/LifeProTips/comments/1qyr1hq/lpt_when_a_conversation_turns_into_a_public/,1967
1r5hsy4,LPT: Photograph the parties your friends host.,,https://www.reddit.com/r/LifeProTips/comments/1r5hsy4/lpt_photograph_the_parties_your_friends_host/,1339
1rb2ztv,LPT: Reply to vague work requests with one sentence that locks the deliverable and deadline.,,https://www.reddit.com/r/LifeProTips/comments/1rb2ztv/lpt_reply_to_vague_work_requests_with_one/,1428
1r9y8pz,LPT: Sleeping a lot but still tired? Try these 3 changes first,,https://www.reddit.com/r/LifeProTips/comments/1r9y8pz/lpt_sleeping_a_lot_but_still_tired_try_these_3/,1299
1qxojyg,LPT Request: Any tips for when you are with a group of people and know you are the least smart/educated/important person? How to feel less insecure in that situation?,,https://www.reddit.com/r/LifeProTips/comments/1qxojyg/lpt_request_any_tips_for_when_you_are_with_a/,988
1qvyi06,"LPT: When something about a person bothers you, wait 24 hours before saying anything… unless it's urgent.",,https://www.reddit.com/r/LifeProTips/comments/1qvyi06/lpt_when_something_about_a_person_bothers_you/,1247
1qzcx4s,"LPT: if you're helping an elderly relative clean their house, do not throw away old life insurance documents—even if they look ""lapsed."" they might still be worth thousands",,https://www.reddit.com/r/LifeProTips/comments/1qzcx4s/lpt_if_youre_helping_an_elderly_relative_clean/,1099
1rd0tdv,LPT: Pack a “first night” box when moving.,,https://www.reddit.com/r/LifeProTips/comments/1rd0tdv/lpt_pack_a_first_night_box_when_moving/,834
1qwgfjn,LPT: Funerals don't have to be expensive,,https://www.reddit.com/r/LifeProTips/comments/1qwgfjn/lpt_funerals_dont_have_to_be_expensive/,930
1r20c5b,LPT: Save your old phones for international travel.,,https://www.reddit.com/r/LifeProTips/comments/1r20c5b/lpt_save_your_old_phones_for_international_travel/,1275
1rim5bk,"LPT: When job hunting, pay attention to roles that are constantly advertised.",,https://www.reddit.com/r/LifeProTips/comments/1rim5bk/lpt_when_job_hunting_pay_attention_to_roles_that/,498
1rlk1iu,LPT: Fix one small inconvenience in your life every single day,,https://www.reddit.com/r/LifeProTips/comments/1rlk1iu/lpt_fix_one_small_inconvenience_in_your_life/,621
1rexsbj,"LPT - If you want to stay close with people during burnout, send one small photo or screenshot once a week with one simple line.",,https://www.reddit.com/r/LifeProTips/comments/1rexsbj/lpt_if_you_want_to_stay_close_with_people_during/,1284
1rlrtey,"LPT: Before a difficult conversation, write down the one thing you most need the other person to understand. Not what you want to say — what you need them to understand. It will change how you approach the whole thing.",,https://www.reddit.com/r/LifeProTips/comments/1rlrtey/lpt_before_a_difficult_conversation_write_down/,913
1r4ajvr,LPT: Do routine tasks with your weaker hand,,https://www.reddit.com/r/LifeProTips/comments/1r4ajvr/lpt_do_routine_tasks_with_your_weaker_hand/,880
1r5i3ci,LPT - Make strawberries last longer than 2 days + avoid mushy / mould,,https://www.reddit.com/r/LifeProTips/comments/1r5i3ci/lpt_make_strawberries_last_longer_than_2_days/,1005
1rkg2bs,"LPT: The dumber my productivity system, the better it works",,https://www.reddit.com/r/LifeProTips/comments/1rkg2bs/lpt_the_dumber_my_productivity_system_the_better/,930
1r08u4x,"LPT: Before a big plan day, send a two minute expectations text so nobody has to guess.",,https://www.reddit.com/r/LifeProTips/comments/1r08u4x/lpt_before_a_big_plan_day_send_a_two_minute/,1011
1ra135v,LPT Use a privacy screen on your laptop when flying,,https://www.reddit.com/r/LifeProTips/comments/1ra135v/lpt_use_a_privacy_screen_on_your_laptop_when/,1030
1risha8,"LPT: When reading a classic book, the ""Introduction"" isn't part of the story and may contain unmarked spoilers for the book.",,https://www.reddit.com/r/LifeProTips/comments/1risha8/lpt_when_reading_a_classic_book_the_introduction/,362
1qwdmtm,"LPT: In job interviews, try the STAR method: Situation, Task, Action, Result. Listing exact keywords from the job ad that align with qualifiers from your resume.",,https://www.reddit.com/r/LifeProTips/comments/1qwdmtm/lpt_in_job_interviews_try_the_star_method/,651
1qzu2kp,LPT: Buy bed sheets that have a directional pattern so that you’re never struggling to figure out if you’re putting in on correctly.,,https://www.reddit.com/r/LifeProTips/comments/1qzu2kp/lpt_buy_bed_sheets_that_have_a_directional/,646
1qxtftp,"LPT: Never, ever plug a space heater into a power strip or extension cord. Plug it directly into the wall outlet.",,https://www.reddit.com/r/LifeProTips/comments/1qxtftp/lpt_never_ever_plug_a_space_heater_into_a_power/,566
1qw4tal,"LPT - When someone tries to pull you into gossip at work, reply with one neutral line and a question that moves the topic back to facts.",,https://www.reddit.com/r/LifeProTips/comments/1qw4tal/lpt_when_someone_tries_to_pull_you_into_gossip_at/,778
1rbx1j8,"LPT: Want your kids to genuinely respect you? Don't make family decisions alone, even when you already know the answer.",,https://www.reddit.com/r/LifeProTips/comments/1rbx1j8/lpt_want_your_kids_to_genuinely_respect_you_dont/,835
1r4oxym,"LPT If your hotel is stingy with bottled water, go their fitness room…",,https://www.reddit.com/r/LifeProTips/comments/1r4oxym/lpt_if_your_hotel_is_stingy_with_bottled_water_go/,530
