id,title,selftext,permalink,score
1t5x4wi,LPT Using Dish Soap on Drains,,https://www.reddit.com/r/LifeProTips/comments/1t5x4wi/lpt_using_dish_soap_on_drains/,22991
1t5gekl,"LPT: If you work from home, use the ""Schedule Send"" button to train your clients and boss on your boundaries.",,https://www.reddit.com/r/LifeProTips/comments/1t5gekl/lpt_if_you_work_from_home_use_the_schedule_send/,19983
1sisb8v,"LPT: Before quitting your job, take your unused vacation days. You earned them and most companies won't pay them out.",,https://www.reddit.com/r/LifeProTips/comments/1sisb8v/lpt_before_quitting_your_job_take_your_unused/,17786
1t4l8p8,"LPT: if you’re in a city that’s notorious for pickpocketers, stuff some napkins or tissues into your pocket after your wallet",,https://www.reddit.com/r/LifeProTips/comments/1t4l8p8/lpt_if_youre_in_a_city_thats_notorious_for/,16013
1sqqtel,"LPT: If you need to have an awkward conversation with someone, do not start with ""we need to talk""",,https://www.reddit.com/r/LifeProTips/comments/1sqqtel/lpt_if_you_need_to_have_an_awkward_conversation/,14209
1skd2nw,LPT: Discipline isn't about never quitting. It's about quitting and coming back. Stop shaming yourself for breaks.,,https://www.reddit.com/r/LifeProTips/comments/1skd2nw/lpt_discipline_isnt_about_never_quitting_its/,12625
1srpwnx,"LPT If you’re job hunting, copy the exact key phrases from the job description into your resume many companies use AI scanners that filter for matching keywords",,https://www.reddit.com/r/LifeProTips/comments/1srpwnx/lpt_if_youre_job_hunting_copy_the_exact_key/,10965
1syjx5g,"LPT: When you withdraw money from an ATM abroad, always choose ""Withdraw without conversion""",,https://www.reddit.com/r/LifeProTips/comments/1syjx5g/lpt_when_you_withdraw_money_from_an_atm_abroad/,9592
1t8uzc9,"LPT: if you're watching a Blu-ray, start the movie by selecting chapter 1 on the top menu rather than ""play movie"", that way you will skip the antipiracy warnings and age rating splash screens and go straight into the film, saving you time.",,https://www.reddit.com/r/LifeProTips/comments/1t8uzc9/lpt_if_youre_watching_a_bluray_start_the_movie_by/,8387
1szg7zo,"LPT: At work, say what you are waiting on before people think you are just late.",,https://www.reddit.com/r/LifeProTips/comments/1szg7zo/lpt_at_work_say_what_you_are_waiting_on_before/,7736
1slkyxy,"LPT: If your Windows PC has been acting up or crashing and you don't know why, search for ""View reliability history"". It gives you a visual timeline of every app crash and hardware failure without needing to be a tech expert.",,https://www.reddit.com/r/LifeProTips/comments/1slkyxy/lpt_if_your_windows_pc_has_been_acting_up_or/,6292
1t459cc,"LPT: When checking into a hotel, ask if there are any complimentary upgrades available.",,https://www.reddit.com/r/LifeProTips/comments/1t459cc/lpt_when_checking_into_a_hotel_ask_if_there_are/,5632
1syhh7h,"LPT: If someone gives you a maybe, stop planning like you got a yes.",,https://www.reddit.com/r/LifeProTips/comments/1syhh7h/lpt_if_someone_gives_you_a_maybe_stop_planning/,4943
1sov5qk,LPT - How to disable Shorts from you tube.,,https://www.reddit.com/r/LifeProTips/comments/1sov5qk/lpt_how_to_disable_shorts_from_you_tube/,4495
1swip2x,"LPT: set your mower at the highest height, and side eject or mulch (don’t bag). The clippings return nutrients to the soil and the longer grass crowds out weeds.",,https://www.reddit.com/r/LifeProTips/comments/1swip2x/lpt_set_your_mower_at_the_highest_height_and_side/,4011
1sub1z5,"LPT: When a person close to you passes and you're in charge of their estate, consider porting their phone number(s) to Google Voice",,https://www.reddit.com/r/LifeProTips/comments/1sub1z5/lpt_when_a_person_close_to_you_passes_and_youre/,4115
1spt9uk,"LPT: To reduce burnout and irritability, stop ""bracketing"" tasks into likes and dislikes. Internal resistance is often more exhausting than the work itself.",,https://www.reddit.com/r/LifeProTips/comments/1spt9uk/lpt_to_reduce_burnout_and_irritability_stop/,3189
1t9e9k9,"LPT: With mother's day comes flowers, just a reminder not to buy Lillies for someone who owns a cat/ cats, they are extremely poisonous to them causing fatal kidney failure within days of contact with the plant!",,https://www.reddit.com/r/LifeProTips/comments/1t9e9k9/lpt_with_mothers_day_comes_flowers_just_a/,2826
1t4uwkj,"LPT: When you're driving for a long distance, fold a towel and place it on your lower back",,https://www.reddit.com/r/LifeProTips/comments/1t4uwkj/lpt_when_youre_driving_for_a_long_distance_fold_a/,2993
1t7q74a,LPT: Come to terms with the fact that there will always be someone better than you at the thing you're doing.,,https://www.reddit.com/r/LifeProTips/comments/1t7q74a/lpt_come_to_terms_with_the_fact_that_there_will/,2951
1t2pq3o,LPT keep a private brag document and update it every single friday with your exact work accomplishments and metrics,,https://www.reddit.com/r/LifeProTips/comments/1t2pq3o/lpt_keep_a_private_brag_document_and_update_it/,2383
1t6ey8f,LPT: Boredom is the ultimate antidote to procrastination.,,https://www.reddit.com/r/LifeProTips/comments/1t6ey8f/lpt_boredom_is_the_ultimate_antidote_to/,1729
1sv8c8s,"LPT: When your brain just refuses to work, don’t try to win the day — just don’t lose it",,https://www.reddit.com/r/LifeProTips/comments/1sv8c8s/lpt_when_your_brain_just_refuses_to_work_dont_try/,1966
1sw9azj,LPT: The carts in the cart return are statistically less likely to have fucked up wheels,,https://www.reddit.com/r/LifeProTips/comments/1sw9azj/lpt_the_carts_in_the_cart_return_are/,1827
1szyj3l,LPT: Do not try to stop thoughts when you meditate,,https://www.reddit.com/r/LifeProTips/comments/1szyj3l/lpt_do_not_try_to_stop_thoughts_when_you_meditate/,1261
1sx9s5q,"LPT: if you share bed with a partner, buy two separate blankets/quilts to prevent sleep divorce",,https://www.reddit.com/r/LifeProTips/comments/1sx9s5q/lpt_if_you_share_bed_with_a_partner_buy_two/,1637
1t4fp9z,"LPT: If you can't follow a productive timetable, follow a ""waste time"" timetable instead. It actually works and here's why.",,https://www.reddit.com/r/LifeProTips/comments/1t4fp9z/lpt_if_you_cant_follow_a_productive_timetable/,1422
1t8zufb,LPT: It is much better to be alone than to surround yourself with people who make you feel alone,,https://www.reddit.com/r/LifeProTips/comments/1t8zufb/lpt_it_is_much_better_to_be_alone_than_to/,964
1t0vs7y,LPT: It's fledgling season! Here are a few tips in case you come across a baby bird on the ground.,,https://www.reddit.com/r/LifeProTips/comments/1t0vs7y/lpt_its_fledgling_season_here_are_a_few_tips_in/,814
1squwz9,"LPT: If an authority figure is toxic, leave. It will only escalate",,https://www.reddit.com/r/LifeProTips/comments/1squwz9/lpt_if_an_authority_figure_is_toxic_leave_it_will/,743
1st1hq7,LPT : Got an email saying someone tried logging into your account? DO NOT CLICK THAT LINK,,https://www.reddit.com/r/LifeProTips/comments/1st1hq7/lpt_got_an_email_saying_someone_tried_logging/,674
1sxzhr7,LPT: Always add a splash of water when reheating rice or pasta,,https://www.reddit.com/r/LifeProTips/comments/1sxzhr7/lpt_always_add_a_splash_of_water_when_reheating/,596
1sqys9w,LPT: Check venue information before going to the show or game to potentially save money!,,https://www.reddit.com/r/LifeProTips/comments/1sqys9w/lpt_check_venue_information_before_going_to_the/,992
1swfpx7,"LPT: At work, say what is done before you say what is delayed.",,https://www.reddit.com/r/LifeProTips/comments/1swfpx7/lpt_at_work_say_what_is_done_before_you_say_what/,987
1sleys1,"LPT: If you’re learning a language, start speaking before you feel ready",,https://www.reddit.com/r/LifeProTips/comments/1sleys1/lpt_if_youre_learning_a_language_start_speaking/,795
1snl5wg,LPT: Set a calendar reminder 1 year before your passport expires,,https://www.reddit.com/r/LifeProTips/comments/1snl5wg/lpt_set_a_calendar_reminder_1_year_before_your/,1012
1su7o5i,LPT - small hacks with big helps,,https://www.reddit.com/r/LifeProTips/comments/1su7o5i/lpt_small_hacks_with_big_helps/,1062
1t6w3pf,LPT You can do work distracted too instead of not doing at all,,https://www.reddit.com/r/LifeProTips/comments/1t6w3pf/lpt_you_can_do_work_distracted_too_instead_of_not/,792
1t76d7t,LPT: Use Toothpicks in Stripped Screw Holes,,https://www.reddit.com/r/LifeProTips/comments/1t76d7t/lpt_use_toothpicks_in_stripped_screw_holes/,725
1sn2qu5,"LPT If you Like to snack and love unhealthy food but want to live a healthier Lifestyle, don't cut out snacks right away - instead, add healthy foods to your diet",,https://www.reddit.com/r/LifeProTips/comments/1sn2qu5/lpt_if_you_like_to_snack_and_love_unhealthy_food/,554
1t8w08a,"LPT: If you want to exercise but going to the gym is difficult for you, get resistance bands.",,https://www.reddit.com/r/LifeProTips/comments/1t8w08a/lpt_if_you_want_to_exercise_but_going_to_the_gym/,426
1svusv4,LPT: Consistently communicate with others when they’ve hurt your feelings.,,https://www.reddit.com/r/LifeProTips/comments/1svusv4/lpt_consistently_communicate_with_others_when/,398
1stm814,LPT: Have a Windows 11 computer? Know where to find your BitLocker key before you get locked out,,https://www.reddit.com/r/LifeProTips/comments/1stm814/lpt_have_a_windows_11_computer_know_where_to_find/,675
1sjlgm3,"LPT: When showing something on a video call, hold it still longer than you think you need to",,https://www.reddit.com/r/LifeProTips/comments/1sjlgm3/lpt_when_showing_something_on_a_video_call_hold/,608
1so1ida,"LPT: Wipe your car’s camera lens each time you close the trunk—it only takes a second and helps ensure a clear, accurate view when you’re backing up, especially in bad weather or low light.",,https://www.reddit.com/r/LifeProTips/comments/1so1ida/lpt_wipe_your_cars_camera_lens_each_time_you/,759
1t5sz46,"LPT: If you are checking on someone, make it easy for them to answer.",,https://www.reddit.com/r/LifeProTips/comments/1t5sz46/lpt_if_you_are_checking_on_someone_make_it_easy/,360
1skoni9,"LPT: If your internet bill has increased, call your provider and tell them you want to cancel. You'll be transferred to a ""retention team"" that has access to discounted offers that never appear on the website.",,https://www.reddit.com/r/LifeProTips/comments/1skoni9/lpt_if_your_internet_bill_has_increased_call_your/,686
1sju426,"LPT: If you need a real answer, stop asking in a way that lets people escape.",,https://www.reddit.com/r/LifeProTips/comments/1sju426/lpt_if_you_need_a_real_answer_stop_asking_in_a/,439
1t5039m,LPT Do basic stretches while watching videos on mobile,,https://www.reddit.com/r/LifeProTips/comments/1t5039m/lpt_do_basic_stretches_while_watching_videos_on/,542
1snww9n,"LPT When you're just sitting there, with a ton of things to do, but you just can't seem to get started, act on your first impulse and just start doing something",,https://www.reddit.com/r/LifeProTips/comments/1snww9n/lpt_when_youre_just_sitting_there_with_a_ton_of/,553
