id,title,selftext,permalink,score
1tswlgd,"LPT When purchasing seating at an arena, buy in block shapes, not in lines.",,https://www.reddit.com/r/LifeProTips/comments/1tswlgd/lpt_when_purchasing_seating_at_an_arena_buy_in/,24128
1tgll3k,"LPT: When you move abroad, the first question to ask locals isn't where to live or what to eat. It's ""What do foreigners always get wrong here?""",,https://www.reddit.com/r/LifeProTips/comments/1tgll3k/lpt_when_you_move_abroad_the_first_question_to/,21233
1t5x4wi,LPT Using Dish Soap on Drains,,https://www.reddit.com/r/LifeProTips/comments/1t5x4wi/lpt_using_dish_soap_on_drains/,19339
1t5gekl,"LPT: If you work from home, use the ""Schedule Send"" button to train your clients and boss on your boundaries.",,https://www.reddit.com/r/LifeProTips/comments/1t5gekl/lpt_if_you_work_from_home_use_the_schedule_send/,16436
1tgiawf,"LPT: If youre a college student, buildings for courses with bad gender balances have the best bathrooms on campus",,https://www.reddit.com/r/LifeProTips/comments/1tgiawf/lpt_if_youre_a_college_student_buildings_for/,14378
1t4l8p8,"LPT: if you’re in a city that’s notorious for pickpocketers, stuff some napkins or tissues into your pocket after your wallet",,https://www.reddit.com/r/LifeProTips/comments/1t4l8p8/lpt_if_youre_in_a_city_thats_notorious_for/,12916
1ti3jd3,"LPT: If the milk you buy often goes bad because you don't drink that much or have a small family, try lactose free milk. The milk will have an expiration date of 30-90 days instead of weeks.",,https://www.reddit.com/r/LifeProTips/comments/1ti3jd3/lpt_if_the_milk_you_buy_often_goes_bad_because/,11109
1tmdu7x,LPT: The rules for buying a grill during a summer holiday sale are the same for buying something during Black Friday,,https://www.reddit.com/r/LifeProTips/comments/1tmdu7x/lpt_the_rules_for_buying_a_grill_during_a_summer/,9906
1tjm2nc,LPT: Being easy to talk to matters more than being interesting to listen to.,,https://www.reddit.com/r/LifeProTips/comments/1tjm2nc/lpt_being_easy_to_talk_to_matters_more_than_being/,8818
1t8uzc9,"LPT: if you're watching a Blu-ray, start the movie by selecting chapter 1 on the top menu rather than ""play movie"", that way you will skip the antipiracy warnings and age rating splash screens and go straight into the film, saving you time.",,https://www.reddit.com/r/LifeProTips/comments/1t8uzc9/lpt_if_youre_watching_a_bluray_start_the_movie_by/,8380
1tp879y,LPT: Take a picture of the receipt when you buy your luggage. It’s one of the few receipts you might need 5+ years later.,,https://www.reddit.com/r/LifeProTips/comments/1tp879y/lpt_take_a_picture_of_the_receipt_when_you_buy/,7355
1t459cc,"LPT: When checking into a hotel, ask if there are any complimentary upgrades available.",,https://www.reddit.com/r/LifeProTips/comments/1t459cc/lpt_when_checking_into_a_hotel_ask_if_there_are/,6384
1tqth4c,"LPT: Before making a difficult decision, imagine a close friend came to you with the exact same situation. Your advice to them is often better than the advice you give yourself.",,https://www.reddit.com/r/LifeProTips/comments/1tqth4c/lpt_before_making_a_difficult_decision_imagine_a/,6018
1tb5q5o,"LPT: If you are asking for honesty, make sure your reaction can handle it.",,https://www.reddit.com/r/LifeProTips/comments/1tb5q5o/lpt_if_you_are_asking_for_honesty_make_sure_your/,5438
1tnbjvd,"LPT: If you want to sound well-spoken, practice speaking for 10 minut",,https://www.reddit.com/r/LifeProTips/comments/1tnbjvd/lpt_if_you_want_to_sound_wellspoken_practice/,4198
1touvgh,"LPT: The ""Antagonist Theory"" to hack motivation",,https://www.reddit.com/r/LifeProTips/comments/1touvgh/lpt_the_antagonist_theory_to_hack_motivation/,3934
1th0pvw,"LPT: If you ever need to download an obscure software from github, you're looking for the ""releases"" tab",,https://www.reddit.com/r/LifeProTips/comments/1th0pvw/lpt_if_you_ever_need_to_download_an_obscure/,4053
1tj2l1r,"LPT: After every job interview, write down the questions you were asked while they’re still fresh in your mind.",,https://www.reddit.com/r/LifeProTips/comments/1tj2l1r/lpt_after_every_job_interview_write_down_the/,3466
1tgshzq,LPT: If you go to France you should ask the bakery for a « Tradition » instead of a « baguette »,,https://www.reddit.com/r/LifeProTips/comments/1tgshzq/lpt_if_you_go_to_france_you_should_ask_the_bakery/,3112
1tntqil,LPT: Hypochlorous Acid is a great way to get rid of bad smells in the house!,,https://www.reddit.com/r/LifeProTips/comments/1tntqil/lpt_hypochlorous_acid_is_a_great_way_to_get_rid/,2917
1t9e9k9,"LPT: With mother's day comes flowers, just a reminder not to buy Lillies for someone who owns a cat/ cats, they are extremely poisonous to them causing fatal kidney failure within days of contact with the plant!",,https://www.reddit.com/r/LifeProTips/comments/1t9e9k9/lpt_with_mothers_day_comes_flowers_just_a/,2076
1te13fk,LPT: Stop telling people your big plans too early. Your brain can mistake being understood for actually making progress.,,https://www.reddit.com/r/LifeProTips/comments/1te13fk/lpt_stop_telling_people_your_big_plans_too_early/,2015
1tc867n,LPT: Anything Worth Doing is Worth Doing SLOWLY,,https://www.reddit.com/r/LifeProTips/comments/1tc867n/lpt_anything_worth_doing_is_worth_doing_slowly/,1607
1teuxnr,"LPT - Before mowing your lawn, walk it slowly to scoot any critters away",,https://www.reddit.com/r/LifeProTips/comments/1teuxnr/lpt_before_mowing_your_lawn_walk_it_slowly_to/,2159
1tt1sdm,"LPT: Always build a “next job” buffer, even if you love your current one",,https://www.reddit.com/r/LifeProTips/comments/1tt1sdm/lpt_always_build_a_next_job_buffer_even_if_you/,1877
1t8zufb,LPT: It is much better to be alone than to surround yourself with people who make you feel alone,,https://www.reddit.com/r/LifeProTips/comments/1t8zufb/lpt_it_is_much_better_to_be_alone_than_to/,1792
1t7q74a,LPT: Come to terms with the fact that there will always be someone better than you at the thing you're doing.,,https://www.reddit.com/r/LifeProTips/comments/1t7q74a/lpt_come_to_terms_with_the_fact_that_there_will/,1289
1tb247d,LPT: walnuts are so rich in oil that you can just rub one on finished wood to fix scratches!,,https://www.reddit.com/r/LifeProTips/comments/1tb247d/lpt_walnuts_are_so_rich_in_oil_that_you_can_just/,1117
1tqugp9,"LPT - relax your jaw muscle. It’ll help you relax, and most people don’t even realize that it’s tense!",,https://www.reddit.com/r/LifeProTips/comments/1tqugp9/lpt_relax_your_jaw_muscle_itll_help_you_relax_and/,1364
1t4uwkj,"LPT: When you're driving for a long distance, fold a towel and place it on your lower back",,https://www.reddit.com/r/LifeProTips/comments/1t4uwkj/lpt_when_youre_driving_for_a_long_distance_fold_a/,1542
1t6ey8f,LPT: Boredom is the ultimate antidote to procrastination.,,https://www.reddit.com/r/LifeProTips/comments/1t6ey8f/lpt_boredom_is_the_ultimate_antidote_to/,743
1t2pq3o,LPT keep a private brag document and update it every single friday with your exact work accomplishments and metrics,,https://www.reddit.com/r/LifeProTips/comments/1t2pq3o/lpt_keep_a_private_brag_document_and_update_it/,947
1thpvtj,"LPT: If you see someone fall on an escalator, there will always be shut off buttons located at both the top and bottom by the hand rails.",,https://www.reddit.com/r/LifeProTips/comments/1thpvtj/lpt_if_you_see_someone_fall_on_an_escalator_there/,853
1ta7g7f,LPT - When searching on sites like YouTube use - to filter out slop channels,,https://www.reddit.com/r/LifeProTips/comments/1ta7g7f/lpt_when_searching_on_sites_like_youtube_use_to/,965
1tde5ix,"LPT: Look up the daily caloric requirements for your pet, it might be higher than you realize.",,https://www.reddit.com/r/LifeProTips/comments/1tde5ix/lpt_look_up_the_daily_caloric_requirements_for/,956
1tpxlhb,"LPT - Freeze a block of cheese for 30 minutes before shredding it. It will shred quicker, smoother, and won't chunk up on the shredder",,https://www.reddit.com/r/LifeProTips/comments/1tpxlhb/lpt_freeze_a_block_of_cheese_for_30_minutes/,844
1tkvj9v,"LPT: Set hourly reminders to stretch at your desk, preventing years of back/neck damage is easier than fixing it later",,https://www.reddit.com/r/LifeProTips/comments/1tkvj9v/lpt_set_hourly_reminders_to_stretch_at_your_desk/,421
1tdmjht,"LPT: If someone falls or takes an injury, do NOT try and stand them back up right away.",,https://www.reddit.com/r/LifeProTips/comments/1tdmjht/lpt_if_someone_falls_or_takes_an_injury_do_not/,876
1t8w08a,"LPT: If you want to exercise but going to the gym is difficult for you, get resistance bands.",,https://www.reddit.com/r/LifeProTips/comments/1t8w08a/lpt_if_you_want_to_exercise_but_going_to_the_gym/,959
1tkim03,"LPT: if someone’s only nice to you when they need something, stop calling them a friend",,https://www.reddit.com/r/LifeProTips/comments/1tkim03/lpt_if_someones_only_nice_to_you_when_they_need/,873
1tl30n3,LPT Rubbing alcohol in a spray bottle makes a very effective non-toxic bug killer.,,https://www.reddit.com/r/LifeProTips/comments/1tl30n3/lpt_rubbing_alcohol_in_a_spray_bottle_makes_a/,882
1tje4mv,LPT: hang a slightly damp towel directly over an oscillating fan to hack a cheap AC,,https://www.reddit.com/r/LifeProTips/comments/1tje4mv/lpt_hang_a_slightly_damp_towel_directly_over_an/,709
1t76d7t,LPT: Use Toothpicks in Stripped Screw Holes,,https://www.reddit.com/r/LifeProTips/comments/1t76d7t/lpt_use_toothpicks_in_stripped_screw_holes/,636
1tmajqx,"LPT: Before you contact support angry, write down the one outcome you actually want.",,https://www.reddit.com/r/LifeProTips/comments/1tmajqx/lpt_before_you_contact_support_angry_write_down/,764
1trmqzh,LPT: Dead stuff showing up in your garden water feature could be crow baby food.,,https://www.reddit.com/r/LifeProTips/comments/1trmqzh/lpt_dead_stuff_showing_up_in_your_garden_water/,488
1tccskd,"LPT: If you're learning a language, narrate your life in that new language",,https://www.reddit.com/r/LifeProTips/comments/1tccskd/lpt_if_youre_learning_a_language_narrate_your/,1050
1tbgly9,"LPT: Screenshot important conversations, confirmations, and agreements the moment they happen. Future you will thank you.",,https://www.reddit.com/r/LifeProTips/comments/1tbgly9/lpt_screenshot_important_conversations/,442
1t5sz46,"LPT: If you are checking on someone, make it easy for them to answer.",,https://www.reddit.com/r/LifeProTips/comments/1t5sz46/lpt_if_you_are_checking_on_someone_make_it_easy/,798
1tif04o,"LPT: Sometimes it's best not to ""set a goal"" for working out, but instead, just focus on consistency",,https://www.reddit.com/r/LifeProTips/comments/1tif04o/lpt_sometimes_its_best_not_to_set_a_goal_for/,608
1tspvbn,LPT: run a free webrtc leak test before renewing your vpn because the vpn itself can't tell you it's failing,,https://www.reddit.com/r/LifeProTips/comments/1tspvbn/lpt_run_a_free_webrtc_leak_test_before_renewing/,878
