id,title,selftext,permalink,score
1rgkn46,Croatia declared free of landmines after 31 years,,https://www.reddit.com/r/UpliftingNews/comments/1rgkn46/croatia_declared_free_of_landmines_after_31_years/,26167
1qza3ax,California introduces bill to cap ticket re-sale prices,,https://www.reddit.com/r/UpliftingNews/comments/1qza3ax/california_introduces_bill_to_cap_ticket_resale/,23552
1r6jzme,Indonesia bans elephant rides nationwide in major win for animal welfare.,,https://www.reddit.com/r/UpliftingNews/comments/1r6jzme/indonesia_bans_elephant_rides_nationwide_in_major/,20919
1rjnlb2,"Mexico's Supreme Court sets key precedent by recognizing that any inhabitant or user of an ecosystem can file an environmental injunction to demand its protection, even without proving direct individual harm, laying groundwork for communities across the country to defend their natural resources",,https://www.reddit.com/r/UpliftingNews/comments/1rjnlb2/mexicos_supreme_court_sets_key_precedent_by/,17907
1r1tjjn,"Monks complete 2,300-mile walk for peace to Washington",,https://www.reddit.com/r/UpliftingNews/comments/1r1tjjn/monks_complete_2300mile_walk_for_peace_to/,16021
1rhv63n,Sex workers at Nevada brothel fight for the first unionization,,https://www.reddit.com/r/UpliftingNews/comments/1rhv63n/sex_workers_at_nevada_brothel_fight_for_the_first/,14509
1r9r504,Japan: Mystery donor gives $3.6m of gold to fix Osaka water system,,https://www.reddit.com/r/UpliftingNews/comments/1r9r504/japan_mystery_donor_gives_36m_of_gold_to_fix/,12658
1qzt9o7,A Couple Invited Bad Bunny to Their Wedding. They Just Got Married During His Super Bowl Halftime Show,,https://www.reddit.com/r/UpliftingNews/comments/1qzt9o7/a_couple_invited_bad_bunny_to_their_wedding_they/,10956
1qwqq3z,Bill Nye to Receive Lifetime Achievement Honor at the 4th Annual Children’s & Family Emmy Awards,,https://www.reddit.com/r/UpliftingNews/comments/1qwqq3z/bill_nye_to_receive_lifetime_achievement_honor_at/,9663
1rl6o7e,Wife Used ‘Find My iPhone’ to Locate Husband Who Was Buried for Over 4 Hours After Avalanche,,https://www.reddit.com/r/UpliftingNews/comments/1rl6o7e/wife_used_find_my_iphone_to_locate_husband_who/,8989
1r2ypqw,"China’s carbon dioxide (CO2) emissions have now been ‘flat or falling’ for 21 months, as growth in energy storage capacity and clean-power output topped the increases in peak and total electricity demand, respectively, and transportation got cleaner, exceeding official targets",,https://www.reddit.com/r/UpliftingNews/comments/1r2ypqw/chinas_carbon_dioxide_co2_emissions_have_now_been/,7561
1rdmuru,India set to launch free nationwide HPV vaccination for adolescent girls,,https://www.reddit.com/r/UpliftingNews/comments/1rdmuru/india_set_to_launch_free_nationwide_hpv/,6586
1rgodtr,Denmark becomes first country in the European Union to eliminate mother-to-child transmission of HIV and syphilis,,https://www.reddit.com/r/UpliftingNews/comments/1rgodtr/denmark_becomes_first_country_in_the_european/,6575
1rlqeja,Mexico Introduces Legislation to Federally Ban Octopus Farming,,https://www.reddit.com/r/UpliftingNews/comments/1rlqeja/mexico_introduces_legislation_to_federally_ban/,5409
1r1dkdr,Somalia welcomes its first bowling alley as the middle class and diaspora returnees grow,,https://www.reddit.com/r/UpliftingNews/comments/1r1dkdr/somalia_welcomes_its_first_bowling_alley_as_the/,5162
1req46a,South Korea Birth Rate Rises 6.8%,,https://www.reddit.com/r/UpliftingNews/comments/1req46a/south_korea_birth_rate_rises_68/,4274
1rbo1ca,Millions of New York City workers entitled to more time off as new law takes effect Sunday,,https://www.reddit.com/r/UpliftingNews/comments/1rbo1ca/millions_of_new_york_city_workers_entitled_to/,3900
1qz2bqz,Twin Cities tow truck driver returns abandoned vehicles to families after ICE arrests,,https://www.reddit.com/r/UpliftingNews/comments/1qz2bqz/twin_cities_tow_truck_driver_returns_abandoned/,3432
1rilcpb,"University of Waterloo researchers have successfully engineered soil bacteria to ""eat"" cancer tumors from the inside out. The bacteria target the oxygen-starved core of tumors, leaving healthy, oxygen-rich tissue completely untouched",,https://www.reddit.com/r/UpliftingNews/comments/1rilcpb/university_of_waterloo_researchers_have/,3108
1rlhm17,New United Airlines policy requires headphones,,https://www.reddit.com/r/UpliftingNews/comments/1rlhm17/new_united_airlines_policy_requires_headphones/,2861
1r5u3t5,"EVs are already making your air cleaner, research shows. Across nearly 1,700 ZIP codes, the analysis showed that, for every increase of 200 electric vehicles, nitrogen dioxide emissions decreased by 1.1 percent.",,https://www.reddit.com/r/UpliftingNews/comments/1r5u3t5/evs_are_already_making_your_air_cleaner_research/,2816
1rfl66j,A children's hospital is renamed for Dolly Parton and hopes to transform pediatric care in Tennessee,,https://www.reddit.com/r/UpliftingNews/comments/1rfl66j/a_childrens_hospital_is_renamed_for_dolly_parton/,2355
1r21eqn,"Minneapolis Restaurant Owner Opened Her Doors for Protesters Seeking Refuge: ‘Come In, Come In’",,https://www.reddit.com/r/UpliftingNews/comments/1r21eqn/minneapolis_restaurant_owner_opened_her_doors_for/,1848
1r0sv5z,"Pope Leo sends 80 generators, thousands of medical supplies to Ukraine",,https://www.reddit.com/r/UpliftingNews/comments/1r0sv5z/pope_leo_sends_80_generators_thousands_of_medical/,2199
1rj3dpp,Common anti-seizure drug prevents Alzheimer’s plaques from forming,,https://www.reddit.com/r/UpliftingNews/comments/1rj3dpp/common_antiseizure_drug_prevents_alzheimers/,1474
1qvsb1r,111 child marriages prevented in Punjab in a year,,https://www.reddit.com/r/UpliftingNews/comments/1qvsb1r/111_child_marriages_prevented_in_punjab_in_a_year/,1962
1qxdmxe,"As the ozone layer heals, so too does public faith in science-led collaboration. It shows that collective decisions grounded in evidence can achieve measurable results within a single generation. Global environmental restoration is possible when nations commit to shared goals.",,https://www.reddit.com/r/UpliftingNews/comments/1qxdmxe/as_the_ozone_layer_heals_so_too_does_public_faith/,1217
1r0bfjx,‘The Librarians’: Meet the heroes fighting against conservative book bans in the South,,https://www.reddit.com/r/UpliftingNews/comments/1r0bfjx/the_librarians_meet_the_heroes_fighting_against/,1486
1r3qyxz,Global Momentum Builds to End Female Genital Mutilation,,https://www.reddit.com/r/UpliftingNews/comments/1r3qyxz/global_momentum_builds_to_end_female_genital/,1693
1r289iu,A 410-pound manatee rescued from a Florida storm drain is now recovering at SeaWorld Orlando,,https://www.reddit.com/r/UpliftingNews/comments/1r289iu/a_410pound_manatee_rescued_from_a_florida_storm/,1347
1r11gr8,Norway to phase out fast-growing ‘Frankenchickens’ by 2027,,https://www.reddit.com/r/UpliftingNews/comments/1r11gr8/norway_to_phase_out_fastgrowing_frankenchickens/,909
1qw6cg9,Austin Appelbee's incredible tale of survival has made international headlines. How did the 13yo do it?,,https://www.reddit.com/r/UpliftingNews/comments/1qw6cg9/austin_appelbees_incredible_tale_of_survival_has/,1338
1rjzl16,US Supreme Court declines to hear dispute over copyrights for AI-generated material,,https://www.reddit.com/r/UpliftingNews/comments/1rjzl16/us_supreme_court_declines_to_hear_dispute_over/,840
1r6t7yn,"EVs are always cleaner than gas cars. That includes vehicle production and disposal, the impact of manufacturing batteries and generating power to charge them. An electric truck with a 300-mile range emits 37% less CO2 than an gas-only small car over the course of its life.",,https://www.reddit.com/r/UpliftingNews/comments/1r6t7yn/evs_are_always_cleaner_than_gas_cars_that/,576
1r835n5,Marshall Islands Experience Explosion of Wildlife One Year After Invasive Rats Were Removed,,https://www.reddit.com/r/UpliftingNews/comments/1r835n5/marshall_islands_experience_explosion_of_wildlife/,990
1r3ijdf,"After 1,600 years underwater, remains of the Lighthouse of Alexandria emerge",,https://www.reddit.com/r/UpliftingNews/comments/1r3ijdf/after_1600_years_underwater_remains_of_the/,440
1re6tzd,'I just burst into tears': 400yo viola found after five year search,,https://www.reddit.com/r/UpliftingNews/comments/1re6tzd/i_just_burst_into_tears_400yo_viola_found_after/,384
1rg51x2,Novartis settles with Henrietta Lacks' estate over use of her 'stolen' cells to advance medicine,,https://www.reddit.com/r/UpliftingNews/comments/1rg51x2/novartis_settles_with_henrietta_lacks_estate_over/,336
1rjv6ec,"Something Surprising Happens When Bus Rides Are Free: a cascade of benefits, from easing traffic to promoting public safety. But from the author's personal experience as a lawyer, it clears junk cases from the court system and decriminalizes poverty",,https://www.reddit.com/r/UpliftingNews/comments/1rjv6ec/something_surprising_happens_when_bus_rides_are/,755
1r2uswn,"New law in Brazil allows pets to be buried in their owners' family graves, in recognition of the ""emotional bond"" between them",,https://www.reddit.com/r/UpliftingNews/comments/1r2uswn/new_law_in_brazil_allows_pets_to_be_buried_in/,980
1rjpx9m,James Webb spots a galaxy with tentacles in deep space,,https://www.reddit.com/r/UpliftingNews/comments/1rjpx9m/james_webb_spots_a_galaxy_with_tentacles_in_deep/,1097
1r8e0zw,"Universal child care clears NM House, heads back to Senate for final approval",,https://www.reddit.com/r/UpliftingNews/comments/1r8e0zw/universal_child_care_clears_nm_house_heads_back/,736
1rdxvea,Famous bald eagles Jackie and Shadow welcome third egg after losing first two,,https://www.reddit.com/r/UpliftingNews/comments/1rdxvea/famous_bald_eagles_jackie_and_shadow_welcome/,313
1riwdtr,A Wireless Chip in the Eye Restores Sight to Blind Patients The Future of Medicine Is Here,,https://www.reddit.com/r/UpliftingNews/comments/1riwdtr/a_wireless_chip_in_the_eye_restores_sight_to/,850
1rcundn,Younger people reflect on untapped 'wealth of knowledge' in intergenerational friendships,,https://www.reddit.com/r/UpliftingNews/comments/1rcundn/younger_people_reflect_on_untapped_wealth_of/,298
1rl17d2,"James Harrison, an Australian blood plasma donor. Known as ""The Man with the Golden Arm"", his unusual plasma composition has been used to cure Rhesus disease. He has made over 1,100 donations in his lifetime. The donations have saved over 2.5 million babies",,https://www.reddit.com/r/UpliftingNews/comments/1rl17d2/james_harrison_an_australian_blood_plasma_donor/,760
1qzg2jv,"On his deathbed, lifelong fox lover Colin gets a visit from Ben a rescue fox.",,https://www.reddit.com/r/UpliftingNews/comments/1qzg2jv/on_his_deathbed_lifelong_fox_lover_colin_gets_a/,318
1r9f1j8,"Universal vaccine for cold, flu, COVID and allergies moves a step closer, scientists say",,https://www.reddit.com/r/UpliftingNews/comments/1r9f1j8/universal_vaccine_for_cold_flu_covid_and/,285
1qvsnx3,"Ohio bill would require bars, restaurants to offer date rape drug testing kit",,https://www.reddit.com/r/UpliftingNews/comments/1qvsnx3/ohio_bill_would_require_bars_restaurants_to_offer/,341
1r9rxsy,Younger Generations Are Becoming Noticeably More Mindful,,https://www.reddit.com/r/UpliftingNews/comments/1r9rxsy/younger_generations_are_becoming_noticeably_more/,780
