id,title,selftext,permalink,score
1sh0zjg,4-day workweek advocates gain momentum as new study reveals 5th day is basically useless,,https://www.reddit.com/r/UpliftingNews/comments/1sh0zjg/4day_workweek_advocates_gain_momentum_as_new/,30785
1sauhun,Sickle cell disease has just been cured for the first time in New York,,https://www.reddit.com/r/UpliftingNews/comments/1sauhun/sickle_cell_disease_has_just_been_cured_for_the/,27247
1sy57y2,‘Jurassic Park’ Star Sam Neill Says He’s Now Cancer-Free After Chemo Stopped Working: ‘It Looked Like I Was on the Way Out’,,https://www.reddit.com/r/UpliftingNews/comments/1sy57y2/jurassic_park_star_sam_neill_says_hes_now/,23609
1snerex,NPR receives $113 million in charitable gifts - two of the largest donations it has ever received,,https://www.reddit.com/r/UpliftingNews/comments/1snerex/npr_receives_113_million_in_charitable_gifts_two/,20657
1sh4tit,Mexico's President Sheinbaum Decrees Universal Healthcare for 120 Million | the deep dive,,https://www.reddit.com/r/UpliftingNews/comments/1sh4tit/mexicos_president_sheinbaum_decrees_universal/,18579
1sg49og,Chicago Turns All Public School IDs Into Library Cards To Boost Student Access,,https://www.reddit.com/r/UpliftingNews/comments/1sg49og/chicago_turns_all_public_school_ids_into_library/,16743
1sz0oxm,Hilton Donates Unserved White House Correspondents' Dinner Lobsters and Steaks to Local Shelters,,https://www.reddit.com/r/UpliftingNews/comments/1sz0oxm/hilton_donates_unserved_white_house/,14324
1sv50ug,California becomes first state to require folic acid in corn masa flour to help prevent birth defects,,https://www.reddit.com/r/UpliftingNews/comments/1sv50ug/california_becomes_first_state_to_require_folic/,12957
1sid8us,"After family and police unable to contact 91-year-old woman, officers enter her home, only to find her preoccupied in her bedroom trying to beat her record in video game",,https://www.reddit.com/r/UpliftingNews/comments/1sid8us/after_family_and_police_unable_to_contact/,11304
1sf0o2u,"Canada now requires food that has too much salt, sugar, or fat to put a high contrast warning label on the front (not the back) of packaging. This helps people access the information faster, instead of having to turn the package around and go through the detailed nutrition list.",,https://www.reddit.com/r/UpliftingNews/comments/1sf0o2u/canada_now_requires_food_that_has_too_much_salt/,10092
1sn3xmi,Steve Guttenberg broke into elderly couple's home and carried them out during Palisades fire: 'They hated me',,https://www.reddit.com/r/UpliftingNews/comments/1sn3xmi/steve_guttenberg_broke_into_elderly_couples_home/,8787
1soo56f,"Stop Killing Games delivers ""absolutely incredible"" hearing in European Parliament: ""There was no [parliament member] that wasn't responding positively. Even the commission was pretty positive. There's a long road ahead, but the momentum is real.""",,https://www.reddit.com/r/UpliftingNews/comments/1soo56f/stop_killing_games_delivers_absolutely_incredible/,8141
1szep1s,Pizza Hut's 'BOOK IT!' Summer Reading Program Returns to Provide Voracious Young Readers with Pizza Parties and More,,https://www.reddit.com/r/UpliftingNews/comments/1szep1s/pizza_huts_book_it_summer_reading_program_returns/,7023
1sg63m9,Man unexpectedly cured of HIV after stem cell transplant,,https://www.reddit.com/r/UpliftingNews/comments/1sg63m9/man_unexpectedly_cured_of_hiv_after_stem_cell/,5989
1sxfrel,"After 20 years of declining numbers, indie booksellers in the U.S. have come ‘roaring back’",,https://www.reddit.com/r/UpliftingNews/comments/1sxfrel/after_20_years_of_declining_numbers_indie/,5885
1t064k3,Mayo Clinic AI helps specialists detect pancreatic cancer up to 3 years before diagnosis in landmark validation study,,https://www.reddit.com/r/UpliftingNews/comments/1t064k3/mayo_clinic_ai_helps_specialists_detect/,4952
1sdlpn2,Woman Diagnosed with Sickle Cell Disease at 2 Months Old Wakes Up with No Pain for the First Time in Her Life After New Treatment,,https://www.reddit.com/r/UpliftingNews/comments/1sdlpn2/woman_diagnosed_with_sickle_cell_disease_at_2/,4614
1srm1g7,Eminem Celebrates 18 Years of Sobriety After Near-Fatal Overdose in 2007,,https://www.reddit.com/r/UpliftingNews/comments/1srm1g7/eminem_celebrates_18_years_of_sobriety_after/,3659
1sugl93,More than 50 countries attending: Nations gather for first-ever conference on fossil fuel exit,,https://www.reddit.com/r/UpliftingNews/comments/1sugl93/more_than_50_countries_attending_nations_gather/,3922
1spb7gl,"Global chocolate industry secures a sustainable future: Cell suspension culture technology can produce 1 ton of cocoa butter annually in a 1000 liter bioreactor from a single bean, which would otherwise require about a hectare of cocoa trees. Texture, melt profile and sensory experience are the same",,https://www.reddit.com/r/UpliftingNews/comments/1spb7gl/global_chocolate_industry_secures_a_sustainable/,2848
1sbbe6x,"Decades after poaching drove them extinct, rhinos are back in the wild in Uganda",,https://www.reddit.com/r/UpliftingNews/comments/1sbbe6x/decades_after_poaching_drove_them_extinct_rhinos/,3307
1ss2xhq,"A natural extract from moringa tree seeds removes 98% of microplastics from drinking water, outperforming chemical treatments. And you can make it at home.",,https://www.reddit.com/r/UpliftingNews/comments/1ss2xhq/a_natural_extract_from_moringa_tree_seeds_removes/,2284
1t0t2y4,Breakthrough Bowel Cancer Trial Leaves Patients Cancer-Free for Nearly 3 Years,,https://www.reddit.com/r/UpliftingNews/comments/1t0t2y4/breakthrough_bowel_cancer_trial_leaves_patients/,2331
1sgod3w,The global suicide rate has fallen by 40% since 1995,,https://www.reddit.com/r/UpliftingNews/comments/1sgod3w/the_global_suicide_rate_has_fallen_by_40_since/,2372
1se321p,Scientists may have found a way to keep your bones strong for life,,https://www.reddit.com/r/UpliftingNews/comments/1se321p/scientists_may_have_found_a_way_to_keep_your/,1709
1sy5i45,'Jurassic Park' star Sam Neill is cancer-free due to new drug,,https://www.reddit.com/r/UpliftingNews/comments/1sy5i45/jurassic_park_star_sam_neill_is_cancerfree_due_to/,2017
1sv2hci,Aspirin can reduce the risk of cancer - and we're starting to understand why,,https://www.reddit.com/r/UpliftingNews/comments/1sv2hci/aspirin_can_reduce_the_risk_of_cancer_and_were/,1765
1se96ob,Man who had been struggling with chronic hiccups for 20 years has them completely resolve three months after pulsed radiofrequency treatment: report,,https://www.reddit.com/r/UpliftingNews/comments/1se96ob/man_who_had_been_struggling_with_chronic_hiccups/,1481
1sk6xn3,"'It's incredible, like science fiction': How a new wave of immunotherapy is eliminating cancers",,https://www.reddit.com/r/UpliftingNews/comments/1sk6xn3/its_incredible_like_science_fiction_how_a_new/,1329
1sc80ex,"30,000 trees planted to create Isle of Man temperate rainforest",,https://www.reddit.com/r/UpliftingNews/comments/1sc80ex/30000_trees_planted_to_create_isle_of_man/,1518
1spz4tf,Hero principal who tackled school shooter is crowned prom king,,https://www.reddit.com/r/UpliftingNews/comments/1spz4tf/hero_principal_who_tackled_school_shooter_is/,1180
1ssie90,Scientists Find Way to Reverse Fatty Liver Disease Without Changing Diet,,https://www.reddit.com/r/UpliftingNews/comments/1ssie90/scientists_find_way_to_reverse_fatty_liver/,1405
1slol45,"Fluoride in drinking water has no negative effect on IQ or cognitive function, study says",,https://www.reddit.com/r/UpliftingNews/comments/1slol45/fluoride_in_drinking_water_has_no_negative_effect/,1360
1smf1j9,Police were called for a welfare check on a 91 year old woman only to find her playing video games (she was trying to beat her record!),,https://www.reddit.com/r/UpliftingNews/comments/1smf1j9/police_were_called_for_a_welfare_check_on_a_91/,592
1su17a2,"No selfies, no phones: Why wildlife destinations are starting to say 'no' to tourists",,https://www.reddit.com/r/UpliftingNews/comments/1su17a2/no_selfies_no_phones_why_wildlife_destinations/,1336
1swgwnt,UK solar generation hits record 15 GW as gas falls to historic low,,https://www.reddit.com/r/UpliftingNews/comments/1swgwnt/uk_solar_generation_hits_record_15_gw_as_gas/,1117
1saozm1,"Canada has now fully rolled out a government funded dental plan to pay for non-cosmetic dental care for low income Canadians. The cutoff is gradual instead of all at once, so people aren't discouraged from increasing their income beyond a certain point.",,https://www.reddit.com/r/UpliftingNews/comments/1saozm1/canada_has_now_fully_rolled_out_a_government/,865
1skk0fu,Coffee Shop Says Other Cafes Can ‘Steal’ Its Bestselling Latte Recipe. Hundreds of Them Have,,https://www.reddit.com/r/UpliftingNews/comments/1skk0fu/coffee_shop_says_other_cafes_can_steal_its/,566
1sgqz38,"Teen birth rates hit another historical low in 2025, CDC says",,https://www.reddit.com/r/UpliftingNews/comments/1sgqz38/teen_birth_rates_hit_another_historical_low_in/,1132
1stpsm3,Six-year-old girl has sight restored by breakthrough therapy,,https://www.reddit.com/r/UpliftingNews/comments/1stpsm3/sixyearold_girl_has_sight_restored_by/,1134
1svnuip,These UC Berkeley Students Are Leading the Fight Against Phones -- They’re deleting their social media accounts and reducing their screen time. And they want you to join them.,,https://www.reddit.com/r/UpliftingNews/comments/1svnuip/these_uc_berkeley_students_are_leading_the_fight/,1147
1skxbqz,Person functionally cured of HIV after bone marrow transplant from sibling,,https://www.reddit.com/r/UpliftingNews/comments/1skxbqz/person_functionally_cured_of_hiv_after_bone/,590
1st1k8u,Bowel cancer immunotherapy clinical trial follow-up shows zero relapses,,https://www.reddit.com/r/UpliftingNews/comments/1st1k8u/bowel_cancer_immunotherapy_clinical_trial/,936
1sobl54,Study finds U.S. sewage and manure could supply $5.7B worth of farm nutrients,,https://www.reddit.com/r/UpliftingNews/comments/1sobl54/study_finds_us_sewage_and_manure_could_supply_57b/,478
1sc99jw,Law to make it illegal to lie in elections passed in Senedd,,https://www.reddit.com/r/UpliftingNews/comments/1sc99jw/law_to_make_it_illegal_to_lie_in_elections_passed/,219
1si0a7g,Naturally Occurring Bacteria Completely Eradicate Tumors in Mice With a Single Dose,,https://www.reddit.com/r/UpliftingNews/comments/1si0a7g/naturally_occurring_bacteria_completely_eradicate/,508
1sq5osu,"Peter is the last living speaker of the First Nations language Thiinma. When he met linguist Rosie, they used music to help keep his knowledge alive, and formed a beautiful friendship along the way.",,https://www.reddit.com/r/UpliftingNews/comments/1sq5osu/peter_is_the_last_living_speaker_of_the_first/,1048
1t0b5gm,"CATL will start mass producing sodium-ion batteries with 175Wh/kg in 2026, after solving manufacturing challenges. They perform well in freezing conditions, offering ranges of 600 km for EVs. Their price should be 30% lower than LFP, as they don’t require lithium or other scarce battery minerals",,https://www.reddit.com/r/UpliftingNews/comments/1t0b5gm/catl_will_start_mass_producing_sodiumion/,583
1sfo7gb,Johns Hopkins Scientists Develop Nasal DNA Vaccine for Tuberculosis,,https://www.reddit.com/r/UpliftingNews/comments/1sfo7gb/johns_hopkins_scientists_develop_nasal_dna/,928
1sg1lqs,Pair of GOP anti-abortion bills draw vetoes from Democratic Kansas governor,,https://www.reddit.com/r/UpliftingNews/comments/1sg1lqs/pair_of_gop_antiabortion_bills_draw_vetoes_from/,1024
