id,title,selftext,permalink,score
1rgkn46,Croatia declared free of landmines after 31 years,,https://www.reddit.com/r/UpliftingNews/comments/1rgkn46/croatia_declared_free_of_landmines_after_31_years/,31960
1rrvxod,"'Millionaires tax' receives Senate confirmation, heads to governor's desk: Both the House and Senate passed the ""millionaires tax"" bill imposing a 9.9% tax on high earners, stirring debate on future tax reform in Washington.",,https://www.reddit.com/r/UpliftingNews/comments/1rrvxod/millionaires_tax_receives_senate_confirmation/,28024
1r6jzme,Indonesia bans elephant rides nationwide in major win for animal welfare.,,https://www.reddit.com/r/UpliftingNews/comments/1r6jzme/indonesia_bans_elephant_rides_nationwide_in_major/,24180
1rjnlb2,"Mexico's Supreme Court sets key precedent by recognizing that any inhabitant or user of an ecosystem can file an environmental injunction to demand its protection, even without proving direct individual harm, laying groundwork for communities across the country to defend their natural resources",,https://www.reddit.com/r/UpliftingNews/comments/1rjnlb2/mexicos_supreme_court_sets_key_precedent_by/,21365
1rs50yf,Native American tribes in the West are trying — and succeeding — in getting ancestral lands back,,https://www.reddit.com/r/UpliftingNews/comments/1rs50yf/native_american_tribes_in_the_west_are_trying_and/,19478
1rr5hmh,Lords a-leaving: Britain is ejecting hereditary nobles from Parliament after 700 years,,https://www.reddit.com/r/UpliftingNews/comments/1rr5hmh/lords_aleaving_britain_is_ejecting_hereditary/,17173
1rhv63n,Sex workers at Nevada brothel fight for the first unionization,,https://www.reddit.com/r/UpliftingNews/comments/1rhv63n/sex_workers_at_nevada_brothel_fight_for_the_first/,14692
1r9r504,Japan: Mystery donor gives $3.6m of gold to fix Osaka water system,,https://www.reddit.com/r/UpliftingNews/comments/1r9r504/japan_mystery_donor_gives_36m_of_gold_to_fix/,13281
1rl6o7e,Wife Used ‘Find My iPhone’ to Locate Husband Who Was Buried for Over 4 Hours After Avalanche,,https://www.reddit.com/r/UpliftingNews/comments/1rl6o7e/wife_used_find_my_iphone_to_locate_husband_who/,12111
1rlqeja,Mexico Introduces Legislation to Federally Ban Octopus Farming,,https://www.reddit.com/r/UpliftingNews/comments/1rlqeja/mexico_introduces_legislation_to_federally_ban/,10448
1rqrbq5,Scientists may have found a pill for sleep apnea,,https://www.reddit.com/r/UpliftingNews/comments/1rqrbq5/scientists_may_have_found_a_pill_for_sleep_apnea/,9583
1rlhm17,New United Airlines policy requires headphones,,https://www.reddit.com/r/UpliftingNews/comments/1rlhm17/new_united_airlines_policy_requires_headphones/,8559
1rdmuru,India set to launch free nationwide HPV vaccination for adolescent girls,,https://www.reddit.com/r/UpliftingNews/comments/1rdmuru/india_set_to_launch_free_nationwide_hpv/,7481
1rgodtr,Denmark becomes first country in the European Union to eliminate mother-to-child transmission of HIV and syphilis,,https://www.reddit.com/r/UpliftingNews/comments/1rgodtr/denmark_becomes_first_country_in_the_european/,6296
1req46a,South Korea Birth Rate Rises 6.8%,,https://www.reddit.com/r/UpliftingNews/comments/1req46a/south_korea_birth_rate_rises_68/,5592
1rbo1ca,Millions of New York City workers entitled to more time off as new law takes effect Sunday,,https://www.reddit.com/r/UpliftingNews/comments/1rbo1ca/millions_of_new_york_city_workers_entitled_to/,5028
1rilcpb,"University of Waterloo researchers have successfully engineered soil bacteria to ""eat"" cancer tumors from the inside out. The bacteria target the oxygen-starved core of tumors, leaving healthy, oxygen-rich tissue completely untouched",,https://www.reddit.com/r/UpliftingNews/comments/1rilcpb/university_of_waterloo_researchers_have/,4198
1r5u3t5,"EVs are already making your air cleaner, research shows. Across nearly 1,700 ZIP codes, the analysis showed that, for every increase of 200 electric vehicles, nitrogen dioxide emissions decreased by 1.1 percent.",,https://www.reddit.com/r/UpliftingNews/comments/1r5u3t5/evs_are_already_making_your_air_cleaner_research/,4532
1rfl66j,A children's hospital is renamed for Dolly Parton and hopes to transform pediatric care in Tennessee,,https://www.reddit.com/r/UpliftingNews/comments/1rfl66j/a_childrens_hospital_is_renamed_for_dolly_parton/,3443
1rj3dpp,Common anti-seizure drug prevents Alzheimer’s plaques from forming,,https://www.reddit.com/r/UpliftingNews/comments/1rj3dpp/common_antiseizure_drug_prevents_alzheimers/,3107
1rmysxx,Japan approves stem-cell treatment for Parkinson's in world first,,https://www.reddit.com/r/UpliftingNews/comments/1rmysxx/japan_approves_stemcell_treatment_for_parkinsons/,3258
1rq1u9s,Universal child care program fully footing the bill for working New Mexican families enshrined into law,,https://www.reddit.com/r/UpliftingNews/comments/1rq1u9s/universal_child_care_program_fully_footing_the/,2331
1ro6dq7,Satellites are exposing weak bridges in America and around the world,,https://www.reddit.com/r/UpliftingNews/comments/1ro6dq7/satellites_are_exposing_weak_bridges_in_america/,2391
1rnv1gp,A 5-year-old boy was left alone in a hospital on the day of his heart surgery. His anesthesiologist adopted him.,,https://www.reddit.com/r/UpliftingNews/comments/1rnv1gp/a_5yearold_boy_was_left_alone_in_a_hospital_on/,2237
1rsllmh,"All games with loot boxes in them will be rated minimum PEGI 16, starting this summer | Meaning they can’t legally be sold to children 15 or under in the UK or any other European country which has adopted PEGI ratings into its legislation",,https://www.reddit.com/r/UpliftingNews/comments/1rsllmh/all_games_with_loot_boxes_in_them_will_be_rated/,1870
1rjzl16,US Supreme Court declines to hear dispute over copyrights for AI-generated material,,https://www.reddit.com/r/UpliftingNews/comments/1rjzl16/us_supreme_court_declines_to_hear_dispute_over/,1492
1r6t7yn,"EVs are always cleaner than gas cars. That includes vehicle production and disposal, the impact of manufacturing batteries and generating power to charge them. An electric truck with a 300-mile range emits 37% less CO2 than an gas-only small car over the course of its life.",,https://www.reddit.com/r/UpliftingNews/comments/1r6t7yn/evs_are_always_cleaner_than_gas_cars_that/,1454
1rugv9t,"America’s Smoking Habit Just Hit a Wild Milestone That Once Seemed Impossible. The adult smoking rate reached a record low in 2024, new research shows.",,https://www.reddit.com/r/UpliftingNews/comments/1rugv9t/americas_smoking_habit_just_hit_a_wild_milestone/,1345
1r835n5,Marshall Islands Experience Explosion of Wildlife One Year After Invasive Rats Were Removed,,https://www.reddit.com/r/UpliftingNews/comments/1r835n5/marshall_islands_experience_explosion_of_wildlife/,1539
1rp1agu,Paris Hilton Launches Recovery Fund for Women Business Owners After Disasters,,https://www.reddit.com/r/UpliftingNews/comments/1rp1agu/paris_hilton_launches_recovery_fund_for_women/,1536
1re6tzd,'I just burst into tears': 400yo viola found after five year search,,https://www.reddit.com/r/UpliftingNews/comments/1re6tzd/i_just_burst_into_tears_400yo_viola_found_after/,1416
1rg51x2,Novartis settles with Henrietta Lacks' estate over use of her 'stolen' cells to advance medicine,,https://www.reddit.com/r/UpliftingNews/comments/1rg51x2/novartis_settles_with_henrietta_lacks_estate_over/,1076
1ruthfx,"Nine Years, Eight Versions of “Golden,” and One Historic Oscar: ‘KPop Demon Hunters’ Becomes the First Korean Film to Win Best Animated Feature",,https://www.reddit.com/r/UpliftingNews/comments/1ruthfx/nine_years_eight_versions_of_golden_and_one/,1156
1rjv6ec,"Something Surprising Happens When Bus Rides Are Free: a cascade of benefits, from easing traffic to promoting public safety. But from the author's personal experience as a lawyer, it clears junk cases from the court system and decriminalizes poverty",,https://www.reddit.com/r/UpliftingNews/comments/1rjv6ec/something_surprising_happens_when_bus_rides_are/,691
1rsicye,Lost Doctor Who episodes found in 'eclectic' collection,,https://www.reddit.com/r/UpliftingNews/comments/1rsicye/lost_doctor_who_episodes_found_in_eclectic/,1147
1rqfl51,"Alabama Father, 99, and Son, 80, Become First Ever Pair to Redeem Decades-Old Promise of Free Oysters at Local Oyster House",,https://www.reddit.com/r/UpliftingNews/comments/1rqfl51/alabama_father_99_and_son_80_become_first_ever/,561
1rmaw08,New Toothpaste Stops Gum Disease Without Harming Healthy Bacteria,,https://www.reddit.com/r/UpliftingNews/comments/1rmaw08/new_toothpaste_stops_gum_disease_without_harming/,834
1ruv3r1,"Ryan Coogler Wins First Oscar, Becomes Only the Second Black Writer to Take Best Original Screenplay",,https://www.reddit.com/r/UpliftingNews/comments/1ruv3r1/ryan_coogler_wins_first_oscar_becomes_only_the/,377
1rjpx9m,James Webb spots a galaxy with tentacles in deep space,,https://www.reddit.com/r/UpliftingNews/comments/1rjpx9m/james_webb_spots_a_galaxy_with_tentacles_in_deep/,782
1r8e0zw,"Universal child care clears NM House, heads back to Senate for final approval",,https://www.reddit.com/r/UpliftingNews/comments/1r8e0zw/universal_child_care_clears_nm_house_heads_back/,436
1rdxvea,Famous bald eagles Jackie and Shadow welcome third egg after losing first two,,https://www.reddit.com/r/UpliftingNews/comments/1rdxvea/famous_bald_eagles_jackie_and_shadow_welcome/,790
1riwdtr,A Wireless Chip in the Eye Restores Sight to Blind Patients The Future of Medicine Is Here,,https://www.reddit.com/r/UpliftingNews/comments/1riwdtr/a_wireless_chip_in_the_eye_restores_sight_to/,688
1rl17d2,"James Harrison, an Australian blood plasma donor. Known as ""The Man with the Golden Arm"", his unusual plasma composition has been used to cure Rhesus disease. He has made over 1,100 donations in his lifetime. The donations have saved over 2.5 million babies",,https://www.reddit.com/r/UpliftingNews/comments/1rl17d2/james_harrison_an_australian_blood_plasma_donor/,764
1rcundn,Younger people reflect on untapped 'wealth of knowledge' in intergenerational friendships,,https://www.reddit.com/r/UpliftingNews/comments/1rcundn/younger_people_reflect_on_untapped_wealth_of/,943
1rttpe5,Rescue dog Rosie’s cancer shrinks after world-first mRNA vaccine,,https://www.reddit.com/r/UpliftingNews/comments/1rttpe5/rescue_dog_rosies_cancer_shrinks_after_worldfirst/,807
1rolmg3,"Border collie rejected as a sheepdog finds “dream job” as life-drawing model, bringing joy and creativity to strangers.",,https://www.reddit.com/r/UpliftingNews/comments/1rolmg3/border_collie_rejected_as_a_sheepdog_finds_dream/,864
1r9f1j8,"Universal vaccine for cold, flu, COVID and allergies moves a step closer, scientists say",,https://www.reddit.com/r/UpliftingNews/comments/1r9f1j8/universal_vaccine_for_cold_flu_covid_and/,923
1r9rxsy,Younger Generations Are Becoming Noticeably More Mindful,,https://www.reddit.com/r/UpliftingNews/comments/1r9rxsy/younger_generations_are_becoming_noticeably_more/,639
1r5rf33,China has planted so many trees around the Taklamakan Desert that it's turned this 'biological void' into a carbon sink,,https://www.reddit.com/r/UpliftingNews/comments/1r5rf33/china_has_planted_so_many_trees_around_the/,1023
1ra1wfg,New Mexico's historic move to give universal child care to parents in the state is paid for by an oil and gas windfall | Fortune,,https://www.reddit.com/r/UpliftingNews/comments/1ra1wfg/new_mexicos_historic_move_to_give_universal_child/,476
