id,title,selftext,permalink,score
1qtpulu,"Goodbye to the idea that solar panels “die” after 25 years: New Swiss study shows real-world performance after 3 decades still over 80%, average annual loss about 0.25%, thermal stress and quality key factors. Their long-term economics are better than many people assume",,https://www.reddit.com/r/UpliftingNews/comments/1qtpulu/goodbye_to_the_idea_that_solar_panels_die_after/,27068
1rgkn46,Croatia declared free of landmines after 31 years,,https://www.reddit.com/r/UpliftingNews/comments/1rgkn46/croatia_declared_free_of_landmines_after_31_years/,24183
1qsoml1,"Steve Martin and Martin Short Pause Comedy Show to Honor Catherine O’Hara: ‘“Catherine O’Hara, I met when she was 18 years of age, and all these years later, she has been the greatest, most brilliant, kindest, sweetest angel that any of us worked with,” said Short alongside Martin.",,https://www.reddit.com/r/UpliftingNews/comments/1qsoml1/steve_martin_and_martin_short_pause_comedy_show/,21153
1qu9qls,US judge allows last of five offshore wind projects halted by Trump to proceed,,https://www.reddit.com/r/UpliftingNews/comments/1qu9qls/us_judge_allows_last_of_five_offshore_wind/,18673
1qza3ax,California introduces bill to cap ticket re-sale prices,,https://www.reddit.com/r/UpliftingNews/comments/1qza3ax/california_introduces_bill_to_cap_ticket_resale/,16790
1r6jzme,Indonesia bans elephant rides nationwide in major win for animal welfare.,,https://www.reddit.com/r/UpliftingNews/comments/1r6jzme/indonesia_bans_elephant_rides_nationwide_in_major/,14452
1r1tjjn,"Monks complete 2,300-mile walk for peace to Washington",,https://www.reddit.com/r/UpliftingNews/comments/1r1tjjn/monks_complete_2300mile_walk_for_peace_to/,12469
1r9r504,Japan: Mystery donor gives $3.6m of gold to fix Osaka water system,,https://www.reddit.com/r/UpliftingNews/comments/1r9r504/japan_mystery_donor_gives_36m_of_gold_to_fix/,11085
1qs55t6,The city of Los Angeles votes to ban single-use printer cartridges,,https://www.reddit.com/r/UpliftingNews/comments/1qs55t6/the_city_of_los_angeles_votes_to_ban_singleuse/,9679
1qzt9o7,A Couple Invited Bad Bunny to Their Wedding. They Just Got Married During His Super Bowl Halftime Show,,https://www.reddit.com/r/UpliftingNews/comments/1qzt9o7/a_couple_invited_bad_bunny_to_their_wedding_they/,8948
1qwqq3z,Bill Nye to Receive Lifetime Achievement Honor at the 4th Annual Children’s & Family Emmy Awards,,https://www.reddit.com/r/UpliftingNews/comments/1qwqq3z/bill_nye_to_receive_lifetime_achievement_honor_at/,7845
1rhat0g,Elizabeth Warren to introduces bill to bring back Direct File (reversing Trump ending Direct File),,https://www.reddit.com/r/UpliftingNews/comments/1rhat0g/elizabeth_warren_to_introduces_bill_to_bring_back/,6798
1qt441n,"'Going home': Liam Conejo Ramos, 5, and father arrive in Minneapolis after release from detention center",,https://www.reddit.com/r/UpliftingNews/comments/1qt441n/going_home_liam_conejo_ramos_5_and_father_arrive/,6365
1r2ypqw,"China’s carbon dioxide (CO2) emissions have now been ‘flat or falling’ for 21 months, as growth in energy storage capacity and clean-power output topped the increases in peak and total electricity demand, respectively, and transportation got cleaner, exceeding official targets",,https://www.reddit.com/r/UpliftingNews/comments/1r2ypqw/chinas_carbon_dioxide_co2_emissions_have_now_been/,5757
1rdmuru,India set to launch free nationwide HPV vaccination for adolescent girls,,https://www.reddit.com/r/UpliftingNews/comments/1rdmuru/india_set_to_launch_free_nationwide_hpv/,4943
1r1dkdr,Somalia welcomes its first bowling alley as the middle class and diaspora returnees grow,,https://www.reddit.com/r/UpliftingNews/comments/1r1dkdr/somalia_welcomes_its_first_bowling_alley_as_the/,4538
1rbo1ca,Millions of New York City workers entitled to more time off as new law takes effect Sunday,,https://www.reddit.com/r/UpliftingNews/comments/1rbo1ca/millions_of_new_york_city_workers_entitled_to/,3620
1qz2bqz,Twin Cities tow truck driver returns abandoned vehicles to families after ICE arrests,,https://www.reddit.com/r/UpliftingNews/comments/1qz2bqz/twin_cities_tow_truck_driver_returns_abandoned/,3384
1rgodtr,Denmark becomes first country in the European Union to eliminate mother-to-child transmission of HIV and syphilis,,https://www.reddit.com/r/UpliftingNews/comments/1rgodtr/denmark_becomes_first_country_in_the_european/,2934
1req46a,South Korea Birth Rate Rises 6.8%,,https://www.reddit.com/r/UpliftingNews/comments/1req46a/south_korea_birth_rate_rises_68/,3158
1r5u3t5,"EVs are already making your air cleaner, research shows. Across nearly 1,700 ZIP codes, the analysis showed that, for every increase of 200 electric vehicles, nitrogen dioxide emissions decreased by 1.1 percent.",,https://www.reddit.com/r/UpliftingNews/comments/1r5u3t5/evs_are_already_making_your_air_cleaner_research/,2795
1r21eqn,"Minneapolis Restaurant Owner Opened Her Doors for Protesters Seeking Refuge: ‘Come In, Come In’",,https://www.reddit.com/r/UpliftingNews/comments/1r21eqn/minneapolis_restaurant_owner_opened_her_doors_for/,1995
1r0sv5z,"Pope Leo sends 80 generators, thousands of medical supplies to Ukraine",,https://www.reddit.com/r/UpliftingNews/comments/1r0sv5z/pope_leo_sends_80_generators_thousands_of_medical/,1885
1rfl66j,A children's hospital is renamed for Dolly Parton and hopes to transform pediatric care in Tennessee,,https://www.reddit.com/r/UpliftingNews/comments/1rfl66j/a_childrens_hospital_is_renamed_for_dolly_parton/,2278
1qvsb1r,111 child marriages prevented in Punjab in a year,,https://www.reddit.com/r/UpliftingNews/comments/1qvsb1r/111_child_marriages_prevented_in_punjab_in_a_year/,1889
1qxdmxe,"As the ozone layer heals, so too does public faith in science-led collaboration. It shows that collective decisions grounded in evidence can achieve measurable results within a single generation. Global environmental restoration is possible when nations commit to shared goals.",,https://www.reddit.com/r/UpliftingNews/comments/1qxdmxe/as_the_ozone_layer_heals_so_too_does_public_faith/,1632
1r0bfjx,‘The Librarians’: Meet the heroes fighting against conservative book bans in the South,,https://www.reddit.com/r/UpliftingNews/comments/1r0bfjx/the_librarians_meet_the_heroes_fighting_against/,1735
1r3qyxz,Global Momentum Builds to End Female Genital Mutilation,,https://www.reddit.com/r/UpliftingNews/comments/1r3qyxz/global_momentum_builds_to_end_female_genital/,1485
1r289iu,A 410-pound manatee rescued from a Florida storm drain is now recovering at SeaWorld Orlando,,https://www.reddit.com/r/UpliftingNews/comments/1r289iu/a_410pound_manatee_rescued_from_a_florida_storm/,841
1r11gr8,Norway to phase out fast-growing ‘Frankenchickens’ by 2027,,https://www.reddit.com/r/UpliftingNews/comments/1r11gr8/norway_to_phase_out_fastgrowing_frankenchickens/,1615
1qw6cg9,Austin Appelbee's incredible tale of survival has made international headlines. How did the 13yo do it?,,https://www.reddit.com/r/UpliftingNews/comments/1qw6cg9/austin_appelbees_incredible_tale_of_survival_has/,895
1r6t7yn,"EVs are always cleaner than gas cars. That includes vehicle production and disposal, the impact of manufacturing batteries and generating power to charge them. An electric truck with a 300-mile range emits 37% less CO2 than an gas-only small car over the course of its life.",,https://www.reddit.com/r/UpliftingNews/comments/1r6t7yn/evs_are_always_cleaner_than_gas_cars_that/,1045
1r835n5,Marshall Islands Experience Explosion of Wildlife One Year After Invasive Rats Were Removed,,https://www.reddit.com/r/UpliftingNews/comments/1r835n5/marshall_islands_experience_explosion_of_wildlife/,907
1r3ijdf,"After 1,600 years underwater, remains of the Lighthouse of Alexandria emerge",,https://www.reddit.com/r/UpliftingNews/comments/1r3ijdf/after_1600_years_underwater_remains_of_the/,822
1re6tzd,'I just burst into tears': 400yo viola found after five year search,,https://www.reddit.com/r/UpliftingNews/comments/1re6tzd/i_just_burst_into_tears_400yo_viola_found_after/,746
1rg51x2,Novartis settles with Henrietta Lacks' estate over use of her 'stolen' cells to advance medicine,,https://www.reddit.com/r/UpliftingNews/comments/1rg51x2/novartis_settles_with_henrietta_lacks_estate_over/,1030
1quctpe,"Banning lead in gasoline worked. Analysis of 100 years of hair samples shows lead levels were ~100× higher before environmental regulations. Removing lead from fuel and paint dramatically reduced human exposure, protecting brain development and public health.",,https://www.reddit.com/r/UpliftingNews/comments/1quctpe/banning_lead_in_gasoline_worked_analysis_of_100/,1085
1r2uswn,"New law in Brazil allows pets to be buried in their owners' family graves, in recognition of the ""emotional bond"" between them",,https://www.reddit.com/r/UpliftingNews/comments/1r2uswn/new_law_in_brazil_allows_pets_to_be_buried_in/,1185
1qtnl18,"Korean American singer EJAE was an aspiring K-pop star, she never debuted; her agency let her contract run out. EJAE co-wrote and recorded demos for the chart-topping soundtrack-its uplifting anthem, “Golden- in the ""Kpop Demon Hunters"" Netflix original movie, which won a Golden Globe in January.",,https://www.reddit.com/r/UpliftingNews/comments/1qtnl18/korean_american_singer_ejae_was_an_aspiring_kpop/,795
1r8e0zw,"Universal child care clears NM House, heads back to Senate for final approval",,https://www.reddit.com/r/UpliftingNews/comments/1r8e0zw/universal_child_care_clears_nm_house_heads_back/,456
1rdxvea,Famous bald eagles Jackie and Shadow welcome third egg after losing first two,,https://www.reddit.com/r/UpliftingNews/comments/1rdxvea/famous_bald_eagles_jackie_and_shadow_welcome/,539
1rcundn,Younger people reflect on untapped 'wealth of knowledge' in intergenerational friendships,,https://www.reddit.com/r/UpliftingNews/comments/1rcundn/younger_people_reflect_on_untapped_wealth_of/,675
1qzg2jv,"On his deathbed, lifelong fox lover Colin gets a visit from Ben a rescue fox.",,https://www.reddit.com/r/UpliftingNews/comments/1qzg2jv/on_his_deathbed_lifelong_fox_lover_colin_gets_a/,893
1r9f1j8,"Universal vaccine for cold, flu, COVID and allergies moves a step closer, scientists say",,https://www.reddit.com/r/UpliftingNews/comments/1r9f1j8/universal_vaccine_for_cold_flu_covid_and/,594
1qtvjqt,Teenager makes 'superhuman' swim to save family swept out to sea,,https://www.reddit.com/r/UpliftingNews/comments/1qtvjqt/teenager_makes_superhuman_swim_to_save_family/,576
1qv7ef3,Buddhist monks reach Richmond on 100th day of Walk for Peace,,https://www.reddit.com/r/UpliftingNews/comments/1qv7ef3/buddhist_monks_reach_richmond_on_100th_day_of/,968
1qvsnx3,"Ohio bill would require bars, restaurants to offer date rape drug testing kit",,https://www.reddit.com/r/UpliftingNews/comments/1qvsnx3/ohio_bill_would_require_bars_restaurants_to_offer/,438
1r9rxsy,Younger Generations Are Becoming Noticeably More Mindful,,https://www.reddit.com/r/UpliftingNews/comments/1r9rxsy/younger_generations_are_becoming_noticeably_more/,548
1r5rf33,China has planted so many trees around the Taklamakan Desert that it's turned this 'biological void' into a carbon sink,,https://www.reddit.com/r/UpliftingNews/comments/1r5rf33/china_has_planted_so_many_trees_around_the/,225
1rgpuw2,Cards Against Humanity Gives You Your Fucking Money Back,,https://www.reddit.com/r/UpliftingNews/comments/1rgpuw2/cards_against_humanity_gives_you_your_fucking/,399
