id,title,selftext,permalink,score
1sh0zjg,4-day workweek advocates gain momentum as new study reveals 5th day is basically useless,,https://www.reddit.com/r/UpliftingNews/comments/1sh0zjg/4day_workweek_advocates_gain_momentum_as_new/,21215
1sauhun,Sickle cell disease has just been cured for the first time in New York,,https://www.reddit.com/r/UpliftingNews/comments/1sauhun/sickle_cell_disease_has_just_been_cured_for_the/,18901
1snerex,NPR receives $113 million in charitable gifts - two of the largest donations it has ever received,,https://www.reddit.com/r/UpliftingNews/comments/1snerex/npr_receives_113_million_in_charitable_gifts_two/,16785
1sh4tit,Mexico's President Sheinbaum Decrees Universal Healthcare for 120 Million | the deep dive,,https://www.reddit.com/r/UpliftingNews/comments/1sh4tit/mexicos_president_sheinbaum_decrees_universal/,14911
1s5s2ta,Scientists uncovered the nutrients bees were missing — Colonies surged 15-fold,,https://www.reddit.com/r/UpliftingNews/comments/1s5s2ta/scientists_uncovered_the_nutrients_bees_were/,13299
1sg49og,Chicago Turns All Public School IDs Into Library Cards To Boost Student Access,,https://www.reddit.com/r/UpliftingNews/comments/1sg49og/chicago_turns_all_public_school_ids_into_library/,11781
1s3m9t7,Woman who never stopped updating her lost dog's chip reunites with him after 11 years,,https://www.reddit.com/r/UpliftingNews/comments/1s3m9t7/woman_who_never_stopped_updating_her_lost_dogs/,10498
1s9nqb9,"Sweden goes back to basics, swapping screens for books in the classroom in attempt to reverse declines in reading, math, and science.",,https://www.reddit.com/r/UpliftingNews/comments/1s9nqb9/sweden_goes_back_to_basics_swapping_screens_for/,8667
1s511t3,"United Airlines, flight attendants reach tentative labor deal for first top pay raises of $100 an hour at the end of the contract, pay for flight attendants during boarding and “a signing bonus for every flight attendant worth a total of $740 million,” since the Covid-19 pandemic",,https://www.reddit.com/r/UpliftingNews/comments/1s511t3/united_airlines_flight_attendants_reach_tentative/,8173
1s3dikt,"Wikipedia has banned AI-generated text, with two exceptions",,https://www.reddit.com/r/UpliftingNews/comments/1s3dikt/wikipedia_has_banned_aigenerated_text_with_two/,7122
1sid8us,"After family and police unable to contact 91-year-old woman, officers enter her home, only to find her preoccupied in her bedroom trying to beat her record in video game",,https://www.reddit.com/r/UpliftingNews/comments/1sid8us/after_family_and_police_unable_to_contact/,6636
1sf0o2u,"Canada now requires food that has too much salt, sugar, or fat to put a high contrast warning label on the front (not the back) of packaging. This helps people access the information faster, instead of having to turn the package around and go through the detailed nutrition list.",,https://www.reddit.com/r/UpliftingNews/comments/1sf0o2u/canada_now_requires_food_that_has_too_much_salt/,5995
1sn3xmi,Steve Guttenberg broke into elderly couple's home and carried them out during Palisades fire: 'They hated me',,https://www.reddit.com/r/UpliftingNews/comments/1sn3xmi/steve_guttenberg_broke_into_elderly_couples_home/,5122
1soo56f,"Stop Killing Games delivers ""absolutely incredible"" hearing in European Parliament: ""There was no [parliament member] that wasn't responding positively. Even the commission was pretty positive. There's a long road ahead, but the momentum is real.""",,https://www.reddit.com/r/UpliftingNews/comments/1soo56f/stop_killing_games_delivers_absolutely_incredible/,4151
1s7323m,U.S. adult smoking rates hit a record low,,https://www.reddit.com/r/UpliftingNews/comments/1s7323m/us_adult_smoking_rates_hit_a_record_low/,3843
1sg63m9,Man unexpectedly cured of HIV after stem cell transplant,,https://www.reddit.com/r/UpliftingNews/comments/1sg63m9/man_unexpectedly_cured_of_hiv_after_stem_cell/,3606
1sdlpn2,Woman Diagnosed with Sickle Cell Disease at 2 Months Old Wakes Up with No Pain for the First Time in Her Life After New Treatment,,https://www.reddit.com/r/UpliftingNews/comments/1sdlpn2/woman_diagnosed_with_sickle_cell_disease_at_2/,3001
1srm1g7,Eminem Celebrates 18 Years of Sobriety After Near-Fatal Overdose in 2007,,https://www.reddit.com/r/UpliftingNews/comments/1srm1g7/eminem_celebrates_18_years_of_sobriety_after/,3204
1spb7gl,"Global chocolate industry secures a sustainable future: Cell suspension culture technology can produce 1 ton of cocoa butter annually in a 1000 liter bioreactor from a single bean, which would otherwise require about a hectare of cocoa trees. Texture, melt profile and sensory experience are the same",,https://www.reddit.com/r/UpliftingNews/comments/1spb7gl/global_chocolate_industry_secures_a_sustainable/,2844
1sbbe6x,"Decades after poaching drove them extinct, rhinos are back in the wild in Uganda",,https://www.reddit.com/r/UpliftingNews/comments/1sbbe6x/decades_after_poaching_drove_them_extinct_rhinos/,2086
1ss2xhq,"A natural extract from moringa tree seeds removes 98% of microplastics from drinking water, outperforming chemical treatments. And you can make it at home.",,https://www.reddit.com/r/UpliftingNews/comments/1ss2xhq/a_natural_extract_from_moringa_tree_seeds_removes/,1856
1sgod3w,The global suicide rate has fallen by 40% since 1995,,https://www.reddit.com/r/UpliftingNews/comments/1sgod3w/the_global_suicide_rate_has_fallen_by_40_since/,2085
1s975s3,Judge blocks executive order to end federal funding for PBS and NPR,,https://www.reddit.com/r/UpliftingNews/comments/1s975s3/judge_blocks_executive_order_to_end_federal/,1607
1se321p,Scientists may have found a way to keep your bones strong for life,,https://www.reddit.com/r/UpliftingNews/comments/1se321p/scientists_may_have_found_a_way_to_keep_your/,1535
1s81t2v,Shingles vaccine drastically cuts heart risk nearly in half in new study,,https://www.reddit.com/r/UpliftingNews/comments/1s81t2v/shingles_vaccine_drastically_cuts_heart_risk/,1267
1se96ob,Man who had been struggling with chronic hiccups for 20 years has them completely resolve three months after pulsed radiofrequency treatment: report,,https://www.reddit.com/r/UpliftingNews/comments/1se96ob/man_who_had_been_struggling_with_chronic_hiccups/,1183
1sk6xn3,"'It's incredible, like science fiction': How a new wave of immunotherapy is eliminating cancers",,https://www.reddit.com/r/UpliftingNews/comments/1sk6xn3/its_incredible_like_science_fiction_how_a_new/,882
1sc80ex,"30,000 trees planted to create Isle of Man temperate rainforest",,https://www.reddit.com/r/UpliftingNews/comments/1sc80ex/30000_trees_planted_to_create_isle_of_man/,1535
1spz4tf,Hero principal who tackled school shooter is crowned prom king,,https://www.reddit.com/r/UpliftingNews/comments/1spz4tf/hero_principal_who_tackled_school_shooter_is/,1342
1ssie90,Scientists Find Way to Reverse Fatty Liver Disease Without Changing Diet,,https://www.reddit.com/r/UpliftingNews/comments/1ssie90/scientists_find_way_to_reverse_fatty_liver/,1201
1s708nh,Solar is winning the energy race,,https://www.reddit.com/r/UpliftingNews/comments/1s708nh/solar_is_winning_the_energy_race/,1124
1slol45,"Fluoride in drinking water has no negative effect on IQ or cognitive function, study says",,https://www.reddit.com/r/UpliftingNews/comments/1slol45/fluoride_in_drinking_water_has_no_negative_effect/,1082
1smf1j9,Police were called for a welfare check on a 91 year old woman only to find her playing video games (she was trying to beat her record!),,https://www.reddit.com/r/UpliftingNews/comments/1smf1j9/police_were_called_for_a_welfare_check_on_a_91/,1319
1s7o3c4,Full network of clitoral nerves mapped out for first time,,https://www.reddit.com/r/UpliftingNews/comments/1s7o3c4/full_network_of_clitoral_nerves_mapped_out_for/,452
1s5gi39,Scientists Have Discovered a Protein That Reverses Brain Aging in The Lab,,https://www.reddit.com/r/UpliftingNews/comments/1s5gi39/scientists_have_discovered_a_protein_that/,865
1s9vzvj,"After Man’s Death Following Insurance Denials, West Virginia Tackles Prior Authorization",,https://www.reddit.com/r/UpliftingNews/comments/1s9vzvj/after_mans_death_following_insurance_denials_west/,789
1saozm1,"Canada has now fully rolled out a government funded dental plan to pay for non-cosmetic dental care for low income Canadians. The cutoff is gradual instead of all at once, so people aren't discouraged from increasing their income beyond a certain point.",,https://www.reddit.com/r/UpliftingNews/comments/1saozm1/canada_has_now_fully_rolled_out_a_government/,1031
1skk0fu,Coffee Shop Says Other Cafes Can ‘Steal’ Its Bestselling Latte Recipe. Hundreds of Them Have,,https://www.reddit.com/r/UpliftingNews/comments/1skk0fu/coffee_shop_says_other_cafes_can_steal_its/,574
1sgqz38,"Teen birth rates hit another historical low in 2025, CDC says",,https://www.reddit.com/r/UpliftingNews/comments/1sgqz38/teen_birth_rates_hit_another_historical_low_in/,923
1skxbqz,Person functionally cured of HIV after bone marrow transplant from sibling,,https://www.reddit.com/r/UpliftingNews/comments/1skxbqz/person_functionally_cured_of_hiv_after_bone/,634
1sobl54,Study finds U.S. sewage and manure could supply $5.7B worth of farm nutrients,,https://www.reddit.com/r/UpliftingNews/comments/1sobl54/study_finds_us_sewage_and_manure_could_supply_57b/,275
1sc99jw,Law to make it illegal to lie in elections passed in Senedd,,https://www.reddit.com/r/UpliftingNews/comments/1sc99jw/law_to_make_it_illegal_to_lie_in_elections_passed/,660
1si0a7g,Naturally Occurring Bacteria Completely Eradicate Tumors in Mice With a Single Dose,,https://www.reddit.com/r/UpliftingNews/comments/1si0a7g/naturally_occurring_bacteria_completely_eradicate/,907
1st1k8u,Bowel cancer immunotherapy clinical trial follow-up shows zero relapses,,https://www.reddit.com/r/UpliftingNews/comments/1st1k8u/bowel_cancer_immunotherapy_clinical_trial/,562
1sq5osu,"Peter is the last living speaker of the First Nations language Thiinma. When he met linguist Rosie, they used music to help keep his knowledge alive, and formed a beautiful friendship along the way.",,https://www.reddit.com/r/UpliftingNews/comments/1sq5osu/peter_is_the_last_living_speaker_of_the_first/,584
1s9j8so,Scientists achieve ‘impossible’ solar efficiency in renewables breakthrough,,https://www.reddit.com/r/UpliftingNews/comments/1s9j8so/scientists_achieve_impossible_solar_efficiency_in/,702
1sfo7gb,Johns Hopkins Scientists Develop Nasal DNA Vaccine for Tuberculosis,,https://www.reddit.com/r/UpliftingNews/comments/1sfo7gb/johns_hopkins_scientists_develop_nasal_dna/,196
1sg1lqs,Pair of GOP anti-abortion bills draw vetoes from Democratic Kansas governor,,https://www.reddit.com/r/UpliftingNews/comments/1sg1lqs/pair_of_gop_antiabortion_bills_draw_vetoes_from/,696
1shyyi8,‘A dream come true’: Brazil’s blue-and-yellow macaws return to Rio after 200 years,,https://www.reddit.com/r/UpliftingNews/comments/1shyyi8/a_dream_come_true_brazils_blueandyellow_macaws/,261
1s8bnwy,"A supermarket on an island on Orkney, an archipelago north of mainland Scotland, is giving away bananas! They somehow accidentally ordered 38000 but meant 380kg. Heavy winds and ferry problems meant they couldn't just return some. They're being sent to the schools, communities and smaller islands.",,https://www.reddit.com/r/UpliftingNews/comments/1s8bnwy/a_supermarket_on_an_island_on_orkney_an/,550
