id,title,selftext,permalink,score
1rgkn46,Croatia declared free of landmines after 31 years,,https://www.reddit.com/r/UpliftingNews/comments/1rgkn46/croatia_declared_free_of_landmines_after_31_years/,32407
1s03rx1,"Mexico’s monarch butterfly population jumps 64%, offering hope for at-risk species",,https://www.reddit.com/r/UpliftingNews/comments/1s03rx1/mexicos_monarch_butterfly_population_jumps_64/,28574
1ry0ftd,'Mister Rogers' Neighborhood' Getting YouTube Channel For First Time,,https://www.reddit.com/r/UpliftingNews/comments/1ry0ftd/mister_rogers_neighborhood_getting_youtube/,24589
1rwz747,Scientists inject one tumor and watch cancer vanish across the body,,https://www.reddit.com/r/UpliftingNews/comments/1rwz747/scientists_inject_one_tumor_and_watch_cancer/,22461
1rjnlb2,"Mexico's Supreme Court sets key precedent by recognizing that any inhabitant or user of an ecosystem can file an environmental injunction to demand its protection, even without proving direct individual harm, laying groundwork for communities across the country to defend their natural resources",,https://www.reddit.com/r/UpliftingNews/comments/1rjnlb2/mexicos_supreme_court_sets_key_precedent_by/,19151
1rs50yf,Native American tribes in the West are trying — and succeeding — in getting ancestral lands back,,https://www.reddit.com/r/UpliftingNews/comments/1rs50yf/native_american_tribes_in_the_west_are_trying_and/,17553
1rr5hmh,Lords a-leaving: Britain is ejecting hereditary nobles from Parliament after 700 years,,https://www.reddit.com/r/UpliftingNews/comments/1rr5hmh/lords_aleaving_britain_is_ejecting_hereditary/,15592
1rhv63n,Sex workers at Nevada brothel fight for the first unionization,,https://www.reddit.com/r/UpliftingNews/comments/1rhv63n/sex_workers_at_nevada_brothel_fight_for_the_first/,13603
1s1gai9,Scientists discover Alzheimer’s hidden “death switch” in the brain,,https://www.reddit.com/r/UpliftingNews/comments/1s1gai9/scientists_discover_alzheimers_hidden_death/,11623
1rl6o7e,Wife Used ‘Find My iPhone’ to Locate Husband Who Was Buried for Over 4 Hours After Avalanche,,https://www.reddit.com/r/UpliftingNews/comments/1rl6o7e/wife_used_find_my_iphone_to_locate_husband_who/,10922
1rlqeja,Mexico Introduces Legislation to Federally Ban Octopus Farming,,https://www.reddit.com/r/UpliftingNews/comments/1rlqeja/mexico_introduces_legislation_to_federally_ban/,9251
1s119e3,"After floods devastated their village, these Welsh neighbours planted tens of thousands of trees and built “leaky dams” by hand, protecting homes, fighting climate change, and caring for future generations.",,https://www.reddit.com/r/UpliftingNews/comments/1s119e3/after_floods_devastated_their_village_these_welsh/,8495
1rqrbq5,Scientists may have found a pill for sleep apnea,,https://www.reddit.com/r/UpliftingNews/comments/1rqrbq5/scientists_may_have_found_a_pill_for_sleep_apnea/,7448
1rlhm17,New United Airlines policy requires headphones,,https://www.reddit.com/r/UpliftingNews/comments/1rlhm17/new_united_airlines_policy_requires_headphones/,6824
1rdmuru,India set to launch free nationwide HPV vaccination for adolescent girls,,https://www.reddit.com/r/UpliftingNews/comments/1rdmuru/india_set_to_launch_free_nationwide_hpv/,5451
1rgodtr,Denmark becomes first country in the European Union to eliminate mother-to-child transmission of HIV and syphilis,,https://www.reddit.com/r/UpliftingNews/comments/1rgodtr/denmark_becomes_first_country_in_the_european/,5539
1req46a,South Korea Birth Rate Rises 6.8%,,https://www.reddit.com/r/UpliftingNews/comments/1req46a/south_korea_birth_rate_rises_68/,5051
1rilcpb,"University of Waterloo researchers have successfully engineered soil bacteria to ""eat"" cancer tumors from the inside out. The bacteria target the oxygen-starved core of tumors, leaving healthy, oxygen-rich tissue completely untouched",,https://www.reddit.com/r/UpliftingNews/comments/1rilcpb/university_of_waterloo_researchers_have/,4067
1rx3b6m,Luke Combs Hopes His Song 'Whoever You Turn Out to Be' Resonates with Parents of Queer Children,,https://www.reddit.com/r/UpliftingNews/comments/1rx3b6m/luke_combs_hopes_his_song_whoever_you_turn_out_to/,4131
1rfl66j,A children's hospital is renamed for Dolly Parton and hopes to transform pediatric care in Tennessee,,https://www.reddit.com/r/UpliftingNews/comments/1rfl66j/a_childrens_hospital_is_renamed_for_dolly_parton/,3013
1rxywgv,"From Scotland and California to Pennsylvania and Australia to Canada, golf courses are being rewilded, reaping some big rewards for biodiversity and local people. Many countries across the world, including the UK and the US, use far more land for golf courses than they do for wind or solar energy",,https://www.reddit.com/r/UpliftingNews/comments/1rxywgv/from_scotland_and_california_to_pennsylvania_and/,2845
1rxdm8e,Cat who was signed over for euthanasia due to intestinal blockage is now recovering and showing healthy appetite after veterinarians remove 26 hair ties during surgery,,https://www.reddit.com/r/UpliftingNews/comments/1rxdm8e/cat_who_was_signed_over_for_euthanasia_due_to/,3058
1s1qgly,‘A miracle’: Canadian flight attendant ejected from plane survives New York crash,,https://www.reddit.com/r/UpliftingNews/comments/1s1qgly/a_miracle_canadian_flight_attendant_ejected_from/,2136
1rj3dpp,Common anti-seizure drug prevents Alzheimer’s plaques from forming,,https://www.reddit.com/r/UpliftingNews/comments/1rj3dpp/common_antiseizure_drug_prevents_alzheimers/,2387
1rwemf3,Paid Sick Days (40 hours/yr minimum) Bill Passes both Houses of the Virginia General Assembly,,https://www.reddit.com/r/UpliftingNews/comments/1rwemf3/paid_sick_days_40_hoursyr_minimum_bill_passes/,2270
1rmysxx,Japan approves stem-cell treatment for Parkinson's in world first,,https://www.reddit.com/r/UpliftingNews/comments/1rmysxx/japan_approves_stemcell_treatment_for_parkinsons/,1773
1rq1u9s,Universal child care program fully footing the bill for working New Mexican families enshrined into law,,https://www.reddit.com/r/UpliftingNews/comments/1rq1u9s/universal_child_care_program_fully_footing_the/,1243
1rxglg1,CERN Discovers New Particle After Upgrading Large Hadron Collider,,https://www.reddit.com/r/UpliftingNews/comments/1rxglg1/cern_discovers_new_particle_after_upgrading_large/,1755
1ro6dq7,Satellites are exposing weak bridges in America and around the world,,https://www.reddit.com/r/UpliftingNews/comments/1ro6dq7/satellites_are_exposing_weak_bridges_in_america/,1582
1rnv1gp,A 5-year-old boy was left alone in a hospital on the day of his heart surgery. His anesthesiologist adopted him.,,https://www.reddit.com/r/UpliftingNews/comments/1rnv1gp/a_5yearold_boy_was_left_alone_in_a_hospital_on/,1102
1ry8aht,Iran war energy shock sparks global push to reduce fossil fuel dependence,,https://www.reddit.com/r/UpliftingNews/comments/1ry8aht/iran_war_energy_shock_sparks_global_push_to/,1200
1rsllmh,"All games with loot boxes in them will be rated minimum PEGI 16, starting this summer | Meaning they can’t legally be sold to children 15 or under in the UK or any other European country which has adopted PEGI ratings into its legislation",,https://www.reddit.com/r/UpliftingNews/comments/1rsllmh/all_games_with_loot_boxes_in_them_will_be_rated/,760
1rjzl16,US Supreme Court declines to hear dispute over copyrights for AI-generated material,,https://www.reddit.com/r/UpliftingNews/comments/1rjzl16/us_supreme_court_declines_to_hear_dispute_over/,1330
1rugv9t,"America’s Smoking Habit Just Hit a Wild Milestone That Once Seemed Impossible. The adult smoking rate reached a record low in 2024, new research shows.",,https://www.reddit.com/r/UpliftingNews/comments/1rugv9t/americas_smoking_habit_just_hit_a_wild_milestone/,1319
1s2bdca,Scientists Say One Gene Could Be Behind up to 93% of Alzheimer’s Cases,,https://www.reddit.com/r/UpliftingNews/comments/1s2bdca/scientists_say_one_gene_could_be_behind_up_to_93/,508
1rp1agu,Paris Hilton Launches Recovery Fund for Women Business Owners After Disasters,,https://www.reddit.com/r/UpliftingNews/comments/1rp1agu/paris_hilton_launches_recovery_fund_for_women/,529
1s0wfha,"Woman Born Without a Vagina Conceives, Carries Healthy Baby",,https://www.reddit.com/r/UpliftingNews/comments/1s0wfha/woman_born_without_a_vagina_conceives_carries/,655
1re6tzd,'I just burst into tears': 400yo viola found after five year search,,https://www.reddit.com/r/UpliftingNews/comments/1re6tzd/i_just_burst_into_tears_400yo_viola_found_after/,657
1rg51x2,Novartis settles with Henrietta Lacks' estate over use of her 'stolen' cells to advance medicine,,https://www.reddit.com/r/UpliftingNews/comments/1rg51x2/novartis_settles_with_henrietta_lacks_estate_over/,885
1rjv6ec,"Something Surprising Happens When Bus Rides Are Free: a cascade of benefits, from easing traffic to promoting public safety. But from the author's personal experience as a lawyer, it clears junk cases from the court system and decriminalizes poverty",,https://www.reddit.com/r/UpliftingNews/comments/1rjv6ec/something_surprising_happens_when_bus_rides_are/,349
1rw9hy3,"In a major victory for elephants, Indonesia has ended elephant rides, strengthening animal welfare and ethical wildlife tourism.",,https://www.reddit.com/r/UpliftingNews/comments/1rw9hy3/in_a_major_victory_for_elephants_indonesia_has/,725
1rsicye,Lost Doctor Who episodes found in 'eclectic' collection,,https://www.reddit.com/r/UpliftingNews/comments/1rsicye/lost_doctor_who_episodes_found_in_eclectic/,639
1rqfl51,"Alabama Father, 99, and Son, 80, Become First Ever Pair to Redeem Decades-Old Promise of Free Oysters at Local Oyster House",,https://www.reddit.com/r/UpliftingNews/comments/1rqfl51/alabama_father_99_and_son_80_become_first_ever/,402
1rmaw08,New Toothpaste Stops Gum Disease Without Harming Healthy Bacteria,,https://www.reddit.com/r/UpliftingNews/comments/1rmaw08/new_toothpaste_stops_gum_disease_without_harming/,937
1rx8nvl,Electric Vehicles Avoided Use of 2.3 Million Barrels of Oil Daily in 2025,,https://www.reddit.com/r/UpliftingNews/comments/1rx8nvl/electric_vehicles_avoided_use_of_23_million/,587
1rjpx9m,James Webb spots a galaxy with tentacles in deep space,,https://www.reddit.com/r/UpliftingNews/comments/1rjpx9m/james_webb_spots_a_galaxy_with_tentacles_in_deep/,586
1rz3x19,Mexican Senate backs reform to strengthen non-discrimination against LGBTIQ+ community in 28 laws,,https://www.reddit.com/r/UpliftingNews/comments/1rz3x19/mexican_senate_backs_reform_to_strengthen/,779
1rdxvea,Famous bald eagles Jackie and Shadow welcome third egg after losing first two,,https://www.reddit.com/r/UpliftingNews/comments/1rdxvea/famous_bald_eagles_jackie_and_shadow_welcome/,545
1ryu867,Cells can sense 10x farther than expected and it may explain cancer spread,,https://www.reddit.com/r/UpliftingNews/comments/1ryu867/cells_can_sense_10x_farther_than_expected_and_it/,638
1riwdtr,A Wireless Chip in the Eye Restores Sight to Blind Patients The Future of Medicine Is Here,,https://www.reddit.com/r/UpliftingNews/comments/1riwdtr/a_wireless_chip_in_the_eye_restores_sight_to/,310
