id,title,selftext,permalink,score
1sh0zjg,4-day workweek advocates gain momentum as new study reveals 5th day is basically useless,,https://www.reddit.com/r/UpliftingNews/comments/1sh0zjg/4day_workweek_advocates_gain_momentum_as_new/,19589
1sy57y2,‘Jurassic Park’ Star Sam Neill Says He’s Now Cancer-Free After Chemo Stopped Working: ‘It Looked Like I Was on the Way Out’,,https://www.reddit.com/r/UpliftingNews/comments/1sy57y2/jurassic_park_star_sam_neill_says_hes_now/,17191
1snerex,NPR receives $113 million in charitable gifts - two of the largest donations it has ever received,,https://www.reddit.com/r/UpliftingNews/comments/1snerex/npr_receives_113_million_in_charitable_gifts_two/,15462
1t4khia,"Mariska Hargitay’s End The Backlog Campaign Achieves Rape Kit Reform In All 50 States, D.C. & Puerto Rico",,https://www.reddit.com/r/UpliftingNews/comments/1t4khia/mariska_hargitays_end_the_backlog_campaign/,13947
1sh4tit,Mexico's President Sheinbaum Decrees Universal Healthcare for 120 Million | the deep dive,,https://www.reddit.com/r/UpliftingNews/comments/1sh4tit/mexicos_president_sheinbaum_decrees_universal/,12439
1sz0oxm,Hilton Donates Unserved White House Correspondents' Dinner Lobsters and Steaks to Local Shelters,,https://www.reddit.com/r/UpliftingNews/comments/1sz0oxm/hilton_donates_unserved_white_house/,10343
1sv50ug,California becomes first state to require folic acid in corn masa flour to help prevent birth defects,,https://www.reddit.com/r/UpliftingNews/comments/1sv50ug/california_becomes_first_state_to_require_folic/,9314
1sid8us,"After family and police unable to contact 91-year-old woman, officers enter her home, only to find her preoccupied in her bedroom trying to beat her record in video game",,https://www.reddit.com/r/UpliftingNews/comments/1sid8us/after_family_and_police_unable_to_contact/,8515
1t2jsfg,"Doomed to die, one man chose a risky experiment that changed history",,https://www.reddit.com/r/UpliftingNews/comments/1t2jsfg/doomed_to_die_one_man_chose_a_risky_experiment/,7463
1sn3xmi,Steve Guttenberg broke into elderly couple's home and carried them out during Palisades fire: 'They hated me',,https://www.reddit.com/r/UpliftingNews/comments/1sn3xmi/steve_guttenberg_broke_into_elderly_couples_home/,6827
1soo56f,"Stop Killing Games delivers ""absolutely incredible"" hearing in European Parliament: ""There was no [parliament member] that wasn't responding positively. Even the commission was pretty positive. There's a long road ahead, but the momentum is real.""",,https://www.reddit.com/r/UpliftingNews/comments/1soo56f/stop_killing_games_delivers_absolutely_incredible/,5614
1szep1s,Pizza Hut's 'BOOK IT!' Summer Reading Program Returns to Provide Voracious Young Readers with Pizza Parties and More,,https://www.reddit.com/r/UpliftingNews/comments/1szep1s/pizza_huts_book_it_summer_reading_program_returns/,5355
1t7etf7,8-year-old boy credited with stopping Jet2 plane from emergency diversion after singing song to unruly passenger and asking about her kids is given vouchers for free flights,,https://www.reddit.com/r/UpliftingNews/comments/1t7etf7/8yearold_boy_credited_with_stopping_jet2_plane/,4264
1t6567w,Supreme Court restores broad access to abortion pill in major ruling,,https://www.reddit.com/r/UpliftingNews/comments/1t6567w/supreme_court_restores_broad_access_to_abortion/,4288
1sxfrel,"After 20 years of declining numbers, indie booksellers in the U.S. have come ‘roaring back’",,https://www.reddit.com/r/UpliftingNews/comments/1sxfrel/after_20_years_of_declining_numbers_indie/,3978
1t064k3,Mayo Clinic AI helps specialists detect pancreatic cancer up to 3 years before diagnosis in landmark validation study,,https://www.reddit.com/r/UpliftingNews/comments/1t064k3/mayo_clinic_ai_helps_specialists_detect/,3767
1srm1g7,Eminem Celebrates 18 Years of Sobriety After Near-Fatal Overdose in 2007,,https://www.reddit.com/r/UpliftingNews/comments/1srm1g7/eminem_celebrates_18_years_of_sobriety_after/,3318
1t1u7ak,"Colorado will ban pet stores from selling dogs and cats starting January 1, 2027, under new legislation.",,https://www.reddit.com/r/UpliftingNews/comments/1t1u7ak/colorado_will_ban_pet_stores_from_selling_dogs/,2734
1sugl93,More than 50 countries attending: Nations gather for first-ever conference on fossil fuel exit,,https://www.reddit.com/r/UpliftingNews/comments/1sugl93/more_than_50_countries_attending_nations_gather/,2179
1t0t2y4,Breakthrough Bowel Cancer Trial Leaves Patients Cancer-Free for Nearly 3 Years,,https://www.reddit.com/r/UpliftingNews/comments/1t0t2y4/breakthrough_bowel_cancer_trial_leaves_patients/,2198
1spb7gl,"Global chocolate industry secures a sustainable future: Cell suspension culture technology can produce 1 ton of cocoa butter annually in a 1000 liter bioreactor from a single bean, which would otherwise require about a hectare of cocoa trees. Texture, melt profile and sensory experience are the same",,https://www.reddit.com/r/UpliftingNews/comments/1spb7gl/global_chocolate_industry_secures_a_sustainable/,2396
1ss2xhq,"A natural extract from moringa tree seeds removes 98% of microplastics from drinking water, outperforming chemical treatments. And you can make it at home.",,https://www.reddit.com/r/UpliftingNews/comments/1ss2xhq/a_natural_extract_from_moringa_tree_seeds_removes/,2147
1t7rp40,California will give new parents hundreds of free diapers for all newborns born in the state,,https://www.reddit.com/r/UpliftingNews/comments/1t7rp40/california_will_give_new_parents_hundreds_of_free/,2001
1t47k06,New treatment cuts bad cholesterol by nearly 50% without statins,,https://www.reddit.com/r/UpliftingNews/comments/1t47k06/new_treatment_cuts_bad_cholesterol_by_nearly_50/,1137
1sgod3w,The global suicide rate has fallen by 40% since 1995,,https://www.reddit.com/r/UpliftingNews/comments/1sgod3w/the_global_suicide_rate_has_fallen_by_40_since/,1216
1t64ju5,New Desalination Plant Gives San Diego So Much Water it’s Helping Other States Suffering Drought,,https://www.reddit.com/r/UpliftingNews/comments/1t64ju5/new_desalination_plant_gives_san_diego_so_much/,1027
1t5v1gw,"Scientists Discover a Way to Silence the Gene That Keeps Cholesterol High, Cutting Bad Cholesterol by 50% Without a Single Statin",,https://www.reddit.com/r/UpliftingNews/comments/1t5v1gw/scientists_discover_a_way_to_silence_the_gene/,863
1sy5i45,'Jurassic Park' star Sam Neill is cancer-free due to new drug,,https://www.reddit.com/r/UpliftingNews/comments/1sy5i45/jurassic_park_star_sam_neill_is_cancerfree_due_to/,1422
1t2lit1,Minnesota passes ban on fake AI nudes; app makers risk $500K fines,,https://www.reddit.com/r/UpliftingNews/comments/1t2lit1/minnesota_passes_ban_on_fake_ai_nudes_app_makers/,852
1sv2hci,Aspirin can reduce the risk of cancer - and we're starting to understand why,,https://www.reddit.com/r/UpliftingNews/comments/1sv2hci/aspirin_can_reduce_the_risk_of_cancer_and_were/,1181
1sk6xn3,"'It's incredible, like science fiction': How a new wave of immunotherapy is eliminating cancers",,https://www.reddit.com/r/UpliftingNews/comments/1sk6xn3/its_incredible_like_science_fiction_how_a_new/,1317
1spz4tf,Hero principal who tackled school shooter is crowned prom king,,https://www.reddit.com/r/UpliftingNews/comments/1spz4tf/hero_principal_who_tackled_school_shooter_is/,566
1t6k748,'Sweet' dog abandoned at Walmart for 3 days with all its toys finds new home,,https://www.reddit.com/r/UpliftingNews/comments/1t6k748/sweet_dog_abandoned_at_walmart_for_3_days_with/,913
1ssie90,Scientists Find Way to Reverse Fatty Liver Disease Without Changing Diet,,https://www.reddit.com/r/UpliftingNews/comments/1ssie90/scientists_find_way_to_reverse_fatty_liver/,591
1t6moh0,Sally Field Recalls Robin Williams' Kindness on Set of Mrs. Doubtfire After Her Father Died,,https://www.reddit.com/r/UpliftingNews/comments/1t6moh0/sally_field_recalls_robin_williams_kindness_on/,1103
1slol45,"Fluoride in drinking water has no negative effect on IQ or cognitive function, study says",,https://www.reddit.com/r/UpliftingNews/comments/1slol45/fluoride_in_drinking_water_has_no_negative_effect/,850
1smf1j9,Police were called for a welfare check on a 91 year old woman only to find her playing video games (she was trying to beat her record!),,https://www.reddit.com/r/UpliftingNews/comments/1smf1j9/police_were_called_for_a_welfare_check_on_a_91/,1170
1t6781d,Breaking News: Korea Blocks AI-Generated Books From Library Deposits,,https://www.reddit.com/r/UpliftingNews/comments/1t6781d/breaking_news_korea_blocks_aigenerated_books_from/,450
1su17a2,"No selfies, no phones: Why wildlife destinations are starting to say 'no' to tourists",,https://www.reddit.com/r/UpliftingNews/comments/1su17a2/no_selfies_no_phones_why_wildlife_destinations/,273
1swgwnt,UK solar generation hits record 15 GW as gas falls to historic low,,https://www.reddit.com/r/UpliftingNews/comments/1swgwnt/uk_solar_generation_hits_record_15_gw_as_gas/,780
1skk0fu,Coffee Shop Says Other Cafes Can ‘Steal’ Its Bestselling Latte Recipe. Hundreds of Them Have,,https://www.reddit.com/r/UpliftingNews/comments/1skk0fu/coffee_shop_says_other_cafes_can_steal_its/,530
1sgqz38,"Teen birth rates hit another historical low in 2025, CDC says",,https://www.reddit.com/r/UpliftingNews/comments/1sgqz38/teen_birth_rates_hit_another_historical_low_in/,232
1stpsm3,Six-year-old girl has sight restored by breakthrough therapy,,https://www.reddit.com/r/UpliftingNews/comments/1stpsm3/sixyearold_girl_has_sight_restored_by/,377
1svnuip,These UC Berkeley Students Are Leading the Fight Against Phones -- They’re deleting their social media accounts and reducing their screen time. And they want you to join them.,,https://www.reddit.com/r/UpliftingNews/comments/1svnuip/these_uc_berkeley_students_are_leading_the_fight/,563
1t56vz1,"For 80 years she kept his memory alive. Now the grandchildren of the starving POW her parents risked everything to hide have found her, and their bravery is finally honoured.",,https://www.reddit.com/r/UpliftingNews/comments/1t56vz1/for_80_years_she_kept_his_memory_alive_now_the/,770
1skxbqz,Person functionally cured of HIV after bone marrow transplant from sibling,,https://www.reddit.com/r/UpliftingNews/comments/1skxbqz/person_functionally_cured_of_hiv_after_bone/,437
1st1k8u,Bowel cancer immunotherapy clinical trial follow-up shows zero relapses,,https://www.reddit.com/r/UpliftingNews/comments/1st1k8u/bowel_cancer_immunotherapy_clinical_trial/,445
1t0b5gm,"CATL will start mass producing sodium-ion batteries with 175Wh/kg in 2026, after solving manufacturing challenges. They perform well in freezing conditions, offering ranges of 600 km for EVs. Their price should be 30% lower than LFP, as they don’t require lithium or other scarce battery minerals",,https://www.reddit.com/r/UpliftingNews/comments/1t0b5gm/catl_will_start_mass_producing_sodiumion/,849
1sobl54,Study finds U.S. sewage and manure could supply $5.7B worth of farm nutrients,,https://www.reddit.com/r/UpliftingNews/comments/1sobl54/study_finds_us_sewage_and_manure_could_supply_57b/,728
1si0a7g,Naturally Occurring Bacteria Completely Eradicate Tumors in Mice With a Single Dose,,https://www.reddit.com/r/UpliftingNews/comments/1si0a7g/naturally_occurring_bacteria_completely_eradicate/,181
