id,title,selftext,permalink,score
1sh0zjg,4-day workweek advocates gain momentum as new study reveals 5th day is basically useless,,https://www.reddit.com/r/UpliftingNews/comments/1sh0zjg/4day_workweek_advocates_gain_momentum_as_new/,21515
1sauhun,Sickle cell disease has just been cured for the first time in New York,,https://www.reddit.com/r/UpliftingNews/comments/1sauhun/sickle_cell_disease_has_just_been_cured_for_the/,18888
1s03rx1,"Mexico’s monarch butterfly population jumps 64%, offering hope for at-risk species",,https://www.reddit.com/r/UpliftingNews/comments/1s03rx1/mexicos_monarch_butterfly_population_jumps_64/,16613
1ry0ftd,'Mister Rogers' Neighborhood' Getting YouTube Channel For First Time,,https://www.reddit.com/r/UpliftingNews/comments/1ry0ftd/mister_rogers_neighborhood_getting_youtube/,14654
1sh4tit,Mexico's President Sheinbaum Decrees Universal Healthcare for 120 Million | the deep dive,,https://www.reddit.com/r/UpliftingNews/comments/1sh4tit/mexicos_president_sheinbaum_decrees_universal/,12774
1s5s2ta,Scientists uncovered the nutrients bees were missing — Colonies surged 15-fold,,https://www.reddit.com/r/UpliftingNews/comments/1s5s2ta/scientists_uncovered_the_nutrients_bees_were/,11163
1sg49og,Chicago Turns All Public School IDs Into Library Cards To Boost Student Access,,https://www.reddit.com/r/UpliftingNews/comments/1sg49og/chicago_turns_all_public_school_ids_into_library/,9850
1rwz747,Scientists inject one tumor and watch cancer vanish across the body,,https://www.reddit.com/r/UpliftingNews/comments/1rwz747/scientists_inject_one_tumor_and_watch_cancer/,8604
1s3m9t7,Woman who never stopped updating her lost dog's chip reunites with him after 11 years,,https://www.reddit.com/r/UpliftingNews/comments/1s3m9t7/woman_who_never_stopped_updating_her_lost_dogs/,7737
1s9nqb9,"Sweden goes back to basics, swapping screens for books in the classroom in attempt to reverse declines in reading, math, and science.",,https://www.reddit.com/r/UpliftingNews/comments/1s9nqb9/sweden_goes_back_to_basics_swapping_screens_for/,6944
1s511t3,"United Airlines, flight attendants reach tentative labor deal for first top pay raises of $100 an hour at the end of the contract, pay for flight attendants during boarding and “a signing bonus for every flight attendant worth a total of $740 million,” since the Covid-19 pandemic",,https://www.reddit.com/r/UpliftingNews/comments/1s511t3/united_airlines_flight_attendants_reach_tentative/,6301
1s3dikt,"Wikipedia has banned AI-generated text, with two exceptions",,https://www.reddit.com/r/UpliftingNews/comments/1s3dikt/wikipedia_has_banned_aigenerated_text_with_two/,5185
1s1gai9,Scientists discover Alzheimer’s hidden “death switch” in the brain,,https://www.reddit.com/r/UpliftingNews/comments/1s1gai9/scientists_discover_alzheimers_hidden_death/,5227
1sid8us,"After family and police unable to contact 91-year-old woman, officers enter her home, only to find her preoccupied in her bedroom trying to beat her record in video game",,https://www.reddit.com/r/UpliftingNews/comments/1sid8us/after_family_and_police_unable_to_contact/,4384
1sf0o2u,"Canada now requires food that has too much salt, sugar, or fat to put a high contrast warning label on the front (not the back) of packaging. This helps people access the information faster, instead of having to turn the package around and go through the detailed nutrition list.",,https://www.reddit.com/r/UpliftingNews/comments/1sf0o2u/canada_now_requires_food_that_has_too_much_salt/,4418
1s7323m,U.S. adult smoking rates hit a record low,,https://www.reddit.com/r/UpliftingNews/comments/1s7323m/us_adult_smoking_rates_hit_a_record_low/,3573
1sg63m9,Man unexpectedly cured of HIV after stem cell transplant,,https://www.reddit.com/r/UpliftingNews/comments/1sg63m9/man_unexpectedly_cured_of_hiv_after_stem_cell/,2968
1s119e3,"After floods devastated their village, these Welsh neighbours planted tens of thousands of trees and built “leaky dams” by hand, protecting homes, fighting climate change, and caring for future generations.",,https://www.reddit.com/r/UpliftingNews/comments/1s119e3/after_floods_devastated_their_village_these_welsh/,3149
1sdlpn2,Woman Diagnosed with Sickle Cell Disease at 2 Months Old Wakes Up with No Pain for the First Time in Her Life After New Treatment,,https://www.reddit.com/r/UpliftingNews/comments/1sdlpn2/woman_diagnosed_with_sickle_cell_disease_at_2/,2888
1sijyln,Universal Healthcare is now the law in Mexico,,https://www.reddit.com/r/UpliftingNews/comments/1sijyln/universal_healthcare_is_now_the_law_in_mexico/,2336
1sbbe6x,"Decades after poaching drove them extinct, rhinos are back in the wild in Uganda",,https://www.reddit.com/r/UpliftingNews/comments/1sbbe6x/decades_after_poaching_drove_them_extinct_rhinos/,2512
1sgsf83,"Ron DeSantis destroyed Miami Beach's rainbow crosswalk. So they moved it brick-by-brick into a park. 3,606 rainbow pavers were salvaged for the new installation.",,https://www.reddit.com/r/UpliftingNews/comments/1sgsf83/ron_desantis_destroyed_miami_beachs_rainbow/,2199
1rx3b6m,Luke Combs Hopes His Song 'Whoever You Turn Out to Be' Resonates with Parents of Queer Children,,https://www.reddit.com/r/UpliftingNews/comments/1rx3b6m/luke_combs_hopes_his_song_whoever_you_turn_out_to/,1675
1sgod3w,The global suicide rate has fallen by 40% since 1995,,https://www.reddit.com/r/UpliftingNews/comments/1sgod3w/the_global_suicide_rate_has_fallen_by_40_since/,1423
1s975s3,Judge blocks executive order to end federal funding for PBS and NPR,,https://www.reddit.com/r/UpliftingNews/comments/1s975s3/judge_blocks_executive_order_to_end_federal/,1372
1s2wao1,New Mexico Jury says Meta Harms Children's Mental Health and Safety - 375M Judgement | AP News,,https://www.reddit.com/r/UpliftingNews/comments/1s2wao1/new_mexico_jury_says_meta_harms_childrens_mental/,1248
1rxywgv,"From Scotland and California to Pennsylvania and Australia to Canada, golf courses are being rewilded, reaping some big rewards for biodiversity and local people. Many countries across the world, including the UK and the US, use far more land for golf courses than they do for wind or solar energy",,https://www.reddit.com/r/UpliftingNews/comments/1rxywgv/from_scotland_and_california_to_pennsylvania_and/,1434
1se321p,Scientists may have found a way to keep your bones strong for life,,https://www.reddit.com/r/UpliftingNews/comments/1se321p/scientists_may_have_found_a_way_to_keep_your/,1459
1rxdm8e,Cat who was signed over for euthanasia due to intestinal blockage is now recovering and showing healthy appetite after veterinarians remove 26 hair ties during surgery,,https://www.reddit.com/r/UpliftingNews/comments/1rxdm8e/cat_who_was_signed_over_for_euthanasia_due_to/,1047
1s81t2v,Shingles vaccine drastically cuts heart risk nearly in half in new study,,https://www.reddit.com/r/UpliftingNews/comments/1s81t2v/shingles_vaccine_drastically_cuts_heart_risk/,1052
1se96ob,Man who had been struggling with chronic hiccups for 20 years has them completely resolve three months after pulsed radiofrequency treatment: report,,https://www.reddit.com/r/UpliftingNews/comments/1se96ob/man_who_had_been_struggling_with_chronic_hiccups/,932
1sc80ex,"30,000 trees planted to create Isle of Man temperate rainforest",,https://www.reddit.com/r/UpliftingNews/comments/1sc80ex/30000_trees_planted_to_create_isle_of_man/,1336
1sk6xn3,"'It's incredible, like science fiction': How a new wave of immunotherapy is eliminating cancers",,https://www.reddit.com/r/UpliftingNews/comments/1sk6xn3/its_incredible_like_science_fiction_how_a_new/,665
1rwemf3,Paid Sick Days (40 hours/yr minimum) Bill Passes both Houses of the Virginia General Assembly,,https://www.reddit.com/r/UpliftingNews/comments/1rwemf3/paid_sick_days_40_hoursyr_minimum_bill_passes/,636
1rxglg1,CERN Discovers New Particle After Upgrading Large Hadron Collider,,https://www.reddit.com/r/UpliftingNews/comments/1rxglg1/cern_discovers_new_particle_after_upgrading_large/,849
1s708nh,Solar is winning the energy race,,https://www.reddit.com/r/UpliftingNews/comments/1s708nh/solar_is_winning_the_energy_race/,812
1ry8aht,Iran war energy shock sparks global push to reduce fossil fuel dependence,,https://www.reddit.com/r/UpliftingNews/comments/1ry8aht/iran_war_energy_shock_sparks_global_push_to/,967
1s2bdca,Scientists Say One Gene Could Be Behind up to 93% of Alzheimer’s Cases,,https://www.reddit.com/r/UpliftingNews/comments/1s2bdca/scientists_say_one_gene_could_be_behind_up_to_93/,930
1s7o3c4,Full network of clitoral nerves mapped out for first time,,https://www.reddit.com/r/UpliftingNews/comments/1s7o3c4/full_network_of_clitoral_nerves_mapped_out_for/,311
1s5gi39,Scientists Have Discovered a Protein That Reverses Brain Aging in The Lab,,https://www.reddit.com/r/UpliftingNews/comments/1s5gi39/scientists_have_discovered_a_protein_that/,311
1s9vzvj,"After Man’s Death Following Insurance Denials, West Virginia Tackles Prior Authorization",,https://www.reddit.com/r/UpliftingNews/comments/1s9vzvj/after_mans_death_following_insurance_denials_west/,797
1saozm1,"Canada has now fully rolled out a government funded dental plan to pay for non-cosmetic dental care for low income Canadians. The cutoff is gradual instead of all at once, so people aren't discouraged from increasing their income beyond a certain point.",,https://www.reddit.com/r/UpliftingNews/comments/1saozm1/canada_has_now_fully_rolled_out_a_government/,827
1sgqz38,"Teen birth rates hit another historical low in 2025, CDC says",,https://www.reddit.com/r/UpliftingNews/comments/1sgqz38/teen_birth_rates_hit_another_historical_low_in/,713
1s0wfha,"Woman Born Without a Vagina Conceives, Carries Healthy Baby",,https://www.reddit.com/r/UpliftingNews/comments/1s0wfha/woman_born_without_a_vagina_conceives_carries/,700
1skk0fu,Coffee Shop Says Other Cafes Can ‘Steal’ Its Bestselling Latte Recipe. Hundreds of Them Have,,https://www.reddit.com/r/UpliftingNews/comments/1skk0fu/coffee_shop_says_other_cafes_can_steal_its/,771
1sc99jw,Law to make it illegal to lie in elections passed in Senedd,,https://www.reddit.com/r/UpliftingNews/comments/1sc99jw/law_to_make_it_illegal_to_lie_in_elections_passed/,832
1si0a7g,Naturally Occurring Bacteria Completely Eradicate Tumors in Mice With a Single Dose,,https://www.reddit.com/r/UpliftingNews/comments/1si0a7g/naturally_occurring_bacteria_completely_eradicate/,312
1skxbqz,Person functionally cured of HIV after bone marrow transplant from sibling,,https://www.reddit.com/r/UpliftingNews/comments/1skxbqz/person_functionally_cured_of_hiv_after_bone/,348
1s9j8so,Scientists achieve ‘impossible’ solar efficiency in renewables breakthrough,,https://www.reddit.com/r/UpliftingNews/comments/1s9j8so/scientists_achieve_impossible_solar_efficiency_in/,478
1sfo7gb,Johns Hopkins Scientists Develop Nasal DNA Vaccine for Tuberculosis,,https://www.reddit.com/r/UpliftingNews/comments/1sfo7gb/johns_hopkins_scientists_develop_nasal_dna/,187
