id,title,selftext,permalink,score
1ssnwrd,"TIL that US student math and reading scores have dropped so sharply that they’ve erased nearly two decades of progress. In '22/23, avg math scores for 13-year-olds fell to levels not seen since the 1990s, while reading scores for high school seniors hit their lowest point since testing began in '92.",,https://www.reddit.com/r/todayilearned/comments/1ssnwrd/til_that_us_student_math_and_reading_scores_have/,95906
1sxbk1e,"TIL in 1963, a man renovating his home in Turkey noticed his chickens kept disappearing into a crack in his basement wall. When he dug it open, he found the ancient city of Derinkuyu, an 18 level city 85m underground that could shelter 20,000 people.",,https://www.reddit.com/r/todayilearned/comments/1sxbk1e/til_in_1963_a_man_renovating_his_home_in_turkey/,84745
1stjiqr,"TIL That comedian John Olvier turned down an OBE (Order of the British Empire) award because he didn't want his name associated with the words ""British Empire""",,https://www.reddit.com/r/todayilearned/comments/1stjiqr/til_that_comedian_john_olvier_turned_down_an_obe/,74675
1sr8p0k,"TIL Apple co-founder Steve Wozniak gave $10 million of his own stock to early Apple employees in 1980 because it was ""the right thing"" to do. Steve Jobs refused to do the same.",,https://www.reddit.com/r/todayilearned/comments/1sr8p0k/til_apple_cofounder_steve_wozniak_gave_10_million/,65903
1swrcri,"TIL if under-cooked, a popular mushroom in China causes “lilliputian hallucinations,” a rare phenomenon involving miniature human or fantasy figures. The hallucinations are consistent across people and cultures: ""tiny, elflike people"" climbing under doors, scaling walls & clinging to furniture",,https://www.reddit.com/r/todayilearned/comments/1swrcri/til_if_undercooked_a_popular_mushroom_in_china/,57655
1suvjfo,"TIL Shaggy's original voice actor, Casey Kasem, was a vegan and outspoken critic of factory farming. He quit the show in 1995 after being asked to voice Shaggy for a Burger King commercial, and came back after negotiating that Shaggy would become a vegetarian.",,https://www.reddit.com/r/todayilearned/comments/1suvjfo/til_shaggys_original_voice_actor_casey_kasem_was/,50902
1t3w8rq,"TIL when Eminem's weight increased to 230lbs (100 kg) before he became sober, he was so unrecognizable due to the weight gain that Em once overheard two teenagers arguing about whether or not it was actually him that they were looking at, with one of them stating ""Eminem ain't fat.""",,https://www.reddit.com/r/todayilearned/comments/1t3w8rq/til_when_eminems_weight_increased_to_230lbs_100/,44626
1st9vnk,"TIL Gerald Ford's teenage son Steven once sneaked twenty friends to party at the White House and ordered food and drinks, assuming they were free. The next day, his father showed him the bill from the Oval Office and he learned it came out of his salary",,https://www.reddit.com/r/todayilearned/comments/1st9vnk/til_gerald_fords_teenage_son_steven_once_sneaked/,39439
1te8rf3,TIL that Empress Ma was born poor and during a famine she stole cakes to feed her husband by hiding them in her breasts. The cakes were hot and she got burns. Later her husband became a rebel commander who became Emperor and made her his Empress. He was deeply devoted to her even as an Emperor.,,https://www.reddit.com/r/todayilearned/comments/1te8rf3/til_that_empress_ma_was_born_poor_and_during_a/,35178
1ta9osm,"TIL: In 1998, elementary students in Aurora, Colorado started buying slaves in Sudan to free them, this gained global attention with schools in other countries starting slave buyback programs until it became clear that the money was just helping slavery grow",,https://www.reddit.com/r/todayilearned/comments/1ta9osm/til_in_1998_elementary_students_in_aurora/,31089
1t0pkuq,"TIL about ""orphaned negatives""—words like disgruntled, nonchalant, and innocent whose positive counterparts (gruntled, chalant, and nocent) have completely vanished from common usage.",,https://www.reddit.com/r/todayilearned/comments/1t0pkuq/til_about_orphaned_negativeswords_like/,26911
1tf96mm,"TIL a man watching an episode of the ""Antiques Roadshow"" noticed a Navajo blanket, that was similar to one his grandma left him (and had been sitting in his closet for years), be appraised for $300K-$500K. He then got his blanket authenticated and put it up for auction where it sold for $1.5 million",,https://www.reddit.com/r/todayilearned/comments/1tf96mm/til_a_man_watching_an_episode_of_the_antiques/,23617
1t6ow6i,"TIL hikers in the Alps discovered Otzi in 1991, a 5,300-year-old man naturally preserved in ice. Scientists identified his last meal as ibex meat and grains, found over 60 soot tattoos around his joints and spine, and recovered his copper axe, flint knife, a fire-starting kit and grass cloak.",,https://www.reddit.com/r/todayilearned/comments/1t6ow6i/til_hikers_in_the_alps_discovered_otzi_in_1991_a/,21269
1taig7s,"TIL the Mona Lisa’s long-debated identity and creation date were confirmed in 2005 when a German researcher found a verified, handwritten note in the margin of a book stating that Leonardo da Vinci was painting a portrait of Lisa del Giocondo in 1503.",,https://www.reddit.com/r/todayilearned/comments/1taig7s/til_the_mona_lisas_longdebated_identity_and/,18641
1syl9xj,"TIL that 2.4 billion years ago, the evolution of oxygen-producing bacteria caused a mass extinction. Oxygen was toxic to the planet's existing life, and its reaction with methane triggered a ""Snowball Earth"" ice age that lasted 300 million years.",,https://www.reddit.com/r/todayilearned/comments/1syl9xj/til_that_24_billion_years_ago_the_evolution_of/,16539
1t4uanv,TIL in 2007 Katherine Heigl won an Emmy for Outstanding Supporting Actress in a Drama for her role on Grey's Anatomy. But in 2008 she removed herself from Emmy consideration because she said the material she was given on Grey's that year wasn't good enough; this comment led to her leaving the show.,,https://www.reddit.com/r/todayilearned/comments/1t4uanv/til_in_2007_katherine_heigl_won_an_emmy_for/,14797
1tfuca8,"TIL Margot Robbie convinced Martin Scorsese to cast her in The Wolf of Wall Street by hauling off & giving Leonardo DiCaprio an improvised ""thunderclap of a slap on the face"" during her first audition that stunned DiCaprio & Scorsese. Both men burst out laughing afterwards and thought it was great.",,https://www.reddit.com/r/todayilearned/comments/1tfuca8/til_margot_robbie_convinced_martin_scorsese_to/,13008
1t6x606,"TIL scientists have been able to trace the start of HIV/AIDS to King Leopold’s Belgian Congo, originating as far back as 1909. The first person to be infected probably got the virus in the 1920s",,https://www.reddit.com/r/todayilearned/comments/1t6x606/til_scientists_have_been_able_to_trace_the_start/,11565
1t5qcyk,"TIL Krakatoa's eruption was estimated to be at 310 dB, the loudest sound ever. Well above the typical max sound limit of 194 dB",,https://www.reddit.com/r/todayilearned/comments/1t5qcyk/til_krakatoas_eruption_was_estimated_to_be_at_310/,9672
1tdts9u,TIL Groupon has lost more than 95% of its value since it rejected Google's $6 billion offer and instead went public with a $17.8 billion market cap 15 years ago.,,https://www.reddit.com/r/todayilearned/comments/1tdts9u/til_groupon_has_lost_more_than_95_of_its_value/,9005
1t4n65x,"TIL there were 180.000 bees kept in the spires of Notre Dame and they survived the fire. Because bees don’t have lungs they weren’t hurt by the smoke, they just fell asleep",,https://www.reddit.com/r/todayilearned/comments/1t4n65x/til_there_were_180000_bees_kept_in_the_spires_of/,8165
1t0iddb,"TIL about Nzou, a female elephant in a Zimbabwean reserve who shuns other elephants and has been the leader of a buffalo herd for decades. Along the years she has killed many male buffaloes who challenged her leadership.",,https://www.reddit.com/r/todayilearned/comments/1t0iddb/til_about_nzou_a_female_elephant_in_a_zimbabwean/,7273
1t83id1,"TIL : Cold temperatures weaken nasal immunity, making us more vulnerable to viruses. A mere 5°C drop in nasal tissue temperature reduces immune response by nearly half.",,https://www.reddit.com/r/todayilearned/comments/1t83id1/til_cold_temperatures_weaken_nasal_immunity/,6171
1sx5hi4,"TIL that magician Penn Jillette and singer Debbie Harry were once in a hot tub when Harry suggested that the watr jets should be angled for a woman's pleasure. This led to Jillette filing a patent for a ""hydro-therapeutic stimulator,"" which he named ""the Jill-Jet""",,https://www.reddit.com/r/todayilearned/comments/1sx5hi4/til_that_magician_penn_jillette_and_singer_debbie/,5197
1tdjgl7,TIL that China consumes 46% of cigarettes in the entire world at a rate of 2.4 trillion a year.,,https://www.reddit.com/r/todayilearned/comments/1tdjgl7/til_that_china_consumes_46_of_cigarettes_in_the/,4808
1tc4you,"TIL Ostrich farms routinely have difficulties getting male ostriches to breed, because they often find their human caretakers more attractive than female ostriches.",,https://www.reddit.com/r/todayilearned/comments/1tc4you/til_ostrich_farms_routinely_have_difficulties/,4784
1t3gd0h,"TIL Ghana is the world's largest importer of secondhand clothing. Locals refer to it as ""Obroni Wawu,"" or ""Dead White Man's Clothes,"" reflecting a belief that the items are of such high quality that their original owners must have died for them to be discarded.",,https://www.reddit.com/r/todayilearned/comments/1t3gd0h/til_ghana_is_the_worlds_largest_importer_of/,4106
1t9jfya,TIL that the oldest active organization affiliated with New Orleans Mardi Gras hasn't marched in the parade since 1991 because it refuses to let non-white people join.,,https://www.reddit.com/r/todayilearned/comments/1t9jfya/til_that_the_oldest_active_organization/,3760
1sw5qv7,"TIL in August, 2013, thieves broke into a San Bernardino non-profit support group for victims and stole several computer towers and monitors. The next day, the items were returned along with an apology note encouraging the organization to continue making a difference in people's lives.",,https://www.reddit.com/r/todayilearned/comments/1sw5qv7/til_in_august_2013_thieves_broke_into_a_san/,3048
1tervw1,"Til I learned that President Truman was heavily involved with all aspects of his presidential library. He would work 5-6 days a week there, he personally trained staff, he held impromptu press conferences for visiting school children, and even worked the telephone giving directions.",,https://www.reddit.com/r/todayilearned/comments/1tervw1/til_i_learned_that_president_truman_was_heavily/,2807
1tczvpi,TIL that infants who live with dogs at three months of age are 90% less likely to develop a food allergy.,,https://www.reddit.com/r/todayilearned/comments/1tczvpi/til_that_infants_who_live_with_dogs_at_three/,2659
1th8lpe,"TIL about Browser, the library cat. Adopted by a White Settlement, TX library in 2010, Browser was evicted from the library by the local govt in 2016, provoking a backlash that resulted in a unanimous decision permitting him to stay. Browser outlived the councilmember that voted to evict him.",,https://www.reddit.com/r/todayilearned/comments/1th8lpe/til_about_browser_the_library_cat_adopted_by_a/,2700
1t76ivc,TIL that Maria Antonia of Austria had the highest inbreeding coefficient (0.3053) of the House of Habsburg - higher than the child of brother and sister or the child of a parent and their own offspring,,https://www.reddit.com/r/todayilearned/comments/1t76ivc/til_that_maria_antonia_of_austria_had_the_highest/,2191
1stdj80,"TIL that in 2007, Thailand legally issued a compulsory license to make cheap generic versions of Abbott's HIV drug Kaletra. Abbott retaliated by withdrawing 7 medicines from Thailand. Thailand held firm, and HIV treatment coverage expanded to hundreds of thousands more patients.",,https://www.reddit.com/r/todayilearned/comments/1stdj80/til_that_in_2007_thailand_legally_issued_a/,2289
1t7wudu,"TIL of the “spirit effect”, whereby spirit airlines entering a new route would cause other carriers to drop prices, making prices more affordable for regular Americans",,https://www.reddit.com/r/todayilearned/comments/1t7wudu/til_of_the_spirit_effect_whereby_spirit_airlines/,1820
1tb0y9y,"TIL when geologist Marie Tharp identified a giant rift valley running down the Atlantic seafloor in the 1950s—evidence for the then-controversial theory of continental drift—her male colleague dismissed her hypothesis as ""girl talk"" and made her redo all the charts.",,https://www.reddit.com/r/todayilearned/comments/1tb0y9y/til_when_geologist_marie_tharp_identified_a_giant/,1947
1t28m8e,"TIL that the sitcom ALF ends with the titular character being captured by federal agents just as he’s about to return to his home planet, because the show was canceled before it could resolve that cliffhanger.",,https://www.reddit.com/r/todayilearned/comments/1t28m8e/til_that_the_sitcom_alf_ends_with_the_titular/,1561
1sv9b7x,"TIL that the Swedish Navy spent 15 years and millions of dollars tracking what they believed were Russian submarines in their waters. In 1996, civilian scientists finally investigated the acoustic signals and discovered the ""submarines"" were actually just massive schools of herring farting.",,https://www.reddit.com/r/todayilearned/comments/1sv9b7x/til_that_the_swedish_navy_spent_15_years_and/,1007
1tgfv6p,"TIL in 2001 Sharon Stone arranged a private visit to the LA Zoo's komodo dragon pen for her then-husband, who'd always wanted to see one up close. However, the dragon attacked him by biting his foot and attempting to eat it by jerking back & forth. He survived, but the top half of his foot was gone.",,https://www.reddit.com/r/todayilearned/comments/1tgfv6p/til_in_2001_sharon_stone_arranged_a_private_visit/,1630
1sslt7h,"TIL In-N-Out Burger used to accept orders of any size by adding patties and slices of cheese at an additional cost, till someone ordered 100 patties and 100 slices of cheese",,https://www.reddit.com/r/todayilearned/comments/1sslt7h/til_innout_burger_used_to_accept_orders_of_any/,1118
1t1u9lb,"TIL in 2008 a 33-year-old Wisconsin woman stole her daughter's identity and enrolled in high school in order to ""get her high school diploma and join the cheerleading squad."" She reportedly attended practices, received a cheerleader's locker & went to a pool party at the cheerleading coach's house.",,https://www.reddit.com/r/todayilearned/comments/1t1u9lb/til_in_2008_a_33yearold_wisconsin_woman_stole_her/,1184
1t0xn9u,TIL The rise in colon cancer in adults under 50 has been strongly and directly linked to exposure to certain strains of E.Coli in the first ten years of life,,https://www.reddit.com/r/todayilearned/comments/1t0xn9u/til_the_rise_in_colon_cancer_in_adults_under_50/,1221
1t08p2r,TIL that many public libraries eliminated late fees after finding that fines discouraged people from returning at all - and that bringing patrons back often mattered more than enforcing penalties.,,https://www.reddit.com/r/todayilearned/comments/1t08p2r/til_that_many_public_libraries_eliminated_late/,1390
1ss6bt2,"TIL a 17-year-old girl from Pennsylvania once slept for 64 days (from Thanksgiving in 2012 into January 2013). On average, the teenager slept 18-19 hours a day and would only get up to eat while in a sleepwalking state that she wouldn't remember after the fact.",,https://www.reddit.com/r/todayilearned/comments/1ss6bt2/til_a_17yearold_girl_from_pennsylvania_once_slept/,880
1sy0z9y,"TIL the Cottingley Fairies—a hoax where two young English girls faked photographs of fairies near their home—went unconfessed for over 60 years partly because the cousins were embarrassed at having fooled Sherlock Holmes creator Arthur Conan Doyle, who publicly defended the photos as real.",,https://www.reddit.com/r/todayilearned/comments/1sy0z9y/til_the_cottingley_fairiesa_hoax_where_two_young/,1005
1ssfl4p,"TIL that Eleanor of Aquitaine was blamed by her husband King Louis VII for failing to produce a male heir in their fifteen years together. After the annulment of their marriage, Eleanor would go on to have five sons with her second husband Henry II including Richard the Lionheart and John Lackland",,https://www.reddit.com/r/todayilearned/comments/1ssfl4p/til_that_eleanor_of_aquitaine_was_blamed_by_her/,432
1t0eieb,"TIL all octopuses are programmed to die after reproducing, as an optic gland hormone triggers rapid self destruction, with males declining within days to weeks after mating and females starving while guarding eggs until death, and none of the octopus live longer than 5 years even in ideal conditions",,https://www.reddit.com/r/todayilearned/comments/1t0eieb/til_all_octopuses_are_programmed_to_die_after/,1248
1srv4xo,"TIL the founder of Gillette was a utopian socialist who believed all industry should be run by a single publicly owned corporation and that Americans ought to live in a giant city called Metropolis, powered by Niagara Falls.",,https://www.reddit.com/r/todayilearned/comments/1srv4xo/til_the_founder_of_gillette_was_a_utopian/,617
1t6lr0c,"TIL of the knight William Marshal, who rose from obscurity to win 500 tournaments, saved Eleanor of Aquitaine from capture, unhorsed Richard the Lionheart in combat, journeyed to the Holy Land, redrafted Magna Carta and saved England from a French invasion by personally leading a charge at age 70",,https://www.reddit.com/r/todayilearned/comments/1t6lr0c/til_of_the_knight_william_marshal_who_rose_from/,392
1te6uj8,TIL that Hebrew is the only successful attempt at a large-scale linguistic revival. After having largely been replaced by other languages between the 2nd and 4th centuries. It was revived as a language beginning in the late 19th century,,https://www.reddit.com/r/todayilearned/comments/1te6uj8/til_that_hebrew_is_the_only_successful_attempt_at/,598
