id,title,selftext,permalink,score
1r2vnhs,"TIL a Dollar General employee who was told she couldn't keep drinks at the cash register was fired after taking and drinking a $1.69 orange juice to stave off diabetic shock. Despite her paying for the orange juice afterward, the company said she was 'grazing'. Later, a jury awarded her $277,565.",,https://www.reddit.com/r/todayilearned/comments/1r2vnhs/til_a_dollar_general_employee_who_was_told_she/,86571
1r3puv4,"TIL a Burger King cook (who'd worked there for 24 years) was fired for taking home a sandwich, fries & a drink after her manager claimed she had only asked permission for a sandwich & accused her of stealing. However, a judge ruled that the cook did not intend to steal the food & awarded her $46,000",,https://www.reddit.com/r/todayilearned/comments/1r3puv4/til_a_burger_king_cook_whod_worked_there_for_24/,76429
1r1bkll,"TIL the actor who played Furio in the Sopranos spotted an incorrectly labeled painting at an auction. He purchased it for $68,000 and later had it correctly appraised for $10 million.",,https://www.reddit.com/r/todayilearned/comments/1r1bkll/til_the_actor_who_played_furio_in_the_sopranos/,67444
1rfaq9y,"TIL that the Switzerlands largest supermarket Migros, doesn’t sell alcohol or tobacco in stores, pays no dividends, caps profits by lowering prices if earnings exceeds 5%, is a cooperative with 2M+ members, and donates 1% of revenue to social projects, purely out of the founders moral philosophy",,https://www.reddit.com/r/todayilearned/comments/1rfaq9y/til_that_the_switzerlands_largest_supermarket/,59232
1r6uye8,"TIL Fred Collins went to visit his brother at the Straight Inc. program, a teen rehab, but before he was allowed to, he was ""screened"" for any drug issues. After he admitted smoking weed, they held him against his will for 10 months before he finally escaped. He then sued them & was awarded $220,000",,https://www.reddit.com/r/todayilearned/comments/1r6uye8/til_fred_collins_went_to_visit_his_brother_at_the/,52512
1rh83cp,"TIL Christopher Nolan did not write the line ""You either die a hero or you live long enough to see yourself become the villain"" said by Harvey Dent in The Dark Knight, his brother Jonathan did. Nolan didn't understand it initially & revealed ""It kills me because it's the line that most resonates.""",,https://www.reddit.com/r/todayilearned/comments/1rh83cp/til_christopher_nolan_did_not_write_the_line_you/,45811
1r0ntud,TIL ... about the Rice Hypothesis which posits cultures that engaged in wet rice farming that requires coordinated irrigation and synchronized planting tend to be collectivist while wheat farming cultures evolved to be more individualistic.,,https://www.reddit.com/r/todayilearned/comments/1r0ntud/til_about_the_rice_hypothesis_which_posits/,40713
1rd2zfo,"TIL Peter Cushing, who played Grand Moff Tarkin was extremely pleased with how the film came out, got along well with the cast, and his only regret was that his character died and he couldn't appear in the sequels",,https://www.reddit.com/r/todayilearned/comments/1rd2zfo/til_peter_cushing_who_played_grand_moff_tarkin/,35670
1reiiu5,"TIL that Cancún didn’t exist until 1970, its location was chosen using early computer models to identify a suitable place for a new resort city. The area had only three residents at the time.",,https://www.reddit.com/r/todayilearned/comments/1reiiu5/til_that_cancún_didnt_exist_until_1970_its/,31326
1ro9txn,TIL in 2023 Disney made more profit from churros sales at its theme parks than it did for Disney+ streaming.,,https://www.reddit.com/r/todayilearned/comments/1ro9txn/til_in_2023_disney_made_more_profit_from_churros/,27801
1r57hy2,"TIL The 2021 Razzie Awards had a special category for ""Worst Performance by Bruce Willis in a 2021 Movie,"" with all eight of his performances that year being nominated. Four days after the awards ceremony, Willis' family announced his aphasia diagnosis.",,https://www.reddit.com/r/todayilearned/comments/1r57hy2/til_the_2021_razzie_awards_had_a_special_category/,24656
1raq7wk,"TIL we know where China’s first emperor is buried, but his 2,200-year-old tomb—described as containing a scale model of China with rivers of mercury—has never been opened",,https://www.reddit.com/r/todayilearned/comments/1raq7wk/til_we_know_where_chinas_first_emperor_is_buried/,21991
1rc9v91,"TIL after a man fell in the snow in his backyard & broke his neck, his dog helped save his life by keeping him warm and alert by lying on his body and licking his face & hands for 20 hours until a neighbor finally stopped by and rushed him to the hospital. After surgery, he was able to walk again.",,https://www.reddit.com/r/todayilearned/comments/1rc9v91/til_after_a_man_fell_in_the_snow_in_his_backyard/,18983
1rmm645,"TIL in 2021 a woman in a hurry checked her scratch-off ticket ""real quick"" and then gave to the store owners to throw out because she thought it wasn't a winner. Ten days later, the owners returned it to her after scratching off the last number for her and discovering it was a $1 million winner.",,https://www.reddit.com/r/todayilearned/comments/1rmm645/til_in_2021_a_woman_in_a_hurry_checked_her/,17192
1r137ge,"TIL Canadians sent 5 tonnes of maple syrup to thank a Norwegian coach who gave a Canadian skier a spare pole after she broke hers mid-race, which led to Canada winning a silver medal at the 2006 Winter Olympics",,https://www.reddit.com/r/todayilearned/comments/1r137ge/til_canadians_sent_5_tonnes_of_maple_syrup_to/,15328
1rdfvux,TIL that Kansai International Airport in Japan reached its 30th year of service without having ever lost a single piece of luggage.,,https://www.reddit.com/r/todayilearned/comments/1rdfvux/til_that_kansai_international_airport_in_japan/,13019
1rbn511,TIL about the Business Plot. In 1933 a group of wealthy American industrialists were planning a coup d'état to overthrow President Franklin D. Roosevelt and install Major General Smedley Butler as dictator.,,https://www.reddit.com/r/todayilearned/comments/1rbn511/til_about_the_business_plot_in_1933_a_group_of/,11432
1rlmu7n,"TIL a 2022 study revealed that 35% of the adults in Japan intend to ""never travel"" again. No other country ""came close to the travel reluctance shown in Japan""; the next highest was South Korea at 15%.",,https://www.reddit.com/r/todayilearned/comments/1rlmu7n/til_a_2022_study_revealed_that_35_of_the_adults/,10782
1r5j8oe,TIL Takeru Kobayashi retired from competitive eating because he says he no longer feels hunger or fullness.,,https://www.reddit.com/r/todayilearned/comments/1r5j8oe/til_takeru_kobayashi_retired_from_competitive/,8836
1rm1hr4,"TIL Felix Baumgartner, the man who jumped from the stratosphere during the Red Bull Stratos Project, died on the 17th of July, 2025 from a paragliding crash caused by human error.",,https://www.reddit.com/r/todayilearned/comments/1rm1hr4/til_felix_baumgartner_the_man_who_jumped_from_the/,7808
1repkxi,"TIL while recording samples for the Mellotron (an early keyboard sampler), cellist Reginald Kilbey refused to downtune his Cello to cover lower notes claiming he'd be robbing a bassist of their fee. A bassist was hired for the next recording session, which turned out to be Kilbey with a bass.",,https://www.reddit.com/r/todayilearned/comments/1repkxi/til_while_recording_samples_for_the_mellotron_an/,7448
1r41w1q,"TIL that in 2011, a woman drowned and remained at the bottom of a busy Massachusetts public pool for two days, hidden by cloudy water",,https://www.reddit.com/r/todayilearned/comments/1r41w1q/til_that_in_2011_a_woman_drowned_and_remained_at/,6106
1rhkbc3,TIL the last time a checkmate actually occurred on the board during a World Chess Championship match was in 1929.,,https://www.reddit.com/r/todayilearned/comments/1rhkbc3/til_the_last_time_a_checkmate_actually_occurred/,5270
1rpqjgu,"TIL puppeteer Frank Oz hasn’t worked with the Muppets since 2007 not because he wanna retire. In 2021, he stated: “I’d love to do the Muppets again but Disney doesn’t want me. They don’t want me because I won’t follow orders and I won’t do the kind of Muppets they believe in, The soul’s not there"".",,https://www.reddit.com/r/todayilearned/comments/1rpqjgu/til_puppeteer_frank_oz_hasnt_worked_with_the/,5296
1rmm0b8,"TIL Costco is responsible for 50% of the cashews sold worldwide. The company sources from, and supports, independent nut farmers in at least 20 countries including an estimated 2.5 million independent cashew farmers in Africa alone.",,https://www.reddit.com/r/todayilearned/comments/1rmm0b8/til_costco_is_responsible_for_50_of_the_cashews/,4789
1r5wmyf,"TIL after spending 3 days with his arm trapped in a furnace, a man attempted to amputate it with a saw blade because he began to smell rotting flesh. Although he passed out from pain before he could completely sever it. He was rescued after a friend called for help when he hadn't shown up for work.",,https://www.reddit.com/r/todayilearned/comments/1r5wmyf/til_after_spending_3_days_with_his_arm_trapped_in/,4431
1r80bwk,"TIL United Airlines Flight 232, despite 112 out of 296 onboard dying, is considered to be one of the most impressive landings in aviation history. Pilots failed to copy the accident & landing on simulators. UA232 helped make Crew Resource Management, a new concept, standard practice in airplanes.",,https://www.reddit.com/r/todayilearned/comments/1r80bwk/til_united_airlines_flight_232_despite_112_out_of/,3880
1r8y2yt,"TIL the “Invisible Gorilla” experiment which fooled most people. In a famous 1999 study, participants watched a video of people passing a basketball and were asked to count passes. Midway through, a person in a gorilla suit walked through the scene and half of participants didn’t notice the gorilla.",,https://www.reddit.com/r/todayilearned/comments/1r8y2yt/til_the_invisible_gorilla_experiment_which_fooled/,3313
1rjubrg,"TIL chicken sold in supermarkets are often ""plumped"" with a salt water solution to increase sell weight, making up as much as 30% of the total weight. A serving of plumped chicken can contain between 200 and 500mg of sodium while non-plumped chicken generally contains 45 to 70mg.",,https://www.reddit.com/r/todayilearned/comments/1rjubrg/til_chicken_sold_in_supermarkets_are_often/,2714
1rja2sy,"TIL that before becoming an actor, Danny DeVito worked as a cosmetologist for dead bodies at a morgue, styling the hair of the deceased. He began this after a client of his died where he worked as a beautician at his sister's salon, and her family asked him to do her hair for her funeral.",,https://www.reddit.com/r/todayilearned/comments/1rja2sy/til_that_before_becoming_an_actor_danny_devito/,2937
1r73vdz,"TIL Weird Al was set to a series of Star Wars parody sketches where he would interact with the movie via green-screening, but Mark Hamill refused to allow usage of any footage with him in it, despite already getting approval from Lucas and Alec Guinness, so the idea was scrapped",,https://www.reddit.com/r/todayilearned/comments/1r73vdz/til_weird_al_was_set_to_a_series_of_star_wars/,2138
1r2co0p,TIL that salted raw celery used to be the third most popular dish on New York menus and more expensive than caviar due to issues with growing it.,,https://www.reddit.com/r/todayilearned/comments/1r2co0p/til_that_salted_raw_celery_used_to_be_the_third/,1736
1r6c3k4,"TIL that Detroit, once America's 5th largest city at 1.85 million residents in 1957, saw 66 straight years of population loss to a low of 630,000 residents in 2022. This makes it the only US city to drop below 1 million after reaching it. It would see its first reversal of this trend in 2023.",,https://www.reddit.com/r/todayilearned/comments/1r6c3k4/til_that_detroit_once_americas_5th_largest_city/,2351
1r2thhr,"TIL that Stellen Skarsgard suffered a stroke in 2022, which affected his memory. Because of this, he had been forced to wear an earpiece with his assistant feeding him his lines for his recent films.",,https://www.reddit.com/r/todayilearned/comments/1r2thhr/til_that_stellen_skarsgard_suffered_a_stroke_in/,1383
1rex9sl,"TIL The ""Asoh Defense"" refers to the legendary 1968 incident where Japan Airlines Captain Kohei Asoh candidly admitted, ""As you Americans say, I f---ed up,"" after mistakenly landing his DC-8 jet in San Francisco Bay. By taking full, immediate responsibility without excuses, he set a gold standard",,https://www.reddit.com/r/todayilearned/comments/1rex9sl/til_the_asoh_defense_refers_to_the_legendary_1968/,1504
1rnfdj6,"TIL in episodic television, there are some episodes called ""bottle episodes"", which are produced cheaply and restricted in scope to use as few actors, effects and sets as possible. Notable shows that have these episodes are Star Trek: The Next Generation, Friends, Breaking Bad, Community, and so on.",,https://www.reddit.com/r/todayilearned/comments/1rnfdj6/til_in_episodic_television_there_are_some/,1096
1r6n24e,"Til that when the Japanese daimyo Uesugi Kenshin learned that his great rival Takeda Shingen had his supply of salt cut off, Kenshin sent Shingen salt from his own lands saying “I do not fight with salt, but with the sword”.",,https://www.reddit.com/r/todayilearned/comments/1r6n24e/til_that_when_the_japanese_daimyo_uesugi_kenshin/,1534
1rmgvdx,TIL The United States attempted permanent Daylight Savings Time in 1974. They retracted the law within a year.,,https://www.reddit.com/r/todayilearned/comments/1rmgvdx/til_the_united_states_attempted_permanent/,1212
1rms8p8,TIL that an individual who shoots a bear in self-defense in Alaska outside hunting season must present the skull and the entire hide with claws to the state. Failure to do so is a criminal offense.,,https://www.reddit.com/r/todayilearned/comments/1rms8p8/til_that_an_individual_who_shoots_a_bear_in/,942
1rkr3e0,"TIL that while in the army C.S. Lewis made a pact with his roommate, Edward “Paddy” Moore, that if either died in combat the other would take care of both families. Moore was killed in 1918 and Lewis kept the pact, living with and caring for Moore’s mother until the 1940’s.",,https://www.reddit.com/r/todayilearned/comments/1rkr3e0/til_that_while_in_the_army_cs_lewis_made_a_pact/,1408
1rpct7j,TIL that a Los Angeles woman was once involuntarily committed after she insisted that the boy that she was reunited with was not her missing child. The story later inspired the 2008 movie “Changeling”.,,https://www.reddit.com/r/todayilearned/comments/1rpct7j/til_that_a_los_angeles_woman_was_once/,906
1rjiduw,"TIL that the Persian ""Immortals"" weren't called that because they couldn't die, but because their number was kept at exactly 10,000 at all times. If a soldier was killed or fell ill, he was immediately replaced, creating the illusion that the army never suffered casualties.",,https://www.reddit.com/r/todayilearned/comments/1rjiduw/til_that_the_persian_immortals_werent_called_that/,572
1riy451,TIL that over third of people who called the Massachusetts Problem Gambling Hotline in 2023 were calling because they were having a technical problem with their betting apps and mistakenly believed that calling the Mass hotline would get them IT help.,,https://www.reddit.com/r/todayilearned/comments/1riy451/til_that_over_third_of_people_who_called_the/,1176
1r4l5a8,"TIL Karl Marx wrote a letter in November 1864 that was addressed to President Abraham Lincoln. In the letter, Marx congratulates Lincoln on his re-election and for fighting against slavery in the United States.",,https://www.reddit.com/r/todayilearned/comments/1r4l5a8/til_karl_marx_wrote_a_letter_in_november_1864/,1171
1razytb,"TIL about Odin, a dog who refused to evacuate during the 2017 California wildfires. When his owners returned days later, they found him alive and still guarding his entire flock of 8 goats",,https://www.reddit.com/r/todayilearned/comments/1razytb/til_about_odin_a_dog_who_refused_to_evacuate/,846
1r7mr71,"TIL Bruce Pryor was so upset by the murders in Belanglo State Park AUS that he spent 9 months searching the park for clues; found a body, reported it, only to be treated as the primary suspect for 3 months despite evidence pointing elsewhere.",,https://www.reddit.com/r/todayilearned/comments/1r7mr71/til_bruce_pryor_was_so_upset_by_the_murders_in/,1154
1r3s418,"TIL of the ""sterile cockpit"" or ""sterile flight deck"" rule. When an aircraft is operating during a critical phase of the flight (anytime they're below 10,000 feet), the crew is only allowed to engage in conversation related to the safe operation of the aircraft",,https://www.reddit.com/r/todayilearned/comments/1r3s418/til_of_the_sterile_cockpit_or_sterile_flight_deck/,651
1r2p5m2,"TIL during the Xbox development, the name was not favoured by Microsoft's marketing team. During focus testing, they put ""Xbox"" on a list of possible names to prove how unpopular the name would be with consumers. ""Xbox"" then proved to be the more popular name on the list; thus, became official name.",,https://www.reddit.com/r/todayilearned/comments/1r2p5m2/til_during_the_xbox_development_the_name_was_not/,881
1rjd5ml,"TIL a woman named Lydia Abate has been ""funeral tracking"" for nearly 6 years — she scours obituaries to find recently deceased people, then offers grieving families a free estate clean-out service in exchange for keeping their dead relatives' vintage clothes. She hasn't bought clothes in years.",,https://www.reddit.com/r/todayilearned/comments/1rjd5ml/til_a_woman_named_lydia_abate_has_been_funeral/,922
1r9m3ak,TIL an audit at the University of North Carolina found that one of its most reliable servers had been walled off for 4+ years without anyone even noticing,,https://www.reddit.com/r/todayilearned/comments/1r9m3ak/til_an_audit_at_the_university_of_north_carolina/,288
