id,title,selftext,permalink,score
1t50yad,am i crazy or is a 16% APR on a car loan with a 740 credit score bad….,,https://www.reddit.com/r/personalfinance/comments/1t50yad/am_i_crazy_or_is_a_16_apr_on_a_car_loan_with_a/,66848
1tkfqcd,"I found $11,800 sitting in an old 401k from a job I left at 22, and I have no idea what to do with it",,https://www.reddit.com/r/personalfinance/comments/1tkfqcd/i_found_11800_sitting_in_an_old_401k_from_a_job_i/,58981
1tiodc5,My parents opened a credit card in my name and now I have $30k in debt.,,https://www.reddit.com/r/personalfinance/comments/1tiodc5/my_parents_opened_a_credit_card_in_my_name_and/,52292
1tfeh8e,The FTC just sent warning letters to 97 dealer groups about hidden fees,,https://www.reddit.com/r/personalfinance/comments/1tfeh8e/the_ftc_just_sent_warning_letters_to_97_dealer/,45480
1tal9an,More people should review their loan’s amortization table,,https://www.reddit.com/r/personalfinance/comments/1tal9an/more_people_should_review_their_loans/,40143
1t34hbo,My mom is asking for $500 to help pay for rent,,https://www.reddit.com/r/personalfinance/comments/1t34hbo/my_mom_is_asking_for_500_to_help_pay_for_rent/,35576
1t5gd69,Is $60 a month fair to pay a coworker for a ride home 3x a week on a tight budget?,,https://www.reddit.com/r/personalfinance/comments/1t5gd69/is_60_a_month_fair_to_pay_a_coworker_for_a_ride/,31110
1tmojpo,what happens when one of us dies,,https://www.reddit.com/r/personalfinance/comments/1tmojpo/what_happens_when_one_of_us_dies/,27758
1syb3a2,Grandpa is giving me valuable family land that I can’t sell. What’s the smartest financial move?,,https://www.reddit.com/r/personalfinance/comments/1syb3a2/grandpa_is_giving_me_valuable_family_land_that_i/,24557
1tfrpfq,Financial advisor says to keep 10k as emergency fund and put rest of 90k savings into a brokerage account. I’m on the fence,,https://www.reddit.com/r/personalfinance/comments/1tfrpfq/financial_advisor_says_to_keep_10k_as_emergency/,21159
1tadldn,"AI is eliminating my field fast, how should I prepare?",,https://www.reddit.com/r/personalfinance/comments/1tadldn/ai_is_eliminating_my_field_fast_how_should_i/,19165
1t0ue6d,Why does my mom always ask for paycheck stubs with no context?,,https://www.reddit.com/r/personalfinance/comments/1t0ue6d/why_does_my_mom_always_ask_for_paycheck_stubs/,17155
1tbts44,~$70k sitting in my HYSA; how do I stop hoarding this cash?,,https://www.reddit.com/r/personalfinance/comments/1tbts44/70k_sitting_in_my_hysa_how_do_i_stop_hoarding/,15237
1tht949,Answer to ‘can I borrow some money?’,,https://www.reddit.com/r/personalfinance/comments/1tht949/answer_to_can_i_borrow_some_money/,13541
1tasjen,Left job and haven't touched 401k for 10 years,,https://www.reddit.com/r/personalfinance/comments/1tasjen/left_job_and_havent_touched_401k_for_10_years/,11399
1tmnr7c,"I made an exceedingly lucky $1,600 investment in one stock 3 years ago and it is worth $21k right now and I don’t know what to do.",,https://www.reddit.com/r/personalfinance/comments/1tmnr7c/i_made_an_exceedingly_lucky_1600_investment_in/,10002
1t7nt5a,I’m going to be given my deceased father’s 401k later this year - I have questions,,https://www.reddit.com/r/personalfinance/comments/1t7nt5a/im_going_to_be_given_my_deceased_fathers_401k/,9308
1t41l3u,Family Member Owes $65K on a $42K Car at 13.7% APR Right Before Retirement — What Are Her Options?,,https://www.reddit.com/r/personalfinance/comments/1t41l3u/family_member_owes_65k_on_a_42k_car_at_137_apr/,7937
1t8nurm,Private student loan disappeared from my credit. Now a debt collector sent me a letter.,,https://www.reddit.com/r/personalfinance/comments/1t8nurm/private_student_loan_disappeared_from_my_credit/,6826
1tc21ug,Wife represented herself against a debt collector and won — here's the specific issue that got the case dismissed (Maryland),,https://www.reddit.com/r/personalfinance/comments/1tc21ug/wife_represented_herself_against_a_debt_collector/,6006
1togh3r,"Financially treading water with a wife and child, can't find a better paying job",,https://www.reddit.com/r/personalfinance/comments/1togh3r/financially_treading_water_with_a_wife_and_child/,5625
1td8y55,How do we not lose everything we have saved in next couple of years if we get a crash/recession (US),,https://www.reddit.com/r/personalfinance/comments/1td8y55/how_do_we_not_lose_everything_we_have_saved_in/,4827
1t00kiy,Bill for 17k can I pay it off with a CC and pay off the CC the next day for free points?,,https://www.reddit.com/r/personalfinance/comments/1t00kiy/bill_for_17k_can_i_pay_it_off_with_a_cc_and_pay/,4376
1t310ol,My parents financial situation is stressing me out,,https://www.reddit.com/r/personalfinance/comments/1t310ol/my_parents_financial_situation_is_stressing_me_out/,4148
1szd5uw,Someone Opened a $3000 Loan in My Name,,https://www.reddit.com/r/personalfinance/comments/1szd5uw/someone_opened_a_3000_loan_in_my_name/,3387
1tn0xwl,New job offers a Use-It-Or-Lose-It monthly $160 “Personal Wellness” benefit - Suggestions?,,https://www.reddit.com/r/personalfinance/comments/1tn0xwl/new_job_offers_a_useitorloseit_monthly_160/,3108
1tlx4mo,Should I buy my sister a house to live in?,,https://www.reddit.com/r/personalfinance/comments/1tlx4mo/should_i_buy_my_sister_a_house_to_live_in/,2724
1sz023p,Parents in 60s with very little in savings - help,,https://www.reddit.com/r/personalfinance/comments/1sz023p/parents_in_60s_with_very_little_in_savings_help/,2578
1th6eiu,As a young person how do I survive the future financially?,,https://www.reddit.com/r/personalfinance/comments/1th6eiu/as_a_young_person_how_do_i_survive_the_future/,2562
1t26pyu,Going from $1300 to $2100 rent,,https://www.reddit.com/r/personalfinance/comments/1t26pyu/going_from_1300_to_2100_rent/,2150
1tj7j81,"Paycheck deposited to wrong account due to typo. Employer pointing me to bank, bank pointing me back to employer. Need advice.",,https://www.reddit.com/r/personalfinance/comments/1tj7j81/paycheck_deposited_to_wrong_account_due_to_typo/,2382
1t1e9qh,My ex wife's bankruptcy hit my credit report,,https://www.reddit.com/r/personalfinance/comments/1t1e9qh/my_ex_wifes_bankruptcy_hit_my_credit_report/,2243
1t1hjls,Dad ruined my credit and I don't know what to do,,https://www.reddit.com/r/personalfinance/comments/1t1hjls/dad_ruined_my_credit_and_i_dont_know_what_to_do/,2022
1toe1se,Forgotten 20 year old 401k help.,,https://www.reddit.com/r/personalfinance/comments/1toe1se/forgotten_20_year_old_401k_help/,1549
1t20xzk,Should I quit a new job after one month for my preferred offer?,,https://www.reddit.com/r/personalfinance/comments/1t20xzk/should_i_quit_a_new_job_after_one_month_for_my/,1689
1tip7pv,What do I do with $80k,,https://www.reddit.com/r/personalfinance/comments/1tip7pv/what_do_i_do_with_80k/,1081
1t701i4,Eviction I didn’t know I had. What to do?,,https://www.reddit.com/r/personalfinance/comments/1t701i4/eviction_i_didnt_know_i_had_what_to_do/,824
1tm30hw,My mom died and i don’t know what to do with the money she left me.,,https://www.reddit.com/r/personalfinance/comments/1tm30hw/my_mom_died_and_i_dont_know_what_to_do_with_the/,1215
1t1qxen,Rental car company charging $2k for damage found hours after return — no proof. Worth fighting?,,https://www.reddit.com/r/personalfinance/comments/1t1qxen/rental_car_company_charging_2k_for_damage_found/,1488
1tjjfvi,My spouse started a job at WF Advisors and now they are requiring me to transfer all my brokerage and IRA accounts over. Does FINRA apply to non-registered employees?,,https://www.reddit.com/r/personalfinance/comments/1tjjfvi/my_spouse_started_a_job_at_wf_advisors_and_now/,1374
1szkid9,How can I hide money in a prepaid debit card?,,https://www.reddit.com/r/personalfinance/comments/1szkid9/how_can_i_hide_money_in_a_prepaid_debit_card/,890
1sy3m8c,Expecting Life Insurance payout on my Birthday. What Do I Even Do?,,https://www.reddit.com/r/personalfinance/comments/1sy3m8c/expecting_life_insurance_payout_on_my_birthday/,1182
1tmg2zk,Friend laid off with mortgage and CC debt,,https://www.reddit.com/r/personalfinance/comments/1tmg2zk/friend_laid_off_with_mortgage_and_cc_debt/,930
1tng2lg,"Got lucky with NVDA, what to do now?",,https://www.reddit.com/r/personalfinance/comments/1tng2lg/got_lucky_with_nvda_what_to_do_now/,1121
1tguc68,Does dealer need to run credit if I have pre-approval letter,,https://www.reddit.com/r/personalfinance/comments/1tguc68/does_dealer_need_to_run_credit_if_i_have/,976
1t4s7dw,Working 80 hours per week for one year investing it all?,,https://www.reddit.com/r/personalfinance/comments/1t4s7dw/working_80_hours_per_week_for_one_year_investing/,1039
1tl4qd0,Did I sign a lease for an apartment I can’t afford and what should I do,,https://www.reddit.com/r/personalfinance/comments/1tl4qd0/did_i_sign_a_lease_for_an_apartment_i_cant_afford/,474
1t6smtz,Drowning in Debt After Divorce,,https://www.reddit.com/r/personalfinance/comments/1t6smtz/drowning_in_debt_after_divorce/,972
1t97rkz,"Unemployed, out of money, and out of time. Need to figure out the next steps.",,https://www.reddit.com/r/personalfinance/comments/1t97rkz/unemployed_out_of_money_and_out_of_time_need_to/,1025
1t4dcmn,Broke and Late to the game,,https://www.reddit.com/r/personalfinance/comments/1t4dcmn/broke_and_late_to_the_game/,1003
