id,title,selftext,permalink,score
1su47f8,"Found my late father's framed Microsoft stock certificate from 1991. How do I verify if it’s still ""live""?",,https://www.reddit.com/r/personalfinance/comments/1su47f8/found_my_late_fathers_framed_microsoft_stock/,52969
1sjvtex,I bought a house and I don’t know what to do,,https://www.reddit.com/r/personalfinance/comments/1sjvtex/i_bought_a_house_and_i_dont_know_what_to_do/,47142
1sqc5z6,I feel so behind financially,,https://www.reddit.com/r/personalfinance/comments/1sqc5z6/i_feel_so_behind_financially/,41117
1t50yad,am i crazy or is a 16% APR on a car loan with a 740 credit score bad….,,https://www.reddit.com/r/personalfinance/comments/1t50yad/am_i_crazy_or_is_a_16_apr_on_a_car_loan_with_a/,36637
1swm7es,How to prepare for end of life,,https://www.reddit.com/r/personalfinance/comments/1swm7es/how_to_prepare_for_end_of_life/,31988
1sm15re,My last car loan payment was 6 years and 10 months ago.,,https://www.reddit.com/r/personalfinance/comments/1sm15re/my_last_car_loan_payment_was_6_years_and_10/,28595
1t34hbo,My mom is asking for $500 to help pay for rent,,https://www.reddit.com/r/personalfinance/comments/1t34hbo/my_mom_is_asking_for_500_to_help_pay_for_rent/,25437
1t5gd69,Is $60 a month fair to pay a coworker for a ride home 3x a week on a tight budget?,,https://www.reddit.com/r/personalfinance/comments/1t5gd69/is_60_a_month_fair_to_pay_a_coworker_for_a_ride/,22470
1syb3a2,Grandpa is giving me valuable family land that I can’t sell. What’s the smartest financial move?,,https://www.reddit.com/r/personalfinance/comments/1syb3a2/grandpa_is_giving_me_valuable_family_land_that_i/,19369
1sx5it9,I desperately need help,,https://www.reddit.com/r/personalfinance/comments/1sx5it9/i_desperately_need_help/,17231
1si5573,Should I ask my ex to refinance a 26 yr old mortgage with a small remaining balance or leave it be?,,https://www.reddit.com/r/personalfinance/comments/1si5573/should_i_ask_my_ex_to_refinance_a_26_yr_old/,15350
1smuuc9,Should I try to buy my 105 year old next door neighbors home when she passes?,,https://www.reddit.com/r/personalfinance/comments/1smuuc9/should_i_try_to_buy_my_105_year_old_next_door/,13882
1t0ue6d,Why does my mom always ask for paycheck stubs with no context?,,https://www.reddit.com/r/personalfinance/comments/1t0ue6d/why_does_my_mom_always_ask_for_paycheck_stubs/,12349
1sso7y9,My dad put my name on a storage unit years ago and now the account is in collections,,https://www.reddit.com/r/personalfinance/comments/1sso7y9/my_dad_put_my_name_on_a_storage_unit_years_ago/,10493
1t41l3u,Family Member Owes $65K on a $42K Car at 13.7% APR Right Before Retirement — What Are Her Options?,,https://www.reddit.com/r/personalfinance/comments/1t41l3u/family_member_owes_65k_on_a_42k_car_at_137_apr/,9590
1sq4n5y,"My brother passed away and left my mom money via life insurance. My mom has no income, no capability to work but a ton of credit card debt. What are my options?",,https://www.reddit.com/r/personalfinance/comments/1sq4n5y/my_brother_passed_away_and_left_my_mom_money_via/,8492
1snqea2,Car loan rejected 2 months after getting the car,,https://www.reddit.com/r/personalfinance/comments/1snqea2/car_loan_rejected_2_months_after_getting_the_car/,7675
1shkv9m,My MIL is unexpectedly receiving inheritance as she's moving into independent living facility. How to handle this?,,https://www.reddit.com/r/personalfinance/comments/1shkv9m/my_mil_is_unexpectedly_receiving_inheritance_as/,6849
1si0ruh,Scammer almost ran off with my dad's retirement.,,https://www.reddit.com/r/personalfinance/comments/1si0ruh/scammer_almost_ran_off_with_my_dads_retirement/,5711
1sseiaw,How do high earners actually reducing taxes legally?,,https://www.reddit.com/r/personalfinance/comments/1sseiaw/how_do_high_earners_actually_reducing_taxes/,4991
1t00kiy,Bill for 17k can I pay it off with a CC and pay off the CC the next day for free points?,,https://www.reddit.com/r/personalfinance/comments/1t00kiy/bill_for_17k_can_i_pay_it_off_with_a_cc_and_pay/,4994
1siipy3,Net worth “by age” charts are everywhere -> here’s what the Fed’s SCF 2022 actually looks like after CPI inflation to 2026 dollars [OC],,https://www.reddit.com/r/personalfinance/comments/1siipy3/net_worth_by_age_charts_are_everywhere_heres_what/,4444
1t310ol,My parents financial situation is stressing me out,,https://www.reddit.com/r/personalfinance/comments/1t310ol/my_parents_financial_situation_is_stressing_me_out/,3727
1szd5uw,Someone Opened a $3000 Loan in My Name,,https://www.reddit.com/r/personalfinance/comments/1szd5uw/someone_opened_a_3000_loan_in_my_name/,2999
1stt3d9,Rocket Money Bill Negotiation Scam,,https://www.reddit.com/r/personalfinance/comments/1stt3d9/rocket_money_bill_negotiation_scam/,3005
1spxgmn,"Gym Membership- never charged, can’t cancel",,https://www.reddit.com/r/personalfinance/comments/1spxgmn/gym_membership_never_charged_cant_cancel/,2384
1smm0j1,"I'm 50 with no retirement or assets, do I save for a home or retirement?",,https://www.reddit.com/r/personalfinance/comments/1smm0j1/im_50_with_no_retirement_or_assets_do_i_save_for/,2370
1sowvz0,Is it a dumb decision to sell house with 2.5% mortgage to move west and rent an apartment,,https://www.reddit.com/r/personalfinance/comments/1sowvz0/is_it_a_dumb_decision_to_sell_house_with_25/,1873
1t7nt5a,I’m going to be given my deceased father’s 401k later this year - I have questions,,https://www.reddit.com/r/personalfinance/comments/1t7nt5a/im_going_to_be_given_my_deceased_fathers_401k/,2428
1sz023p,Parents in 60s with very little in savings - help,,https://www.reddit.com/r/personalfinance/comments/1sz023p/parents_in_60s_with_very_little_in_savings_help/,2232
1t26pyu,Going from $1300 to $2100 rent,,https://www.reddit.com/r/personalfinance/comments/1t26pyu/going_from_1300_to_2100_rent/,2044
1sx47r3,Is this an elaborate pyramid scheme?,,https://www.reddit.com/r/personalfinance/comments/1sx47r3/is_this_an_elaborate_pyramid_scheme/,1967
1t1e9qh,My ex wife's bankruptcy hit my credit report,,https://www.reddit.com/r/personalfinance/comments/1t1e9qh/my_ex_wifes_bankruptcy_hit_my_credit_report/,1234
1t1hjls,Dad ruined my credit and I don't know what to do,,https://www.reddit.com/r/personalfinance/comments/1t1hjls/dad_ruined_my_credit_and_i_dont_know_what_to_do/,1080
1t20xzk,Should I quit a new job after one month for my preferred offer?,,https://www.reddit.com/r/personalfinance/comments/1t20xzk/should_i_quit_a_new_job_after_one_month_for_my/,823
1skyhqe,I am drowning in debt and don't know what to do,,https://www.reddit.com/r/personalfinance/comments/1skyhqe/i_am_drowning_in_debt_and_dont_know_what_to_do/,1117
1sry1ac,It never feels like enough.,,https://www.reddit.com/r/personalfinance/comments/1sry1ac/it_never_feels_like_enough/,1069
1t1qxen,Rental car company charging $2k for damage found hours after return — no proof. Worth fighting?,,https://www.reddit.com/r/personalfinance/comments/1t1qxen/rental_car_company_charging_2k_for_damage_found/,955
1t701i4,Eviction I didn’t know I had. What to do?,,https://www.reddit.com/r/personalfinance/comments/1t701i4/eviction_i_didnt_know_i_had_what_to_do/,1354
1sl7x4e,Please help me understand 50k tax bill after father’s death,,https://www.reddit.com/r/personalfinance/comments/1sl7x4e/please_help_me_understand_50k_tax_bill_after/,1333
1szkid9,How can I hide money in a prepaid debit card?,,https://www.reddit.com/r/personalfinance/comments/1szkid9/how_can_i_hide_money_in_a_prepaid_debit_card/,1059
1srayzg,Leaving a job you absolutely love,,https://www.reddit.com/r/personalfinance/comments/1srayzg/leaving_a_job_you_absolutely_love/,1082
1slu3eh,Does my sister qualify as a dependent,,https://www.reddit.com/r/personalfinance/comments/1slu3eh/does_my_sister_qualify_as_a_dependent/,737
1sy3m8c,Expecting Life Insurance payout on my Birthday. What Do I Even Do?,,https://www.reddit.com/r/personalfinance/comments/1sy3m8c/expecting_life_insurance_payout_on_my_birthday/,1207
1sj4xeg,"Almost 40, retirement seems out of reach",,https://www.reddit.com/r/personalfinance/comments/1sj4xeg/almost_40_retirement_seems_out_of_reach/,782
1srb71j,Feeling “retirement rich but life poor”,,https://www.reddit.com/r/personalfinance/comments/1srb71j/feeling_retirement_rich_but_life_poor/,597
1ssr1ks,How to discreetly open a 529 for a nephew?,,https://www.reddit.com/r/personalfinance/comments/1ssr1ks/how_to_discreetly_open_a_529_for_a_nephew/,618
1spwagi,Father’s money is sitting in zero interest checking account?,,https://www.reddit.com/r/personalfinance/comments/1spwagi/fathers_money_is_sitting_in_zero_interest/,419
1t4s7dw,Working 80 hours per week for one year investing it all?,,https://www.reddit.com/r/personalfinance/comments/1t4s7dw/working_80_hours_per_week_for_one_year_investing/,963
1st864x,I travel for work. I just discovered that my employer had been changing my claimed expenses without justification. What do I do?,,https://www.reddit.com/r/personalfinance/comments/1st864x/i_travel_for_work_i_just_discovered_that_my/,1071
