id,title,selftext,permalink,score
1su47f8,"Found my late father's framed Microsoft stock certificate from 1991. How do I verify if it’s still ""live""?",,https://www.reddit.com/r/personalfinance/comments/1su47f8/found_my_late_fathers_framed_microsoft_stock/,50986
1s8r2bt,"I feel so defeated, got a $5,185 cell phone bill.",,https://www.reddit.com/r/personalfinance/comments/1s8r2bt/i_feel_so_defeated_got_a_5185_cell_phone_bill/,45305
1sjvtex,I bought a house and I don’t know what to do,,https://www.reddit.com/r/personalfinance/comments/1sjvtex/i_bought_a_house_and_i_dont_know_what_to_do/,39919
1se2lbv,"logged into my old 401K, it was converted and reduced to 0; i don't know where the money went",,https://www.reddit.com/r/personalfinance/comments/1se2lbv/logged_into_my_old_401k_it_was_converted_and/,35519
1s6x28g,"Massive jump in salary, need advice.",,https://www.reddit.com/r/personalfinance/comments/1s6x28g/massive_jump_in_salary_need_advice/,31060
1sqc5z6,I feel so behind financially,,https://www.reddit.com/r/personalfinance/comments/1sqc5z6/i_feel_so_behind_financially/,27033
1sfair7,My daughter has her mind set on an expensive school. Advice please!,,https://www.reddit.com/r/personalfinance/comments/1sfair7/my_daughter_has_her_mind_set_on_an_expensive/,23954
1sa85un,Am I being dumb for getting my own apartment at 19?,,https://www.reddit.com/r/personalfinance/comments/1sa85un/am_i_being_dumb_for_getting_my_own_apartment_at_19/,21258
1s8knxt,"Mom is 60k in debt, can’t pay bills and relies on her parents yet spends $400 a month on Doordash. How can I help her?",,https://www.reddit.com/r/personalfinance/comments/1s8knxt/mom_is_60k_in_debt_cant_pay_bills_and_relies_on/,18818
1swm7es,How to prepare for end of life,,https://www.reddit.com/r/personalfinance/comments/1swm7es/how_to_prepare_for_end_of_life/,16959
1sm15re,My last car loan payment was 6 years and 10 months ago.,,https://www.reddit.com/r/personalfinance/comments/1sm15re/my_last_car_loan_payment_was_6_years_and_10/,14531
1sbd146,Boss changing me to 1099,,https://www.reddit.com/r/personalfinance/comments/1sbd146/boss_changing_me_to_1099/,12598
1sg2dmf,"Mom died and left me money, but I am a little lost with all my options.",,https://www.reddit.com/r/personalfinance/comments/1sg2dmf/mom_died_and_left_me_money_but_i_am_a_little_lost/,11690
1sau0kp,Talk to your parents about their finances,,https://www.reddit.com/r/personalfinance/comments/1sau0kp/talk_to_your_parents_about_their_finances/,10616
1si5573,Should I ask my ex to refinance a 26 yr old mortgage with a small remaining balance or leave it be?,,https://www.reddit.com/r/personalfinance/comments/1si5573/should_i_ask_my_ex_to_refinance_a_26_yr_old/,9334
1smuuc9,Should I try to buy my 105 year old next door neighbors home when she passes?,,https://www.reddit.com/r/personalfinance/comments/1smuuc9/should_i_try_to_buy_my_105_year_old_next_door/,8368
1seyv2l,Is there ever a time to NOT file married jointly for taxes?,,https://www.reddit.com/r/personalfinance/comments/1seyv2l/is_there_ever_a_time_to_not_file_married_jointly/,6960
1sso7y9,My dad put my name on a storage unit years ago and now the account is in collections,,https://www.reddit.com/r/personalfinance/comments/1sso7y9/my_dad_put_my_name_on_a_storage_unit_years_ago/,6350
1s97dxq,Mom racked up 8k on my credit card,,https://www.reddit.com/r/personalfinance/comments/1s97dxq/mom_racked_up_8k_on_my_credit_card/,5628
1sq4n5y,"My brother passed away and left my mom money via life insurance. My mom has no income, no capability to work but a ton of credit card debt. What are my options?",,https://www.reddit.com/r/personalfinance/comments/1sq4n5y/my_brother_passed_away_and_left_my_mom_money_via/,4601
1snqea2,Car loan rejected 2 months after getting the car,,https://www.reddit.com/r/personalfinance/comments/1snqea2/car_loan_rejected_2_months_after_getting_the_car/,4189
1shkv9m,My MIL is unexpectedly receiving inheritance as she's moving into independent living facility. How to handle this?,,https://www.reddit.com/r/personalfinance/comments/1shkv9m/my_mil_is_unexpectedly_receiving_inheritance_as/,3721
1si0ruh,Scammer almost ran off with my dad's retirement.,,https://www.reddit.com/r/personalfinance/comments/1si0ruh/scammer_almost_ran_off_with_my_dads_retirement/,3875
1sseiaw,How do high earners actually reducing taxes legally?,,https://www.reddit.com/r/personalfinance/comments/1sseiaw/how_do_high_earners_actually_reducing_taxes/,3400
1sgumx9,"Front loaded my 401k in January, got laid off in March, and now I have no idea how cautious to be",,https://www.reddit.com/r/personalfinance/comments/1sgumx9/front_loaded_my_401k_in_january_got_laid_off_in/,2785
1sd9wq1,Hidden bank account from parents,,https://www.reddit.com/r/personalfinance/comments/1sd9wq1/hidden_bank_account_from_parents/,2327
1siipy3,Net worth “by age” charts are everywhere -> here’s what the Fed’s SCF 2022 actually looks like after CPI inflation to 2026 dollars [OC],,https://www.reddit.com/r/personalfinance/comments/1siipy3/net_worth_by_age_charts_are_everywhere_heres_what/,2426
1stt3d9,Rocket Money Bill Negotiation Scam,,https://www.reddit.com/r/personalfinance/comments/1stt3d9/rocket_money_bill_negotiation_scam/,2119
1spxgmn,"Gym Membership- never charged, can’t cancel",,https://www.reddit.com/r/personalfinance/comments/1spxgmn/gym_membership_never_charged_cant_cancel/,1572
1sgh4ys,"My paycheck was $108, checked and saw it was because of health insurance? Please explain I am not familiar with this.",,https://www.reddit.com/r/personalfinance/comments/1sgh4ys/my_paycheck_was_108_checked_and_saw_it_was/,1462
1smm0j1,"I'm 50 with no retirement or assets, do I save for a home or retirement?",,https://www.reddit.com/r/personalfinance/comments/1smm0j1/im_50_with_no_retirement_or_assets_do_i_save_for/,2064
1sa03c3,Just another dumba#@ co- signer on a home loan here,,https://www.reddit.com/r/personalfinance/comments/1sa03c3/just_another_dumba_co_signer_on_a_home_loan_here/,1961
1sfwp2r,"Got a $2,000 tax refund. Do I wipe out 3 small maxed-out cards or put a massive dent in my biggest one?",,https://www.reddit.com/r/personalfinance/comments/1sfwp2r/got_a_2000_tax_refund_do_i_wipe_out_3_small/,1224
1sowvz0,Is it a dumb decision to sell house with 2.5% mortgage to move west and rent an apartment,,https://www.reddit.com/r/personalfinance/comments/1sowvz0/is_it_a_dumb_decision_to_sell_house_with_25/,1018
1sx5it9,I desperately need help,,https://www.reddit.com/r/personalfinance/comments/1sx5it9/i_desperately_need_help/,1601
1sei34g,"Landlord kicking us out, offered to sell to my mother what is the best course of action?",,https://www.reddit.com/r/personalfinance/comments/1sei34g/landlord_kicking_us_out_offered_to_sell_to_my/,1048
1s7dsb1,"Got myself into a 84 month car loan of $42K, feeling financial pressure as I try to grow in life",,https://www.reddit.com/r/personalfinance/comments/1s7dsb1/got_myself_into_a_84_month_car_loan_of_42k/,1475
1sc6lp3,Is selling a big chunk of stocks for a down payment dumb?,,https://www.reddit.com/r/personalfinance/comments/1sc6lp3/is_selling_a_big_chunk_of_stocks_for_a_down/,1326
1skyhqe,I am drowning in debt and don't know what to do,,https://www.reddit.com/r/personalfinance/comments/1skyhqe/i_am_drowning_in_debt_and_dont_know_what_to_do/,1095
1sry1ac,It never feels like enough.,,https://www.reddit.com/r/personalfinance/comments/1sry1ac/it_never_feels_like_enough/,939
1sl7x4e,Please help me understand 50k tax bill after father’s death,,https://www.reddit.com/r/personalfinance/comments/1sl7x4e/please_help_me_understand_50k_tax_bill_after/,645
1srayzg,Leaving a job you absolutely love,,https://www.reddit.com/r/personalfinance/comments/1srayzg/leaving_a_job_you_absolutely_love/,862
1slu3eh,Does my sister qualify as a dependent,,https://www.reddit.com/r/personalfinance/comments/1slu3eh/does_my_sister_qualify_as_a_dependent/,1119
1s90hvr,401K held hostage by former employer for 10 years,,https://www.reddit.com/r/personalfinance/comments/1s90hvr/401k_held_hostage_by_former_employer_for_10_years/,517
1sx47r3,Is this an elaborate pyramid scheme?,,https://www.reddit.com/r/personalfinance/comments/1sx47r3/is_this_an_elaborate_pyramid_scheme/,632
1sf4nyp,Billed $1440 for 20 min urgent care visit,,https://www.reddit.com/r/personalfinance/comments/1sf4nyp/billed_1440_for_20_min_urgent_care_visit/,742
1sj4xeg,"Almost 40, retirement seems out of reach",,https://www.reddit.com/r/personalfinance/comments/1sj4xeg/almost_40_retirement_seems_out_of_reach/,1025
1sgxsx1,For anyone on a HDHP you can order your own bloodwork for a fraction of what your doctor bills,,https://www.reddit.com/r/personalfinance/comments/1sgxsx1/for_anyone_on_a_hdhp_you_can_order_your_own/,356
1srb71j,Feeling “retirement rich but life poor”,,https://www.reddit.com/r/personalfinance/comments/1srb71j/feeling_retirement_rich_but_life_poor/,444
1sarug5,Wife’s Inheritance Plan,,https://www.reddit.com/r/personalfinance/comments/1sarug5/wifes_inheritance_plan/,851
