id,title,selftext,permalink,score
1s4ca2l,Mother placed $60k into a John Hancock “conservative” retirement fund in 2014 which is now worth $39k. Is this normal?,,https://www.reddit.com/r/personalfinance/comments/1s4ca2l/mother_placed_60k_into_a_john_hancock/,54680
1s8r2bt,"I feel so defeated, got a $5,185 cell phone bill.",,https://www.reddit.com/r/personalfinance/comments/1s8r2bt/i_feel_so_defeated_got_a_5185_cell_phone_bill/,48257
1rvh2z4,Im homeless living out of a $35k truck what should I do first,,https://www.reddit.com/r/personalfinance/comments/1rvh2z4/im_homeless_living_out_of_a_35k_truck_what_should/,42920
1s1p2n7,Just signed my settlement what next?,,https://www.reddit.com/r/personalfinance/comments/1s1p2n7/just_signed_my_settlement_what_next/,37585
1s6x28g,"Massive jump in salary, need advice.",,https://www.reddit.com/r/personalfinance/comments/1s6x28g/massive_jump_in_salary_need_advice/,33452
1rx7hv0,"My girlfriend (27) has $70k sitting in cash and no investments, what would you do?",,https://www.reddit.com/r/personalfinance/comments/1rx7hv0/my_girlfriend_27_has_70k_sitting_in_cash_and_no/,29195
1rp9jih,"Bank is closing my account with life savings in it, what’s the best way of getting my money to another bank safely?",,https://www.reddit.com/r/personalfinance/comments/1rp9jih/bank_is_closing_my_account_with_life_savings_in/,25468
1s53h8w,Father passed unexpectedly. My mom doesn’t know any of his passwords or where any of his investments are. Who can we contact ?,,https://www.reddit.com/r/personalfinance/comments/1s53h8w/father_passed_unexpectedly_my_mom_doesnt_know_any/,22955
1rtrgn3,Realized my extra car loan payments have been going to next payment instead of principal,,https://www.reddit.com/r/personalfinance/comments/1rtrgn3/realized_my_extra_car_loan_payments_have_been/,20277
1rz2not,My landlord is selling. Does he have any benefit of selling to me at a discount?,,https://www.reddit.com/r/personalfinance/comments/1rz2not/my_landlord_is_selling_does_he_have_any_benefit/,17410
1rqu19o,Debt in a foreign country I’m never moving back to,,https://www.reddit.com/r/personalfinance/comments/1rqu19o/debt_in_a_foreign_country_im_never_moving_back_to/,15825
1rll8vl,My parents have basically no retirement savings and are starting to hint that I'll need to help support them. I'm 29 and just getting my own finances together.,,https://www.reddit.com/r/personalfinance/comments/1rll8vl/my_parents_have_basically_no_retirement_savings/,13903
1s8knxt,"Mom is 60k in debt, can’t pay bills and relies on her parents yet spends $400 a month on Doordash. How can I help her?",,https://www.reddit.com/r/personalfinance/comments/1s8knxt/mom_is_60k_in_debt_cant_pay_bills_and_relies_on/,12216
1s53d8s,"Storage units are only good for short-term use. After a number of months, your rent costs will exceed the value of the stuff you are storing.",,https://www.reddit.com/r/personalfinance/comments/1s53d8s/storage_units_are_only_good_for_shortterm_use/,11238
1rojapl,MIL has been taking my wife's late father's annuity that was given to my wife without her knowing,,https://www.reddit.com/r/personalfinance/comments/1rojapl/mil_has_been_taking_my_wifes_late_fathers_annuity/,9527
1rnlmwq,My Elderly Grandparents Can No Longer Go to the Bank to Withdraw Money,,https://www.reddit.com/r/personalfinance/comments/1rnlmwq/my_elderly_grandparents_can_no_longer_go_to_the/,8499
1rxmdcb,"Shared bedroom for $900/month? Or my own bedroom for $1,200/month?",,https://www.reddit.com/r/personalfinance/comments/1rxmdcb/shared_bedroom_for_900month_or_my_own_bedroom_for/,7548
1s3c5hl,"Bought a car 4 weeks ago, bank denied my loan",,https://www.reddit.com/r/personalfinance/comments/1s3c5hl/bought_a_car_4_weeks_ago_bank_denied_my_loan/,7059
1rjzid8,I am nineteen and cannot afford my 9k medical bill,,https://www.reddit.com/r/personalfinance/comments/1rjzid8/i_am_nineteen_and_cannot_afford_my_9k_medical_bill/,6264
1ruezml,Elderly mother can’t pay bills,,https://www.reddit.com/r/personalfinance/comments/1ruezml/elderly_mother_cant_pay_bills/,5016
1rxouhp,Dad's retiring after only 10 years of US work ($10k avg). How much will his SS check actually be?,,https://www.reddit.com/r/personalfinance/comments/1rxouhp/dads_retiring_after_only_10_years_of_us_work_10k/,4773
1rsonoa,"My landlord illegally kept my security deposit. I beat them in court, but they live overseas and will likely never pay the damages. Is my original security deposit deductible?",,https://www.reddit.com/r/personalfinance/comments/1rsonoa/my_landlord_illegally_kept_my_security_deposit_i/,4601
1s3oxiv,Wife's former employer was bought out and they terminated the 401k plan. Email from Fidelity states all assets must be distributed. What to do?,,https://www.reddit.com/r/personalfinance/comments/1s3oxiv/wifes_former_employer_was_bought_out_and_they/,3972
1rwlqkz,"Chase pays my brother's property taxes via the escrow. My brother forgot this, so he paid the property tax on his own which is $5,674.29. Can he get back the entire $5,674.29?",,https://www.reddit.com/r/personalfinance/comments/1rwlqkz/chase_pays_my_brothers_property_taxes_via_the/,3064
1s2mibm,Need advice on stretching under 20 dollars for a month of food,,https://www.reddit.com/r/personalfinance/comments/1s2mibm/need_advice_on_stretching_under_20_dollars_for_a/,3052
1rq8tfx,Am I right to think buying a house would be foolish right now?,,https://www.reddit.com/r/personalfinance/comments/1rq8tfx/am_i_right_to_think_buying_a_house_would_be/,2419
1s0js64,I think my roommate might be scamming me.,,https://www.reddit.com/r/personalfinance/comments/1s0js64/i_think_my_roommate_might_be_scamming_me/,2135
1rvqeyi,Billed by school I never attended/applied for/heard of,,https://www.reddit.com/r/personalfinance/comments/1rvqeyi/billed_by_school_i_never_attendedapplied_forheard/,2180
1s7dsb1,"Got myself into a 84 month car loan of $42K, feeling financial pressure as I try to grow in life",,https://www.reddit.com/r/personalfinance/comments/1s7dsb1/got_myself_into_a_84_month_car_loan_of_42k/,2334
1rky5il,"Feeling blindsided by $9,300 birth bill even with insurance. Am I naive?",,https://www.reddit.com/r/personalfinance/comments/1rky5il/feeling_blindsided_by_9300_birth_bill_even_with/,1759
1s02m2j,"Is the ""Always Buy Used"" rule broken when New APR is <1%?",,https://www.reddit.com/r/personalfinance/comments/1s02m2j/is_the_always_buy_used_rule_broken_when_new_apr/,2085
1rqd8t2,Dealer update bricked my Mazda3.,,https://www.reddit.com/r/personalfinance/comments/1rqd8t2/dealer_update_bricked_my_mazda3/,1479
1rrzp29,Married filing separately- Spouse hasn’t filed in 3 years!,,https://www.reddit.com/r/personalfinance/comments/1rrzp29/married_filing_separately_spouse_hasnt_filed_in_3/,1270
1rjln4r,Car note mysteriously paid off,,https://www.reddit.com/r/personalfinance/comments/1rjln4r/car_note_mysteriously_paid_off/,1403
1s0b6p0,My mother (68) has added my name to her checking and savings accounts in case something happens to her I can access her funds easier. But I’m concerned about liability.,,https://www.reddit.com/r/personalfinance/comments/1s0b6p0/my_mother_68_has_added_my_name_to_her_checking/,1325
1rit5g0,Mortgage company is refusing to accept my payoff until a later date,,https://www.reddit.com/r/personalfinance/comments/1rit5g0/mortgage_company_is_refusing_to_accept_my_payoff/,1603
1rmp0oc,Is losing half my 401k a reason to stay at my current job?,,https://www.reddit.com/r/personalfinance/comments/1rmp0oc/is_losing_half_my_401k_a_reason_to_stay_at_my/,1434
1ro6tkr,Does it make sense to buy a house anymore?,,https://www.reddit.com/r/personalfinance/comments/1ro6tkr/does_it_make_sense_to_buy_a_house_anymore/,1094
1rkvc2x,"Laid off after 25 years, what to do with 401K ???",,https://www.reddit.com/r/personalfinance/comments/1rkvc2x/laid_off_after_25_years_what_to_do_with_401k/,962
1s2t8zq,"I’m in debt, my rent is killing me, and I’m trapped.",,https://www.reddit.com/r/personalfinance/comments/1s2t8zq/im_in_debt_my_rent_is_killing_me_and_im_trapped/,1290
1rjysqq,"Spouse died at age 40, need advice how to manage finances and whether to focus on paying off debt or focus on investing",,https://www.reddit.com/r/personalfinance/comments/1rjysqq/spouse_died_at_age_40_need_advice_how_to_manage/,1262
1rs8tkp,Inherited wealth - How do I manage this money safely for the benefit of a child?,,https://www.reddit.com/r/personalfinance/comments/1rs8tkp/inherited_wealth_how_do_i_manage_this_money/,798
1s0c9k4,Am I financially ok to move out?,,https://www.reddit.com/r/personalfinance/comments/1s0c9k4/am_i_financially_ok_to_move_out/,908
1rppc5l,Can I afford to take in my nonverbal special needs brother?,,https://www.reddit.com/r/personalfinance/comments/1rppc5l/can_i_afford_to_take_in_my_nonverbal_special/,383
1rln4m4,How to support parents who are overly generous with money and can’t retire,,https://www.reddit.com/r/personalfinance/comments/1rln4m4/how_to_support_parents_who_are_overly_generous/,515
1s0bfh1,529 - how do i spend it?,,https://www.reddit.com/r/personalfinance/comments/1s0bfh1/529_how_do_i_spend_it/,715
1s82o5k,CD rates make no sense based on length of time invested. Explain like I'm 5?,,https://www.reddit.com/r/personalfinance/comments/1s82o5k/cd_rates_make_no_sense_based_on_length_of_time/,857
1s1otve,"Divorcing - better to sell house and split 401k, or keep house and give up 401k",,https://www.reddit.com/r/personalfinance/comments/1s1otve/divorcing_better_to_sell_house_and_split_401k_or/,1100
1s82osx,Ex has my truck that I’m paying loan for,,https://www.reddit.com/r/personalfinance/comments/1s82osx/ex_has_my_truck_that_im_paying_loan_for/,1095
1ry5fsf,"Just sold my house, where do I put the money?",,https://www.reddit.com/r/personalfinance/comments/1ry5fsf/just_sold_my_house_where_do_i_put_the_money/,218
