id,title,selftext,permalink,score
1r8wh11,"I let my parents convince me to skip my company's 401k for three years because they said ""the market is about to crash"" and I will never forgive myself for this",,https://www.reddit.com/r/personalfinance/comments/1r8wh11/i_let_my_parents_convince_me_to_skip_my_companys/,66067
1rauamc,"Be very cautious about master's degrees, including from prestigious universities. Some of my coworkers in their 30s are financially hobbled by these degrees.",,https://www.reddit.com/r/personalfinance/comments/1rauamc/be_very_cautious_about_masters_degrees_including/,57705
1rf5wpx,Protecting myself from my soon to be ex-fiancée,,https://www.reddit.com/r/personalfinance/comments/1rf5wpx/protecting_myself_from_my_soon_to_be_exfiancée/,51294
1rdprp1,"I received a $15,000 bill for an ER visit for a kidney stone. They offering 70% off - should I take it or can I negotiate a higher discount?",,https://www.reddit.com/r/personalfinance/comments/1rdprp1/i_received_a_15000_bill_for_an_er_visit_for_a/,45070
1qvehv5,"Dentist billed insurance for orthodontics I never had, insurance confirmed fraud, now office is threatening collections — what do I do?",,https://www.reddit.com/r/personalfinance/comments/1qvehv5/dentist_billed_insurance_for_orthodontics_i_never/,40189
1rdd7ou,I send 1k usd to my mom in Korea every month,,https://www.reddit.com/r/personalfinance/comments/1rdd7ou/i_send_1k_usd_to_my_mom_in_korea_every_month/,34646
1r42cx6,Friend hasn't filed taxes in 10 years,,https://www.reddit.com/r/personalfinance/comments/1r42cx6/friend_hasnt_filed_taxes_in_10_years/,30856
1qtkz0m,Propane company billed me for my own propane - now what?,,https://www.reddit.com/r/personalfinance/comments/1qtkz0m/propane_company_billed_me_for_my_own_propane_now/,27401
1rd2732,"I tracked my spending for the past 4 months and I am spending around $1,500 per month on food/groceries. I am feeling so angry and disappointed. How to fix this?",,https://www.reddit.com/r/personalfinance/comments/1rd2732/i_tracked_my_spending_for_the_past_4_months_and_i/,24307
1r0qoe0,Are HYSAs as easy as I think they are?,,https://www.reddit.com/r/personalfinance/comments/1r0qoe0/are_hysas_as_easy_as_i_think_they_are/,21055
1rbtpv3,Husband (soon to be ex- ) opened new credit cards in my name and maxed them out - can I somehow remove them from my debt?,,https://www.reddit.com/r/personalfinance/comments/1rbtpv3/husband_soon_to_be_ex_opened_new_credit_cards_in/,18921
1rgz43k,Landlord raised rent by $650 and idk what to do,,https://www.reddit.com/r/personalfinance/comments/1rgz43k/landlord_raised_rent_by_650_and_idk_what_to_do/,16394
1rcnb15,"Hotel didn't issue a refund. Asked Amex for a chargeback, now hotel wants me to give them my bank details one day before the chargeback will be credited.",,https://www.reddit.com/r/personalfinance/comments/1rcnb15/hotel_didnt_issue_a_refund_asked_amex_for_a/,14582
1r84l43,Seller pressuring me to close chargeback case,,https://www.reddit.com/r/personalfinance/comments/1r84l43/seller_pressuring_me_to_close_chargeback_case/,13212
1qwzzub,Using credit cards instead of debit card.,,https://www.reddit.com/r/personalfinance/comments/1qwzzub/using_credit_cards_instead_of_debit_card/,11832
1qt826g,My dad passed away in July of 2025 and I kept getting his medical bills. What do I do?,,https://www.reddit.com/r/personalfinance/comments/1qt826g/my_dad_passed_away_in_july_of_2025_and_i_kept/,9751
1rfcqld,I got a 46% discount on college with my 529,,https://www.reddit.com/r/personalfinance/comments/1rfcqld/i_got_a_46_discount_on_college_with_my_529/,8861
1r762x5,Just discovered I didn't pay my property tax last year. Gave it to someone else.,,https://www.reddit.com/r/personalfinance/comments/1r762x5/just_discovered_i_didnt_pay_my_property_tax_last/,8166
1r60d6h,Am I being stupid to leave rent stabilized apartment,,https://www.reddit.com/r/personalfinance/comments/1r60d6h/am_i_being_stupid_to_leave_rent_stabilized/,7443
1r384ir,Please be careful with financial advisors,,https://www.reddit.com/r/personalfinance/comments/1r384ir/please_be_careful_with_financial_advisors/,6307
1r0et3h,If I’m young is it really that easy?,,https://www.reddit.com/r/personalfinance/comments/1r0et3h/if_im_young_is_it_really_that_easy/,5344
1r1p1vs,I loaned my brother $70k so he could buy his first house. He’s paying me back…,,https://www.reddit.com/r/personalfinance/comments/1r1p1vs/i_loaned_my_brother_70k_so_he_could_buy_his_first/,4664
1r98q83,Scam attempt warning,,https://www.reddit.com/r/personalfinance/comments/1r98q83/scam_attempt_warning/,4374
1ra7rs5,"Aunt died, and my dad inherited her pension benefit, but he then died before receiving anything. What happens to the funds my aunt contributed to the pension?",,https://www.reddit.com/r/personalfinance/comments/1ra7rs5/aunt_died_and_my_dad_inherited_her_pension/,4187
1r8cp5d,My credit score dropped 221 points from missing one student loan payment. 808 to 587.,,https://www.reddit.com/r/personalfinance/comments/1r8cp5d/my_credit_score_dropped_221_points_from_missing/,3701
1qw8ksd,"I feel like I'm way behind on retirement, is it as bad as I think?",,https://www.reddit.com/r/personalfinance/comments/1qw8ksd/i_feel_like_im_way_behind_on_retirement_is_it_as/,3395
1r4tfh7,Just filed my taxes today and I forgot to add a 1099-INT from my HYSA Account,,https://www.reddit.com/r/personalfinance/comments/1r4tfh7/just_filed_my_taxes_today_and_i_forgot_to_add_a/,2835
1r148vr,Why would my husbands ex be asking us to claim both kids on our taxes?,,https://www.reddit.com/r/personalfinance/comments/1r148vr/why_would_my_husbands_ex_be_asking_us_to_claim/,2987
1r321j5,Be aware that turbotax might not be correct,,https://www.reddit.com/r/personalfinance/comments/1r321j5/be_aware_that_turbotax_might_not_be_correct/,2136
1r5naar,I have 25k at 20. No idea what to do with it.,,https://www.reddit.com/r/personalfinance/comments/1r5naar/i_have_25k_at_20_no_idea_what_to_do_with_it/,1864
1rg4y6t,Okay so this might be a dumb question but I genuinely cannot find a straight answer anywhere.,,https://www.reddit.com/r/personalfinance/comments/1rg4y6t/okay_so_this_might_be_a_dumb_question_but_i/,1963
1r0xgmc,"My parents passed when I was 12, I am just not getting my inheritance at 30. How can I verify that the person managing these accounts is qualified and has my best interests in mind?",,https://www.reddit.com/r/personalfinance/comments/1r0xgmc/my_parents_passed_when_i_was_12_i_am_just_not/,1960
1r2kvuy,"Unexpectedly large bill for migraine Botox injections, unsure of how I will pay it as a teacher making 49k in LA",,https://www.reddit.com/r/personalfinance/comments/1r2kvuy/unexpectedly_large_bill_for_migraine_botox/,1584
1rf7dxs,Venmo claim dispute declined,,https://www.reddit.com/r/personalfinance/comments/1rf7dxs/venmo_claim_dispute_declined/,1407
1qy2x61,empty nest single mom (42) feeling overwhelmed about finances — where do I start?,,https://www.reddit.com/r/personalfinance/comments/1qy2x61/empty_nest_single_mom_42_feeling_overwhelmed/,1468
1r48bsf,I’ve never made money like this. What do I do?,,https://www.reddit.com/r/personalfinance/comments/1r48bsf/ive_never_made_money_like_this_what_do_i_do/,1458
1rgg3p9,My retired mother received a pension wind up letter from her company she's retired from. What does this mean?,,https://www.reddit.com/r/personalfinance/comments/1rgg3p9/my_retired_mother_received_a_pension_wind_up/,790
1queg5n,"Employer lied about sending W-2, probably won’t send it as retaliation.",,https://www.reddit.com/r/personalfinance/comments/1queg5n/employer_lied_about_sending_w2_probably_wont_send/,1482
1r872mz,"28, Way too Much in HYSA because of Uncertainty/Doubt",,https://www.reddit.com/r/personalfinance/comments/1r872mz/28_way_too_much_in_hysa_because_of/,753
1rit5g0,Mortgage company is refusing to accept my payoff until a later date,,https://www.reddit.com/r/personalfinance/comments/1rit5g0/mortgage_company_is_refusing_to_accept_my_payoff/,1378
1rig38n,"I’m 24 years old in 50k debt making 42,000/year. where do i start fixing this?",,https://www.reddit.com/r/personalfinance/comments/1rig38n/im_24_years_old_in_50k_debt_making_42000year/,544
1r6f179,My parents claimed me as a false worker under their business.,,https://www.reddit.com/r/personalfinance/comments/1r6f179/my_parents_claimed_me_as_a_false_worker_under/,1032
1ra0p8a,We finally bought a house for our terminally ill sons… and now I feel like we’re drowning. What would you do in our position?,,https://www.reddit.com/r/personalfinance/comments/1ra0p8a/we_finally_bought_a_house_for_our_terminally_ill/,1270
1r9tdl4,Can I just put $5 on my card every month and pay it right away for my credit to build?,,https://www.reddit.com/r/personalfinance/comments/1r9tdl4/can_i_just_put_5_on_my_card_every_month_and_pay/,691
1rfey65,Is quitting a job with a pension a bad move?,,https://www.reddit.com/r/personalfinance/comments/1rfey65/is_quitting_a_job_with_a_pension_a_bad_move/,759
1rigws8,How should I split the rent with my friends?,,https://www.reddit.com/r/personalfinance/comments/1rigws8/how_should_i_split_the_rent_with_my_friends/,758
1rdovp9,What do I do with my inheritance?,,https://www.reddit.com/r/personalfinance/comments/1rdovp9/what_do_i_do_with_my_inheritance/,566
1qyt0ex,Bad credit w/ inheritance,,https://www.reddit.com/r/personalfinance/comments/1qyt0ex/bad_credit_w_inheritance/,693
1rakdkj,"My mom was given savings bonds from a woman she took care of, no idea what to do with them.",,https://www.reddit.com/r/personalfinance/comments/1rakdkj/my_mom_was_given_savings_bonds_from_a_woman_she/,599
1rbh3o9,"Am I being ""penalized"" for paying credit off in full every month?",,https://www.reddit.com/r/personalfinance/comments/1rbh3o9/am_i_being_penalized_for_paying_credit_off_in/,396
