id,title,selftext,permalink,score
1mmvsvt,Guy casually demonstrates a completely different way to hang up shirts,,https://www.reddit.com/r/lifehacks/comments/1mmvsvt/guy_casually_demonstrates_a_completely_different/,33049
1sht1yn,"I was racking my brain, trying to remember if I'd taken my morning anti-biotic, when an idea occurred to me",,https://www.reddit.com/r/lifehacks/comments/1sht1yn/i_was_racking_my_brain_trying_to_remember_if_id/,29169
1ofsy97,How to put string back in hole,,https://www.reddit.com/r/lifehacks/comments/1ofsy97/how_to_put_string_back_in_hole/,25157
1mfliig,"If you happen to drop your key in dirty water, use a transparent plastic bag filled with clean water to expel dirty water so that you can see through the bottom.",,https://www.reddit.com/r/lifehacks/comments/1mfliig/if_you_happen_to_drop_your_key_in_dirty_water_use/,22618
1pv746i,"If you cut your wrapping paper to small, Try turning the gift 45 degrees!",,https://www.reddit.com/r/lifehacks/comments/1pv746i/if_you_cut_your_wrapping_paper_to_small_try/,20288
1rs1sy0,Fill Empty Space in Your Freezer With Jugs of Water,,https://www.reddit.com/r/lifehacks/comments/1rs1sy0/fill_empty_space_in_your_freezer_with_jugs_of/,17521
1nx8jnh,"When I hear about “life hack,” this is what I expect to see",,https://www.reddit.com/r/lifehacks/comments/1nx8jnh/when_i_hear_about_life_hack_this_is_what_i_expect/,15943
1mx6th2,Retrieving a cork that has fallen into a wine bottle,,https://www.reddit.com/r/lifehacks/comments/1mx6th2/retrieving_a_cork_that_has_fallen_into_a_wine/,13909
1tn6e2g,No pill-cutter? Try this,,https://www.reddit.com/r/lifehacks/comments/1tn6e2g/no_pillcutter_try_this/,11785
1msm289,"When pouring liquid from a large bottle, making a small hole on the other side helps the liquid flow out smoothly.",,https://www.reddit.com/r/lifehacks/comments/1msm289/when_pouring_liquid_from_a_large_bottle_making_a/,10424
1ucwvbo,Got tired of refilling the soap,,https://www.reddit.com/r/lifehacks/comments/1ucwvbo/got_tired_of_refilling_the_soap/,9110
1mnjl04,Plastic waste management somewhere in Pakistan.,,https://www.reddit.com/r/lifehacks/comments/1mnjl04/plastic_waste_management_somewhere_in_pakistan/,8085
1p20ixn,"When you can't tear open plastic packaging, you can try to tear it using two coins like this.",,https://www.reddit.com/r/lifehacks/comments/1p20ixn/when_you_cant_tear_open_plastic_packaging_you_can/,7076
1p29k40,Real life example of CTRL-C + CTRL-V,,https://www.reddit.com/r/lifehacks/comments/1p29k40/real_life_example_of_ctrlc_ctrlv/,6546
1o0r9or,A demonstration of how to use your arm to easily tie a necktie,,https://www.reddit.com/r/lifehacks/comments/1o0r9or/a_demonstration_of_how_to_use_your_arm_to_easily/,6013
1rtsjtq,No seatback display? No problem!,,https://www.reddit.com/r/lifehacks/comments/1rtsjtq/no_seatback_display_no_problem/,5395
1un19lm,My trick for falling asleep quickly,,https://www.reddit.com/r/lifehacks/comments/1un19lm/my_trick_for_falling_asleep_quickly/,4352
1qxpuka,Improvised funnel,,https://www.reddit.com/r/lifehacks/comments/1qxpuka/improvised_funnel/,3927
1p0t3ka,Useful paint-removal hack,,https://www.reddit.com/r/lifehacks/comments/1p0t3ka/useful_paintremoval_hack/,3793
1mkwkok,Super simple hack.,,https://www.reddit.com/r/lifehacks/comments/1mkwkok/super_simple_hack/,3516
1s8cl9z,Toddlers should also be equipped with pitons and crampons.,,https://www.reddit.com/r/lifehacks/comments/1s8cl9z/toddlers_should_also_be_equipped_with_pitons_and/,2739
1twot8r,i saw this a while ago and saved it for when i needed it... today i can say that this lifehack saved my gym shorts!,,https://www.reddit.com/r/lifehacks/comments/1twot8r/i_saw_this_a_while_ago_and_saved_it_for_when_i/,2695
1toalpl,DIY Hack,,https://www.reddit.com/r/lifehacks/comments/1toalpl/diy_hack/,2205
1tzk7uq,"Airplane floors are extremely gross, so I always pack a trash bag to slip my backpack into.",,https://www.reddit.com/r/lifehacks/comments/1tzk7uq/airplane_floors_are_extremely_gross_so_i_always/,2521
1nb5vq7,Has anyone seen this before,,https://www.reddit.com/r/lifehacks/comments/1nb5vq7/has_anyone_seen_this_before/,1620
1tp2gtf,You might be using your dishwasher wrong,,https://www.reddit.com/r/lifehacks/comments/1tp2gtf/you_might_be_using_your_dishwasher_wrong/,2007
1n8vr4v,Keep a worse version of your important consumables onhand,,https://www.reddit.com/r/lifehacks/comments/1n8vr4v/keep_a_worse_version_of_your_important/,1841
1si1t2j,It's getting warmer outside. That means ants!! Here's a concoction that I have used for years now.,,https://www.reddit.com/r/lifehacks/comments/1si1t2j/its_getting_warmer_outside_that_means_ants_heres/,1999
1mwl0pt,"After urban flooding in Pakistan, a man was spotted using a pipe to keep water out of his motorcycle’s exhaust.",,https://www.reddit.com/r/lifehacks/comments/1mwl0pt/after_urban_flooding_in_pakistan_a_man_was/,1146
1utgrzk,When you just can't fihd that damn fork!,,https://www.reddit.com/r/lifehacks/comments/1utgrzk/when_you_just_cant_fihd_that_damn_fork/,1460
1npv168,My 13yo daughter invented a way to clean hair brushes.,,https://www.reddit.com/r/lifehacks/comments/1npv168/my_13yo_daughter_invented_a_way_to_clean_hair/,1080
1uaclnj,I can't believe cinnamon worked!,,https://www.reddit.com/r/lifehacks/comments/1uaclnj/i_cant_believe_cinnamon_worked/,927
1m8pxqe,Quickly convert celsius to Fahrenheit in your head… Accurately,,https://www.reddit.com/r/lifehacks/comments/1m8pxqe/quickly_convert_celsius_to_fahrenheit_in_your/,1209
1tynumi,Fake wasp nest to avoid real wasps nesting around my balcony,,https://www.reddit.com/r/lifehacks/comments/1tynumi/fake_wasp_nest_to_avoid_real_wasps_nesting_around/,921
1n2a3tc,Command Strip Win!,,https://www.reddit.com/r/lifehacks/comments/1n2a3tc/command_strip_win/,1036
1tt3daw,"Bring always an umbrella with, even into the Caribbean",,https://www.reddit.com/r/lifehacks/comments/1tt3daw/bring_always_an_umbrella_with_even_into_the/,626
1mpnhsm,How to Open a Can Without a Can Opener,,https://www.reddit.com/r/lifehacks/comments/1mpnhsm/how_to_open_a_can_without_a_can_opener/,1105
1mbn7qg,Free Bookmarks,,https://www.reddit.com/r/lifehacks/comments/1mbn7qg/free_bookmarks/,638
1ntbimm,"When you feel stuck, try this: write the opposite solution first.",,https://www.reddit.com/r/lifehacks/comments/1ntbimm/when_you_feel_stuck_try_this_write_the_opposite/,649
1sellcj,"Put some rice into a sock, tie a knot, microwave it for 2mins and you got yourself a heating pad!",,https://www.reddit.com/r/lifehacks/comments/1sellcj/put_some_rice_into_a_sock_tie_a_knot_microwave_it/,898
1qtd9yd,"You didn't shrink your wool sweater, you ""felted"" it. Here is the conditioner trick to un-shrink it.",,https://www.reddit.com/r/lifehacks/comments/1qtd9yd/you_didnt_shrink_your_wool_sweater_you_felted_it/,821
1ochf92,Just wanted to say Thank You,,https://www.reddit.com/r/lifehacks/comments/1ochf92/just_wanted_to_say_thank_you/,1057
1q7mh38,"If a fly is following you, hold your breath",,https://www.reddit.com/r/lifehacks/comments/1q7mh38/if_a_fly_is_following_you_hold_your_breath/,385
1skbd5s,"When traveling alone, tie your backpack or purse to the chair to deter theft",,https://www.reddit.com/r/lifehacks/comments/1skbd5s/when_traveling_alone_tie_your_backpack_or_purse/,787
1qz0lm8,My dad found a new use for a pool noodle,,https://www.reddit.com/r/lifehacks/comments/1qz0lm8/my_dad_found_a_new_use_for_a_pool_noodle/,653
1m32hhj,My amazing wife taught me this fire-starter life hack and it works SO well. 🤩🔥,,https://www.reddit.com/r/lifehacks/comments/1m32hhj/my_amazing_wife_taught_me_this_firestarter_life/,327
1phspi8,Keep paint tins clean,,https://www.reddit.com/r/lifehacks/comments/1phspi8/keep_paint_tins_clean/,454
1mcfvbr,Some Polish ingenuity (aka my Dads idea) for saving money and keeping the dehumidifier empty!,,https://www.reddit.com/r/lifehacks/comments/1mcfvbr/some_polish_ingenuity_aka_my_dads_idea_for_saving/,648
1r9ja6u,if you hate doing something just make it stupid easy to start,,https://www.reddit.com/r/lifehacks/comments/1r9ja6u/if_you_hate_doing_something_just_make_it_stupid/,181
1qr3szw,My favourite life hack,,https://www.reddit.com/r/lifehacks/comments/1qr3szw/my_favourite_life_hack/,161
