id,title,selftext,permalink,score
1kqr8m9,Get the full value out of lotion bottles,,https://www.reddit.com/r/lifehacks/comments/1kqr8m9/get_the_full_value_out_of_lotion_bottles/,21290
1mmvsvt,Guy casually demonstrates a completely different way to hang up shirts,,https://www.reddit.com/r/lifehacks/comments/1mmvsvt/guy_casually_demonstrates_a_completely_different/,19344
1ofsy97,How to put string back in hole,,https://www.reddit.com/r/lifehacks/comments/1ofsy97/how_to_put_string_back_in_hole/,17065
1sht1yn,"I was racking my brain, trying to remember if I'd taken my morning anti-biotic, when an idea occurred to me",,https://www.reddit.com/r/lifehacks/comments/1sht1yn/i_was_racking_my_brain_trying_to_remember_if_id/,15188
1mfliig,"If you happen to drop your key in dirty water, use a transparent plastic bag filled with clean water to expel dirty water so that you can see through the bottom.",,https://www.reddit.com/r/lifehacks/comments/1mfliig/if_you_happen_to_drop_your_key_in_dirty_water_use/,12884
1pv746i,"If you cut your wrapping paper to small, Try turning the gift 45 degrees!",,https://www.reddit.com/r/lifehacks/comments/1pv746i/if_you_cut_your_wrapping_paper_to_small_try/,11637
1rs1sy0,Fill Empty Space in Your Freezer With Jugs of Water,,https://www.reddit.com/r/lifehacks/comments/1rs1sy0/fill_empty_space_in_your_freezer_with_jugs_of/,10238
1nx8jnh,"When I hear about “life hack,” this is what I expect to see",,https://www.reddit.com/r/lifehacks/comments/1nx8jnh/when_i_hear_about_life_hack_this_is_what_i_expect/,9403
1mx6th2,Retrieving a cork that has fallen into a wine bottle,,https://www.reddit.com/r/lifehacks/comments/1mx6th2/retrieving_a_cork_that_has_fallen_into_a_wine/,7896
1msm289,"When pouring liquid from a large bottle, making a small hole on the other side helps the liquid flow out smoothly.",,https://www.reddit.com/r/lifehacks/comments/1msm289/when_pouring_liquid_from_a_large_bottle_making_a/,7577
1mnjl04,Plastic waste management somewhere in Pakistan.,,https://www.reddit.com/r/lifehacks/comments/1mnjl04/plastic_waste_management_somewhere_in_pakistan/,6370
1p20ixn,"When you can't tear open plastic packaging, you can try to tear it using two coins like this.",,https://www.reddit.com/r/lifehacks/comments/1p20ixn/when_you_cant_tear_open_plastic_packaging_you_can/,5719
1p29k40,Real life example of CTRL-C + CTRL-V,,https://www.reddit.com/r/lifehacks/comments/1p29k40/real_life_example_of_ctrlc_ctrlv/,5160
1o0r9or,A demonstration of how to use your arm to easily tie a necktie,,https://www.reddit.com/r/lifehacks/comments/1o0r9or/a_demonstration_of_how_to_use_your_arm_to_easily/,4854
1rtsjtq,No seatback display? No problem!,,https://www.reddit.com/r/lifehacks/comments/1rtsjtq/no_seatback_display_no_problem/,3985
1qxpuka,Improvised funnel,,https://www.reddit.com/r/lifehacks/comments/1qxpuka/improvised_funnel/,3640
1p0t3ka,Useful paint-removal hack,,https://www.reddit.com/r/lifehacks/comments/1p0t3ka/useful_paintremoval_hack/,2867
1mkwkok,Super simple hack.,,https://www.reddit.com/r/lifehacks/comments/1mkwkok/super_simple_hack/,3119
1kac80u,What's a skill that takes less than an hour to learn but pays off forever?,,https://www.reddit.com/r/lifehacks/comments/1kac80u/whats_a_skill_that_takes_less_than_an_hour_to/,2628
1s8cl9z,Toddlers should also be equipped with pitons and crampons.,,https://www.reddit.com/r/lifehacks/comments/1s8cl9z/toddlers_should_also_be_equipped_with_pitons_and/,2479
1la5v0e,Bandaid kept falling off. Cut the wings down the middle and cross-crossed them and now it stays on all day,,https://www.reddit.com/r/lifehacks/comments/1la5v0e/bandaid_kept_falling_off_cut_the_wings_down_the/,2494
1nb5vq7,Has anyone seen this before,,https://www.reddit.com/r/lifehacks/comments/1nb5vq7/has_anyone_seen_this_before/,2179
1oin2cx,Peel off those barcode stickers on glassware effortlessly,,https://www.reddit.com/r/lifehacks/comments/1oin2cx/peel_off_those_barcode_stickers_on_glassware/,2185
1l9qgep,Keeping yourself online: did anyone think about this?,,https://www.reddit.com/r/lifehacks/comments/1l9qgep/keeping_yourself_online_did_anyone_think_about/,1331
1n8vr4v,Keep a worse version of your important consumables onhand,,https://www.reddit.com/r/lifehacks/comments/1n8vr4v/keep_a_worse_version_of_your_important/,1908
1mwl0pt,"After urban flooding in Pakistan, a man was spotted using a pipe to keep water out of his motorcycle’s exhaust.",,https://www.reddit.com/r/lifehacks/comments/1mwl0pt/after_urban_flooding_in_pakistan_a_man_was/,963
1si1t2j,It's getting warmer outside. That means ants!! Here's a concoction that I have used for years now.,,https://www.reddit.com/r/lifehacks/comments/1si1t2j/its_getting_warmer_outside_that_means_ants_heres/,1588
1npv168,My 13yo daughter invented a way to clean hair brushes.,,https://www.reddit.com/r/lifehacks/comments/1npv168/my_13yo_daughter_invented_a_way_to_clean_hair/,933
1m8pxqe,Quickly convert celsius to Fahrenheit in your head… Accurately,,https://www.reddit.com/r/lifehacks/comments/1m8pxqe/quickly_convert_celsius_to_fahrenheit_in_your/,1257
1lemk0g,"I don’t get ready for work in the mornings anymore, I do it the night before",,https://www.reddit.com/r/lifehacks/comments/1lemk0g/i_dont_get_ready_for_work_in_the_mornings_anymore/,1383
1lcbw9y,How to stop spoofed spam calls,,https://www.reddit.com/r/lifehacks/comments/1lcbw9y/how_to_stop_spoofed_spam_calls/,835
1n2a3tc,Command Strip Win!,,https://www.reddit.com/r/lifehacks/comments/1n2a3tc/command_strip_win/,693
1ppbdlk,Noise reduction as a life hack: my experience after 6 months of using earplugs daily,,https://www.reddit.com/r/lifehacks/comments/1ppbdlk/noise_reduction_as_a_life_hack_my_experience/,1330
1lpi3hq,Cleaning bike gears,,https://www.reddit.com/r/lifehacks/comments/1lpi3hq/cleaning_bike_gears/,809
1mpnhsm,How to Open a Can Without a Can Opener,,https://www.reddit.com/r/lifehacks/comments/1mpnhsm/how_to_open_a_can_without_a_can_opener/,650
1mbn7qg,Free Bookmarks,,https://www.reddit.com/r/lifehacks/comments/1mbn7qg/free_bookmarks/,801
1luaxrq,"Uber to the airport hotel, not the airport",,https://www.reddit.com/r/lifehacks/comments/1luaxrq/uber_to_the_airport_hotel_not_the_airport/,429
1ntbimm,"When you feel stuck, try this: write the opposite solution first.",,https://www.reddit.com/r/lifehacks/comments/1ntbimm/when_you_feel_stuck_try_this_write_the_opposite/,580
1sellcj,"Put some rice into a sock, tie a knot, microwave it for 2mins and you got yourself a heating pad!",,https://www.reddit.com/r/lifehacks/comments/1sellcj/put_some_rice_into_a_sock_tie_a_knot_microwave_it/,393
1kxngwg,What 'brilliant' life hack did you try that made everything infinitely worse?,,https://www.reddit.com/r/lifehacks/comments/1kxngwg/what_brilliant_life_hack_did_you_try_that_made/,851
1qtd9yd,"You didn't shrink your wool sweater, you ""felted"" it. Here is the conditioner trick to un-shrink it.",,https://www.reddit.com/r/lifehacks/comments/1qtd9yd/you_didnt_shrink_your_wool_sweater_you_felted_it/,355
1ochf92,Just wanted to say Thank You,,https://www.reddit.com/r/lifehacks/comments/1ochf92/just_wanted_to_say_thank_you/,854
1q7mh38,"If a fly is following you, hold your breath",,https://www.reddit.com/r/lifehacks/comments/1q7mh38/if_a_fly_is_following_you_hold_your_breath/,940
1qz0lm8,My dad found a new use for a pool noodle,,https://www.reddit.com/r/lifehacks/comments/1qz0lm8/my_dad_found_a_new_use_for_a_pool_noodle/,551
1m32hhj,My amazing wife taught me this fire-starter life hack and it works SO well. 🤩🔥,,https://www.reddit.com/r/lifehacks/comments/1m32hhj/my_amazing_wife_taught_me_this_firestarter_life/,659
1phspi8,Keep paint tins clean,,https://www.reddit.com/r/lifehacks/comments/1phspi8/keep_paint_tins_clean/,730
1mcfvbr,Some Polish ingenuity (aka my Dads idea) for saving money and keeping the dehumidifier empty!,,https://www.reddit.com/r/lifehacks/comments/1mcfvbr/some_polish_ingenuity_aka_my_dads_idea_for_saving/,549
1r9ja6u,if you hate doing something just make it stupid easy to start,,https://www.reddit.com/r/lifehacks/comments/1r9ja6u/if_you_hate_doing_something_just_make_it_stupid/,313
1qr3szw,My favourite life hack,,https://www.reddit.com/r/lifehacks/comments/1qr3szw/my_favourite_life_hack/,770
1n7gldc,Lidls coffee lids fit all other tins so you can use them to cover stuff you can’t finish,,https://www.reddit.com/r/lifehacks/comments/1n7gldc/lidls_coffee_lids_fit_all_other_tins_so_you_can/,993
