id,title,selftext,permalink,score
1sz26w2,u/swissmissmaybe on how being a woman is like riding a bike,,https://www.reddit.com/r/bestof/comments/1sz26w2/uswissmissmaybe_on_how_being_a_woman_is_like/,79343
1tbmkad,U/Amneiger breaks down Red State Vs. Blue State outcomes for Americans with links to back it up,,https://www.reddit.com/r/bestof/comments/1tbmkad/uamneiger_breaks_down_red_state_vs_blue_state/,69793
1t5cllg,OP posts that he was harassed after doing nothing wrong at the terrain park. A witness chimes in that OP absolutely did something wrong.,,https://www.reddit.com/r/bestof/comments/1t5cllg/op_posts_that_he_was_harassed_after_doing_nothing/,61770
1t8rg80,"A hotel's maintenance director explains how hotels deal with bedbugs, how they replace mattresses, and that time one was eaten by a goat",,https://www.reddit.com/r/bestof/comments/1t8rg80/a_hotels_maintenance_director_explains_how_hotels/,54765
1tf6wek,u/Gonna_B_Alright explains why tax cattle aren’t breeding,,https://www.reddit.com/r/bestof/comments/1tf6wek/ugonna_b_alright_explains_why_tax_cattle_arent/,47937
1t6zp3k,"u/clarityappreciated's hobby is collecting useless certifications, and requests more. u/gofuckadick replies providing a long, strange, and eclectic list of useless, useful, and in-between free and paid certifications one can easily get online",,https://www.reddit.com/r/bestof/comments/1t6zp3k/uclarityappreciateds_hobby_is_collecting_useless/,42714
1t9noch,OP gives a hilarious translation of Corporate speak.,,https://www.reddit.com/r/bestof/comments/1t9noch/op_gives_a_hilarious_translation_of_corporate/,37380
1td94e1,Former r/UFOs mod shares their experience with inauthentic manipulation of the topic on reddit as of two years ago. It has only gotten worse since.,,https://www.reddit.com/r/bestof/comments/1td94e1/former_rufos_mod_shares_their_experience_with/,32626
1t6sdqq,U/jizzyMcKnobGobbler gives perfect advice on dealing with a neighbour's dog who won't shut up.,,https://www.reddit.com/r/bestof/comments/1t6sdqq/ujizzymcknobgobbler_gives_perfect_advice_on/,28700
1tifout,How it feels to die while cave diving,,https://www.reddit.com/r/bestof/comments/1tifout/how_it_feels_to_die_while_cave_diving/,25531
1tjm7g1,OP lays out the reality of suing your insurance company,,https://www.reddit.com/r/bestof/comments/1tjm7g1/op_lays_out_the_reality_of_suing_your_insurance/,22833
1tk3mqw,User gets heated about SpaceX plans,,https://www.reddit.com/r/bestof/comments/1tk3mqw/user_gets_heated_about_spacex_plans/,20201
1svy0mc,u/studytimevinyl explains the origin of the record speeds and why 78 isn't just 33 + 45,,https://www.reddit.com/r/bestof/comments/1svy0mc/ustudytimevinyl_explains_the_origin_of_the_record/,17191
1t0ruvj,/u/ScissorNightRam reminds us of Jack Winter's 1994 story that uses only orphaned negatives,,https://www.reddit.com/r/bestof/comments/1t0ruvj/uscissornightram_reminds_us_of_jack_winters_1994/,15792
1tkmeox,u/itsallfolklore explains how likely it was for a prospector to strike it rich during the 1849 California Gold Rush,,https://www.reddit.com/r/bestof/comments/1tkmeox/uitsallfolklore_explains_how_likely_it_was_for_a/,13601
1tebuaz,"U/serversamwinchester explains how multiple competing factors can influence crime rates, the subjective idea behind multivariate analysis.",,https://www.reddit.com/r/bestof/comments/1tebuaz/userversamwinchester_explains_how_multiple/,11873
1t1p6du,"OP Sheepishly asks the difference between a riff, lick and solo in music. u/WellComeToTheMachine takes the time to respond with an answer that’s right on the money",,https://www.reddit.com/r/bestof/comments/1t1p6du/op_sheepishly_asks_the_difference_between_a_riff/,10717
1t4180d,On the history of Watergate & Sweet Home Alabama,,https://www.reddit.com/r/bestof/comments/1t4180d/on_the_history_of_watergate_sweet_home_alabama/,9310
1th8emq,u/Secure_Course_3879 explains why a hand bag is from the 1910’s,,https://www.reddit.com/r/bestof/comments/1th8emq/usecure_course_3879_explains_why_a_hand_bag_is/,8112
1t9wo0x,"Singapore Redditor, who is a former nurse and a current cancer patient, explains why cancer biopsies take so long to complete",,https://www.reddit.com/r/bestof/comments/1t9wo0x/singapore_redditor_who_is_a_former_nurse_and_a/,7617
1t0duhy,u/gypsycookie1015 introduces us to a rich but extremely eccentric May Kay rep who lived in his trailer park,,https://www.reddit.com/r/bestof/comments/1t0duhy/ugypsycookie1015_introduces_us_to_a_rich_but/,6444
1tmhg82,"u/churningaccount explains ""inflation expectations"" and why the psychological cycle of pricing is the Fed's ultimate nightmare.",,https://www.reddit.com/r/bestof/comments/1tmhg82/uchurningaccount_explains_inflation_expectations/,5893
1sxv5dr,"[askscience] u/CrustalTrudger provides extensive detail on what mountains are made of, and why, to an author looking to worldbuild.",,https://www.reddit.com/r/bestof/comments/1sxv5dr/askscience_ucrustaltrudger_provides_extensive/,5712
1tkisky,u/phenomenomnom describes the vaudeville influences that The Muppets drew from that made them successful.,,https://www.reddit.com/r/bestof/comments/1tkisky/uphenomenomnom_describes_the_vaudeville/,4842
1svcz1u,/u/pirivalfang talks about technology improving for the past century and how much it changed their job as a structural welder,,https://www.reddit.com/r/bestof/comments/1svcz1u/upirivalfang_talks_about_technology_improving_for/,3891
1tbpaun,Smashing Pumpkins fan writes about Dublin gig in which Bernadette O'Brien tragically died in crowd crush,,https://www.reddit.com/r/bestof/comments/1tbpaun/smashing_pumpkins_fan_writes_about_dublin_gig_in/,3522
1tieqlt,u/notsostealthyninja explains photographic composition on at least four levels.,,https://www.reddit.com/r/bestof/comments/1tieqlt/unotsostealthyninja_explains_photographic/,3627
1tlrarg,u/Acrobatic_Bee_3198 on how the entire 'ping reducer' is fake,,https://www.reddit.com/r/bestof/comments/1tlrarg/uacrobatic_bee_3198_on_how_the_entire_ping/,3409
1t2tdeg,A deep dive into grappling with an Orangutan,,https://www.reddit.com/r/bestof/comments/1t2tdeg/a_deep_dive_into_grappling_with_an_orangutan/,3009
1t58flj,Where we learn with an analogy about how Quantum Entanglement cant be used to send information faster than speed of light,,https://www.reddit.com/r/bestof/comments/1t58flj/where_we_learn_with_an_analogy_about_how_quantum/,2078
1td5hlm,The three relationship and child-rearing styles of primates (comments by /u/maximum-cover-),,https://www.reddit.com/r/bestof/comments/1td5hlm/the_three_relationship_and_childrearing_styles_of/,2568
1tlhxl3,u/Bug_Hunter teaches us about the possibilities of historic Funyons,,https://www.reddit.com/r/bestof/comments/1tlhxl3/ubug_hunter_teaches_us_about_the_possibilities_of/,2267
1t6yhj4,u/silverbk65105 spots a one-of-a-kind car on the street. Its creator u/Kitchen-Cow-8622 pops up in the comments to explain more about the design and build process behind it,,https://www.reddit.com/r/bestof/comments/1t6yhj4/usilverbk65105_spots_a_oneofakind_car_on_the/,1685
1t6xm32,User asks to identify an unusual car. The fabricator shows up and gives all the behind the scenes info,,https://www.reddit.com/r/bestof/comments/1t6xm32/user_asks_to_identify_an_unusual_car_the/,1394
1t5ziyl,On the parallels between post WW1 Germany and post-1990s Russia,,https://www.reddit.com/r/bestof/comments/1t5ziyl/on_the_parallels_between_post_ww1_germany_and/,2002
1t9ure2,OP has a motorcycle accident. /u/Faokes offers kind words about more than just that.,,https://www.reddit.com/r/bestof/comments/1t9ure2/op_has_a_motorcycle_accident_ufaokes_offers_kind/,1424
1tjkept,A Spanish-language Eve Online player posts about the ongoing in-game lore event. The commenters provide some helpful translations.,,https://www.reddit.com/r/bestof/comments/1tjkept/a_spanishlanguage_eve_online_player_posts_about/,1509
1tmnu1t,u/QuillQuickcard divines what the next No Man's Sky expansion will bring to the game from the lead developer's tweet of a bee emoji,,https://www.reddit.com/r/bestof/comments/1tmnu1t/uquillquickcard_divines_what_the_next_no_mans_sky/,1257
1tjw23l,u/Unequal_vector with a large list of the largest animals ever,,https://www.reddit.com/r/bestof/comments/1tjw23l/uunequal_vector_with_a_large_list_of_the_largest/,937
1tj92d9,xRegardsx shares a thoroughly constructed realization that allowed him to have rock-solid self-esteem,,https://www.reddit.com/r/bestof/comments/1tj92d9/xregardsx_shares_a_thoroughly_constructed/,1199
