id,title,selftext,permalink,score
1u04ivd,u/CompetitionOk2302 explains why he feels Americans have nothing to look forward to on the 250th anniversary of the United States,,https://www.reddit.com/r/bestof/comments/1u04ivd/ucompetitionok2302_explains_why_he_feels/,79248
1twu5p7,"u/ThirdGenRegen explains why coal is economically dead in the modern era, even for traditionally coal-intensive processes like steelmaking",,https://www.reddit.com/r/bestof/comments/1twu5p7/uthirdgenregen_explains_why_coal_is_economically/,69252
1tp29fn,u/xjuggernautx describes the reality of living in a right wing information bubble.,,https://www.reddit.com/r/bestof/comments/1tp29fn/uxjuggernautx_describes_the_reality_of_living_in/,61013
1tykaki,"User explains why the source of the Nile was a mystery until the 19th Century, despite thousands of years of civilization and trade along the river.",,https://www.reddit.com/r/bestof/comments/1tykaki/user_explains_why_the_source_of_the_nile_was_a/,53841
1ttwjn9,MephistoHamProducts explains why protests in America are less effective due to geographical size and insulated elites,,https://www.reddit.com/r/bestof/comments/1ttwjn9/mephistohamproducts_explains_why_protests_in/,47561
1tbmkad,U/Amneiger breaks down Red State Vs. Blue State outcomes for Americans with links to back it up,,https://www.reddit.com/r/bestof/comments/1tbmkad/uamneiger_breaks_down_red_state_vs_blue_state/,41862
1tf6wek,u/Gonna_B_Alright explains why tax cattle aren’t breeding,,https://www.reddit.com/r/bestof/comments/1tf6wek/ugonna_b_alright_explains_why_tax_cattle_arent/,37348
1tuvwv9,"u/strict-carrot4783 comments on the tensions between ranchers and environmentalists, especially concerning land use in the Western US and resource inputs for beef protein vs plant sources",,https://www.reddit.com/r/bestof/comments/1tuvwv9/ustrictcarrot4783_comments_on_the_tensions/,32347
1td94e1,Former r/UFOs mod shares their experience with inauthentic manipulation of the topic on reddit as of two years ago. It has only gotten worse since.,,https://www.reddit.com/r/bestof/comments/1td94e1/former_rufos_mod_shares_their_experience_with/,28746
1tk3mqw,User gets heated about SpaceX plans,,https://www.reddit.com/r/bestof/comments/1tk3mqw/user_gets_heated_about_spacex_plans/,25470
1tjm7g1,OP lays out the reality of suing your insurance company,,https://www.reddit.com/r/bestof/comments/1tjm7g1/op_lays_out_the_reality_of_suing_your_insurance/,22144
1tifout,How it feels to die while cave diving,,https://www.reddit.com/r/bestof/comments/1tifout/how_it_feels_to_die_while_cave_diving/,20111
1tnb9ah,u/Trekkie4eva recounts the time a dying man shared his experience as a POW in WWII.,,https://www.reddit.com/r/bestof/comments/1tnb9ah/utrekkie4eva_recounts_the_time_a_dying_man_shared/,17698
1tkmeox,u/itsallfolklore explains how likely it was for a prospector to strike it rich during the 1849 California Gold Rush,,https://www.reddit.com/r/bestof/comments/1tkmeox/uitsallfolklore_explains_how_likely_it_was_for_a/,15657
1tebuaz,"U/serversamwinchester explains how multiple competing factors can influence crime rates, the subjective idea behind multivariate analysis.",,https://www.reddit.com/r/bestof/comments/1tebuaz/userversamwinchester_explains_how_multiple/,13322
1tmhg82,"u/churningaccount explains ""inflation expectations"" and why the psychological cycle of pricing is the Fed's ultimate nightmare.",,https://www.reddit.com/r/bestof/comments/1tmhg82/uchurningaccount_explains_inflation_expectations/,11860
1toauhi,Lovely comment about how every human is musical instrument,,https://www.reddit.com/r/bestof/comments/1toauhi/lovely_comment_about_how_every_human_is_musical/,10945
1u2bo9k,Commenter breaks down how and why religion and conservatism operate quite well,,https://www.reddit.com/r/bestof/comments/1u2bo9k/commenter_breaks_down_how_and_why_religion_and/,9627
1th8emq,u/Secure_Course_3879 explains why a hand bag is from the 1910’s,,https://www.reddit.com/r/bestof/comments/1th8emq/usecure_course_3879_explains_why_a_hand_bag_is/,8474
1tw7mji,"U/danteelite needs more info! tells story of Kayla from hs got banned from Busch Gardens Tampa for forcibly putting her foot into mouths of 4 employees and assaulting a child, but wasn't arresyed",,https://www.reddit.com/r/bestof/comments/1tw7mji/udanteelite_needs_more_info_tells_story_of_kayla/,7884
1u2pc8e,"u/FomulaicResponse gives an excellent breakdown on how AI has equipped gain of function virus researchers, and how close we are to AI assited bioterrorism",,https://www.reddit.com/r/bestof/comments/1u2pc8e/ufomulaicresponse_gives_an_excellent_breakdown_on/,6738
1tkisky,u/phenomenomnom describes the vaudeville influences that The Muppets drew from that made them successful.,,https://www.reddit.com/r/bestof/comments/1tkisky/uphenomenomnom_describes_the_vaudeville/,5962
1u039hv,u/Diche_Bach gives an excellent analysis of Russia's society and political structure,,https://www.reddit.com/r/bestof/comments/1u039hv/udiche_bach_gives_an_excellent_analysis_of/,5240
1tlrarg,u/Acrobatic_Bee_3198 on how the entire 'ping reducer' is fake,,https://www.reddit.com/r/bestof/comments/1tlrarg/uacrobatic_bee_3198_on_how_the_entire_ping/,5126
1tx55c9,How (not) to get rid of bees,,https://www.reddit.com/r/bestof/comments/1tx55c9/how_not_to_get_rid_of_bees/,4318
1tbpaun,Smashing Pumpkins fan writes about Dublin gig in which Bernadette O'Brien tragically died in crowd crush,,https://www.reddit.com/r/bestof/comments/1tbpaun/smashing_pumpkins_fan_writes_about_dublin_gig_in/,4059
1tieqlt,u/notsostealthyninja explains photographic composition on at least four levels.,,https://www.reddit.com/r/bestof/comments/1tieqlt/unotsostealthyninja_explains_photographic/,2925
1tlhxl3,u/Bug_Hunter teaches us about the possibilities of historic Funyons,,https://www.reddit.com/r/bestof/comments/1tlhxl3/ubug_hunter_teaches_us_about_the_possibilities_of/,2772
1td5hlm,The three relationship and child-rearing styles of primates (comments by /u/maximum-cover-),,https://www.reddit.com/r/bestof/comments/1td5hlm/the_three_relationship_and_childrearing_styles_of/,3013
1tnfvz5,Ziff7 gives the best description you'll ever hear about how unlikely it is to shuffle a deck of cards the same way twice,,https://www.reddit.com/r/bestof/comments/1tnfvz5/ziff7_gives_the_best_description_youll_ever_hear/,2776
1totvk5,Lady and the Tramp x Ratatouille fanfic worthy of AO3 written by /u/Shikabane_Hime,,https://www.reddit.com/r/bestof/comments/1totvk5/lady_and_the_tramp_x_ratatouille_fanfic_worthy_of/,2146
1tmxmvr,u/angrymonkey explains why a cat's reflection is only seen in the mirror but not visible directly,,https://www.reddit.com/r/bestof/comments/1tmxmvr/uangrymonkey_explains_why_a_cats_reflection_is/,1761
1tjkept,A Spanish-language Eve Online player posts about the ongoing in-game lore event. The commenters provide some helpful translations.,,https://www.reddit.com/r/bestof/comments/1tjkept/a_spanishlanguage_eve_online_player_posts_about/,2180
1u2s9vg,LichenTheMood lays out what's wrong with modern linen,,https://www.reddit.com/r/bestof/comments/1u2s9vg/lichenthemood_lays_out_whats_wrong_with_modern/,1945
1tmnu1t,u/QuillQuickcard divines what the next No Man's Sky expansion will bring to the game from the lead developer's tweet of a bee emoji,,https://www.reddit.com/r/bestof/comments/1tmnu1t/uquillquickcard_divines_what_the_next_no_mans_sky/,1161
1u2rf12,Lichen The Mood Rants about Linen Fibers and Processing,,https://www.reddit.com/r/bestof/comments/1u2rf12/lichen_the_mood_rants_about_linen_fibers_and/,1805
1tjw23l,u/Unequal_vector with a large list of the largest animals ever,,https://www.reddit.com/r/bestof/comments/1tjw23l/uunequal_vector_with_a_large_list_of_the_largest/,1662
1twfavu,The Piggie Pie-Hole Poker,,https://www.reddit.com/r/bestof/comments/1twfavu/the_piggie_piehole_poker/,1386
1tj92d9,xRegardsx shares a thoroughly constructed realization that allowed him to have rock-solid self-esteem,,https://www.reddit.com/r/bestof/comments/1tj92d9/xregardsx_shares_a_thoroughly_constructed/,1171
