id,title,selftext,permalink,score
1sh3eqc,u/Unharmed-Cylinder explains in detail how much of a piece of shit company Kimberly-Clark is after an employees burned a warehouse down for low wages.,,https://www.reddit.com/r/bestof/comments/1sh3eqc/uunharmedcylinder_explains_in_detail_how_much_of/,79740
1s9qiyo,u/thedoughbatman tells us just how screwed clavicular is after shooting an alligator,,https://www.reddit.com/r/bestof/comments/1s9qiyo/uthedoughbatman_tells_us_just_how_screwed/,70179
1s7rheh,u/sappk explains why most power tool brands turned to garbage and which ones didn't,,https://www.reddit.com/r/bestof/comments/1s7rheh/usappk_explains_why_most_power_tool_brands_turned/,61916
1s9jh3u,/u/Inevitable_Butthole summarises the President's daily update on Gulf War III,,https://www.reddit.com/r/bestof/comments/1s9jh3u/uinevitable_butthole_summarises_the_presidents/,54774
1sentyy,u/LowKeyNaps lays out the history of how federal-level Democrats have failed to put up any meaningful resistance to Trump beginning with J6,,https://www.reddit.com/r/bestof/comments/1sentyy/ulowkeynaps_lays_out_the_history_of_how/,48137
1s9bok1,u/IndigoHawk lays out how the current US administration is using USPS to influence elections,,https://www.reddit.com/r/bestof/comments/1s9bok1/uindigohawk_lays_out_how_the_current_us/,42267
1slu50r,"Trying to verify a signed book, op accidentally finds the kid who signed it",,https://www.reddit.com/r/bestof/comments/1slu50r/trying_to_verify_a_signed_book_op_accidentally/,37567
1st4xqa,u/SwimmingWonderful755 gives some great parenting advice,,https://www.reddit.com/r/bestof/comments/1st4xqa/uswimmingwonderful755_gives_some_great_parenting/,33193
1sui1cr,"u/saintsithney: Puffy, complex, difficult hairstyles in fundamentalist Christian cults are ""erotic performances"" for the whole congregation",,https://www.reddit.com/r/bestof/comments/1sui1cr/usaintsithney_puffy_complex_difficult_hairstyles/,28958
1sfbccj,Panino87 details Trump's ongoing assessments of the Iran War.,,https://www.reddit.com/r/bestof/comments/1sfbccj/panino87_details_trumps_ongoing_assessments_of/,25678
1sqzu6r,Commenter in r/legaladviceUK explains why facial recognition clocking in technology might be illegal and how best to bring it up with your employer who is currently implementing it.,,https://www.reddit.com/r/bestof/comments/1sqzu6r/commenter_in_rlegaladviceuk_explains_why_facial/,22427
1sezru9,u/MyMusicRunning21 Describes the Cultural Cost of Trump/DOGE Administration Policies in a thread discussing conditions on the National Mall.,,https://www.reddit.com/r/bestof/comments/1sezru9/umymusicrunning21_describes_the_cultural_cost_of/,19476
1ss3qti,/u/MrInexorable chronicles the setbacks of implementing an infrastructure change in America,,https://www.reddit.com/r/bestof/comments/1ss3qti/umrinexorable_chronicles_the_setbacks_of/,17770
1sfncjc,u/how_that_convo_went gives expert advice on how to hunt for cougars,,https://www.reddit.com/r/bestof/comments/1sfncjc/uhow_that_convo_went_gives_expert_advice_on_how/,15115
1sj4e7b,u/RidingWithDonQuixote explains who is answering the Heaven’s Gate cult’s email,,https://www.reddit.com/r/bestof/comments/1sj4e7b/uridingwithdonquixote_explains_who_is_answering/,13392
1sg2fgu,Summary of the Iran “deal”.,,https://www.reddit.com/r/bestof/comments/1sg2fgu/summary_of_the_iran_deal/,12234
1shrl5l,/u/Head-Research-9092 summarizes the experience of a tween or teen during COVID.,,https://www.reddit.com/r/bestof/comments/1shrl5l/uheadresearch9092_summarizes_the_experience_of_a/,11105
1spq2sk,u/godisanelectricolive Explains the origins of pirate “pieces of eight”,,https://www.reddit.com/r/bestof/comments/1spq2sk/ugodisanelectricolive_explains_the_origins_of/,9731
1sbspy8,Weed_O_Whirler gives a marvelous explanation for why snow is such a good insulator,,https://www.reddit.com/r/bestof/comments/1sbspy8/weed_o_whirler_gives_a_marvelous_explanation_for/,8257
1stxs7f,u/WorthDust652 explains why noble women in the middle ages had to get married quickly or avoid kidnapping due to their wealth.,,https://www.reddit.com/r/bestof/comments/1stxs7f/uworthdust652_explains_why_noble_women_in_the/,7663
1sspwll,Response from: “Divers cut huge fishing rope from whale” thread,,https://www.reddit.com/r/bestof/comments/1sspwll/response_from_divers_cut_huge_fishing_rope_from/,6267
1s9f7qj,User describes the impact of discovering the local nudist beach.,,https://www.reddit.com/r/bestof/comments/1s9f7qj/user_describes_the_impact_of_discovering_the/,6337
1sky1ek,"/u/RulerOfSlides, an ex-geologist, describes what the moon (probably) tastes like",,https://www.reddit.com/r/bestof/comments/1sky1ek/urulerofslides_an_exgeologist_describes_what_the/,5132
1sgbpv1,/u/tester_and_breaker diagnoses the problem with OP’s 1500-piece puzzle from a photo,,https://www.reddit.com/r/bestof/comments/1sgbpv1/utester_and_breaker_diagnoses_the_problem_with/,4619
1sn5ztu,/u/voodoo-ish explains why the current oil market issues will not cause an industry-ending crash.,,https://www.reddit.com/r/bestof/comments/1sn5ztu/uvoodooish_explains_why_the_current_oil_market/,4128
1spj8gx,"A ""Visionary"" pitches PBS suits on the children's TV show Wishbone",,https://www.reddit.com/r/bestof/comments/1spj8gx/a_visionary_pitches_pbs_suits_on_the_childrens_tv/,4148
1sion5t,"Rathavoc, an eel expert, has some answers",,https://www.reddit.com/r/bestof/comments/1sion5t/rathavoc_an_eel_expert_has_some_answers/,3155
1s8ci4c,u/gabrrdt explains how famous Brazilian footballers play like that,,https://www.reddit.com/r/bestof/comments/1s8ci4c/ugabrrdt_explains_how_famous_brazilian/,2857
1s9vplo,Chelular07 explains science of washing dyed hair,,https://www.reddit.com/r/bestof/comments/1s9vplo/chelular07_explains_science_of_washing_dyed_hair/,2918
1s9hps4,/u/pumpkin_seed_oil provides some context behind the biggest one day rallies of the S&P500,,https://www.reddit.com/r/bestof/comments/1s9hps4/upumpkin_seed_oil_provides_some_context_behind/,2309
1sm2vh4,A Formalization of the Reddit Scientific Procedure,,https://www.reddit.com/r/bestof/comments/1sm2vh4/a_formalization_of_the_reddit_scientific_procedure/,2029
