id,title,selftext,permalink,score
1sz26w2,u/swissmissmaybe on how being a woman is like riding a bike,,https://www.reddit.com/r/bestof/comments/1sz26w2/uswissmissmaybe_on_how_being_a_woman_is_like/,82825
1sh3eqc,u/Unharmed-Cylinder explains in detail how much of a piece of shit company Kimberly-Clark is after an employees burned a warehouse down for low wages.,,https://www.reddit.com/r/bestof/comments/1sh3eqc/uunharmedcylinder_explains_in_detail_how_much_of/,72706
1sui1cr,"u/saintsithney: Puffy, complex, difficult hairstyles in fundamentalist Christian cults are ""erotic performances"" for the whole congregation",,https://www.reddit.com/r/bestof/comments/1sui1cr/usaintsithney_puffy_complex_difficult_hairstyles/,63832
1slu50r,"Trying to verify a signed book, op accidentally finds the kid who signed it",,https://www.reddit.com/r/bestof/comments/1slu50r/trying_to_verify_a_signed_book_op_accidentally/,56275
1st4xqa,u/SwimmingWonderful755 gives some great parenting advice,,https://www.reddit.com/r/bestof/comments/1st4xqa/uswimmingwonderful755_gives_some_great_parenting/,49872
1t5cllg,OP posts that he was harassed after doing nothing wrong at the terrain park. A witness chimes in that OP absolutely did something wrong.,,https://www.reddit.com/r/bestof/comments/1t5cllg/op_posts_that_he_was_harassed_after_doing_nothing/,43714
1sqzu6r,Commenter in r/legaladviceUK explains why facial recognition clocking in technology might be illegal and how best to bring it up with your employer who is currently implementing it.,,https://www.reddit.com/r/bestof/comments/1sqzu6r/commenter_in_rlegaladviceuk_explains_why_facial/,38673
1sfbccj,Panino87 details Trump's ongoing assessments of the Iran War.,,https://www.reddit.com/r/bestof/comments/1sfbccj/panino87_details_trumps_ongoing_assessments_of/,34415
1sezru9,u/MyMusicRunning21 Describes the Cultural Cost of Trump/DOGE Administration Policies in a thread discussing conditions on the National Mall.,,https://www.reddit.com/r/bestof/comments/1sezru9/umymusicrunning21_describes_the_cultural_cost_of/,30000
1ss3qti,/u/MrInexorable chronicles the setbacks of implementing an infrastructure change in America,,https://www.reddit.com/r/bestof/comments/1ss3qti/umrinexorable_chronicles_the_setbacks_of/,26235
1sv912p,u/originalhugsie tells about tiger's smell and how it feels to be stalked by a one,,https://www.reddit.com/r/bestof/comments/1sv912p/uoriginalhugsie_tells_about_tigers_smell_and_how/,23440
1sfncjc,u/how_that_convo_went gives expert advice on how to hunt for cougars,,https://www.reddit.com/r/bestof/comments/1sfncjc/uhow_that_convo_went_gives_expert_advice_on_how/,20258
1sj4e7b,u/RidingWithDonQuixote explains who is answering the Heaven’s Gate cult’s email,,https://www.reddit.com/r/bestof/comments/1sj4e7b/uridingwithdonquixote_explains_who_is_answering/,18638
1sg2fgu,Summary of the Iran “deal”.,,https://www.reddit.com/r/bestof/comments/1sg2fgu/summary_of_the_iran_deal/,15783
1svy0mc,u/studytimevinyl explains the origin of the record speeds and why 78 isn't just 33 + 45,,https://www.reddit.com/r/bestof/comments/1svy0mc/ustudytimevinyl_explains_the_origin_of_the_record/,14041
1shrl5l,/u/Head-Research-9092 summarizes the experience of a tween or teen during COVID.,,https://www.reddit.com/r/bestof/comments/1shrl5l/uheadresearch9092_summarizes_the_experience_of_a/,12820
1spq2sk,u/godisanelectricolive Explains the origins of pirate “pieces of eight”,,https://www.reddit.com/r/bestof/comments/1spq2sk/ugodisanelectricolive_explains_the_origins_of/,10961
1t0ruvj,/u/ScissorNightRam reminds us of Jack Winter's 1994 story that uses only orphaned negatives,,https://www.reddit.com/r/bestof/comments/1t0ruvj/uscissornightram_reminds_us_of_jack_winters_1994/,9792
1stxs7f,u/WorthDust652 explains why noble women in the middle ages had to get married quickly or avoid kidnapping due to their wealth.,,https://www.reddit.com/r/bestof/comments/1stxs7f/uworthdust652_explains_why_noble_women_in_the/,8468
1t1p6du,"OP Sheepishly asks the difference between a riff, lick and solo in music. u/WellComeToTheMachine takes the time to respond with an answer that’s right on the money",,https://www.reddit.com/r/bestof/comments/1t1p6du/op_sheepishly_asks_the_difference_between_a_riff/,8137
1sspwll,Response from: “Divers cut huge fishing rope from whale” thread,,https://www.reddit.com/r/bestof/comments/1sspwll/response_from_divers_cut_huge_fishing_rope_from/,7150
1t4180d,On the history of Watergate & Sweet Home Alabama,,https://www.reddit.com/r/bestof/comments/1t4180d/on_the_history_of_watergate_sweet_home_alabama/,6337
1t0duhy,u/gypsycookie1015 introduces us to a rich but extremely eccentric May Kay rep who lived in his trailer park,,https://www.reddit.com/r/bestof/comments/1t0duhy/ugypsycookie1015_introduces_us_to_a_rich_but/,5660
1sxv5dr,"[askscience] u/CrustalTrudger provides extensive detail on what mountains are made of, and why, to an author looking to worldbuild.",,https://www.reddit.com/r/bestof/comments/1sxv5dr/askscience_ucrustaltrudger_provides_extensive/,4575
1sky1ek,"/u/RulerOfSlides, an ex-geologist, describes what the moon (probably) tastes like",,https://www.reddit.com/r/bestof/comments/1sky1ek/urulerofslides_an_exgeologist_describes_what_the/,3935
1sgbpv1,/u/tester_and_breaker diagnoses the problem with OP’s 1500-piece puzzle from a photo,,https://www.reddit.com/r/bestof/comments/1sgbpv1/utester_and_breaker_diagnoses_the_problem_with/,3693
1sn5ztu,/u/voodoo-ish explains why the current oil market issues will not cause an industry-ending crash.,,https://www.reddit.com/r/bestof/comments/1sn5ztu/uvoodooish_explains_why_the_current_oil_market/,3360
1svcz1u,/u/pirivalfang talks about technology improving for the past century and how much it changed their job as a structural welder,,https://www.reddit.com/r/bestof/comments/1svcz1u/upirivalfang_talks_about_technology_improving_for/,2957
1spj8gx,"A ""Visionary"" pitches PBS suits on the children's TV show Wishbone",,https://www.reddit.com/r/bestof/comments/1spj8gx/a_visionary_pitches_pbs_suits_on_the_childrens_tv/,2788
1sion5t,"Rathavoc, an eel expert, has some answers",,https://www.reddit.com/r/bestof/comments/1sion5t/rathavoc_an_eel_expert_has_some_answers/,2543
1t2tdeg,A deep dive into grappling with an Orangutan,,https://www.reddit.com/r/bestof/comments/1t2tdeg/a_deep_dive_into_grappling_with_an_orangutan/,2027
1t58flj,Where we learn with an analogy about how Quantum Entanglement cant be used to send information faster than speed of light,,https://www.reddit.com/r/bestof/comments/1t58flj/where_we_learn_with_an_analogy_about_how_quantum/,2322
1sm2vh4,A Formalization of the Reddit Scientific Procedure,,https://www.reddit.com/r/bestof/comments/1sm2vh4/a_formalization_of_the_reddit_scientific_procedure/,2327
