id,title,selftext,permalink,score
1lp5e6e,"ULPT: If you need a doctor to take you seriously, make up a risk factor",,https://www.reddit.com/r/UnethicalLifeProTips/comments/1lp5e6e/ulpt_if_you_need_a_doctor_to_take_you_seriously/,34683
1ksdanp,ULPT: Ruin a pickpockets day by putting broken glass in your bag,,https://www.reddit.com/r/UnethicalLifeProTips/comments/1ksdanp/ulpt_ruin_a_pickpockets_day_by_putting_broken/,30534
1n92k9z,"ULPT: Hire a hooker, take her to walmart, buy her a set of normal clothes, go to a swinger's party, bang someone's wife while they bang a street walker",,https://www.reddit.com/r/UnethicalLifeProTips/comments/1n92k9z/ulpt_hire_a_hooker_take_her_to_walmart_buy_her_a/,26938
1ko4gc9,ULPT: How to get a table at a hot restaurant with no reservation,,https://www.reddit.com/r/UnethicalLifeProTips/comments/1ko4gc9/ulpt_how_to_get_a_table_at_a_hot_restaurant_with/,23998
1nku75r,ULPT: Don’t just cancel your Disney+ subscription….,,https://www.reddit.com/r/UnethicalLifeProTips/comments/1nku75r/ulpt_dont_just_cancel_your_disney_subscription/,21489
1oal1si,ULPT: Insecure about your penis? Post it to a gay penis admiring subreddit.,,https://www.reddit.com/r/UnethicalLifeProTips/comments/1oal1si/ulpt_insecure_about_your_penis_post_it_to_a_gay/,18797
1l6gn31,"ULPT: Yes, you can call 911 for ANY masked people carrying weapons.",,https://www.reddit.com/r/UnethicalLifeProTips/comments/1l6gn31/ulpt_yes_you_can_call_911_for_any_masked_people/,16060
1m78k4r,"ULPT: If you're scared of being forgotten after you die, post some nudes of yourself online.",,https://www.reddit.com/r/UnethicalLifeProTips/comments/1m78k4r/ulpt_if_youre_scared_of_being_forgotten_after_you/,14218
1ralvwc,ULPT How can I ultimately troll my husband so he stops embarrassing me?,,https://www.reddit.com/r/UnethicalLifeProTips/comments/1ralvwc/ulpt_how_can_i_ultimately_troll_my_husband_so_he/,13169
1mvoluk,"ULPT: A female friend told me she keeps a dickpic in her phone. When someone sends her an unsolicited dickpic, she sends hers back with the note: “ I’m hard for you too” 😂",,https://www.reddit.com/r/UnethicalLifeProTips/comments/1mvoluk/ulpt_a_female_friend_told_me_she_keeps_a_dickpic/,11107
1lkw7ne,ULPT - Nobody can question your gender anymore!,,https://www.reddit.com/r/UnethicalLifeProTips/comments/1lkw7ne/ulpt_nobody_can_question_your_gender_anymore/,10055
1kfp9t8,ULPT: Save money on Lyft/Uber AND help the driver make more money,,https://www.reddit.com/r/UnethicalLifeProTips/comments/1kfp9t8/ulpt_save_money_on_lyftuber_and_help_the_driver/,8792
1l573qx,ULPT: My Grandmother’s Fuck Off Chair,,https://www.reddit.com/r/UnethicalLifeProTips/comments/1l573qx/ulpt_my_grandmothers_fuck_off_chair/,8379
1kg3iej,ULPT Request: I need to put 50K miles on my car,,https://www.reddit.com/r/UnethicalLifeProTips/comments/1kg3iej/ulpt_request_i_need_to_put_50k_miles_on_my_car/,7092
1l1n8ra,ULPT: Let banned gamblers back in — just long enough to take their winnings.,,https://www.reddit.com/r/UnethicalLifeProTips/comments/1l1n8ra/ulpt_let_banned_gamblers_back_in_just_long_enough/,6693
1o16gd8,ULPT My weird NSFW reward system for job applications,,https://www.reddit.com/r/UnethicalLifeProTips/comments/1o16gd8/ulpt_my_weird_nsfw_reward_system_for_job/,5879
1l64l5m,ULPT: Cable tie rows of shopping trolleys together and tip them over on the road to prevent certain unmarked vans from wrecklessly driving in your community.,,https://www.reddit.com/r/UnethicalLifeProTips/comments/1l64l5m/ulpt_cable_tie_rows_of_shopping_trolleys_together/,4868
1mytqu0,ULPT To Getting Cheap Rent,,https://www.reddit.com/r/UnethicalLifeProTips/comments/1mytqu0/ulpt_to_getting_cheap_rent/,4514
1khaxtl,ULPT: Have a car with serious issues that aren't readily apparent? sell it to Carvana for full price,,https://www.reddit.com/r/UnethicalLifeProTips/comments/1khaxtl/ulpt_have_a_car_with_serious_issues_that_arent/,4202
1rr6ap8,ULPT to avoid a DUI,,https://www.reddit.com/r/UnethicalLifeProTips/comments/1rr6ap8/ulpt_to_avoid_a_dui/,3710
1lixj2x,ULPT: only ever commit 1 crime at a time,,https://www.reddit.com/r/UnethicalLifeProTips/comments/1lixj2x/ulpt_only_ever_commit_1_crime_at_a_time/,3291
1kx5xqg,ULPT: I tried to cancel my gym membership….,,https://www.reddit.com/r/UnethicalLifeProTips/comments/1kx5xqg/ulpt_i_tried_to_cancel_my_gym_membership/,3088
1ly01nr,ULPT: Fly farther if you're willing to sit in the airport,,https://www.reddit.com/r/UnethicalLifeProTips/comments/1ly01nr/ulpt_fly_farther_if_youre_willing_to_sit_in_the/,2467
1ohi5b1,ULPT: Replace your grandma's space heater with an old Bitcoin miner.,,https://www.reddit.com/r/UnethicalLifeProTips/comments/1ohi5b1/ulpt_replace_your_grandmas_space_heater_with_an/,2480
1qczq9x,"ULPT: Get Mormon missionaries to FLEE by asking about ""soaking""",,https://www.reddit.com/r/UnethicalLifeProTips/comments/1qczq9x/ulpt_get_mormon_missionaries_to_flee_by_asking/,2095
1mswizn,ULPT: Sexual harassment gets rid of telemarketers,,https://www.reddit.com/r/UnethicalLifeProTips/comments/1mswizn/ulpt_sexual_harassment_gets_rid_of_telemarketers/,1909
1pqhd89,"ULPT: If you want to stop getting roped into “helpful” stuff, become mildly",,https://www.reddit.com/r/UnethicalLifeProTips/comments/1pqhd89/ulpt_if_you_want_to_stop_getting_roped_into/,2155
1odgtdd,ULPT I need a way to move 13 2000lbs pallets of margarine side to side and then down into a 6ft hole and then cover it with dirt,,https://www.reddit.com/r/UnethicalLifeProTips/comments/1odgtdd/ulpt_i_need_a_way_to_move_13_2000lbs_pallets_of/,2036
1m6urh2,ULPT: If you’re a young fit attractive but broke male here’s an easy way to make an extra 30-50k every year,,https://www.reddit.com/r/UnethicalLifeProTips/comments/1m6urh2/ulpt_if_youre_a_young_fit_attractive_but_broke/,1826
1mcvakx,"ULPT request: neighbor stole my AirPods. Today after six months, I finally busted them and got them back.",,https://www.reddit.com/r/UnethicalLifeProTips/comments/1mcvakx/ulpt_request_neighbor_stole_my_airpods_today/,1276
1n3nidw,ULPT: If you don’t like someone sign them up to get info from this website. They will call 100+ times a day and never take them off the call list.,,https://www.reddit.com/r/UnethicalLifeProTips/comments/1n3nidw/ulpt_if_you_dont_like_someone_sign_them_up_to_get/,1299
1madaz4,ULPT: Won a $5000 dollar trip from my job but must pay out of pocket and expense it to them. How can I keep the cash?,,https://www.reddit.com/r/UnethicalLifeProTips/comments/1madaz4/ulpt_won_a_5000_dollar_trip_from_my_job_but_must/,927
1opi4t5,ULPT: Almost All Coin Operated Washer And Dryer Machine Keys Can Be Found On Amazon. Just Find The Make And Model And Get Your Money Back After Doing A Load.,,https://www.reddit.com/r/UnethicalLifeProTips/comments/1opi4t5/ulpt_almost_all_coin_operated_washer_and_dryer/,1441
1lil0gz,"ULPT: You can cancel your Planet Fitness membership online easily by changing your ""home gym"" to any city in California",,https://www.reddit.com/r/UnethicalLifeProTips/comments/1lil0gz/ulpt_you_can_cancel_your_planet_fitness/,1314
1l3at79,"ULPT : [UPDATE] Let Me Gamble, Took My $65K, Now Ghosting Me — The Perfect Casino Loophole?",,https://www.reddit.com/r/UnethicalLifeProTips/comments/1l3at79/ulpt_update_let_me_gamble_took_my_65k_now/,683
1kogiwk,ULPT: How to Disappear,,https://www.reddit.com/r/UnethicalLifeProTips/comments/1kogiwk/ulpt_how_to_disappear/,1252
1lrgsmu,ULPT: hotel key cards get you breakfast,,https://www.reddit.com/r/UnethicalLifeProTips/comments/1lrgsmu/ulpt_hotel_key_cards_get_you_breakfast/,916
1l3lpzy,ULPT: Drone Creep,,https://www.reddit.com/r/UnethicalLifeProTips/comments/1l3lpzy/ulpt_drone_creep/,884
1pfzjc1,ULPT: Get into airport lounges for free as a stranger’s guest.,,https://www.reddit.com/r/UnethicalLifeProTips/comments/1pfzjc1/ulpt_get_into_airport_lounges_for_free_as_a/,1137
1lqdnpg,ULPT: Every travel state is your honeymoon.,,https://www.reddit.com/r/UnethicalLifeProTips/comments/1lqdnpg/ulpt_every_travel_state_is_your_honeymoon/,1072
1mr4iut,ULPT: Need a super easy $20+? Get a good will-call number for a long line,,https://www.reddit.com/r/UnethicalLifeProTips/comments/1mr4iut/ulpt_need_a_super_easy_20_get_a_good_willcall/,920
1lgms0u,ULPT What’s your most harmlessly devious life tip you use all the time?,,https://www.reddit.com/r/UnethicalLifeProTips/comments/1lgms0u/ulpt_whats_your_most_harmlessly_devious_life_tip/,846
1kmr5aa,ULPT An annoying coworker tried to sleep with my wife,,https://www.reddit.com/r/UnethicalLifeProTips/comments/1kmr5aa/ulpt_an_annoying_coworker_tried_to_sleep_with_my/,377
1kfugjf,"ULPT Bought a car for 2k from my Roomate last year and he also works at my job. He said he would give me the registration but never did and the other day he towed the car from where I live. I went to the cops and they said because the registration is in his name, they can't do anything. LF ULPT",,https://www.reddit.com/r/UnethicalLifeProTips/comments/1kfugjf/ulpt_bought_a_car_for_2k_from_my_roomate_last/,1013
1l9vetw,ULPT I'm going on a royal Caribbean cruise and they charge $18.99 per day for WiFi access. Any way to bypass a captive portal?,,https://www.reddit.com/r/UnethicalLifeProTips/comments/1l9vetw/ulpt_im_going_on_a_royal_caribbean_cruise_and/,1109
1lnq0ms,"ULPT: Y’all, Ive been unexpectedly offered a dream job and have 15 days to make THC not appear in a drug screen (urine culture), help please, I’m so open to anything as long as it’s ethical (jk light me up with ULPT’s please)",,https://www.reddit.com/r/UnethicalLifeProTips/comments/1lnq0ms/ulpt_yall_ive_been_unexpectedly_offered_a_dream/,276
1osapz2,"ULPT: When getting a license plate, get one with zeros",,https://www.reddit.com/r/UnethicalLifeProTips/comments/1osapz2/ulpt_when_getting_a_license_plate_get_one_with/,261
1mfilu4,ULPT Request: restaurant overcharged me on a tip by $225,,https://www.reddit.com/r/UnethicalLifeProTips/comments/1mfilu4/ulpt_request_restaurant_overcharged_me_on_a_tip/,1069
1mc9kqe,"ULPT: Self checkout ""Insert Coupon Now"" Takes any coupon, or even just a slip of paper",,https://www.reddit.com/r/UnethicalLifeProTips/comments/1mc9kqe/ulpt_self_checkout_insert_coupon_now_takes_any/,992
1oa0b4l,ULPT: no more scam calls from asian call centers,,https://www.reddit.com/r/UnethicalLifeProTips/comments/1oa0b4l/ulpt_no_more_scam_calls_from_asian_call_centers/,975
