id,title,selftext,permalink,score
1ufjh0q,ULPT -- Tell doctors you want to have a baby soon,,https://www.reddit.com/r/UnethicalLifeProTips/comments/1ufjh0q/ulpt_tell_doctors_you_want_to_have_a_baby_soon/,25499
1n92k9z,"ULPT: Hire a hooker, take her to walmart, buy her a set of normal clothes, go to a swinger's party, bang someone's wife while they bang a street walker",,https://www.reddit.com/r/UnethicalLifeProTips/comments/1n92k9z/ulpt_hire_a_hooker_take_her_to_walmart_buy_her_a/,22629
1tyghyr,ULPT: If your partner is fat and refuses to workout; cook and walk,,https://www.reddit.com/r/UnethicalLifeProTips/comments/1tyghyr/ulpt_if_your_partner_is_fat_and_refuses_to/,19903
1nku75r,ULPT: Don’t just cancel your Disney+ subscription….,,https://www.reddit.com/r/UnethicalLifeProTips/comments/1nku75r/ulpt_dont_just_cancel_your_disney_subscription/,17977
1uneal2,ULPT: Stop paying medical bills.,,https://www.reddit.com/r/UnethicalLifeProTips/comments/1uneal2/ulpt_stop_paying_medical_bills/,15329
1ralvwc,ULPT How can I ultimately troll my husband so he stops embarrassing me?,,https://www.reddit.com/r/UnethicalLifeProTips/comments/1ralvwc/ulpt_how_can_i_ultimately_troll_my_husband_so_he/,13658
1mvoluk,"ULPT: A female friend told me she keeps a dickpic in her phone. When someone sends her an unsolicited dickpic, she sends hers back with the note: “ I’m hard for you too” 😂",,https://www.reddit.com/r/UnethicalLifeProTips/comments/1mvoluk/ulpt_a_female_friend_told_me_she_keeps_a_dickpic/,12307
1o16gd8,ULPT My weird NSFW reward system for job applications,,https://www.reddit.com/r/UnethicalLifeProTips/comments/1o16gd8/ulpt_my_weird_nsfw_reward_system_for_job/,10902
1mytqu0,ULPT To Getting Cheap Rent,,https://www.reddit.com/r/UnethicalLifeProTips/comments/1mytqu0/ulpt_to_getting_cheap_rent/,9188
1rr6ap8,ULPT to avoid a DUI,,https://www.reddit.com/r/UnethicalLifeProTips/comments/1rr6ap8/ulpt_to_avoid_a_dui/,8113
1qczq9x,"ULPT: Get Mormon missionaries to FLEE by asking about ""soaking""",,https://www.reddit.com/r/UnethicalLifeProTips/comments/1qczq9x/ulpt_get_mormon_missionaries_to_flee_by_asking/,7900
1ohi5b1,ULPT: Replace your grandma's space heater with an old Bitcoin miner.,,https://www.reddit.com/r/UnethicalLifeProTips/comments/1ohi5b1/ulpt_replace_your_grandmas_space_heater_with_an/,6690
1mswizn,ULPT: Sexual harassment gets rid of telemarketers,,https://www.reddit.com/r/UnethicalLifeProTips/comments/1mswizn/ulpt_sexual_harassment_gets_rid_of_telemarketers/,5545
1sxm6io,"ULPT: If you don't want to hold someone's baby, just drop something",,https://www.reddit.com/r/UnethicalLifeProTips/comments/1sxm6io/ulpt_if_you_dont_want_to_hold_someones_baby_just/,5343
1ucd9fe,ULPT Take a free hotel shuttle from the airport then call uber from hotel.,,https://www.reddit.com/r/UnethicalLifeProTips/comments/1ucd9fe/ulpt_take_a_free_hotel_shuttle_from_the_airport/,4670
1odgtdd,ULPT I need a way to move 13 2000lbs pallets of margarine side to side and then down into a 6ft hole and then cover it with dirt,,https://www.reddit.com/r/UnethicalLifeProTips/comments/1odgtdd/ulpt_i_need_a_way_to_move_13_2000lbs_pallets_of/,4296
1sn98da,ULPT: Need to get out of a hotel room? Do this.,,https://www.reddit.com/r/UnethicalLifeProTips/comments/1sn98da/ulpt_need_to_get_out_of_a_hotel_room_do_this/,4070
1m6urh2,ULPT: If you’re a young fit attractive but broke male here’s an easy way to make an extra 30-50k every year,,https://www.reddit.com/r/UnethicalLifeProTips/comments/1m6urh2/ulpt_if_youre_a_young_fit_attractive_but_broke/,3047
1mcvakx,"ULPT request: neighbor stole my AirPods. Today after six months, I finally busted them and got them back.",,https://www.reddit.com/r/UnethicalLifeProTips/comments/1mcvakx/ulpt_request_neighbor_stole_my_airpods_today/,2733
1n3nidw,ULPT: If you don’t like someone sign them up to get info from this website. They will call 100+ times a day and never take them off the call list.,,https://www.reddit.com/r/UnethicalLifeProTips/comments/1n3nidw/ulpt_if_you_dont_like_someone_sign_them_up_to_get/,2981
1madaz4,ULPT: Won a $5000 dollar trip from my job but must pay out of pocket and expense it to them. How can I keep the cash?,,https://www.reddit.com/r/UnethicalLifeProTips/comments/1madaz4/ulpt_won_a_5000_dollar_trip_from_my_job_but_must/,2284
1ua5n2t,ULPT: If you're meeting someone to sell/buy on facebook marketplace...,,https://www.reddit.com/r/UnethicalLifeProTips/comments/1ua5n2t/ulpt_if_youre_meeting_someone_to_sellbuy_on/,2242
1opi4t5,ULPT: Almost All Coin Operated Washer And Dryer Machine Keys Can Be Found On Amazon. Just Find The Make And Model And Get Your Money Back After Doing A Load.,,https://www.reddit.com/r/UnethicalLifeProTips/comments/1opi4t5/ulpt_almost_all_coin_operated_washer_and_dryer/,1681
1txkhz3,"ULPT: For remote workers, tip to help you clock out early without detection",,https://www.reddit.com/r/UnethicalLifeProTips/comments/1txkhz3/ulpt_for_remote_workers_tip_to_help_you_clock_out/,1662
1pfzjc1,ULPT: Get into airport lounges for free as a stranger’s guest.,,https://www.reddit.com/r/UnethicalLifeProTips/comments/1pfzjc1/ulpt_get_into_airport_lounges_for_free_as_a/,1791
1mr4iut,ULPT: Need a super easy $20+? Get a good will-call number for a long line,,https://www.reddit.com/r/UnethicalLifeProTips/comments/1mr4iut/ulpt_need_a_super_easy_20_get_a_good_willcall/,1897
1tbjzkj,ULPT How I Stopped Someone From Playing Their Radio/CD Player In The Office,,https://www.reddit.com/r/UnethicalLifeProTips/comments/1tbjzkj/ulpt_how_i_stopped_someone_from_playing_their/,1312
1t8pl63,"ULPT request; My fellow Redditors, we have a home wrecker in our midst.",,https://www.reddit.com/r/UnethicalLifeProTips/comments/1t8pl63/ulpt_request_my_fellow_redditors_we_have_a_home/,1486
1t2d8dc,ULPT: bypass chatbots and connect to a human,,https://www.reddit.com/r/UnethicalLifeProTips/comments/1t2d8dc/ulpt_bypass_chatbots_and_connect_to_a_human/,1519
1spizxf,ULPT How to get the lowest possible price from a car dealership.,,https://www.reddit.com/r/UnethicalLifeProTips/comments/1spizxf/ulpt_how_to_get_the_lowest_possible_price_from_a/,1071
1osapz2,"ULPT: When getting a license plate, get one with zeros",,https://www.reddit.com/r/UnethicalLifeProTips/comments/1osapz2/ulpt_when_getting_a_license_plate_get_one_with/,1336
1mfilu4,ULPT Request: restaurant overcharged me on a tip by $225,,https://www.reddit.com/r/UnethicalLifeProTips/comments/1mfilu4/ulpt_request_restaurant_overcharged_me_on_a_tip/,1232
1mc9kqe,"ULPT: Self checkout ""Insert Coupon Now"" Takes any coupon, or even just a slip of paper",,https://www.reddit.com/r/UnethicalLifeProTips/comments/1mc9kqe/ulpt_self_checkout_insert_coupon_now_takes_any/,1100
1oa0b4l,ULPT: no more scam calls from asian call centers,,https://www.reddit.com/r/UnethicalLifeProTips/comments/1oa0b4l/ulpt_no_more_scam_calls_from_asian_call_centers/,661
1uih7vm,ULPT: skip elevator lines,,https://www.reddit.com/r/UnethicalLifeProTips/comments/1uih7vm/ulpt_skip_elevator_lines/,1230
1mcvdsv,"ULPT ""Free"" sunglasses. Just go to the airport",,https://www.reddit.com/r/UnethicalLifeProTips/comments/1mcvdsv/ulpt_free_sunglasses_just_go_to_the_airport/,1064
1urwkw8,ULPT: How a generic wristband and a bit of confidence got me into a spa,,https://www.reddit.com/r/UnethicalLifeProTips/comments/1urwkw8/ulpt_how_a_generic_wristband_and_a_bit_of/,619
1pbuzgo,ULPT: Paper due at 11:59? Crash your professors computer!,,https://www.reddit.com/r/UnethicalLifeProTips/comments/1pbuzgo/ulpt_paper_due_at_1159_crash_your_professors/,385
1og5ch4,ULPT: Removed car boot without paying the ticket.,,https://www.reddit.com/r/UnethicalLifeProTips/comments/1og5ch4/ulpt_removed_car_boot_without_paying_the_ticket/,616
1srtkei,ULPT Request: How to fail a sleep apnea test,,https://www.reddit.com/r/UnethicalLifeProTips/comments/1srtkei/ulpt_request_how_to_fail_a_sleep_apnea_test/,962
1qlvth6,ULPT | You can cancel an annual subscription to Adobe...,,https://www.reddit.com/r/UnethicalLifeProTips/comments/1qlvth6/ulpt_you_can_cancel_an_annual_subscription_to/,837
1m9lbhq,ULPT I did something wrong and found out something even worse,,https://www.reddit.com/r/UnethicalLifeProTips/comments/1m9lbhq/ulpt_i_did_something_wrong_and_found_out/,943
1px7me4,ULPT: GUIDE how to get free edu email (Dec 2025),,https://www.reddit.com/r/UnethicalLifeProTips/comments/1px7me4/ulpt_guide_how_to_get_free_edu_email_dec_2025/,277
1m9hcmq,ULPT: Do your computering at church,,https://www.reddit.com/r/UnethicalLifeProTips/comments/1m9hcmq/ulpt_do_your_computering_at_church/,391
1nm8em7,ULPT: help me ruin the business of a tour guide who stops in front of my house,,https://www.reddit.com/r/UnethicalLifeProTips/comments/1nm8em7/ulpt_help_me_ruin_the_business_of_a_tour_guide/,458
1o7cger,ULPT: I need to ruin a wedding.,,https://www.reddit.com/r/UnethicalLifeProTips/comments/1o7cger/ulpt_i_need_to_ruin_a_wedding/,848
1ma5gga,ULPT: carry a form of currency that no one would accept,,https://www.reddit.com/r/UnethicalLifeProTips/comments/1ma5gga/ulpt_carry_a_form_of_currency_that_no_one_would/,501
1mhl60j,ULPT - How To Avoid Car Repossession…,,https://www.reddit.com/r/UnethicalLifeProTips/comments/1mhl60j/ulpt_how_to_avoid_car_repossession/,1036
1ns1fp3,ULPT: Don't throw birthday parties for your kids before they are old enough to remember.,,https://www.reddit.com/r/UnethicalLifeProTips/comments/1ns1fp3/ulpt_dont_throw_birthday_parties_for_your_kids/,1003
1sd01zh,ULPT: Dispose of small heavy items for free at the airport.,,https://www.reddit.com/r/UnethicalLifeProTips/comments/1sd01zh/ulpt_dispose_of_small_heavy_items_for_free_at_the/,933
