id,title,selftext,permalink,score
1juq2ew,AP wins reinstatement to White House events after judge rules government can’t bar its journalists,,https://www.reddit.com/r/UpliftingNews/comments/1juq2ew/ap_wins_reinstatement_to_white_house_events_after/,16103
1kqd0k3,"‘Sesame Street’ Saved, Inks New Streaming Deal With Netflix",,https://www.reddit.com/r/UpliftingNews/comments/1kqd0k3/sesame_street_saved_inks_new_streaming_deal_with/,13846
1qb0kn1,"U.S. Senator introduces ""One Fair Price Act"" legislation that would bar businesses from using personal information they collect about customers to charge people different prices for the same products",,https://www.reddit.com/r/UpliftingNews/comments/1qb0kn1/us_senator_introduces_one_fair_price_act/,12653
1jwzoeh,"New Mexico made childcare free. It lifted 120,000 people above the poverty line | New Mexico",,https://www.reddit.com/r/UpliftingNews/comments/1jwzoeh/new_mexico_made_childcare_free_it_lifted_120000/,11198
1nbx603,"New Mexico to be first state to launch universal child care system, governor announces",,https://www.reddit.com/r/UpliftingNews/comments/1nbx603/new_mexico_to_be_first_state_to_launch_universal/,9481
1lgx6il,London woman off insulin for Type 1 diabetes after a single dose of experimental manufactured stem cells,,https://www.reddit.com/r/UpliftingNews/comments/1lgx6il/london_woman_off_insulin_for_type_1_diabetes/,8957
1qtpulu,"Goodbye to the idea that solar panels “die” after 25 years: New Swiss study shows real-world performance after 3 decades still over 80%, average annual loss about 0.25%, thermal stress and quality key factors. Their long-term economics are better than many people assume",,https://www.reddit.com/r/UpliftingNews/comments/1qtpulu/goodbye_to_the_idea_that_solar_panels_die_after/,7840
1lvf3vs,Forced participation in religious activities to be classified as child abuse in Japan,,https://www.reddit.com/r/UpliftingNews/comments/1lvf3vs/forced_participation_in_religious_activities_to/,7071
1ksr9so,"German Administrative Court: Cookie banner must contain ""Reject all"" button (on first level)",,https://www.reddit.com/r/UpliftingNews/comments/1ksr9so/german_administrative_court_cookie_banner_must/,5858
1p5bi52,"Colombia bans all new oil and mining projects in its Amazon biome, which covers 42% of the nation’s territory. The entire Colombian Amazon will be made a reserve for renewable natural resources, to prevent forest degradation, river contamination and biodiversity loss",,https://www.reddit.com/r/UpliftingNews/comments/1p5bi52/colombia_bans_all_new_oil_and_mining_projects_in/,5585
1onngjp,"MacKenzie Scott gifts $80 million to Howard University, marking one of the school’s largest donations in its 158-year history",,https://www.reddit.com/r/UpliftingNews/comments/1onngjp/mackenzie_scott_gifts_80_million_to_howard/,4482
1olnnsp,New Mexico Becomes First U.S. State To Offer Free Child Care To All,,https://www.reddit.com/r/UpliftingNews/comments/1olnnsp/new_mexico_becomes_first_us_state_to_offer_free/,4492
1o1kta5,Gavin Newsom Signs Bill That Restricts Loudness Of Commercials On Streaming Services,,https://www.reddit.com/r/UpliftingNews/comments/1o1kta5/gavin_newsom_signs_bill_that_restricts_loudness/,3799
1p49otn,California Passes Bill Blocking Cities from Punishing Good Samaritans Who Offer Aid to the Homeless,,https://www.reddit.com/r/UpliftingNews/comments/1p49otn/california_passes_bill_blocking_cities_from/,3634
1pvni3m,Arizona cancels medical debt for almost half-a-million residents,,https://www.reddit.com/r/UpliftingNews/comments/1pvni3m/arizona_cancels_medical_debt_for_almost/,3025
1nqnm6l,'We can end HIV': Groundbreaking preventative drug to be rolled out for $40 a year from 2027,,https://www.reddit.com/r/UpliftingNews/comments/1nqnm6l/we_can_end_hiv_groundbreaking_preventative_drug/,2739
1ok1d35,"Billie Eilish Donates $11.5 Million To Charity, Encourages Billionaires To Do The Same",,https://www.reddit.com/r/UpliftingNews/comments/1ok1d35/billie_eilish_donates_115_million_to_charity/,2808
1np9a5v,"One of the cruellest and most devastating disease, Huntington's, successfully treated for first time",,https://www.reddit.com/r/UpliftingNews/comments/1np9a5v/one_of_the_cruellest_and_most_devastating_disease/,2327
1klv3ke,Farmers win legal fight to bring climate resources back to federal websites | The USDA says it will return information about climate change to its webpages after the Trump administration took it down.,,https://www.reddit.com/r/UpliftingNews/comments/1klv3ke/farmers_win_legal_fight_to_bring_climate/,2277
1rgkn46,Croatia declared free of landmines after 31 years,,https://www.reddit.com/r/UpliftingNews/comments/1rgkn46/croatia_declared_free_of_landmines_after_31_years/,1547
1pn0y2k,"$300,000 raised via GoFundMe for hero Ahmed al Ahmed who disarmed gunman",,https://www.reddit.com/r/UpliftingNews/comments/1pn0y2k/300000_raised_via_gofundme_for_hero_ahmed_al/,2030
1ltgqg4,NJ man called 'American Hero' after saving 165 lives in Texas flooding disaster,,https://www.reddit.com/r/UpliftingNews/comments/1ltgqg4/nj_man_called_american_hero_after_saving_165/,1193
1lfb1ab,"Just 1 dose of magic mushroom compound eases depression for at least 5 years in most patients, small study suggests",,https://www.reddit.com/r/UpliftingNews/comments/1lfb1ab/just_1_dose_of_magic_mushroom_compound_eases/,1553
1jqvtxu,A historic Black church took the Proud Boys to court. Now it controls their trademark,,https://www.reddit.com/r/UpliftingNews/comments/1jqvtxu/a_historic_black_church_took_the_proud_boys_to/,1292
1qsoml1,"Steve Martin and Martin Short Pause Comedy Show to Honor Catherine O’Hara: ‘“Catherine O’Hara, I met when she was 18 years of age, and all these years later, she has been the greatest, most brilliant, kindest, sweetest angel that any of us worked with,” said Short alongside Martin.",,https://www.reddit.com/r/UpliftingNews/comments/1qsoml1/steve_martin_and_martin_short_pause_comedy_show/,1202
1qe2nji,"San Francisco to make childcare free for families earning up to $230,000",,https://www.reddit.com/r/UpliftingNews/comments/1qe2nji/san_francisco_to_make_childcare_free_for_families/,917
1kt6iwf,"A 19-year-old won $100,000 for inventing a cheaper, faster way to make antiviral drugs out of corn husks",,https://www.reddit.com/r/UpliftingNews/comments/1kt6iwf/a_19yearold_won_100000_for_inventing_a_cheaper/,1303
1lpt2xq,The city of Flint Michigan completes project to replace the lead pipes in the city,,https://www.reddit.com/r/UpliftingNews/comments/1lpt2xq/the_city_of_flint_michigan_completes_project_to/,1013
1ooqwog,"Jimmy Kimmel Launches ‘Big, Beautiful Food Bank’ to Help SNAP Recipients Impacted by Government Shutdown",,https://www.reddit.com/r/UpliftingNews/comments/1ooqwog/jimmy_kimmel_launches_big_beautiful_food_bank_to/,719
1qu9qls,US judge allows last of five offshore wind projects halted by Trump to proceed,,https://www.reddit.com/r/UpliftingNews/comments/1qu9qls/us_judge_allows_last_of_five_offshore_wind/,1228
1l2qyqi,Woman diagnosed with breast cancer at 100 years old is now cancer-free at 101,,https://www.reddit.com/r/UpliftingNews/comments/1l2qyqi/woman_diagnosed_with_breast_cancer_at_100_years/,840
1lhmxww,Pope Leo XIV says there should be no tolerance for abuse of any kind in Catholic Church,,https://www.reddit.com/r/UpliftingNews/comments/1lhmxww/pope_leo_xiv_says_there_should_be_no_tolerance/,708
1l13oxy,GoFundMe for teen who rushed to Burger King shift after graduation skyrockets to $130K — and keeps climbing,,https://www.reddit.com/r/UpliftingNews/comments/1l13oxy/gofundme_for_teen_who_rushed_to_burger_king_shift/,650
1oy41y9,"Boy born with rare genetic condition can now breathe, eat, and swallow independently after surgeons rebuilt his jaw using bone from his ribs",,https://www.reddit.com/r/UpliftingNews/comments/1oy41y9/boy_born_with_rare_genetic_condition_can_now/,767
1qza3ax,California introduces bill to cap ticket re-sale prices,,https://www.reddit.com/r/UpliftingNews/comments/1qza3ax/california_introduces_bill_to_cap_ticket_resale/,756
1m3tyy5,DuckDuckGo now lets you hide AI-generated images in search results | TechCrunch,,https://www.reddit.com/r/UpliftingNews/comments/1m3tyy5/duckduckgo_now_lets_you_hide_aigenerated_images/,546
1jcj5x2,Long Island man is first in New York history to be cured of sickle cell anemia,,https://www.reddit.com/r/UpliftingNews/comments/1jcj5x2/long_island_man_is_first_in_new_york_history_to/,799
1k456m8,3 teens invented a salt-powered refrigerator that doesn't need electricity. They're building 200 of them for hospitals to use.,,https://www.reddit.com/r/UpliftingNews/comments/1k456m8/3_teens_invented_a_saltpowered_refrigerator_that/,555
1m34qkz,The Amount of Electricity Generated From Solar Is Suddenly Unbelievable,,https://www.reddit.com/r/UpliftingNews/comments/1m34qkz/the_amount_of_electricity_generated_from_solar_is/,1041
1m6u8uq,Ozzy Osbourne farewell show was the highest-grossing charity concert of all time,,https://www.reddit.com/r/UpliftingNews/comments/1m6u8uq/ozzy_osbourne_farewell_show_was_the/,472
1kxsfqq,"Spain aims to ban flushing of wet wipes, with manufacturers paying for cleanup",,https://www.reddit.com/r/UpliftingNews/comments/1kxsfqq/spain_aims_to_ban_flushing_of_wet_wipes_with/,550
1oughx5,Gary Sinise donates $1M to transform Nashville church into haven for healing veterans,,https://www.reddit.com/r/UpliftingNews/comments/1oughx5/gary_sinise_donates_1m_to_transform_nashville/,384
1qbjcv8,The Giant Panda Has Officially Come off the Endangered List,,https://www.reddit.com/r/UpliftingNews/comments/1qbjcv8/the_giant_panda_has_officially_come_off_the/,689
1li0sd9,"Infectious disease experts at University of Minnesota organizing to form unbiased, independent vaccine panel",,https://www.reddit.com/r/UpliftingNews/comments/1li0sd9/infectious_disease_experts_at_university_of/,807
1ovv3yj,Chicagoans buy out street vendors amid immigration crackdown to give them a 'day without fear',,https://www.reddit.com/r/UpliftingNews/comments/1ovv3yj/chicagoans_buy_out_street_vendors_amid/,216
1pdc6cd,"Mexican government hikes minimum wage, pushes shorter work week",,https://www.reddit.com/r/UpliftingNews/comments/1pdc6cd/mexican_government_hikes_minimum_wage_pushes/,526
1l36tms,The IRS Tax Filing Software TurboTax Is Trying to Kill Just Got Open Sourced,,https://www.reddit.com/r/UpliftingNews/comments/1l36tms/the_irs_tax_filing_software_turbotax_is_trying_to/,340
1o7cupv,Major study finds tooth decay in Queensland children has declined since water fluoridation expanded,,https://www.reddit.com/r/UpliftingNews/comments/1o7cupv/major_study_finds_tooth_decay_in_queensland/,395
1lxozdf,Flint completes lead pipe replacement 11 years after beginning of water crisis,,https://www.reddit.com/r/UpliftingNews/comments/1lxozdf/flint_completes_lead_pipe_replacement_11_years/,735
1rrvxod,"'Millionaires tax' receives Senate confirmation, heads to governor's desk: Both the House and Senate passed the ""millionaires tax"" bill imposing a 9.9% tax on high earners, stirring debate on future tax reform in Washington.",,https://www.reddit.com/r/UpliftingNews/comments/1rrvxod/millionaires_tax_receives_senate_confirmation/,387
