id,title,selftext,permalink,score
1qb0kn1,"U.S. Senator introduces ""One Fair Price Act"" legislation that would bar businesses from using personal information they collect about customers to charge people different prices for the same products",,https://www.reddit.com/r/UpliftingNews/comments/1qb0kn1/us_senator_introduces_one_fair_price_act/,31167
1nbx603,"New Mexico to be first state to launch universal child care system, governor announces",,https://www.reddit.com/r/UpliftingNews/comments/1nbx603/new_mexico_to_be_first_state_to_launch_universal/,27555
1lgx6il,London woman off insulin for Type 1 diabetes after a single dose of experimental manufactured stem cells,,https://www.reddit.com/r/UpliftingNews/comments/1lgx6il/london_woman_off_insulin_for_type_1_diabetes/,23933
1qtpulu,"Goodbye to the idea that solar panels “die” after 25 years: New Swiss study shows real-world performance after 3 decades still over 80%, average annual loss about 0.25%, thermal stress and quality key factors. Their long-term economics are better than many people assume",,https://www.reddit.com/r/UpliftingNews/comments/1qtpulu/goodbye_to_the_idea_that_solar_panels_die_after/,20776
1sh0zjg,4-day workweek advocates gain momentum as new study reveals 5th day is basically useless,,https://www.reddit.com/r/UpliftingNews/comments/1sh0zjg/4day_workweek_advocates_gain_momentum_as_new/,18743
1lvf3vs,Forced participation in religious activities to be classified as child abuse in Japan,,https://www.reddit.com/r/UpliftingNews/comments/1lvf3vs/forced_participation_in_religious_activities_to/,16235
1p5bi52,"Colombia bans all new oil and mining projects in its Amazon biome, which covers 42% of the nation’s territory. The entire Colombian Amazon will be made a reserve for renewable natural resources, to prevent forest degradation, river contamination and biodiversity loss",,https://www.reddit.com/r/UpliftingNews/comments/1p5bi52/colombia_bans_all_new_oil_and_mining_projects_in/,14548
1onngjp,"MacKenzie Scott gifts $80 million to Howard University, marking one of the school’s largest donations in its 158-year history",,https://www.reddit.com/r/UpliftingNews/comments/1onngjp/mackenzie_scott_gifts_80_million_to_howard/,13096
1olnnsp,New Mexico Becomes First U.S. State To Offer Free Child Care To All,,https://www.reddit.com/r/UpliftingNews/comments/1olnnsp/new_mexico_becomes_first_us_state_to_offer_free/,11129
1o1kta5,Gavin Newsom Signs Bill That Restricts Loudness Of Commercials On Streaming Services,,https://www.reddit.com/r/UpliftingNews/comments/1o1kta5/gavin_newsom_signs_bill_that_restricts_loudness/,9961
1p49otn,California Passes Bill Blocking Cities from Punishing Good Samaritans Who Offer Aid to the Homeless,,https://www.reddit.com/r/UpliftingNews/comments/1p49otn/california_passes_bill_blocking_cities_from/,9308
1pvni3m,Arizona cancels medical debt for almost half-a-million residents,,https://www.reddit.com/r/UpliftingNews/comments/1pvni3m/arizona_cancels_medical_debt_for_almost/,7839
1sauhun,Sickle cell disease has just been cured for the first time in New York,,https://www.reddit.com/r/UpliftingNews/comments/1sauhun/sickle_cell_disease_has_just_been_cured_for_the/,7397
1nqnm6l,'We can end HIV': Groundbreaking preventative drug to be rolled out for $40 a year from 2027,,https://www.reddit.com/r/UpliftingNews/comments/1nqnm6l/we_can_end_hiv_groundbreaking_preventative_drug/,5925
1ok1d35,"Billie Eilish Donates $11.5 Million To Charity, Encourages Billionaires To Do The Same",,https://www.reddit.com/r/UpliftingNews/comments/1ok1d35/billie_eilish_donates_115_million_to_charity/,5192
1np9a5v,"One of the cruellest and most devastating disease, Huntington's, successfully treated for first time",,https://www.reddit.com/r/UpliftingNews/comments/1np9a5v/one_of_the_cruellest_and_most_devastating_disease/,5440
1tae06t,"Europe is moving to block Microsoft, Amazon, and Google from handling government health, financial, and legal data",,https://www.reddit.com/r/UpliftingNews/comments/1tae06t/europe_is_moving_to_block_microsoft_amazon_and/,4055
1tc65x3,BBC announces David Attenborough is returning to narrate Blue Planet III,,https://www.reddit.com/r/UpliftingNews/comments/1tc65x3/bbc_announces_david_attenborough_is_returning_to/,3995
1rgkn46,Croatia declared free of landmines after 31 years,,https://www.reddit.com/r/UpliftingNews/comments/1rgkn46/croatia_declared_free_of_landmines_after_31_years/,3707
1pn0y2k,"$300,000 raised via GoFundMe for hero Ahmed al Ahmed who disarmed gunman",,https://www.reddit.com/r/UpliftingNews/comments/1pn0y2k/300000_raised_via_gofundme_for_hero_ahmed_al/,2810
1ltgqg4,NJ man called 'American Hero' after saving 165 lives in Texas flooding disaster,,https://www.reddit.com/r/UpliftingNews/comments/1ltgqg4/nj_man_called_american_hero_after_saving_165/,2883
1lfb1ab,"Just 1 dose of magic mushroom compound eases depression for at least 5 years in most patients, small study suggests",,https://www.reddit.com/r/UpliftingNews/comments/1lfb1ab/just_1_dose_of_magic_mushroom_compound_eases/,2803
1qsoml1,"Steve Martin and Martin Short Pause Comedy Show to Honor Catherine O’Hara: ‘“Catherine O’Hara, I met when she was 18 years of age, and all these years later, she has been the greatest, most brilliant, kindest, sweetest angel that any of us worked with,” said Short alongside Martin.",,https://www.reddit.com/r/UpliftingNews/comments/1qsoml1/steve_martin_and_martin_short_pause_comedy_show/,2265
1sy57y2,‘Jurassic Park’ Star Sam Neill Says He’s Now Cancer-Free After Chemo Stopped Working: ‘It Looked Like I Was on the Way Out’,,https://www.reddit.com/r/UpliftingNews/comments/1sy57y2/jurassic_park_star_sam_neill_says_hes_now/,2371
1qe2nji,"San Francisco to make childcare free for families earning up to $230,000",,https://www.reddit.com/r/UpliftingNews/comments/1qe2nji/san_francisco_to_make_childcare_free_for_families/,1798
1s03rx1,"Mexico’s monarch butterfly population jumps 64%, offering hope for at-risk species",,https://www.reddit.com/r/UpliftingNews/comments/1s03rx1/mexicos_monarch_butterfly_population_jumps_64/,1980
1lpt2xq,The city of Flint Michigan completes project to replace the lead pipes in the city,,https://www.reddit.com/r/UpliftingNews/comments/1lpt2xq/the_city_of_flint_michigan_completes_project_to/,1714
1ooqwog,"Jimmy Kimmel Launches ‘Big, Beautiful Food Bank’ to Help SNAP Recipients Impacted by Government Shutdown",,https://www.reddit.com/r/UpliftingNews/comments/1ooqwog/jimmy_kimmel_launches_big_beautiful_food_bank_to/,1167
1qu9qls,US judge allows last of five offshore wind projects halted by Trump to proceed,,https://www.reddit.com/r/UpliftingNews/comments/1qu9qls/us_judge_allows_last_of_five_offshore_wind/,1637
1snerex,NPR receives $113 million in charitable gifts - two of the largest donations it has ever received,,https://www.reddit.com/r/UpliftingNews/comments/1snerex/npr_receives_113_million_in_charitable_gifts_two/,1043
1ry0ftd,'Mister Rogers' Neighborhood' Getting YouTube Channel For First Time,,https://www.reddit.com/r/UpliftingNews/comments/1ry0ftd/mister_rogers_neighborhood_getting_youtube/,1630
1lhmxww,Pope Leo XIV says there should be no tolerance for abuse of any kind in Catholic Church,,https://www.reddit.com/r/UpliftingNews/comments/1lhmxww/pope_leo_xiv_says_there_should_be_no_tolerance/,1258
1tne2j1,"Mister Rogers stamp wins USPS contest, will now be reissued",,https://www.reddit.com/r/UpliftingNews/comments/1tne2j1/mister_rogers_stamp_wins_usps_contest_will_now_be/,1174
1t4khia,"Mariska Hargitay’s End The Backlog Campaign Achieves Rape Kit Reform In All 50 States, D.C. & Puerto Rico",,https://www.reddit.com/r/UpliftingNews/comments/1t4khia/mariska_hargitays_end_the_backlog_campaign/,1425
1tul8yz,New Tennessee law requires data center owners to pay full electricity and infrastructure costs,,https://www.reddit.com/r/UpliftingNews/comments/1tul8yz/new_tennessee_law_requires_data_center_owners_to/,716
1oy41y9,"Boy born with rare genetic condition can now breathe, eat, and swallow independently after surgeons rebuilt his jaw using bone from his ribs",,https://www.reddit.com/r/UpliftingNews/comments/1oy41y9/boy_born_with_rare_genetic_condition_can_now/,881
1qza3ax,California introduces bill to cap ticket re-sale prices,,https://www.reddit.com/r/UpliftingNews/comments/1qza3ax/california_introduces_bill_to_cap_ticket_resale/,471
1sh4tit,Mexico's President Sheinbaum Decrees Universal Healthcare for 120 Million | the deep dive,,https://www.reddit.com/r/UpliftingNews/comments/1sh4tit/mexicos_president_sheinbaum_decrees_universal/,685
1m3tyy5,DuckDuckGo now lets you hide AI-generated images in search results | TechCrunch,,https://www.reddit.com/r/UpliftingNews/comments/1m3tyy5/duckduckgo_now_lets_you_hide_aigenerated_images/,711
1s5s2ta,Scientists uncovered the nutrients bees were missing — Colonies surged 15-fold,,https://www.reddit.com/r/UpliftingNews/comments/1s5s2ta/scientists_uncovered_the_nutrients_bees_were/,894
1sg49og,Chicago Turns All Public School IDs Into Library Cards To Boost Student Access,,https://www.reddit.com/r/UpliftingNews/comments/1sg49og/chicago_turns_all_public_school_ids_into_library/,906
1m34qkz,The Amount of Electricity Generated From Solar Is Suddenly Unbelievable,,https://www.reddit.com/r/UpliftingNews/comments/1m34qkz/the_amount_of_electricity_generated_from_solar_is/,450
1m6u8uq,Ozzy Osbourne farewell show was the highest-grossing charity concert of all time,,https://www.reddit.com/r/UpliftingNews/comments/1m6u8uq/ozzy_osbourne_farewell_show_was_the/,628
1oughx5,Gary Sinise donates $1M to transform Nashville church into haven for healing veterans,,https://www.reddit.com/r/UpliftingNews/comments/1oughx5/gary_sinise_donates_1m_to_transform_nashville/,1111
1sz0oxm,Hilton Donates Unserved White House Correspondents' Dinner Lobsters and Steaks to Local Shelters,,https://www.reddit.com/r/UpliftingNews/comments/1sz0oxm/hilton_donates_unserved_white_house/,330
1qbjcv8,The Giant Panda Has Officially Come off the Endangered List,,https://www.reddit.com/r/UpliftingNews/comments/1qbjcv8/the_giant_panda_has_officially_come_off_the/,580
1li0sd9,"Infectious disease experts at University of Minnesota organizing to form unbiased, independent vaccine panel",,https://www.reddit.com/r/UpliftingNews/comments/1li0sd9/infectious_disease_experts_at_university_of/,227
1tdeddw,Bill banning child marriage in Oklahoma becomes law,,https://www.reddit.com/r/UpliftingNews/comments/1tdeddw/bill_banning_child_marriage_in_oklahoma_becomes/,479
1ovv3yj,Chicagoans buy out street vendors amid immigration crackdown to give them a 'day without fear',,https://www.reddit.com/r/UpliftingNews/comments/1ovv3yj/chicagoans_buy_out_street_vendors_amid/,898
1pdc6cd,"Mexican government hikes minimum wage, pushes shorter work week",,https://www.reddit.com/r/UpliftingNews/comments/1pdc6cd/mexican_government_hikes_minimum_wage_pushes/,246
