id,title,selftext,permalink,score
1twlcet,"ELI5: When you 'delete' a 50GB video file from a computer, it vanishes instantly. But downloading it took an hour. If the data isn't physically wiped until it's overwritten, what did the computer actually do in that one split second?",,https://www.reddit.com/r/explainlikeimfive/comments/1twlcet/eli5_when_you_delete_a_50gb_video_file_from_a/,82115
1t73dsa,"ELI5 what does it mean people see ""nothing"" rather than ""black void"" if born absolutely blind",,https://www.reddit.com/r/explainlikeimfive/comments/1t73dsa/eli5_what_does_it_mean_people_see_nothing_rather/,72906
1t9qcn9,ELI5: Why does Cuba allow a U.S. military base (and prison) on their soil while the U.S. has had them under trade embargos for decades?,,https://www.reddit.com/r/explainlikeimfive/comments/1t9qcn9/eli5_why_does_cuba_allow_a_us_military_base_and/,63973
1tti2co,"ELI5 The world record 20km walk is only 29.5% slower than the world record 20km run, how is that even possible?",,https://www.reddit.com/r/explainlikeimfive/comments/1tti2co/eli5_the_world_record_20km_walk_is_only_295/,56678
1tsjko5,ELI5: How is porn profitable?,,https://www.reddit.com/r/explainlikeimfive/comments/1tsjko5/eli5_how_is_porn_profitable/,50042
1te5374,ELI5: Why do Gamma settings in video games ask you to adjust the brightness until a logo or an image is barely visible?,,https://www.reddit.com/r/explainlikeimfive/comments/1te5374/eli5_why_do_gamma_settings_in_video_games_ask_you/,43513
1tchizw,ELI5: why didn’t the Great Depression produce a widespread revolution or anarchy?,,https://www.reddit.com/r/explainlikeimfive/comments/1tchizw/eli5_why_didnt_the_great_depression_produce_a/,38473
1tp40yf,ELI5 Why heat waves affect Europe so much but some other countries are doing fine living under hotter temperatures most of the year?,,https://www.reddit.com/r/explainlikeimfive/comments/1tp40yf/eli5_why_heat_waves_affect_europe_so_much_but/,33934
1tre8z1,"ELI5: Acids and bases are two sides of the same coin, so why does it seem like acidity is so much more present culturally (eg vats of acid in comics) and culinarily (salt, fat, acid, heat)?",,https://www.reddit.com/r/explainlikeimfive/comments/1tre8z1/eli5_acids_and_bases_are_two_sides_of_the_same/,30013
1th0adg,ELI5: What does this predicted super el nino actually mean for the U.S.?,,https://www.reddit.com/r/explainlikeimfive/comments/1th0adg/eli5_what_does_this_predicted_super_el_nino/,26456
1tpcimz,ELI5: why do kids have such crazy stamina?,,https://www.reddit.com/r/explainlikeimfive/comments/1tpcimz/eli5_why_do_kids_have_such_crazy_stamina/,23149
1tvr42y,"ELI5: if you are on the beach when a tsunami hits, do you die by drowning or impact?",,https://www.reddit.com/r/explainlikeimfive/comments/1tvr42y/eli5_if_you_are_on_the_beach_when_a_tsunami_hits/,21043
1trp4mt,ELI5 Are mosquitoes necessary for keeping ecological balance?,,https://www.reddit.com/r/explainlikeimfive/comments/1trp4mt/eli5_are_mosquitoes_necessary_for_keeping/,17767
1t7vtvz,ELI5 How is there so much meat,,https://www.reddit.com/r/explainlikeimfive/comments/1t7vtvz/eli5_how_is_there_so_much_meat/,15711
1tlnrxt,ELI5: Why is India specifically experiencing such high levels of heat?,,https://www.reddit.com/r/explainlikeimfive/comments/1tlnrxt/eli5_why_is_india_specifically_experiencing_such/,14100
1tfekj5,"ELI5: Why do people go to the Naval Academy, West Point, etc. instead of just enlisting in the forces? You need the academy to be an officer? What does an officer do etc.?",,https://www.reddit.com/r/explainlikeimfive/comments/1tfekj5/eli5_why_do_people_go_to_the_naval_academy_west/,12341
1tqc5la,ELI5 How could two people ever know if both of them are seeing the same colour?,,https://www.reddit.com/r/explainlikeimfive/comments/1tqc5la/eli5_how_could_two_people_ever_know_if_both_of/,11129
1ti4kvk,ELI5: why doesn't the ocean suck you dry through osmosis,,https://www.reddit.com/r/explainlikeimfive/comments/1ti4kvk/eli5_why_doesnt_the_ocean_suck_you_dry_through/,9538
1tm370l,"ELI5 how does a ""queen"" bee get chosen?",,https://www.reddit.com/r/explainlikeimfive/comments/1tm370l/eli5_how_does_a_queen_bee_get_chosen/,8519
1tb563x,ELI5: Why is the body not smart enough to realize that a blocked nose is literally preventing my ability to breathe?,,https://www.reddit.com/r/explainlikeimfive/comments/1tb563x/eli5_why_is_the_body_not_smart_enough_to_realize/,7499
1tj31pu,"ELI5: If GPUs are so much more capable, why do we still have CPUs at all?",,https://www.reddit.com/r/explainlikeimfive/comments/1tj31pu/eli5_if_gpus_are_so_much_more_capable_why_do_we/,6533
1thhoj2,ELI5: Why is lamb so expensive when there’s so many sheep?,,https://www.reddit.com/r/explainlikeimfive/comments/1thhoj2/eli5_why_is_lamb_so_expensive_when_theres_so_many/,5828
1torpqa,ELI5 How were wooden ships watertight?,,https://www.reddit.com/r/explainlikeimfive/comments/1torpqa/eli5_how_were_wooden_ships_watertight/,5690
1tk7kje,"ELI5: Why are there no naturally blue, green, or red mammals?",,https://www.reddit.com/r/explainlikeimfive/comments/1tk7kje/eli5_why_are_there_no_naturally_blue_green_or_red/,5257
1tw1fdn,"ELI5: Do medications like Ozempic cause weight loss solely through appetite reduction and therefore calorie deficit, or is there any other mechanism at play?",,https://www.reddit.com/r/explainlikeimfive/comments/1tw1fdn/eli5_do_medications_like_ozempic_cause_weight/,4254
1ts7zwx,ELI5: Why don’t scars tan like the rest of the skin?,,https://www.reddit.com/r/explainlikeimfive/comments/1ts7zwx/eli5_why_dont_scars_tan_like_the_rest_of_the_skin/,3950
1t7egm2,ELI5: Why is it recommended to sleep 8 hours when a sleep cycle is 90 minutes so it should be 7.5 or 9 hours? Won’t you wake up mid sleep cycle (and be groggy) if you set your alarm for 8 hours?,,https://www.reddit.com/r/explainlikeimfive/comments/1t7egm2/eli5_why_is_it_recommended_to_sleep_8_hours_when/,3476
1tfjuae,ELI5: What could possibly be the evolutionary advantage to the luteal phase in women?,,https://www.reddit.com/r/explainlikeimfive/comments/1tfjuae/eli5_what_could_possibly_be_the_evolutionary/,2988
1thwood,"ELI5: Why, in the English language, meat has a distinct name for each animal it comes from",,https://www.reddit.com/r/explainlikeimfive/comments/1thwood/eli5_why_in_the_english_language_meat_has_a/,3160
1tapgot,"ELI5: If the evolutionary goal of a virus is to reproduce and sustain itself as long as possible, why do many evolve to devastate and kill their hosts?",,https://www.reddit.com/r/explainlikeimfive/comments/1tapgot/eli5_if_the_evolutionary_goal_of_a_virus_is_to/,2332
1t9aruk,ELI5:How do the tire pressure sensors send the data to the car?,,https://www.reddit.com/r/explainlikeimfive/comments/1t9aruk/eli5how_do_the_tire_pressure_sensors_send_the/,2529
1tu5o0y,ELI5: Why is Mcdonald ice cream so smooth instead of icy? How does it stop large ice crystals from forming when other regular ice creams get icy or have hard frozen patches?,,https://www.reddit.com/r/explainlikeimfive/comments/1tu5o0y/eli5_why_is_mcdonald_ice_cream_so_smooth_instead/,1983
1tp511g,"ELI5: Why do some languages assign genders to objects like ""table"" or ""bridge"" when there's nothing inherently masculine or feminine about them?",,https://www.reddit.com/r/explainlikeimfive/comments/1tp511g/eli5_why_do_some_languages_assign_genders_to/,2335
1townth,ElI5 why do cats tolerate heat so well?,,https://www.reddit.com/r/explainlikeimfive/comments/1townth/eli5_why_do_cats_tolerate_heat_so_well/,1566
1thowco,ELI5: Why don't we milk pigs?,,https://www.reddit.com/r/explainlikeimfive/comments/1thowco/eli5_why_dont_we_milk_pigs/,1951
1t8v772,ELI5: why doesnt stomach acid leak out of your stomach if you're flipped over,,https://www.reddit.com/r/explainlikeimfive/comments/1t8v772/eli5_why_doesnt_stomach_acid_leak_out_of_your/,1119
1ttu83k,Eli5 What is fire??,,https://www.reddit.com/r/explainlikeimfive/comments/1ttu83k/eli5_what_is_fire/,1480
1txnyv6,ELI5 If black absorbs the most light why aren’t any plant leaves black?,,https://www.reddit.com/r/explainlikeimfive/comments/1txnyv6/eli5_if_black_absorbs_the_most_light_why_arent/,1133
1tx1fnw,"ELI5: I've heard that inside black holes, space and time ""switch roles"". What does this actually mean?",,https://www.reddit.com/r/explainlikeimfive/comments/1tx1fnw/eli5_ive_heard_that_inside_black_holes_space_and/,1141
1tovv3h,ELI5: why did iron lung patients have to have their arms in the machine too?,,https://www.reddit.com/r/explainlikeimfive/comments/1tovv3h/eli5_why_did_iron_lung_patients_have_to_have/,739
1t9f70j,"ELI5: why human/animal faces have eyes, nose, mouth in one place and in same, strict order?",,https://www.reddit.com/r/explainlikeimfive/comments/1t9f70j/eli5_why_humananimal_faces_have_eyes_nose_mouth/,1252
1tkrx61,ELI5: Why don't we put solar panels in our parking lots?,,https://www.reddit.com/r/explainlikeimfive/comments/1tkrx61/eli5_why_dont_we_put_solar_panels_in_our_parking/,1094
1td79wh,ELI5: How can a thread (nuts and bolts) be so strong and can hold heavy objects?,,https://www.reddit.com/r/explainlikeimfive/comments/1td79wh/eli5_how_can_a_thread_nuts_and_bolts_be_so_strong/,1200
1tv82r5,"ELI5: Why does adding a tiny amount of carbon to iron make it dramatically stronger, but adding just a little more makes it completely brittle and useless",,https://www.reddit.com/r/explainlikeimfive/comments/1tv82r5/eli5_why_does_adding_a_tiny_amount_of_carbon_to/,974
1taljww,Eli5: How were old maps often surprisingly accurate even though people had no aerial view or satellite imagery at the time?,,https://www.reddit.com/r/explainlikeimfive/comments/1taljww/eli5_how_were_old_maps_often_surprisingly/,1224
1teigew,"ELI5 - If screws hold so much better than nails, why do we still use nails in building?",,https://www.reddit.com/r/explainlikeimfive/comments/1teigew/eli5_if_screws_hold_so_much_better_than_nails_why/,698
1tlnxsr,ELI5: How does Google maps know there is traffic?,,https://www.reddit.com/r/explainlikeimfive/comments/1tlnxsr/eli5_how_does_google_maps_know_there_is_traffic/,470
1tfz84r,"ELI5: Why are you ""on"" a bus, but ""in"" a car?",,https://www.reddit.com/r/explainlikeimfive/comments/1tfz84r/eli5_why_are_you_on_a_bus_but_in_a_car/,810
1tuedai,ELI5 Why is legal jargon so difficult to understand for any regular person reading it?,,https://www.reddit.com/r/explainlikeimfive/comments/1tuedai/eli5_why_is_legal_jargon_so_difficult_to/,629
1tbgmta,"ELI5: why is a hollow metal tube nearly as strong against bending as a completely solid rod of the same material, even though theres way less metal in it",,https://www.reddit.com/r/explainlikeimfive/comments/1tbgmta/eli5_why_is_a_hollow_metal_tube_nearly_as_strong/,697
