id,title,selftext,permalink,score
1s1glh4,ELI5: how is Hiroshima still habitable despite it being nuked?,,https://www.reddit.com/r/explainlikeimfive/comments/1s1glh4/eli5_how_is_hiroshima_still_habitable_despite_it/,76897
1rmg9lj,ELI5: Fentanyl and related drugs can sometimes cause the user to fold over while standing…why don’t they just sit down? Am I missing something?,,https://www.reddit.com/r/explainlikeimfive/comments/1rmg9lj/eli5_fentanyl_and_related_drugs_can_sometimes/,67429
1rrh0wf,ELI5: How do our organs sit inside our body if not soaked in blood?,,https://www.reddit.com/r/explainlikeimfive/comments/1rrh0wf/eli5_how_do_our_organs_sit_inside_our_body_if_not/,60052
1rk1mwn,"ELI5: What exactly is ""time blindness"" and how is it an actual thing?",,https://www.reddit.com/r/explainlikeimfive/comments/1rk1mwn/eli5_what_exactly_is_time_blindness_and_how_is_it/,52663
1rzv19u,ELI5: Why are airplane bathroom trash receptacles designed to involve so much skin contact?,,https://www.reddit.com/r/explainlikeimfive/comments/1rzv19u/eli5_why_are_airplane_bathroom_trash_receptacles/,46557
1s6gg6q,"ELI5: In the US, how was it so easy to add interstate highways, and now so difficult to add high speed rail lines?",,https://www.reddit.com/r/explainlikeimfive/comments/1s6gg6q/eli5_in_the_us_how_was_it_so_easy_to_add/,40919
1s5ndf5,ELI5 Why don’t our internal organs itch like the external parts of our body?,,https://www.reddit.com/r/explainlikeimfive/comments/1s5ndf5/eli5_why_dont_our_internal_organs_itch_like_the/,36318
1s70s9j,ELI5: Why are blackberries so expensive when they grow so easily,,https://www.reddit.com/r/explainlikeimfive/comments/1s70s9j/eli5_why_are_blackberries_so_expensive_when_they/,31481
1ri0ipd,ELI5: Why do we call it human trafficing instead of slavery?,,https://www.reddit.com/r/explainlikeimfive/comments/1ri0ipd/eli5_why_do_we_call_it_human_trafficing_instead/,28316
1robh6w,ELI5: Why are She/her pronouns used when talking about Ships?,,https://www.reddit.com/r/explainlikeimfive/comments/1robh6w/eli5_why_are_sheher_pronouns_used_when_talking/,25102
1s1afep,"ELI5: Why do we still have to ""eject"" USB sticks?",,https://www.reddit.com/r/explainlikeimfive/comments/1s1afep/eli5_why_do_we_still_have_to_eject_usb_sticks/,21956
1roqbvc,ELI5: Why does Japanese need three writing systems?,,https://www.reddit.com/r/explainlikeimfive/comments/1roqbvc/eli5_why_does_japanese_need_three_writing_systems/,19165
1ruzqmn,ELI5: If bacteria die from (for example boiled water) where do their corpses go?,,https://www.reddit.com/r/explainlikeimfive/comments/1ruzqmn/eli5_if_bacteria_die_from_for_example_boiled/,16827
1rur48t,ELI5 How are modern naval mines a threat to modern ships when a SONAR that finds small fish is less than $300?,,https://www.reddit.com/r/explainlikeimfive/comments/1rur48t/eli5_how_are_modern_naval_mines_a_threat_to/,14982
1rjmtvg,ELI5 Why does going super fast cause time dilation?,,https://www.reddit.com/r/explainlikeimfive/comments/1rjmtvg/eli5_why_does_going_super_fast_cause_time_dilation/,13573
1rrrwir,ELI5: Why does splitting an atom release so much energy when they are so small?,,https://www.reddit.com/r/explainlikeimfive/comments/1rrrwir/eli5_why_does_splitting_an_atom_release_so_much/,11832
1rwv7ti,ELI5: Why is it generally impossible to get rid of diabetes?,,https://www.reddit.com/r/explainlikeimfive/comments/1rwv7ti/eli5_why_is_it_generally_impossible_to_get_rid_of/,10295
1rxloyv,ELI5: Why does a country as small as England have so many regional accents?,,https://www.reddit.com/r/explainlikeimfive/comments/1rxloyv/eli5_why_does_a_country_as_small_as_england_have/,9663
1s39azo,ElI5: Why do phones not need cooling fans like computers do?,,https://www.reddit.com/r/explainlikeimfive/comments/1s39azo/eli5_why_do_phones_not_need_cooling_fans_like/,7902
1rqqi1t,ELI5: Why do clocks go clockwise; who decided that and why did everyone agree?,,https://www.reddit.com/r/explainlikeimfive/comments/1rqqi1t/eli5_why_do_clocks_go_clockwise_who_decided_that/,7442
1rn5yq0,ELI5: why are there so many image file types and whats the point of them,,https://www.reddit.com/r/explainlikeimfive/comments/1rn5yq0/eli5_why_are_there_so_many_image_file_types_and/,6110
1s5pmr0,"ELI5: if a car engine's main waste is heat, why don't engineers harbor that heat, boil water, and generate electricity for hybrid batteries like a mini powerplant?",,https://www.reddit.com/r/explainlikeimfive/comments/1s5pmr0/eli5_if_a_car_engines_main_waste_is_heat_why_dont/,5357
1ryggw9,ELI5 How do police stations find people for a line up?,,https://www.reddit.com/r/explainlikeimfive/comments/1ryggw9/eli5_how_do_police_stations_find_people_for_a/,4749
1s0arhb,"ELI5: If temperature is the average speed of molecules, why does wind feel cold?",,https://www.reddit.com/r/explainlikeimfive/comments/1s0arhb/eli5_if_temperature_is_the_average_speed_of/,4450
1rskdh6,"ELI5: Why does the RPM drop after starting a car, and do you actually need to wait?",,https://www.reddit.com/r/explainlikeimfive/comments/1rskdh6/eli5_why_does_the_rpm_drop_after_starting_a_car/,4541
1s6d7rf,ELI5: If speed is measured by the relation between objects how come going over the speed of light is impossible?,,https://www.reddit.com/r/explainlikeimfive/comments/1s6d7rf/eli5_if_speed_is_measured_by_the_relation_between/,3787
1riojl9,ELI5: Why do rugged laptops used by engineers/construction workers have lower specifications than consumer-grade laptop like office brands?,,https://www.reddit.com/r/explainlikeimfive/comments/1riojl9/eli5_why_do_rugged_laptops_used_by/,3191
1s7nneg,ELI5: Why does Pixar animation look so smooth at 24 fps but a video game feel choppy at 30 fps?,,https://www.reddit.com/r/explainlikeimfive/comments/1s7nneg/eli5_why_does_pixar_animation_look_so_smooth_at/,3378
1rlom4v,"ELI5, Why do browsers use gigabytes of ram?",,https://www.reddit.com/r/explainlikeimfive/comments/1rlom4v/eli5_why_do_browsers_use_gigabytes_of_ram/,2278
1rwaeua,ELI5 - Why do orgasms feel pleasurable? What is happening when we orgasm that makes it feel perceivably good?,,https://www.reddit.com/r/explainlikeimfive/comments/1rwaeua/eli5_why_do_orgasms_feel_pleasurable_what_is/,2743
1rsc377,ELI5: Why is it a bad idea to keep devices constantly plugged in even after they're fully charged?,,https://www.reddit.com/r/explainlikeimfive/comments/1rsc377/eli5_why_is_it_a_bad_idea_to_keep_devices/,2475
1s810hx,ELI5: How do junkyards prosper?,,https://www.reddit.com/r/explainlikeimfive/comments/1s810hx/eli5_how_do_junkyards_prosper/,2303
1rtsqpu,ELI5: How does a muscle physically signal the body to get bigger after lifting something heavy?,,https://www.reddit.com/r/explainlikeimfive/comments/1rtsqpu/eli5_how_does_a_muscle_physically_signal_the_body/,1525
1rixbaf,ELI5: How can (some) encryption software be open source and also be secure?,,https://www.reddit.com/r/explainlikeimfive/comments/1rixbaf/eli5_how_can_some_encryption_software_be_open/,1599
1s4zep7,ELI5: What decides a precious metal? And why is platinum considered one?,,https://www.reddit.com/r/explainlikeimfive/comments/1s4zep7/eli5_what_decides_a_precious_metal_and_why_is/,1687
1rockkr,ELI5: Why did productivity and pay split in 1979?,,https://www.reddit.com/r/explainlikeimfive/comments/1rockkr/eli5_why_did_productivity_and_pay_split_in_1979/,1572
1s2hg7e,ELI5: Why does the F-117 and the F-111 have an “F” designation?,,https://www.reddit.com/r/explainlikeimfive/comments/1s2hg7e/eli5_why_does_the_f117_and_the_f111_have_an_f/,1062
1rtc6nj,ELI5: what does Google get out of Google Wallet?,,https://www.reddit.com/r/explainlikeimfive/comments/1rtc6nj/eli5_what_does_google_get_out_of_google_wallet/,1292
1s39v1i,"ELI5: Why can’t you rename a file when it’s open in Windows, but you can in macOS?",,https://www.reddit.com/r/explainlikeimfive/comments/1s39v1i/eli5_why_cant_you_rename_a_file_when_its_open_in/,1289
1s0sugl,"ELI5 : Why, among the 4 nordic countries, only Finland uses the euro currency while the others use the krone?",,https://www.reddit.com/r/explainlikeimfive/comments/1s0sugl/eli5_why_among_the_4_nordic_countries_only/,1322
1s18wuq,"ELI5 If symptoms of a cold are the body fighting it off, why is taking medicine to relieve symptoms not a bad thing?",,https://www.reddit.com/r/explainlikeimfive/comments/1s18wuq/eli5_if_symptoms_of_a_cold_are_the_body_fighting/,798
1rwxd7f,ELI5: How on Earth is my computer so fast?,,https://www.reddit.com/r/explainlikeimfive/comments/1rwxd7f/eli5_how_on_earth_is_my_computer_so_fast/,975
1rq0eqx,ELI5: Why does your body know to stop growing at a certain height?,,https://www.reddit.com/r/explainlikeimfive/comments/1rq0eqx/eli5_why_does_your_body_know_to_stop_growing_at_a/,629
1rpifyt,"ELI5: When oil drillers create a well, the basins extend far beyond their whatever land claim they have. Doesn't that mean they're stealing from other land claims?",,https://www.reddit.com/r/explainlikeimfive/comments/1rpifyt/eli5_when_oil_drillers_create_a_well_the_basins/,583
1ryrwuu,"ELI5: if viruses aren’t technically alive, how can they evolve like living organisms?",,https://www.reddit.com/r/explainlikeimfive/comments/1ryrwuu/eli5_if_viruses_arent_technically_alive_how_can/,609
1rtt5i8,ELI5: How can a QR code scanner tell the difference between a QR code and a screenshot of that QR code?,,https://www.reddit.com/r/explainlikeimfive/comments/1rtt5i8/eli5_how_can_a_qr_code_scanner_tell_the/,797
1rjk2a4,ELI5 if heart and lungs are technically a muscle. Why dont they grow stronger and larger as we grow?,,https://www.reddit.com/r/explainlikeimfive/comments/1rjk2a4/eli5_if_heart_and_lungs_are_technically_a_muscle/,319
1s5lcam,ELI5: Why do poisonous fruits exist?,,https://www.reddit.com/r/explainlikeimfive/comments/1s5lcam/eli5_why_do_poisonous_fruits_exist/,1125
1s4qgdo,ELI5: What’s actually happening when you feel your “stomach drop”?,,https://www.reddit.com/r/explainlikeimfive/comments/1s4qgdo/eli5_whats_actually_happening_when_you_feel_your/,612
1s3o3m8,"ELI5: Why does water have no smell at all, even though every other liquid around us seems to have one?",,https://www.reddit.com/r/explainlikeimfive/comments/1s3o3m8/eli5_why_does_water_have_no_smell_at_all_even/,1002
