id,title,selftext,permalink,score
1sbl3x6,ELI5 why do penises shrink and hide when it's cold but nipples pop out?,,https://www.reddit.com/r/explainlikeimfive/comments/1sbl3x6/eli5_why_do_penises_shrink_and_hide_when_its_cold/,87936
1sckfei,"ELI5: How do we actually ""find"" a broken cable at the bottom of the ocean? If a shark bites an internet cable halfway between New York and London, how do engineers know exactly which mile of the 3,000-mile cable to pull up?",,https://www.reddit.com/r/explainlikeimfive/comments/1sckfei/eli5_how_do_we_actually_find_a_broken_cable_at/,77564
1st5q3y,"ELI5: Why is it that when you stay up long enough while exhausted, you eventually stop feeling tired?",,https://www.reddit.com/r/explainlikeimfive/comments/1st5q3y/eli5_why_is_it_that_when_you_stay_up_long_enough/,68077
1si78tu,ELI5: Why can’t we just scoop up the capsule?,,https://www.reddit.com/r/explainlikeimfive/comments/1si78tu/eli5_why_cant_we_just_scoop_up_the_capsule/,59918
1t1cwpy,ELI5: Why is crack so much cheaper than cocaine when cocaine is just cooked crack?,,https://www.reddit.com/r/explainlikeimfive/comments/1t1cwpy/eli5_why_is_crack_so_much_cheaper_than_cocaine/,53163
1shd07u,"ELI5: Why does ""sleeping away"" some problems seems to work most of the time ?",,https://www.reddit.com/r/explainlikeimfive/comments/1shd07u/eli5_why_does_sleeping_away_some_problems_seems/,46587
1sjppu7,ELI5:Why do we have 2 nostrils instead of one big,,https://www.reddit.com/r/explainlikeimfive/comments/1sjppu7/eli5why_do_we_have_2_nostrils_instead_of_one_big/,41448
1swbeyn,"ELI5: Why are male and female orgasms different in intensity, duration, and sensation?",,https://www.reddit.com/r/explainlikeimfive/comments/1swbeyn/eli5_why_are_male_and_female_orgasms_different_in/,35987
1swb6vi,"ELI5: Why is it when you drink alcohol and then pee once, you have to pee again in a short time?",,https://www.reddit.com/r/explainlikeimfive/comments/1swb6vi/eli5_why_is_it_when_you_drink_alcohol_and_then/,31815
1swl7tv,ELI5: Why is meth bad for you but prescribed amphetamines aren't?,,https://www.reddit.com/r/explainlikeimfive/comments/1swl7tv/eli5_why_is_meth_bad_for_you_but_prescribed/,28446
1smxycy,"ELI5: why is the muscle for chewing not really growing, even tho we chew every day?",,https://www.reddit.com/r/explainlikeimfive/comments/1smxycy/eli5_why_is_the_muscle_for_chewing_not_really/,25129
1t083jl,ELI5 why do figs need a wasp to die in there? Does every fig have a dead wasp?,,https://www.reddit.com/r/explainlikeimfive/comments/1t083jl/eli5_why_do_figs_need_a_wasp_to_die_in_there_does/,22080
1slkuyk,"ELI5: why your body hurts a day after a workout, not right after it?",,https://www.reddit.com/r/explainlikeimfive/comments/1slkuyk/eli5_why_your_body_hurts_a_day_after_a_workout/,19421
1stsnt8,ELI5 How Major Burns Can Kill,,https://www.reddit.com/r/explainlikeimfive/comments/1stsnt8/eli5_how_major_burns_can_kill/,16985
1sg3cy7,ELI5: Why there is no Nuclear Cargo ships?If a country invest enough it could become a great boon for economy and for the eletric problem itself,,https://www.reddit.com/r/explainlikeimfive/comments/1sg3cy7/eli5_why_there_is_no_nuclear_cargo_shipsif_a/,15482
1skb0a6,ELI5: How did Gold begin to become valuable in ancient times?,,https://www.reddit.com/r/explainlikeimfive/comments/1skb0a6/eli5_how_did_gold_begin_to_become_valuable_in/,13036
1sru67w,"ELI5 How come new Chinese electric cars can charge in 5–10 minutes, while smartphones still need at least half an hour?",,https://www.reddit.com/r/explainlikeimfive/comments/1sru67w/eli5_how_come_new_chinese_electric_cars_can/,11763
1seft9h,Eli5: why do dogs kick their leg when the “sweet spot” is scratched?,,https://www.reddit.com/r/explainlikeimfive/comments/1seft9h/eli5_why_do_dogs_kick_their_leg_when_the_sweet/,10461
1t0rp6g,"ELI5: Why do we get burnt when we touch 90°C solid objects, but not when we sit in a 90°C sauna?",,https://www.reddit.com/r/explainlikeimfive/comments/1t0rp6g/eli5_why_do_we_get_burnt_when_we_touch_90c_solid/,9685
1sr650r,Eli5 how or why are humans so good at knowing how much energy and what angle is needed to throw a thing a distance?,,https://www.reddit.com/r/explainlikeimfive/comments/1sr650r/eli5_how_or_why_are_humans_so_good_at_knowing_how/,8231
1sinf4z,ELI5-Why do humans avoid dead arm posture,,https://www.reddit.com/r/explainlikeimfive/comments/1sinf4z/eli5why_do_humans_avoid_dead_arm_posture/,7735
1sfebm3,ELI5: Why is it so hard for a country to develop nuclear weapons?,,https://www.reddit.com/r/explainlikeimfive/comments/1sfebm3/eli5_why_is_it_so_hard_for_a_country_to_develop/,6832
1spt7lv,ELI5: How did Switzerland remain neutral in WW2 when it was surrounded by Axis Powers?,,https://www.reddit.com/r/explainlikeimfive/comments/1spt7lv/eli5_how_did_switzerland_remain_neutral_in_ww2/,5500
1som2a6,Eli5: How does GPS know your exact location without getting confused by millions of users?,,https://www.reddit.com/r/explainlikeimfive/comments/1som2a6/eli5_how_does_gps_know_your_exact_location/,5173
1scj5a4,ELI5: Why does the Gulf / Middle East have so much more oil that other parts of the world?,,https://www.reddit.com/r/explainlikeimfive/comments/1scj5a4/eli5_why_does_the_gulf_middle_east_have_so_much/,4869
1sc3d1i,ELI5: How do whales and dolphins breathe in storms?,,https://www.reddit.com/r/explainlikeimfive/comments/1sc3d1i/eli5_how_do_whales_and_dolphins_breathe_in_storms/,4459
1smqwq4,ELI5 how would NASA prevent their moon base getting hit by a meteor?,,https://www.reddit.com/r/explainlikeimfive/comments/1smqwq4/eli5_how_would_nasa_prevent_their_moon_base/,3764
1sxia0i,ELI5: Why is half-life used instead of whole-life?,,https://www.reddit.com/r/explainlikeimfive/comments/1sxia0i/eli5_why_is_halflife_used_instead_of_wholelife/,2923
1slbdfs,"ELI5: If the USA exports soy beans to China, and edamame is soybeans, why is most edamame in American stores sourced from China and not the USA?",,https://www.reddit.com/r/explainlikeimfive/comments/1slbdfs/eli5_if_the_usa_exports_soy_beans_to_china_and/,3011
1sm9i7q,"ELI5: Why do people call Zone 3 training (specifically for jogging) ""the useless zone"" when it comes to building endurance? Do the few bpms separating it from Zone 2 really make such a big difference?",,https://www.reddit.com/r/explainlikeimfive/comments/1sm9i7q/eli5_why_do_people_call_zone_3_training/,2474
1sitd0d,ELI5 How are chicken nuggets made? How many chicken nuggets does 1 chicken make?,,https://www.reddit.com/r/explainlikeimfive/comments/1sitd0d/eli5_how_are_chicken_nuggets_made_how_many/,2426
1se1yzc,ElI5: Why are the biggest animals in the ocean mammals instead of fish?,,https://www.reddit.com/r/explainlikeimfive/comments/1se1yzc/eli5_why_are_the_biggest_animals_in_the_ocean/,2385
1szk1v1,ELI5: What makes the crisper compartment of a fridge... crisper than the rest?,,https://www.reddit.com/r/explainlikeimfive/comments/1szk1v1/eli5_what_makes_the_crisper_compartment_of_a/,2397
1sq7pf2,"ELI5: Why does 'old person smell' or 'baby smell' exist? Is it a chemical, or just our imagination?",,https://www.reddit.com/r/explainlikeimfive/comments/1sq7pf2/eli5_why_does_old_person_smell_or_baby_smell/,2104
1sfex0x,ELI5: What is the actual science behind 'one punch deaths' that cause the death?,,https://www.reddit.com/r/explainlikeimfive/comments/1sfex0x/eli5_what_is_the_actual_science_behind_one_punch/,1860
1smrm3c,"ELI5: When a fish is pulled out of water, is it actually feeling 'pain' or just reacting to the lack of oxygen?",,https://www.reddit.com/r/explainlikeimfive/comments/1smrm3c/eli5_when_a_fish_is_pulled_out_of_water_is_it/,1824
1srhlan,"ELI5 Is morning erection solely attributable to elevated testosterone levels, or are there additional physiological mechanisms at play?",,https://www.reddit.com/r/explainlikeimfive/comments/1srhlan/eli5_is_morning_erection_solely_attributable_to/,1407
1syg9fv,"ELI5 if a human is 70% water, where is the water?",,https://www.reddit.com/r/explainlikeimfive/comments/1syg9fv/eli5_if_a_human_is_70_water_where_is_the_water/,1288
1sz70go,"ELI5: What does ""In the key of"" mean?",,https://www.reddit.com/r/explainlikeimfive/comments/1sz70go/eli5_what_does_in_the_key_of_mean/,797
1srppkr,"ELI5 Do we actually need to clean our ears, or are we overdoing it?",,https://www.reddit.com/r/explainlikeimfive/comments/1srppkr/eli5_do_we_actually_need_to_clean_our_ears_or_are/,1543
1smjt5a,ELI5: The rise and fall of NFT’s,,https://www.reddit.com/r/explainlikeimfive/comments/1smjt5a/eli5_the_rise_and_fall_of_nfts/,1034
1sz074w,ELI5: Why does light have no mass?,,https://www.reddit.com/r/explainlikeimfive/comments/1sz074w/eli5_why_does_light_have_no_mass/,1355
1sw0t9c,"ELI5 What is the underlying reason for ""post-nut clarity,"" and does this phenomenon genuinely exist?",,https://www.reddit.com/r/explainlikeimfive/comments/1sw0t9c/eli5_what_is_the_underlying_reason_for_postnut/,900
1se8afu,ELI5 What is activated charcoal and what does it do?,,https://www.reddit.com/r/explainlikeimfive/comments/1se8afu/eli5_what_is_activated_charcoal_and_what_does_it/,1355
1so0wlj,ELI5: How are tiny memory cards with massive storage made? And why are they not insanely expensive?,,https://www.reddit.com/r/explainlikeimfive/comments/1so0wlj/eli5_how_are_tiny_memory_cards_with_massive/,764
1ssh2lu,ELI5:What makes Kevlar so strong?,,https://www.reddit.com/r/explainlikeimfive/comments/1ssh2lu/eli5what_makes_kevlar_so_strong/,399
1sykjoz,"ELI5, in the shipwrecks in The Great Lakes, why don’t bodies float up?",,https://www.reddit.com/r/explainlikeimfive/comments/1sykjoz/eli5_in_the_shipwrecks_in_the_great_lakes_why/,689
1sv3l24,ELI5: why does your immune system attack your eyes after discovering them?,,https://www.reddit.com/r/explainlikeimfive/comments/1sv3l24/eli5_why_does_your_immune_system_attack_your_eyes/,510
1sqieak,ELI5: Why can't we simulate the creation of oil/fossil fuels with animals that have died today?,,https://www.reddit.com/r/explainlikeimfive/comments/1sqieak/eli5_why_cant_we_simulate_the_creation_of/,568
1sqgeop,ELI5: why does breath smell bad when exhaling from my mouth but not from my nose?,,https://www.reddit.com/r/explainlikeimfive/comments/1sqgeop/eli5_why_does_breath_smell_bad_when_exhaling_from/,290
