id,title,selftext,permalink,score
1sbl3x6,ELI5 why do penises shrink and hide when it's cold but nipples pop out?,,https://www.reddit.com/r/explainlikeimfive/comments/1sbl3x6/eli5_why_do_penises_shrink_and_hide_when_its_cold/,96431
1sckfei,"ELI5: How do we actually ""find"" a broken cable at the bottom of the ocean? If a shark bites an internet cable halfway between New York and London, how do engineers know exactly which mile of the 3,000-mile cable to pull up?",,https://www.reddit.com/r/explainlikeimfive/comments/1sckfei/eli5_how_do_we_actually_find_a_broken_cable_at/,85048
1si78tu,ELI5: Why can’t we just scoop up the capsule?,,https://www.reddit.com/r/explainlikeimfive/comments/1si78tu/eli5_why_cant_we_just_scoop_up_the_capsule/,74830
1st5q3y,"ELI5: Why is it that when you stay up long enough while exhausted, you eventually stop feeling tired?",,https://www.reddit.com/r/explainlikeimfive/comments/1st5q3y/eli5_why_is_it_that_when_you_stay_up_long_enough/,65772
1s9yrnm,"ELI5 How come when somebody gets in a terrible accident, professionals tell them to ""keep there eyes open"" or ""stay awake""",,https://www.reddit.com/r/explainlikeimfive/comments/1s9yrnm/eli5_how_come_when_somebody_gets_in_a_terrible/,57788
1shd07u,"ELI5: Why does ""sleeping away"" some problems seems to work most of the time ?",,https://www.reddit.com/r/explainlikeimfive/comments/1shd07u/eli5_why_does_sleeping_away_some_problems_seems/,51003
1sjppu7,ELI5:Why do we have 2 nostrils instead of one big,,https://www.reddit.com/r/explainlikeimfive/comments/1sjppu7/eli5why_do_we_have_2_nostrils_instead_of_one_big/,45173
1smxycy,"ELI5: why is the muscle for chewing not really growing, even tho we chew every day?",,https://www.reddit.com/r/explainlikeimfive/comments/1smxycy/eli5_why_is_the_muscle_for_chewing_not_really/,39371
1s6gg6q,"ELI5: In the US, how was it so easy to add interstate highways, and now so difficult to add high speed rail lines?",,https://www.reddit.com/r/explainlikeimfive/comments/1s6gg6q/eli5_in_the_us_how_was_it_so_easy_to_add/,35208
1s5ndf5,ELI5 Why don’t our internal organs itch like the external parts of our body?,,https://www.reddit.com/r/explainlikeimfive/comments/1s5ndf5/eli5_why_dont_our_internal_organs_itch_like_the/,30604
1slkuyk,"ELI5: why your body hurts a day after a workout, not right after it?",,https://www.reddit.com/r/explainlikeimfive/comments/1slkuyk/eli5_why_your_body_hurts_a_day_after_a_workout/,26825
1s70s9j,ELI5: Why are blackberries so expensive when they grow so easily,,https://www.reddit.com/r/explainlikeimfive/comments/1s70s9j/eli5_why_are_blackberries_so_expensive_when_they/,23644
1sg3cy7,ELI5: Why there is no Nuclear Cargo ships?If a country invest enough it could become a great boon for economy and for the eletric problem itself,,https://www.reddit.com/r/explainlikeimfive/comments/1sg3cy7/eli5_why_there_is_no_nuclear_cargo_shipsif_a/,21453
1skb0a6,ELI5: How did Gold begin to become valuable in ancient times?,,https://www.reddit.com/r/explainlikeimfive/comments/1skb0a6/eli5_how_did_gold_begin_to_become_valuable_in/,19073
1seft9h,Eli5: why do dogs kick their leg when the “sweet spot” is scratched?,,https://www.reddit.com/r/explainlikeimfive/comments/1seft9h/eli5_why_do_dogs_kick_their_leg_when_the_sweet/,16931
1sru67w,"ELI5 How come new Chinese electric cars can charge in 5–10 minutes, while smartphones still need at least half an hour?",,https://www.reddit.com/r/explainlikeimfive/comments/1sru67w/eli5_how_come_new_chinese_electric_cars_can/,14622
1stsnt8,ELI5 How Major Burns Can Kill,,https://www.reddit.com/r/explainlikeimfive/comments/1stsnt8/eli5_how_major_burns_can_kill/,13224
1sr650r,Eli5 how or why are humans so good at knowing how much energy and what angle is needed to throw a thing a distance?,,https://www.reddit.com/r/explainlikeimfive/comments/1sr650r/eli5_how_or_why_are_humans_so_good_at_knowing_how/,11765
1sinf4z,ELI5-Why do humans avoid dead arm posture,,https://www.reddit.com/r/explainlikeimfive/comments/1sinf4z/eli5why_do_humans_avoid_dead_arm_posture/,10439
1sfebm3,ELI5: Why is it so hard for a country to develop nuclear weapons?,,https://www.reddit.com/r/explainlikeimfive/comments/1sfebm3/eli5_why_is_it_so_hard_for_a_country_to_develop/,8862
1spt7lv,ELI5: How did Switzerland remain neutral in WW2 when it was surrounded by Axis Powers?,,https://www.reddit.com/r/explainlikeimfive/comments/1spt7lv/eli5_how_did_switzerland_remain_neutral_in_ww2/,7756
1som2a6,Eli5: How does GPS know your exact location without getting confused by millions of users?,,https://www.reddit.com/r/explainlikeimfive/comments/1som2a6/eli5_how_does_gps_know_your_exact_location/,6858
1scj5a4,ELI5: Why does the Gulf / Middle East have so much more oil that other parts of the world?,,https://www.reddit.com/r/explainlikeimfive/comments/1scj5a4/eli5_why_does_the_gulf_middle_east_have_so_much/,6419
1s810hx,ELI5: How do junkyards prosper?,,https://www.reddit.com/r/explainlikeimfive/comments/1s810hx/eli5_how_do_junkyards_prosper/,5348
1sc3d1i,ELI5: How do whales and dolphins breathe in storms?,,https://www.reddit.com/r/explainlikeimfive/comments/1sc3d1i/eli5_how_do_whales_and_dolphins_breathe_in_storms/,4593
1smqwq4,ELI5 how would NASA prevent their moon base getting hit by a meteor?,,https://www.reddit.com/r/explainlikeimfive/comments/1smqwq4/eli5_how_would_nasa_prevent_their_moon_base/,4165
1s7nneg,ELI5: Why does Pixar animation look so smooth at 24 fps but a video game feel choppy at 30 fps?,,https://www.reddit.com/r/explainlikeimfive/comments/1s7nneg/eli5_why_does_pixar_animation_look_so_smooth_at/,3568
1s9e3h2,ELI5: Can Jupiter have a surface deep down near the core or is it just gas all the way down?,,https://www.reddit.com/r/explainlikeimfive/comments/1s9e3h2/eli5_can_jupiter_have_a_surface_deep_down_near/,3487
1slbdfs,"ELI5: If the USA exports soy beans to China, and edamame is soybeans, why is most edamame in American stores sourced from China and not the USA?",,https://www.reddit.com/r/explainlikeimfive/comments/1slbdfs/eli5_if_the_usa_exports_soy_beans_to_china_and/,3614
1sm9i7q,"ELI5: Why do people call Zone 3 training (specifically for jogging) ""the useless zone"" when it comes to building endurance? Do the few bpms separating it from Zone 2 really make such a big difference?",,https://www.reddit.com/r/explainlikeimfive/comments/1sm9i7q/eli5_why_do_people_call_zone_3_training/,3342
1s8gtxu,"ELI5 How do you build a bridge when the other side is ""inaccessible""?",,https://www.reddit.com/r/explainlikeimfive/comments/1s8gtxu/eli5_how_do_you_build_a_bridge_when_the_other/,2381
1s5pmr0,"ELI5: if a car engine's main waste is heat, why don't engineers harbor that heat, boil water, and generate electricity for hybrid batteries like a mini powerplant?",,https://www.reddit.com/r/explainlikeimfive/comments/1s5pmr0/eli5_if_a_car_engines_main_waste_is_heat_why_dont/,2782
1sitd0d,ELI5 How are chicken nuggets made? How many chicken nuggets does 1 chicken make?,,https://www.reddit.com/r/explainlikeimfive/comments/1sitd0d/eli5_how_are_chicken_nuggets_made_how_many/,2532
1se1yzc,ElI5: Why are the biggest animals in the ocean mammals instead of fish?,,https://www.reddit.com/r/explainlikeimfive/comments/1se1yzc/eli5_why_are_the_biggest_animals_in_the_ocean/,1988
1s8x7yh,"ELI5 Why do many people that have experienced an active warzone become hypersensitive to loud noises and other triggers, as opposed to continuous desensitization?",,https://www.reddit.com/r/explainlikeimfive/comments/1s8x7yh/eli5_why_do_many_people_that_have_experienced_an/,1623
1s6d7rf,ELI5: If speed is measured by the relation between objects how come going over the speed of light is impossible?,,https://www.reddit.com/r/explainlikeimfive/comments/1s6d7rf/eli5_if_speed_is_measured_by_the_relation_between/,1703
1sfex0x,ELI5: What is the actual science behind 'one punch deaths' that cause the death?,,https://www.reddit.com/r/explainlikeimfive/comments/1sfex0x/eli5_what_is_the_actual_science_behind_one_punch/,1826
1sq7pf2,"ELI5: Why does 'old person smell' or 'baby smell' exist? Is it a chemical, or just our imagination?",,https://www.reddit.com/r/explainlikeimfive/comments/1sq7pf2/eli5_why_does_old_person_smell_or_baby_smell/,1049
1smrm3c,"ELI5: When a fish is pulled out of water, is it actually feeling 'pain' or just reacting to the lack of oxygen?",,https://www.reddit.com/r/explainlikeimfive/comments/1smrm3c/eli5_when_a_fish_is_pulled_out_of_water_is_it/,1676
1srhlan,"ELI5 Is morning erection solely attributable to elevated testosterone levels, or are there additional physiological mechanisms at play?",,https://www.reddit.com/r/explainlikeimfive/comments/1srhlan/eli5_is_morning_erection_solely_attributable_to/,1013
1srppkr,"ELI5 Do we actually need to clean our ears, or are we overdoing it?",,https://www.reddit.com/r/explainlikeimfive/comments/1srppkr/eli5_do_we_actually_need_to_clean_our_ears_or_are/,951
1smjt5a,ELI5: The rise and fall of NFT’s,,https://www.reddit.com/r/explainlikeimfive/comments/1smjt5a/eli5_the_rise_and_fall_of_nfts/,1095
1s4zep7,ELI5: What decides a precious metal? And why is platinum considered one?,,https://www.reddit.com/r/explainlikeimfive/comments/1s4zep7/eli5_what_decides_a_precious_metal_and_why_is/,828
1se8afu,ELI5 What is activated charcoal and what does it do?,,https://www.reddit.com/r/explainlikeimfive/comments/1se8afu/eli5_what_is_activated_charcoal_and_what_does_it/,1122
1so0wlj,ELI5: How are tiny memory cards with massive storage made? And why are they not insanely expensive?,,https://www.reddit.com/r/explainlikeimfive/comments/1so0wlj/eli5_how_are_tiny_memory_cards_with_massive/,925
1sa6dne,ELI5: Why is gasoline pricing in the US always calculated to the thousandths place?,,https://www.reddit.com/r/explainlikeimfive/comments/1sa6dne/eli5_why_is_gasoline_pricing_in_the_us_always/,695
1ssh2lu,ELI5:What makes Kevlar so strong?,,https://www.reddit.com/r/explainlikeimfive/comments/1ssh2lu/eli5what_makes_kevlar_so_strong/,628
1s9wqpu,ELI5: Why can a bridge holding thousands of tons of cars be more at risk from a small group of soldiers marching in sync than from all that weight?,,https://www.reddit.com/r/explainlikeimfive/comments/1s9wqpu/eli5_why_can_a_bridge_holding_thousands_of_tons/,584
1s8sjr2,Eli5 What is the significance of having various screw head types when the basic action is just tightening or loosening?,,https://www.reddit.com/r/explainlikeimfive/comments/1s8sjr2/eli5_what_is_the_significance_of_having_various/,837
1sqgeop,ELI5: why does breath smell bad when exhaling from my mouth but not from my nose?,,https://www.reddit.com/r/explainlikeimfive/comments/1sqgeop/eli5_why_does_breath_smell_bad_when_exhaling_from/,1167
