id,title,selftext,permalink,score
1rs1sy0,Fill Empty Space in Your Freezer With Jugs of Water,,https://www.reddit.com/r/lifehacks/comments/1rs1sy0/fill_empty_space_in_your_freezer_with_jugs_of/,19318
1rtsjtq,No seatback display? No problem!,,https://www.reddit.com/r/lifehacks/comments/1rtsjtq/no_seatback_display_no_problem/,16957
1r9ja6u,if you hate doing something just make it stupid easy to start,,https://www.reddit.com/r/lifehacks/comments/1r9ja6u/if_you_hate_doing_something_just_make_it_stupid/,15653
1rl47eh,Every wife has an extra hairband,,https://www.reddit.com/r/lifehacks/comments/1rl47eh/every_wife_has_an_extra_hairband/,13424
1rdufmk,A simple way of storing loose screws at the bench,,https://www.reddit.com/r/lifehacks/comments/1rdufmk/a_simple_way_of_storing_loose_screws_at_the_bench/,12425
1r7shge,Tub caulking,,https://www.reddit.com/r/lifehacks/comments/1r7shge/tub_caulking/,10510
1rk1y2c,It ain’t dumb if it works…. Right?,,https://www.reddit.com/r/lifehacks/comments/1rk1y2c/it_aint_dumb_if_it_works_right/,9377
1rpbhn1,Emergency lamp !,,https://www.reddit.com/r/lifehacks/comments/1rpbhn1/emergency_lamp/,8827
1rrvpr1,put stuff you cant forget ON your shoes,,https://www.reddit.com/r/lifehacks/comments/1rrvpr1/put_stuff_you_cant_forget_on_your_shoes/,7093
1rfke8m,Throw out the XL laundry basket!,,https://www.reddit.com/r/lifehacks/comments/1rfke8m/throw_out_the_xl_laundry_basket/,6982
1r5ng1z,Keeping screws and bits close,,https://www.reddit.com/r/lifehacks/comments/1r5ng1z/keeping_screws_and_bits_close/,6279
1r73jit,Match your keys to your locks with nail polish,,https://www.reddit.com/r/lifehacks/comments/1r73jit/match_your_keys_to_your_locks_with_nail_polish/,5491
1rsq6l6,When crossing the street at night turn on the flashlight on your phone so drivers can easily see you.,,https://www.reddit.com/r/lifehacks/comments/1rsq6l6/when_crossing_the_street_at_night_turn_on_the/,4314
1rboeep,Hostel outlets are usually loose and it drives me crazy,,https://www.reddit.com/r/lifehacks/comments/1rboeep/hostel_outlets_are_usually_loose_and_it_drives_me/,4241
1r47uim,Flies on the front door porch area,,https://www.reddit.com/r/lifehacks/comments/1r47uim/flies_on_the_front_door_porch_area/,3570
1rh9lxa,Seeking a hack from fellow shedding dog owners!!,,https://www.reddit.com/r/lifehacks/comments/1rh9lxa/seeking_a_hack_from_fellow_shedding_dog_owners/,3535
1r9m6ek,Keep Your Clothes Smelling Fresh on the Go With Scented Soap,,https://www.reddit.com/r/lifehacks/comments/1r9m6ek/keep_your_clothes_smelling_fresh_on_the_go_with/,2629
1rcd7bg,"If you have a baby and can't afford cleaners, team up with another parent!",,https://www.reddit.com/r/lifehacks/comments/1rcd7bg/if_you_have_a_baby_and_cant_afford_cleaners_team/,2982
1r67qlk,How do you stop gym trainers smelling so bad?,,https://www.reddit.com/r/lifehacks/comments/1r67qlk/how_do_you_stop_gym_trainers_smelling_so_bad/,2342
1roymp1,how do you pack dishes so they never break during a long move?,,https://www.reddit.com/r/lifehacks/comments/1roymp1/how_do_you_pack_dishes_so_they_never_break_during/,2381
1r9gqn7,What to use on drywall to hang plants,,https://www.reddit.com/r/lifehacks/comments/1r9gqn7/what_to_use_on_drywall_to_hang_plants/,1687
1rozzet,Best mattress for couples with different preferences? How is this problem solved?,,https://www.reddit.com/r/lifehacks/comments/1rozzet/best_mattress_for_couples_with_different/,1940
1rerhl7,Removing lint balls from two layer body suit????,,https://www.reddit.com/r/lifehacks/comments/1rerhl7/removing_lint_balls_from_two_layer_body_suit/,2058
1rgsucq,Wash Your Dust Pan,,https://www.reddit.com/r/lifehacks/comments/1rgsucq/wash_your_dust_pan/,1659
1rprjq6,Why keep the car keys in the fridge?,,https://www.reddit.com/r/lifehacks/comments/1rprjq6/why_keep_the_car_keys_in_the_fridge/,1018
1rdunt5,Padlock Hack,,https://www.reddit.com/r/lifehacks/comments/1rdunt5/padlock_hack/,1482
