id,title,selftext,permalink,score
1tn6e2g,No pill-cutter? Try this,,https://www.reddit.com/r/lifehacks/comments/1tn6e2g/no_pillcutter_try_this/,17085
1twot8r,i saw this a while ago and saved it for when i needed it... today i can say that this lifehack saved my gym shorts!,,https://www.reddit.com/r/lifehacks/comments/1twot8r/i_saw_this_a_while_ago_and_saved_it_for_when_i/,14724
1toalpl,DIY Hack,,https://www.reddit.com/r/lifehacks/comments/1toalpl/diy_hack/,13102
1tp2gtf,You might be using your dishwasher wrong,,https://www.reddit.com/r/lifehacks/comments/1tp2gtf/you_might_be_using_your_dishwasher_wrong/,11711
1tzk7uq,"Airplane floors are extremely gross, so I always pack a trash bag to slip my backpack into.",,https://www.reddit.com/r/lifehacks/comments/1tzk7uq/airplane_floors_are_extremely_gross_so_i_always/,10480
1tt3daw,"Bring always an umbrella with, even into the Caribbean",,https://www.reddit.com/r/lifehacks/comments/1tt3daw/bring_always_an_umbrella_with_even_into_the/,8786
1tynumi,Fake wasp nest to avoid real wasps nesting around my balcony,,https://www.reddit.com/r/lifehacks/comments/1tynumi/fake_wasp_nest_to_avoid_real_wasps_nesting_around/,8141
1tyi971,Use a leaf blower to clean your car interior.,,https://www.reddit.com/r/lifehacks/comments/1tyi971/use_a_leaf_blower_to_clean_your_car_interior/,6843
1tvggy8,Using vinegar to get gum out of jeans,,https://www.reddit.com/r/lifehacks/comments/1tvggy8/using_vinegar_to_get_gum_out_of_jeans/,6600
1thavgx,A use for outlet prong holes,,https://www.reddit.com/r/lifehacks/comments/1thavgx/a_use_for_outlet_prong_holes/,5889
1td1it0,"Welp, I've gone and done it.",,https://www.reddit.com/r/lifehacks/comments/1td1it0/welp_ive_gone_and_done_it/,5024
1tw1h8z,How to remove this stain of off the window?,,https://www.reddit.com/r/lifehacks/comments/1tw1h8z/how_to_remove_this_stain_of_off_the_window/,4284
1tx0rj1,Dry Erase Marker Removes Permanent Marker and all other inks on material,,https://www.reddit.com/r/lifehacks/comments/1tx0rj1/dry_erase_marker_removes_permanent_marker_and_all/,3691
1tbu7pb,Best Squeaky Door Solution: Vaseline.,,https://www.reddit.com/r/lifehacks/comments/1tbu7pb/best_squeaky_door_solution_vaseline/,3272
1tq5uv7,How would I unscrew this stripped screw?,,https://www.reddit.com/r/lifehacks/comments/1tq5uv7/how_would_i_unscrew_this_stripped_screw/,3584
1t9f6fs,Spanner tricks,,https://www.reddit.com/r/lifehacks/comments/1t9f6fs/spanner_tricks/,3347
1tk5tfd,Forgotten Fish oil capsule in pocket burst,,https://www.reddit.com/r/lifehacks/comments/1tk5tfd/forgotten_fish_oil_capsule_in_pocket_burst/,2649
1txn170,Any NEW repellent tricks for keeping away mosquito?,,https://www.reddit.com/r/lifehacks/comments/1txn170/any_new_repellent_tricks_for_keeping_away_mosquito/,2019
1tf3zre,Removing Gorilla Glue,,https://www.reddit.com/r/lifehacks/comments/1tf3zre/removing_gorilla_glue/,2357
1thkk66,How can I cover this IKEA Skruvby to make at least the upper part not reachable by kids?,,https://www.reddit.com/r/lifehacks/comments/1thkk66/how_can_i_cover_this_ikea_skruvby_to_make_at/,2259
1u09xwy,Best way to keep wasps away from entry balconies/breezeways?,,https://www.reddit.com/r/lifehacks/comments/1u09xwy/best_way_to_keep_wasps_away_from_entry/,2185
1tgq3fu,Any solid lifehacks for keeping wired earphones from turning into a tangled mess?,,https://www.reddit.com/r/lifehacks/comments/1tgq3fu/any_solid_lifehacks_for_keeping_wired_earphones/,1709
1tk0zqy,Any way to make my portable AC reach the rest of my apartment?,,https://www.reddit.com/r/lifehacks/comments/1tk0zqy/any_way_to_make_my_portable_ac_reach_the_rest_of/,1781
1tw0663,Smelly basement and long term storage,,https://www.reddit.com/r/lifehacks/comments/1tw0663/smelly_basement_and_long_term_storage/,1166
