id,title,selftext,permalink,score
1sht1yn,"I was racking my brain, trying to remember if I'd taken my morning anti-biotic, when an idea occurred to me",,https://www.reddit.com/r/lifehacks/comments/1sht1yn/i_was_racking_my_brain_trying_to_remember_if_id/,33789
1s8cl9z,Toddlers should also be equipped with pitons and crampons.,,https://www.reddit.com/r/lifehacks/comments/1s8cl9z/toddlers_should_also_be_equipped_with_pitons_and/,29680
1si1t2j,It's getting warmer outside. That means ants!! Here's a concoction that I have used for years now.,,https://www.reddit.com/r/lifehacks/comments/1si1t2j/its_getting_warmer_outside_that_means_ants_heres/,26855
1sellcj,"Put some rice into a sock, tie a knot, microwave it for 2mins and you got yourself a heating pad!",,https://www.reddit.com/r/lifehacks/comments/1sellcj/put_some_rice_into_a_sock_tie_a_knot_microwave_it/,23361
1skbd5s,"When traveling alone, tie your backpack or purse to the chair to deter theft",,https://www.reddit.com/r/lifehacks/comments/1skbd5s/when_traveling_alone_tie_your_backpack_or_purse/,20784
1s4p0hs,What's your Lifehack for filling these dish soap dispensers?,,https://www.reddit.com/r/lifehacks/comments/1s4p0hs/whats_your_lifehack_for_filling_these_dish_soap/,18488
1si9cck,"If someone asks you ""do you have any questions?"" after teaching you something, and you don't have any direct questions, use that opportunity to ask them to check your understanding of the information they just gave you.",,https://www.reddit.com/r/lifehacks/comments/1si9cck/if_someone_asks_you_do_you_have_any_questions/,16471
1sb7u78,Productive ways to use commute time (90 mins/day),,https://www.reddit.com/r/lifehacks/comments/1sb7u78/productive_ways_to_use_commute_time_90_minsday/,14122
1snz860,Hack to keep your bottle upright in your bag,,https://www.reddit.com/r/lifehacks/comments/1snz860/hack_to_keep_your_bottle_upright_in_your_bag/,12622
1sn3f3z,Paracord loop daily carry,,https://www.reddit.com/r/lifehacks/comments/1sn3f3z/paracord_loop_daily_carry/,10935
1spgeqq,"Muffled, practically silenced my windchimes",,https://www.reddit.com/r/lifehacks/comments/1spgeqq/muffled_practically_silenced_my_windchimes/,9883
1s5wl9b,Cleaning the smell of smoke,,https://www.reddit.com/r/lifehacks/comments/1s5wl9b/cleaning_the_smell_of_smoke/,8336
1sfpte6,How do I eliminate the smell from my sneakers,,https://www.reddit.com/r/lifehacks/comments/1sfpte6/how_do_i_eliminate_the_smell_from_my_sneakers/,7622
1s99io9,"When leaving a voicemail for someone, if you mess up or want to hear it again, don't hang up - try hitting pound (hashtag for the youngins). In my experience most voicemails have an option to re-listen, delete, and re-record.",,https://www.reddit.com/r/lifehacks/comments/1s99io9/when_leaving_a_voicemail_for_someone_if_you_mess/,6624
1slvnyu,Use toothpaste and a spare toothbrush to remove hair dye from skin,,https://www.reddit.com/r/lifehacks/comments/1slvnyu/use_toothpaste_and_a_spare_toothbrush_to_remove/,5712
1s9aifw,Water spots on a faucet right after you just cleaned it?,,https://www.reddit.com/r/lifehacks/comments/1s9aifw/water_spots_on_a_faucet_right_after_you_just/,5807
1s3ey92,How do you open a wine bottle without a corkscrew?,,https://www.reddit.com/r/lifehacks/comments/1s3ey92/how_do_you_open_a_wine_bottle_without_a_corkscrew/,4496
1sr1fl5,A credit/debit card is excellent for spreading mud/filler over small holes when you've lost that darn tool!,,https://www.reddit.com/r/lifehacks/comments/1sr1fl5/a_creditdebit_card_is_excellent_for_spreading/,4741
1shddwh,How do I eliminate the kimchi smell in my home? Not just my fridge…,,https://www.reddit.com/r/lifehacks/comments/1shddwh/how_do_i_eliminate_the_kimchi_smell_in_my_home/,3545
1sb0sd5,"No Nailpoship Remover, Alternatives:",,https://www.reddit.com/r/lifehacks/comments/1sb0sd5/no_nailpoship_remover_alternatives/,3068
1sed159,Highlighter bleeds too much,,https://www.reddit.com/r/lifehacks/comments/1sed159/highlighter_bleeds_too_much/,3079
1sp9441,Remove buzzcut hair clippings without showering (hack),,https://www.reddit.com/r/lifehacks/comments/1sp9441/remove_buzzcut_hair_clippings_without_showering/,2687
