id,title,selftext,permalink,score
1sht1yn,"I was racking my brain, trying to remember if I'd taken my morning anti-biotic, when an idea occurred to me",,https://www.reddit.com/r/lifehacks/comments/1sht1yn/i_was_racking_my_brain_trying_to_remember_if_id/,25391
1si1t2j,It's getting warmer outside. That means ants!! Here's a concoction that I have used for years now.,,https://www.reddit.com/r/lifehacks/comments/1si1t2j/its_getting_warmer_outside_that_means_ants_heres/,21958
1sellcj,"Put some rice into a sock, tie a knot, microwave it for 2mins and you got yourself a heating pad!",,https://www.reddit.com/r/lifehacks/comments/1sellcj/put_some_rice_into_a_sock_tie_a_knot_microwave_it/,19499
1skbd5s,"When traveling alone, tie your backpack or purse to the chair to deter theft",,https://www.reddit.com/r/lifehacks/comments/1skbd5s/when_traveling_alone_tie_your_backpack_or_purse/,17212
1sxvyr7,"Broke the cap to the oil, this works right?",,https://www.reddit.com/r/lifehacks/comments/1sxvyr7/broke_the_cap_to_the_oil_this_works_right/,15117
1si9cck,"If someone asks you ""do you have any questions?"" after teaching you something, and you don't have any direct questions, use that opportunity to ask them to check your understanding of the information they just gave you.",,https://www.reddit.com/r/lifehacks/comments/1si9cck/if_someone_asks_you_do_you_have_any_questions/,13227
1snz860,Hack to keep your bottle upright in your bag,,https://www.reddit.com/r/lifehacks/comments/1snz860/hack_to_keep_your_bottle_upright_in_your_bag/,12036
1spgeqq,"Muffled, practically silenced my windchimes",,https://www.reddit.com/r/lifehacks/comments/1spgeqq/muffled_practically_silenced_my_windchimes/,10917
1sn3f3z,Paracord loop daily carry,,https://www.reddit.com/r/lifehacks/comments/1sn3f3z/paracord_loop_daily_carry/,9567
1sfpte6,How do I eliminate the smell from my sneakers,,https://www.reddit.com/r/lifehacks/comments/1sfpte6/how_do_i_eliminate_the_smell_from_my_sneakers/,8288
1swhwgm,iPhone not charging?,,https://www.reddit.com/r/lifehacks/comments/1swhwgm/iphone_not_charging/,7546
1svrrmt,How to keep (polycarbonate) spectacles from getting scratched?,,https://www.reddit.com/r/lifehacks/comments/1svrrmt/how_to_keep_polycarbonate_spectacles_from_getting/,6479
1slvnyu,Use toothpaste and a spare toothbrush to remove hair dye from skin,,https://www.reddit.com/r/lifehacks/comments/1slvnyu/use_toothpaste_and_a_spare_toothbrush_to_remove/,5718
1sr1fl5,A credit/debit card is excellent for spreading mud/filler over small holes when you've lost that darn tool!,,https://www.reddit.com/r/lifehacks/comments/1sr1fl5/a_creditdebit_card_is_excellent_for_spreading/,5483
1shddwh,How do I eliminate the kimchi smell in my home? Not just my fridge…,,https://www.reddit.com/r/lifehacks/comments/1shddwh/how_do_i_eliminate_the_kimchi_smell_in_my_home/,4242
1sueuw2,Lifehack request- teeny tiny parking space,,https://www.reddit.com/r/lifehacks/comments/1sueuw2/lifehack_request_teeny_tiny_parking_space/,3840
1t55aw9,(Life hack needed) Any good lifehacks for preventing laptop charger cables from fraying at the ends?,,https://www.reddit.com/r/lifehacks/comments/1t55aw9/life_hack_needed_any_good_lifehacks_for/,3646
1sp9441,Remove buzzcut hair clippings without showering (hack),,https://www.reddit.com/r/lifehacks/comments/1sp9441/remove_buzzcut_hair_clippings_without_showering/,3368
1sed159,Highlighter bleeds too much,,https://www.reddit.com/r/lifehacks/comments/1sed159/highlighter_bleeds_too_much/,2828
1svc6tn,How to evade questions you don't want to answer,,https://www.reddit.com/r/lifehacks/comments/1svc6tn/how_to_evade_questions_you_dont_want_to_answer/,3011
