id,title,selftext,permalink,score
1rs1sy0,Fill Empty Space in Your Freezer With Jugs of Water,,https://www.reddit.com/r/lifehacks/comments/1rs1sy0/fill_empty_space_in_your_freezer_with_jugs_of/,15904
1rtsjtq,No seatback display? No problem!,,https://www.reddit.com/r/lifehacks/comments/1rtsjtq/no_seatback_display_no_problem/,13666
1rl47eh,Every wife has an extra hairband,,https://www.reddit.com/r/lifehacks/comments/1rl47eh/every_wife_has_an_extra_hairband/,12338
1rdufmk,A simple way of storing loose screws at the bench,,https://www.reddit.com/r/lifehacks/comments/1rdufmk/a_simple_way_of_storing_loose_screws_at_the_bench/,11020
1rk1y2c,It ain’t dumb if it works…. Right?,,https://www.reddit.com/r/lifehacks/comments/1rk1y2c/it_aint_dumb_if_it_works_right/,9529
1rrvpr1,put stuff you cant forget ON your shoes,,https://www.reddit.com/r/lifehacks/comments/1rrvpr1/put_stuff_you_cant_forget_on_your_shoes/,8253
1rpbhn1,Emergency lamp !,,https://www.reddit.com/r/lifehacks/comments/1rpbhn1/emergency_lamp/,7682
1ryfdcb,Clogged Toilet---1/2 cup of Laundry Detergent---wait for it. Might just work,,https://www.reddit.com/r/lifehacks/comments/1ryfdcb/clogged_toilet12_cup_of_laundry_detergentwait_for/,7014
1rfke8m,Throw out the XL laundry basket!,,https://www.reddit.com/r/lifehacks/comments/1rfke8m/throw_out_the_xl_laundry_basket/,5950
1rsq6l6,When crossing the street at night turn on the flashlight on your phone so drivers can easily see you.,,https://www.reddit.com/r/lifehacks/comments/1rsq6l6/when_crossing_the_street_at_night_turn_on_the/,5749
1rh9lxa,Seeking a hack from fellow shedding dog owners!!,,https://www.reddit.com/r/lifehacks/comments/1rh9lxa/seeking_a_hack_from_fellow_shedding_dog_owners/,4709
1rv9nbw,Never thought of using a powered shoe brush for dishes but it actually works 😂,,https://www.reddit.com/r/lifehacks/comments/1rv9nbw/never_thought_of_using_a_powered_shoe_brush_for/,4620
1s0ysod,Help! Male cat peed in oven vent,,https://www.reddit.com/r/lifehacks/comments/1s0ysod/help_male_cat_peed_in_oven_vent/,3784
1s01cif,How to get my shoes to stop squeaking!,,https://www.reddit.com/r/lifehacks/comments/1s01cif/how_to_get_my_shoes_to_stop_squeaking/,3529
1roymp1,how do you pack dishes so they never break during a long move?,,https://www.reddit.com/r/lifehacks/comments/1roymp1/how_do_you_pack_dishes_so_they_never_break_during/,2893
1s2axqx,"Heating Hack, Will It Work?",,https://www.reddit.com/r/lifehacks/comments/1s2axqx/heating_hack_will_it_work/,2875
1rzi2y9,What are budget-friendly ways to enjoy watching movies (possibly shows) at home?,,https://www.reddit.com/r/lifehacks/comments/1rzi2y9/what_are_budgetfriendly_ways_to_enjoy_watching/,2124
1s3ey92,How do you open a wine bottle without a corkscrew?,,https://www.reddit.com/r/lifehacks/comments/1s3ey92/how_do_you_open_a_wine_bottle_without_a_corkscrew/,2446
1s29kmt,"Any good advice for moving large, heavy, commercial grade mirrors?",,https://www.reddit.com/r/lifehacks/comments/1s29kmt/any_good_advice_for_moving_large_heavy_commercial/,2049
1rozzet,Best mattress for couples with different preferences? How is this problem solved?,,https://www.reddit.com/r/lifehacks/comments/1rozzet/best_mattress_for_couples_with_different/,1457
1rerhl7,Removing lint balls from two layer body suit????,,https://www.reddit.com/r/lifehacks/comments/1rerhl7/removing_lint_balls_from_two_layer_body_suit/,1785
1rgsucq,Wash Your Dust Pan,,https://www.reddit.com/r/lifehacks/comments/1rgsucq/wash_your_dust_pan/,1678
1rdunt5,Padlock Hack,,https://www.reddit.com/r/lifehacks/comments/1rdunt5/padlock_hack/,1888
1rvfrb5,Discovered the most obvious fix for a squeaky door and I feel ridiculous for not thinking of it sooner,,https://www.reddit.com/r/lifehacks/comments/1rvfrb5/discovered_the_most_obvious_fix_for_a_squeaky/,1439
1rprjq6,Why keep the car keys in the fridge?,,https://www.reddit.com/r/lifehacks/comments/1rprjq6/why_keep_the_car_keys_in_the_fridge/,833
