id,title,selftext,permalink,score
1rs1sy0,Fill Empty Space in Your Freezer With Jugs of Water,,https://www.reddit.com/r/lifehacks/comments/1rs1sy0/fill_empty_space_in_your_freezer_with_jugs_of/,32954
1rtsjtq,No seatback display? No problem!,,https://www.reddit.com/r/lifehacks/comments/1rtsjtq/no_seatback_display_no_problem/,28429
1rl47eh,Every wife has an extra hairband,,https://www.reddit.com/r/lifehacks/comments/1rl47eh/every_wife_has_an_extra_hairband/,25092
1rdufmk,A simple way of storing loose screws at the bench,,https://www.reddit.com/r/lifehacks/comments/1rdufmk/a_simple_way_of_storing_loose_screws_at_the_bench/,22764
1rk1y2c,It ain’t dumb if it works…. Right?,,https://www.reddit.com/r/lifehacks/comments/1rk1y2c/it_aint_dumb_if_it_works_right/,19605
1rrvpr1,put stuff you cant forget ON your shoes,,https://www.reddit.com/r/lifehacks/comments/1rrvpr1/put_stuff_you_cant_forget_on_your_shoes/,17573
1rpbhn1,Emergency lamp !,,https://www.reddit.com/r/lifehacks/comments/1rpbhn1/emergency_lamp/,15633
1rfke8m,Throw out the XL laundry basket!,,https://www.reddit.com/r/lifehacks/comments/1rfke8m/throw_out_the_xl_laundry_basket/,13810
1ryfdcb,Clogged Toilet---1/2 cup of Laundry Detergent---wait for it. Might just work,,https://www.reddit.com/r/lifehacks/comments/1ryfdcb/clogged_toilet12_cup_of_laundry_detergentwait_for/,11861
1rsq6l6,When crossing the street at night turn on the flashlight on your phone so drivers can easily see you.,,https://www.reddit.com/r/lifehacks/comments/1rsq6l6/when_crossing_the_street_at_night_turn_on_the/,10838
1rboeep,Hostel outlets are usually loose and it drives me crazy,,https://www.reddit.com/r/lifehacks/comments/1rboeep/hostel_outlets_are_usually_loose_and_it_drives_me/,9172
1rh9lxa,Seeking a hack from fellow shedding dog owners!!,,https://www.reddit.com/r/lifehacks/comments/1rh9lxa/seeking_a_hack_from_fellow_shedding_dog_owners/,8386
1rv9nbw,Never thought of using a powered shoe brush for dishes but it actually works 😂,,https://www.reddit.com/r/lifehacks/comments/1rv9nbw/never_thought_of_using_a_powered_shoe_brush_for/,7243
1rcd7bg,"If you have a baby and can't afford cleaners, team up with another parent!",,https://www.reddit.com/r/lifehacks/comments/1rcd7bg/if_you_have_a_baby_and_cant_afford_cleaners_team/,6882
1roymp1,how do you pack dishes so they never break during a long move?,,https://www.reddit.com/r/lifehacks/comments/1roymp1/how_do_you_pack_dishes_so_they_never_break_during/,6006
1s01cif,How to get my shoes to stop squeaking!,,https://www.reddit.com/r/lifehacks/comments/1s01cif/how_to_get_my_shoes_to_stop_squeaking/,5497
1rozzet,Best mattress for couples with different preferences? How is this problem solved?,,https://www.reddit.com/r/lifehacks/comments/1rozzet/best_mattress_for_couples_with_different/,5065
1rzi2y9,What are budget-friendly ways to enjoy watching movies (possibly shows) at home?,,https://www.reddit.com/r/lifehacks/comments/1rzi2y9/what_are_budgetfriendly_ways_to_enjoy_watching/,4007
1rerhl7,Removing lint balls from two layer body suit????,,https://www.reddit.com/r/lifehacks/comments/1rerhl7/removing_lint_balls_from_two_layer_body_suit/,3643
1rgsucq,Wash Your Dust Pan,,https://www.reddit.com/r/lifehacks/comments/1rgsucq/wash_your_dust_pan/,3745
1rvfrb5,Discovered the most obvious fix for a squeaky door and I feel ridiculous for not thinking of it sooner,,https://www.reddit.com/r/lifehacks/comments/1rvfrb5/discovered_the_most_obvious_fix_for_a_squeaky/,3250
1rdunt5,Padlock Hack,,https://www.reddit.com/r/lifehacks/comments/1rdunt5/padlock_hack/,3162
1rprjq6,Why keep the car keys in the fridge?,,https://www.reddit.com/r/lifehacks/comments/1rprjq6/why_keep_the_car_keys_in_the_fridge/,2667
