id,title,selftext,permalink,score
1tam8xp,"Reddit was founded in 2005, meaning it is history according to this sub's 20 year rule. Has there been any sort of academic discussion on the value of Reddit posts as a historical source given the years' worth of threads commented on by thousands of users discussing contemporary events?",,https://www.reddit.com/r/AskHistorians/comments/1tam8xp/reddit_was_founded_in_2005_meaning_it_is_history/,86416
1tf6to8,Question for German-speaking historians: Was Mein Kampf actually written well? Or is it basically a giant ramble like many people describe it as?,,https://www.reddit.com/r/AskHistorians/comments/1tf6to8/question_for_germanspeaking_historians_was_mein/,75343
1t1b708,"English longbowmen during the Hundred Year's War earned 6 pence a day. A single arrow cost 0.3125 pence, so you'd start losing money on the 20th arrow. That doesn't seem like a lot when battles could last multiple hours. Are there accounts or archers refusing to put themselves in the red?",,https://www.reddit.com/r/AskHistorians/comments/1t1b708/english_longbowmen_during_the_hundred_years_war/,66687
1tq675h,"How did ancient armies actually move 100,000–200,000 soldiers across long distances without modern logistics? Like, where did they sleep, how did they get enough food and water every day, and how did they stop the whole army from just collapsing into chaos?",,https://www.reddit.com/r/AskHistorians/comments/1tq675h/how_did_ancient_armies_actually_move_100000200000/,58412
1tcxenf,Contemporary racists were so disgusted by the idea of integrated bathrooms & swimming pools that they shut down public facilities en masse rather than integrate. Their ancestors a few generations before entrusted the enslaved with the most intimate acts of childcare & food preparation. What changed?,,https://www.reddit.com/r/AskHistorians/comments/1tcxenf/contemporary_racists_were_so_disgusted_by_the/,52196
1t3s688,"Was there a medieval equivalent of ""dude"" or ""mate""?",,https://www.reddit.com/r/AskHistorians/comments/1t3s688/was_there_a_medieval_equivalent_of_dude_or_mate/,45462
1tofju5,When did oral sex become more common?,,https://www.reddit.com/r/AskHistorians/comments/1tofju5/when_did_oral_sex_become_more_common/,40161
1t3amiw,Is what my german grandfather told me about his time in ww2 plausible?,,https://www.reddit.com/r/AskHistorians/comments/1t3amiw/is_what_my_german_grandfather_told_me_about_his/,35440
1th6vxm,"I know the “Dark Ages” is now considered a misnomer, but there was SOME darkness, right?",,https://www.reddit.com/r/AskHistorians/comments/1th6vxm/i_know_the_dark_ages_is_now_considered_a_misnomer/,31396
1t3ifgg,"Why were Lynyrd Skynyrd unbothered by Watergate, and what did that have to do with the governor of Alabama?",,https://www.reddit.com/r/AskHistorians/comments/1t3ifgg/why_were_lynyrd_skynyrd_unbothered_by_watergate/,27309
1trkaok,"The No Child Left Behind Act is often seen as a failure that didn't improve education. However data has shown that education ""peaked"" in the mid-2010s with students who spent the majority of their school careers under NCLB. What exactly was NCLB, why is it so controversial, and did it actually fail?",,https://www.reddit.com/r/AskHistorians/comments/1trkaok/the_no_child_left_behind_act_is_often_seen_as_a/,24750
1tbklqk,"General MacArthur is generally criticized for his insubordination and being too aggressive. 75 years later, does this criticism still hold up?",,https://www.reddit.com/r/AskHistorians/comments/1tbklqk/general_macarthur_is_generally_criticized_for_his/,21557
1tahfrb,When did people actually start sleeping in two turns?,,https://www.reddit.com/r/AskHistorians/comments/1tahfrb/when_did_people_actually_start_sleeping_in_two/,19171
1tnqmgz,Why Is Indonesia Largely Left Out of Global History if Its One of the Most Populous Countries in the World?,,https://www.reddit.com/r/AskHistorians/comments/1tnqmgz/why_is_indonesia_largely_left_out_of_global/,16486
1t1va9u,"My dad was infantry in the 101st Airborne during Vietnam, yet never deployed and spent his whole enlistment in the US. Given that a draft was implemented and people were being forcibly sent to Vietnam, was this common?",,https://www.reddit.com/r/AskHistorians/comments/1t1va9u/my_dad_was_infantry_in_the_101st_airborne_during/,15219
1tlq72y,"Why aren't today's Filipinos mixed race and half Spanish like the Spanish colonies in Latin America? Philippines was ruled by Spain for hundreds of years like Latin America, but unlike Latin america, a huge majority of the Philippines never became mixed/mestizo. Why is this?",,https://www.reddit.com/r/AskHistorians/comments/1tlq72y/why_arent_todays_filipinos_mixed_race_and_half/,13334
1t6d43n,How did soldiers not immediately break and run the moment the battle began or even before that out of fear?,,https://www.reddit.com/r/AskHistorians/comments/1t6d43n/how_did_soldiers_not_immediately_break_and_run/,11421
1tdeqw7,"Why do Canada, Australia, and New Zealand consume more coffee than tea, even though the UK and the rest of the Commonwealth drink more tea than coffee? When did these three countries transition to consuming more coffee than tea?",,https://www.reddit.com/r/AskHistorians/comments/1tdeqw7/why_do_canada_australia_and_new_zealand_consume/,10041
1t00gnw,Why was the lyrical presentation of hair metal bands so aggressively macho while their visual presentation was so very...not?,,https://www.reddit.com/r/AskHistorians/comments/1t00gnw/why_was_the_lyrical_presentation_of_hair_metal/,9008
1t94q0v,In movie Wolf of Wall Street Jordan Belford calls random people and persuade them to buy stock. Was it common in 80s and 90s to buy stock from someone you don't know?,,https://www.reddit.com/r/AskHistorians/comments/1t94q0v/in_movie_wolf_of_wall_street_jordan_belford_calls/,7728
1tduvk4,When did Europeans have the technology to create the Holy Hand Grenade of Antioch?,,https://www.reddit.com/r/AskHistorians/comments/1tduvk4/when_did_europeans_have_the_technology_to_create/,6801
1t7zxtg,"In October 1920, an altercation developed between a dog, a monkey, and the King of Greece. In the end the dog was fine, the King was killed, but what happened to the Barbary macaque that did it? Was he killed as well, or did what probably was the cutest little regicide in history escape justice?",,https://www.reddit.com/r/AskHistorians/comments/1t7zxtg/in_october_1920_an_altercation_developed_between/,6647
1t61mmw,"In the past, the standard was for entire books to be read for class, and 200-400 pages of reading a week in college. This reading load has dropped a lot over time. Have historians observed difficulties in training aspiring historians (students) due to a decline in reading ability/stamina over time?",,https://www.reddit.com/r/AskHistorians/comments/1t61mmw/in_the_past_the_standard_was_for_entire_books_to/,5619
1tkbff4,In Mad Men everyone has affairs. Is that accurate?,,https://www.reddit.com/r/AskHistorians/comments/1tkbff4/in_mad_men_everyone_has_affairs_is_that_accurate/,5431
1tjcg89,What were my odds as a gold miner in the u.s in 1849? Was gold so frequent that I would have good chances in becoming rich? Or would I have been beaten by people who got there earlier or who were closer if I got there in 1850?,,https://www.reddit.com/r/AskHistorians/comments/1tjcg89/what_were_my_odds_as_a_gold_miner_in_the_us_in/,4600
1t4fjes,"In the 1926 Census, recently released, my Irish great-grandfather was listed as ‘iascaire gan obair’, which I understand to mean unemployed fisherman. If he was an unemployed fisherman living with his wife, mother and eight children in the west of Ireland, how did they sustain themselves?",,https://www.reddit.com/r/AskHistorians/comments/1t4fjes/in_the_1926_census_recently_released_my_irish/,4405
1t7f4y6,Why did opposition to homosexuality become such a prominent feature in many major religions?,,https://www.reddit.com/r/AskHistorians/comments/1t7f4y6/why_did_opposition_to_homosexuality_become_such_a/,3941
1t5gy6q,What did the ancient Sumerians consider as history?,,https://www.reddit.com/r/AskHistorians/comments/1t5gy6q/what_did_the_ancient_sumerians_consider_as_history/,3214
1tgdeai,"What's so important about Doric, Ionic & Corinthian Columns?",,https://www.reddit.com/r/AskHistorians/comments/1tgdeai/whats_so_important_about_doric_ionic_corinthian/,3099
1t2pgeq,"Bacon and eggs, steak and eggs, pork breakfast sausage: Why is chicken so seldomly seen in American breakfast?",,https://www.reddit.com/r/AskHistorians/comments/1t2pgeq/bacon_and_eggs_steak_and_eggs_pork_breakfast/,2752
1tk36tj,What would you do if you found a primary or close to primary source historical document that does not appear to exist elsewhere?,,https://www.reddit.com/r/AskHistorians/comments/1tk36tj/what_would_you_do_if_you_found_a_primary_or_close/,2012
1tf7pga,Why are there multiple professional baseball teams named after socks?,,https://www.reddit.com/r/AskHistorians/comments/1tf7pga/why_are_there_multiple_professional_baseball/,2432
1tfmxlv,Was Spain viewed as a “backwards” country in the 1400s? How did other European countries basically view Spain during this time?,,https://www.reddit.com/r/AskHistorians/comments/1tfmxlv/was_spain_viewed_as_a_backwards_country_in_the/,2034
1tktkfw,What is the furthest back in time I could make Funyons?,,https://www.reddit.com/r/AskHistorians/comments/1tktkfw/what_is_the_furthest_back_in_time_i_could_make/,1875
1tpzhs9,What do we know about Yobai (夜這い) - the former Japanese custom of premarital sex?,,https://www.reddit.com/r/AskHistorians/comments/1tpzhs9/what_do_we_know_about_yobai_夜這い_the_former/,1633
1te7b0j,Who is the earliest historical figure from whom we have surviving handwriting?,,https://www.reddit.com/r/AskHistorians/comments/1te7b0j/who_is_the_earliest_historical_figure_from_whom/,1896
1thr6x3,"Are students in China or India learning about American/European scientists when discussing physical discoveries and inventions, or is there a distorted cultural bias in my education and learning?",,https://www.reddit.com/r/AskHistorians/comments/1thr6x3/are_students_in_china_or_india_learning_about/,1590
1t1ygw3,Why didn't Manila become a powerful international port city similar to Hongkong or Singapore?,,https://www.reddit.com/r/AskHistorians/comments/1t1ygw3/why_didnt_manila_become_a_powerful_international/,1567
1tdx9fd,"I'm Jonathan S. Jones, author of Opium Slavery: Civil War Veterans and America's First Opioid Crisis. I'm a U.S. Civil War historian, and I research the history of drugs and the people who used them. AMA about drugs in the Civil War era!",,https://www.reddit.com/r/AskHistorians/comments/1tdx9fd/im_jonathan_s_jones_author_of_opium_slavery_civil/,765
1tauw70,How did Smith become the most common occupational surname as opposed to Farmer? Surely there were more peasant farmers than smiths,,https://www.reddit.com/r/AskHistorians/comments/1tauw70/how_did_smith_become_the_most_common_occupational/,1358
1topey8,My great-aunt tried to adopt the secret son of an anti-Nazi Romanian Ambassador and a Japanese aristocrat. I have photos and am trying to find him.Can anyone help ?,,https://www.reddit.com/r/AskHistorians/comments/1topey8/my_greataunt_tried_to_adopt_the_secret_son_of_an/,908
1t8u6pn,The plot of the 1977 film Smokey and the Bandit centers on two bootleggers evading the police while delivering 400 cases of Coors from Texas to Atlanta. What were the laws in the South at the time that they were breaking by transporting beer?,,https://www.reddit.com/r/AskHistorians/comments/1t8u6pn/the_plot_of_the_1977_film_smokey_and_the_bandit/,1395
1tg0q3c,What exactly was the logic behind letting people purchase a military rank with money? Didn't this seem like a bad idea even at the time?,,https://www.reddit.com/r/AskHistorians/comments/1tg0q3c/what_exactly_was_the_logic_behind_letting_people/,1060
1tpkbqj,"I'm a peasant in early Medieval Europe. How important is money to me? How much of my food/clothing/etc do I buy with money, compared to what I grow myself, barter for, get through mutual aid within the community, or otherwise obtain non-monetarily?",,https://www.reddit.com/r/AskHistorians/comments/1tpkbqj/im_a_peasant_in_early_medieval_europe_how/,1195
1t04uh1,"How was Stalin able to execute 680,000 high ranking military officials without any repercussions, coups, unrest, or any casualties?",,https://www.reddit.com/r/AskHistorians/comments/1t04uh1/how_was_stalin_able_to_execute_680000_high/,907
1t60icg,"In the Irish Folk song ""Whiskey in the Jar"", the speaker describes initiating a robbery as ""I first produced my pistol, and I then produced my rapier."" How is he using each weapon?",,https://www.reddit.com/r/AskHistorians/comments/1t60icg/in_the_irish_folk_song_whiskey_in_the_jar_the/,722
1tp87gd,How did people in the past deal with the much greater purchasing power of money?,,https://www.reddit.com/r/AskHistorians/comments/1tp87gd/how_did_people_in_the_past_deal_with_the_much/,1112
1tjtm34,"Proponents of conspiracy theories sometimes point to things like Tuskegee Syphilis Experiments, MKUltra and COINTELPRO as ""conspiracy theories that have come true"". How accurate is this characterization? Were they spread and treated as conspiracy theories before coming to light?",,https://www.reddit.com/r/AskHistorians/comments/1tjtm34/proponents_of_conspiracy_theories_sometimes_point/,547
1tqkmib,"Osama bin Laden spoke Arabic in a calm, literary, almost poetic style. Is this usual among extremist or militant leaders in other cultures?",,https://www.reddit.com/r/AskHistorians/comments/1tqkmib/osama_bin_laden_spoke_arabic_in_a_calm_literary/,1053
1toey0s,"In “The Godfather”, how accurate is Sonny’s assertion that in the Pacific Theater, U.S. Marines would “shoot ‘em a mile away” as opposed to near-point-blank-range combat?",,https://www.reddit.com/r/AskHistorians/comments/1toey0s/in_the_godfather_how_accurate_is_sonnys_assertion/,364
